,title,byline,dates
339,"Travel agency at centre of missing Christmas flights fiasco makes commitment to refund passengers: Philippine diplomat sheds light on Christmas flights fiasco after meeting Peya Travel boss, but it is unclear when customers will get money back",,22 Dec 2017
340,"An Australian inventor, a British exorcist and a secret Soviet ray gun: headlines from four decades ago",,22 Dec 2017
341,"Lower toll for Pearl River Delta mega bridge preferred option at hearing: Majority of representatives from Hong Kong, Macau and Zhuhai at a public hearing say cross-border coaches should pay only 200 yuan",,22 Dec 2017
342,"Man, 42, arrested for stealing over HK$600,000 worth of electronic components: Suspect believed to be connected to spate of such crimes involving HK$600,000 in losses",,22 Dec 2017
343,Young people still divided on Hong Kong government's push to increase youth participation in policy advice,,22 Dec 2017
344,Carrie Lam says 'being accountable' to Beijing doesn't equate to unquestioning obedience: Chief executive insists being 'accountable' to mainland authorities doesn't mean agreeing to every request and vows to push back if in city's interests,,22 Dec 2017
345,Hong Kong arbitration legal eagle Teresa Cheng set to take up justice secretary role on January 18,,22 Dec 2017
346,Horror on the street,,22 Dec 2017
347,"Tortured helper Erwiana wins HK$809,430 civil claim against abusive Hong Kong employer: Judge awards full amount sought, disregarding employer's claims she overstated her injuries",,22 Dec 2017
348,Don't let Uber ideologues take you for a ride,,22 Dec 2017
349,"Fake news proves to be a huge problem for Tencent as it blocks 1,000 articles each minute: Internet giant blocks almost 16 stories every second on popular WeChat messaging app",,22 Dec 2017
350,Hong Kong arm of embattled Chinese conglomerate LeEco files petition to wind up business: Application to liquidate business comes after LE Corporation was hit with a flurry of civil claims,,22 Dec 2017
351,Shenzhen tech company the latest victim of China's 100 trillion yuan wealth management market,,22 Dec 2017
352,Why Xi Jinping is taking a longer view on the economy: Time frame for key 'battles' including financial risk and cutting poverty extended to three years,,22 Dec 2017
353,Death of K-pop star Jonghyun sends out tragic message,,22 Dec 2017
354,Region has to ease up on military drills at times of uncertainty,,22 Dec 2017
355,HONG KONG t o y s t or y,,22 Dec 2017
356,'XXX: Most important economic meeting wraps up by putting president at centre of national development,,22 Dec 2017
357,Deep in thought,,22 Dec 2017
358,"Man jailed 5½ years, fined US$76,000 for selling VPN in southern China",,22 Dec 2017
359,Donald Trump 'ignores facts': Chinese military hits back at claim it is trying to challenge US interests: Chinese military hits back after US leader claims Beijing is threat to national security,,22 Dec 2017
360,Pick of the crop,,22 Dec 2017
361,Chasing a hat-trick,,22 Dec 2017
362,"Eighty Eighty the one to beat and could be reasonable odds without 'Joao Moreira-factor' at play: The four-year-old was defeated as a short-priced favourite on debut but this time Rawiller takes the ride, replacing the suspended superstar",,22 Dec 2017
363,Put Sleep Education and Fair Comment in your black book after their efforts at Happy Valley,,22 Dec 2017
364,TRACK STARS,,22 Dec 2017
365,Fancy a fight with Chael Sonnen? The moment that forever changed fearless Hong Kong Shaun's life: The 23-year-old reflects on the night he made a name for himself in Brazilian jiu-jitsu against legend Sonnen and how he strives for greatness,,22 Dec 2017
366,"Goodbye, Anna Richards, wherever it is you've gone and for whatever reason: Departure of acclaimed coach of HK women's sevens team leaves a lot of questions unanswered",,22 Dec 2017
367,"Goalscoring machine Yuen Chun-sing could be Hong Kong's next star striker, says coach Kwok Ka-lok: Goalscoring machine gets big opportunity in annual Interport Cup against Guangdong",,22 Dec 2017
368,Missing sailor Guo Chuan's wife in tears as she accepts special sports spirit prize at China's Laureus Awards: Guo Chuan's wife in tears as she accepts special sports spirit award for the China sailor who disappeared trying to set a solo Pacific crossing record,,22 Dec 2017
369,Done and dusted,,22 Dec 2017
370,China's Alibaba expands operations in India with foray into cloud computing services: E-commerce giant allies with submarine cable operator Global Cloud Xchange in expansion bid,,22 Dec 2017
371,HNA gets go-ahead to build nine residential blocks in Kai Tak: Mainland firm's initial development will see nine low- and high-rise buildings go up,,22 Dec 2017
372,"JD.com takes the fight to Alibaba, Tencent in the sizzling second-hand online shopping market",,22 Dec 2017
373,"Muddy Waters launches scathing attack on Nasdaq-listed online finance firm CIFS, accusing it of being 'another worthless Chinese fraud': Muddy Waters' scathing report says loans, revenue and profits at CIFS are 'completely fake'",,22 Dec 2017
374,CCB to offer homeowners one-off payment for leasing rights in bid to tap nascent rental market: Construction Bank eager to get owners to accept cash to lease homes out as the government encourages people to rent amid the rising cost of housing,,22 Dec 2017
375,China's US$56 billion ride-hailing king set for showdown with Uber again after latest fundraising round,,22 Dec 2017
376,"Hong Kong stocks at three-week high as Ping An, consumer companies advance: Shanghai index reclaims 3,300 points after developers get boost from government support",,22 Dec 2017
377,Yuan hits three-month high after China hints at tighter monetary policy,,22 Dec 2017
378,Beijing Jingneng seeks clean energy growth from Australia and Beijing Olympics,,22 Dec 2017
379,China's bitcoin crackdown raises cryptocurrency demand as they move to peer-to-peer platforms,,22 Dec 2017
380,E Fund wants to help connect investors to opportunities in 'new markets': Asset manager among firms looking to use huge capital trapped in China owing to restrictions,,22 Dec 2017
381,"Latest 'Enigma' salvoes fired: China Green denies being Convoy placee, Jun Yang Financial confirms it was briefly a shareholder: Trading company included in 'Enigma Network' of 50 listed businesses that activist investor David Webb said had crossholdings in each other",,22 Dec 2017
382,"Restaurant review: Zither Garden in Wan Chai - tasty Chinese fare that did not disappoint: A range of dishes hit the spot, including Peking duck served with an array of accompaniments",,22 Dec 2017
383,"Finnish Christmas fare for Hongkongers - at Finds, the winter flavours are to savour: FINDS chef Jaakko Sorsa reveals the traditional dishes he is serving up during the festive season",,22 Dec 2017
384,Herbal teas for busy bees: how two Hong Kong TCM experts' health-boosting drinks cater for modern lifestyles and the quest for balance: TCM practitioners are helping people drink the right tea for their body type to maximise benefits,,22 Dec 2017
385,"Access to China's housing fund for Hongkongers hits a snag, as Shenzhen-based firm refuses to let eligible employee join: Hongkongers working across border tell of non-compliance with scheme",,24 Dec 2017
386,"Revealed: Lin Zhongmin is the buyer of Asia's priciest flats at Mount Nicholson: Who is Lin Zhongmin, who last month paid a total of HK$1.16b for two adjoining flats?",,24 Dec 2017
387,The thin green line,,24 Dec 2017
388,"United Nations agrees more sanctions on North Korea, but is the world running out of options?: Latest UN sanctions cut petroleum deliveries to hermit state, but experts question whether economic penalties will prove enough to turn tide",,24 Dec 2017
389,"How I was robbed flying Air India from New Delhi to Hong Kong: Yonden Lhatoo shares his nightmarish experience travelling on India's national airline, during which money was stolen from him in a highly devious and audacious mid-air scam",,24 Dec 2017
390,"'It's good for the country, but my family may suffer': Nepalese villagers in limbo as fate of Chinese-built dam hangs in balance: Village homes would be submerged if project goes ahead under Beijing-friendly government",,24 Dec 2017
391,Holiday cheers,,24 Dec 2017
392,"Hong Kong leader Carrie Lam welcomes more 'peaceful' atmosphere in city, but says time still not right for political reform: Chief executive says social atmosphere has improved, but people may just be exhausted",,24 Dec 2017
393,"More Hongkongers should be aware of mainland housing scheme, recipient says",,24 Dec 2017
394,Why a Xi Jinping protégé came under fire in Beijing over mass eviction of migrant workers: Beijing party secretary Cai Qi initially called for 'tough' response in wake of deadly blaze last month,,24 Dec 2017
395,"Joint checkpoint plan for cross-border high-speed rail 'entirely in line with Hong Kong Basic Law', Beijing official says: Remarks by Beijing official Li Fei come as critics challenge legal basis of arrangement",,24 Dec 2017
396,"Legal eagles led by Philip Dykes to run in Hong Kong Bar Association polls, vowing to 'stand fearlessly' for judicial independence: Prominent rights lawyer part of team that will contest election for city's beleaguered Bar Association",,24 Dec 2017
397,"More to the economy than finding next Google or Facebook, Hong Kong's small business owners say: Small businesses feel neglected and call for more government support",,24 Dec 2017
398,"Personal information more at risk than ever in age of big data, Hong Kong privacy watchdog head says: Information about your online behaviour is new currency of business: privacy chief",,24 Dec 2017
399,Plastic bottle deposit scheme considered for Hong Kong to boost recycling incentives,,24 Dec 2017
400,Incoming HKU chief deserves a chance,,24 Dec 2017
401,Recycling regime must be reviewed,,24 Dec 2017
402,"Can China realise Xi Jinping's vision for a green measure of sustainable growth?: Development of a ""sustainability metric"" remains in its early stages, official says",,24 Dec 2017
403,Chinese scholars sign open letter calling for release of Maoist intellectual,,24 Dec 2017
404,Meet the Chinese artisan fighting to keep his silky skills alive: Zhao Shuxian and a Nanjing museum are preserving ancient art of ronghua,,24 Dec 2017
405,Why China's war on Christmas is gathering pace: Members of the party's Youth League reportedly told not to participate in marking the festival or 'blindly follow the opium of Western spirits',,24 Dec 2017
406,"Ex-China diving coach 'allowed environment of rape, sexual harassment, violence to continue' in Malaysia: Yang Zhuliang shocked at claims he had failed to protect athletes amid 'rape and violence cases'",,24 Dec 2017
407,Kitasan Black out to farewell his fans on a winning note: Star Japanese stayer set to start an odds-on favourite for today's Arima Kinen at Nakayama,,24 Dec 2017
408,"Slow and boring? Formula E is cool and fun, says Richard Branson, and will overtake F1 in 10 years: Billionaire Virgin Group founder says electric racing series is going to have a huge future",,24 Dec 2017
409,Almond Lee and Keith Yeung show their staying power with a Sha Tin double,,24 Dec 2017
410,Paul O'Sullivan's Win Beauty Win looks a future star after big Griffin Trophy victory,,24 Dec 2017
411,"When pedigree and 'Derby fever' clashes with reality: 'Derby fever' afflicts most at Sha Tin but not all horses bought for the occasion can run 2,000m",,24 Dec 2017
412,Zac Purton pleased as Exultant stamps himself as a serious Hong Kong Derby contender: Cruz's Irish import highlights his class with a dominant display as Size's boom sprinter Hot King Prawn remains undefeated after five straight wins,,24 Dec 2017
413,Christmas comes early as Alberto Sanna delivers a Sha Tin double,,24 Dec 2017
414,Close encounter,,24 Dec 2017
415,Best and brightest,,24 Dec 2017
416,How puzzles prepare children for real-life problems,,24 Dec 2017
417,Eight-hour waits in emergency rooms as Hong Kong hospitals feel flu season surge over Christmas holidays,,27 Dec 2017
418,"Funds raised on Hong Kong stock market fall to lowest in a decade: Funds raised drop 15 per cent to US$35 billion, the least in nearly 10 years",,27 Dec 2017
419,Taiwan warns Chinese military drills pose huge threat to its security: Taiwan defence report admits island's forces cannot compete against might of the PLA,,27 Dec 2017
420,Talk of Christmas being banned on the mainland is humbug,,27 Dec 2017
421,"Chinese cities vie to harness the energy that powers the sun: With Beijing's backing, three cities compete to build world's first nuclear fusion reactor but experts warn colossal undertaking also has risks",,27 Dec 2017
422,Chinese rights activist 'Super Vulgar Butcher' jailed for eight years,,27 Dec 2017
423,"Cybercrimes and scams will be two big challenges for Hong Kong police, outgoing veteran says",,27 Dec 2017
424,Why Greece is banking on China's modern-day Silk Road to help its economic recovery: Envoy says Athens is keen to seize opportunities to revive the thriving trade network that once linked two of the world's cradles of civilisation,,27 Dec 2017
425,"With Hong Kong flats out of reach, young buyers seek home ownership in Thailand, Japan: Relatively lower prices in Thailand and Japan entice those starting out in the property game",,27 Dec 2017
426,Cinema operator UA wants to ride on upbeat consumer sentiment to open more screens,,27 Dec 2017
427,"It's many happy returns of the festive season for Hong Kong retailers, but can the good times last?: After a couple of years of contractions, 2017 has marked the return of good times for Hong Kong retailers.",,27 Dec 2017
428,"Asylum seekers in Hong Kong who are trying to make the best out a bad situation: They offer fellow refugees English lessons, serve in church and give talks to not only benefit others but also themselves while waiting to resettle",,27 Dec 2017
429,"Beauty centre 'cheats teacher in Hong Kong with claim that warts on neck would become contagious': Teacher tells how she was billed HK$110,000 after staff said warts would be contagious",,27 Dec 2017
430,"Canada can learn from Hong Kong's tax system, commerce chamber chief says: New chamber of commerce chief says low taxes will give businesses that more money to invest",,27 Dec 2017
431,Number of elderly organ donors on the rise in Hong Kong after lifting of age limit,,27 Dec 2017
432,China must protect basic human rights,,27 Dec 2017
433,Deal welcome over cross-border arrests,,27 Dec 2017
434,China to start releasing proper unemployment figures after decades of downplaying the problem: Official statisticians will start focusing on key economic indicator after decades of releasing partial data or pretending problem did not exist,,27 Dec 2017
435,Apprentice Mo goes from the sublime to the ridiculous,,27 Dec 2017
436,"Has Hong Kong's love affair with Joao Moreira taken a downward turn?: After 299 races, Purton has closed the margin to just three winners in the race for the jockeys' title",,27 Dec 2017
437,Kim Pan-gone! Shock for Hong Kong as head coach quits ahead of crucial Asian Cup qualifier,,27 Dec 2017
438,Hong Kong's Scallywag fifth across the finish line in Volvo Ocean Race third leg: Skipper Witt and his crew now preparing for the leg to HK in the Volvo Ocean Race,,27 Dec 2017
439,Wife's leaked messages claiming Zou Shiming was owed millions and forced to fight is denied by agents: Seca insists it had acted humanely after being accused by the Chinese boxer's wife of coercing him into the ring despite knowing he was injured,,27 Dec 2017
440,Five private equity firms exposed by China's insurance watchdog for having weak compliance standards,,27 Dec 2017
441,"Hong Kong M&A deals up by almost half in 2017 as mainland firms buy into property, insurance sector",,27 Dec 2017
442,"Mainland consumers to spend more on health, experience, premium products in 2018, experts say: Mainland consumers have their eyes on high-end products, experiences and fitness-related purchases in 2018 as disposable incomes keep rising",,27 Dec 2017
443,"Mirror, mirror on the wall: How Chinese start-ups plan to change the way shoppers try on clothes: Technology firms hope to induce purchases by creating an interactive shopping experience",,27 Dec 2017
444,Baptist University biology researcher claims his political leanings have led to talk of his termination: 'Reliable source' tells Baptist University assistant professor that his contract will not be renewed,,28 Dec 2017
445,"Beijing implies support for Hong Kong's plan to build schools, hospitals and elderly care centres in Greater Bay Area: Schools, hospitals and elderly care centres on wish list Carrie Lam presented to Beijing",,28 Dec 2017
446,Disqualified lawmakers say they have a strong legal defence against salary and expenses claim: Lawmakers disqualified in oath fiasco say they have legal grounds not to repay salary and expenses,,28 Dec 2017
447,"Girl tied up, assaulted and murdered after refusing to wear costume during photo shoot, Hong Kong court hears",,28 Dec 2017
448,In a jam,,28 Dec 2017
449,Rail plan 'will not undermine autonomy',,28 Dec 2017
450,"Proposed changes to tax law could save Hong Kong's small businesses HK$165,000 a year",,28 Dec 2017
451,Six things to know about Hong Kong's controversial 'co-location' joint checkpoint scheme,,28 Dec 2017
452,'Civic Square' to reopen to public in Hong Kong - but with restricted access for demonstrations: Permits to protest at symbolic site to be granted only on public holidays,,28 Dec 2017
453,Appeal court backs telecoms operators in licence fee dispute with Hong Kong government,,28 Dec 2017
454,China's top legislative body approves plan to enforce mainland laws at joint checkpoint in Hong Kong railway station: Hong Kong government will go forward with contentious plan for zone at Kowloon station for high-speed link despite fears over autonomy,,28 Dec 2017
455,Keep Hong Kong schools out of political shenanigans,,28 Dec 2017
456,"China's latest plans to dominate robot, smart car and railway industries by 2020: Initiatives are aimed at upgrading manufacturing power in areas such as railways and smart cars",,28 Dec 2017
457,"Convoy sues executives for theft, ratcheting up its clean-up effort before a boardroom showdown: Action seeks redress of financial woes ahead of major boardroom tussle tomorrow",,28 Dec 2017
458,"Marital spat between Bawang's co-founders spill into the courts while company's stock plummets: As stocks plunge, estranged wife of co-founder wants to liquidate holding company and sell assets",,28 Dec 2017
459,Sleep deprived and under pressure: Carrie Lam discusses coping with life as Hong Kong's leader,,28 Dec 2017
460,Era of cheap money for Hong Kong and the mainland has to end,,28 Dec 2017
461,Right road must be taken on Hong Kong parking,,28 Dec 2017
462,"'Hawaii of China' dumps GDP targets to save its tropical beaches: Island authorities under fire for 'destroying the ecology for the sake of money', state media says",,28 Dec 2017
463,"China ready to work with Afghanistan to counter terror threat, military chief says: China also keen to boost anti-terrorism exchanges with Kabul 'to ensure security across the region'",,28 Dec 2017
464,China sets new rules on overseas investment for its biggest deal makers,,28 Dec 2017
465,China's Politburo holds two-day self-criticism session as Xi Jinping garners fresh pledges of fealty,,28 Dec 2017
466,Highbrow tastes,,28 Dec 2017
467,Shanghai caps population at 25 million by 2035 but experts doubt plan will work: Financial hub sets limit of 25 million by 2035 as some say it is already much bigger than that,,28 Dec 2017
468,New blood,,28 Dec 2017
469,"berry gets a timely sling from derby hope: After a slow start to the season as Moore's retained rider, the Australian tastes success at Happy Valley, scoring wins for Fownes and Millard",,28 Dec 2017
470,How a Hong Kong charity is giving Kenya's forgotten runners a second chance in Asia: MIRARunners is looking to give athletes from the African country a chance to make a mark in Asia,,28 Dec 2017
471,No holding back,,28 Dec 2017
472,Anti-sexual harassment code for Hong Kong cricket in the wake of hurdler Vera Lui's assault claims: CEO Pearce says CHK was initially planning a child protection programme but expanded it to include sexual abuse in wake of Vera Lui's case,,28 Dec 2017
473,Hong Kong players eye bonanza as Chinese Football Association welcomes them back into the fold: Locals no longer under foreign quotas in China but naturalised players still face restrictions,,28 Dec 2017
474,Geely buys into Swedish truck maker AB Volvo to reinforce globalisation drive,,28 Dec 2017
475,Shanghai and Shenzhen stock exchanges continue to chip away at Hong Kong's IPO attractiveness: Speedier approvals and strong investor demand likely to help Shanghai and Shenzhen extend lead,,28 Dec 2017
476,"Shanghai banks offer customers rice, cooking oil to attract deposits as funding dries up: As smaller lenders try to cut leverage, savers lured with oil, rice, transport cards and higher rates",,28 Dec 2017
477,"Tencent's WeChat messaging platform adopted by Beijing court for case filing: Service aims to save time by allowing users to submit documents, pay and verify identity",,28 Dec 2017
478,Cash is dead as small businesses opt for e-payment in China's digitalisation drivekindklkkkkk: More small businesses are embracing mobile and digital purchases as the mainland takes a 42 per cent share of the world's e-commerce transactions,,28 Dec 2017
479,Chart of the day: China's consumption story,,28 Dec 2017
480,China opens antitrust probe into gas suppliers as shortage drives up prices amid cold snap: Watchdog probes 17 companies and orders four others to return profits from illegal price rises,,28 Dec 2017
481,Hong Kong stocks rise as oil-price surge boosts PetroChina and CNOOC,,28 Dec 2017
482,The Great Buddha+ director Huang Hsin-yao on his Golden Horse-winning feature debut - and the depressing state of Taiwanese society: Director's debut feature about the grim state of Taiwanese society becomes a surprise award-winner,,28 Dec 2017
483,"Top five films to watch in Hong Kong this week (December 28-January 3), from Yi Yi: A One and a Two to The Great Buddha+",,28 Dec 2017
484,"A 99-year-old yoga teacher's amazing life and youthful spirit, and the people she's known, from Gandhi to Marlene Dietrich: At 99, Tao Porchon-Lynch is living up to her advice that within you is the possibility to do anything",,28 Dec 2017
485,Hong Kong mini arts hub Cheung Chau is an island abuzz with creativity: The tiny island of Cheung Chau has become home to a an impressive and diverse creative community,,28 Dec 2017
486,"Bodily fluids found on dead teen may belong to murder suspect, Hong Kong court told: DNA tests also suggest that blood stains on a suitcase could have come from defendant",,29 Dec 2017
487,"Hong Kong's No 2 official defends decision to limit access to 'Civic Square' where protests are allowed only on specific days: Pan-dems, however, are not impressed and stage protest without a permit",,29 Dec 2017
488,"New wave of Cambodian domestic helpers 'know risks' that come with working in Hong Kong: Latest wave of recruits have been briefed on potential pitfalls of working in Hong Kong, woman who is helping them integrate says",,29 Dec 2017
489,Taste for diversity,,29 Dec 2017
490,Three in Hong Kong jailed for providing illegal TV boxes to stream subscription-based Now TV content,,29 Dec 2017
491,"You were wrong, Hong Kong leader Carrie Lam says of the naysayers who doubted her in run-up to election",,29 Dec 2017
492,Growing charity promotes wellness among Hong Kong's youth through sports,,29 Dec 2017
493,"A mega bridge, student activism and HK$1,000 banknotes: headlines from four decades ago",,29 Dec 2017
494,"Newly approved joint checkpoint plan will damage Hong Kong's rule of law, legal heavyweights say: Six legal heavyweights issue statement slamming arrangement for mainland laws to be applied at West Kowloon terminus of high-speed rail link",,29 Dec 2017
495,Beijing's top office on Hong Kong affairs says city 'must implement' controversial joint checkpoint for high-speed rail: Top body on city's affairs makes demand despite legal doubts about plan,,29 Dec 2017
496,China's central bank tightens security in US$5.5 trillion mobile payment sector: New central bank rules will mean consumers using system for transactions over 500 yuanwill have to provide extra ways to verify identity,,29 Dec 2017
497,Protesters face hitting the buffers at Hong Kong rail terminus,,29 Dec 2017
498,'American dream' becomes a nightmare for Chinese workers left stranded in Saipan,,29 Dec 2017
499,British documents reveal inside story of handover talks: Files show Beijing tried to use airport negotiation to undercut governor's plan for electoral reform,,29 Dec 2017
500,"Hong Kong domestic helper Erwiana Sulistyaningsih wins battle to stop abusive ex-boss evading HK$800,000 in damages",,29 Dec 2017
501,On the wall,,29 Dec 2017
502,The reason why China's armed police will now only take orders from Xi and his generals: PAP will only take orders from Xi's army elite as grip tightens to stop local authorities using paramilitary personnel to challenge Beijing leadership,,29 Dec 2017
503,"Is tide turning for US-China ties under Trump?: Donald Trump has changed tack on China, calling it a strategic competitor, but analysts are divided over how seriously to take the president's rhetoric",,29 Dec 2017
504,Compromise needed in Spanish stand-off,,29 Dec 2017
505,Transparent approach needed at Hong Kong high-speed rail terminus,,29 Dec 2017
506,"Why Hong Kong's judges may be set for yet another stormy year in 2018: Cliff Buddle says if 2017 was the year of controversies for Hong Kong's courts, 2018 may well be the same",,29 Dec 2017
