,title,byline,dates
0,Hong Kong and Macau's best restaurants honoured in the 2018 Michelin Guide,,01 Dec 2017
1,"Hong Kong e-payment operator Octopus launches QR code service, aiming to get city's 40,000 taxi drivers off cash",,01 Dec 2017
2,"Hong Kong's MTR Corporation turning blind eye to bullying in workplace, union says: Four in every five employees at city's railway operator feel they have been unreasonably treated by supervisors, according to survey",,01 Dec 2017
3,"Lu Ping held firm on immigration, Zhang says",,01 Dec 2017
4,Sex abuse claims rock sport ... and raise questions: Lawmaker reveals that he received a letter recently accusing another coach of assault,,01 Dec 2017
5,19 hurt as Hong Kong double-decker bus ploughs into truck on Lantau highway,,01 Dec 2017
6,Better treatment of heart disease eyed for East Asians with discovery of genetic factors by HKU researchers: HKU team identifies genes linked to blood lipid levels that are more common in East Asians,,01 Dec 2017
7,Tearful finance boss tells Hong Kong murder trial he did not intend to harm or kill mistress: Finance company boss accused of murdering his mistress denies he meant any harm and lied only because he was afraid of losing everything,,01 Dec 2017
8,"Excessive executions, a Red Army blacklist and a house on The Peak for 'only' HK$4 million: headlines from four decades ago",,01 Dec 2017
9,"Hong Kong government should start take two years before starting controversial national security legislation, says former minister",,01 Dec 2017
10,"retail sales surge on 'Golden Week' bonanza: Figures up for eighth straight month in October thanks to mainland's annual, week-long holiday",,01 Dec 2017
11,"Despite Joko Widodo pledge, Indonesian domestic helpers are still coming to Hong Kong",,01 Dec 2017
12,"Hong Kong hurdler Vera Lui's claim that a coach sexually assaulted her when she was 13 sparks outcry, police probe: Hong Kong hurdler Vera Lui follows in footsteps of other public figures who have come forward with #MeToo Facebook post on her birthday",,01 Dec 2017
13,Britain needs to truly let go of Hong Kong,,01 Dec 2017
14,"China prepared to end North Korea student exchanges if missile test crisis deepens: China could end two-decade-old programme with N Korea if tensions escalate, official says",,01 Dec 2017
15,"China will back tougher sanctions as North Korea threat grows, say analysts: But Beijing to stop short of meeting US call for full oil embargo, experts say",,01 Dec 2017
16,Couple in street sale row vow to fight on despite 'huge' legal bill after reversal of San Francisco street purchase,,01 Dec 2017
17,Hong Kong tycoon Hui Wing-mau donates priceless ancient map of Silk Road to Palace Museum,,01 Dec 2017
18,"Malaysian tour group arrested at Hong Kong airport with HK$4 million worth of ketamine: Six Malaysians arriving from Kuala Lumpur arrested for trying to carry in 8kg of stimulant, in what could be fresh drug trafficking route",,01 Dec 2017
19,"Despite its limited influence, activists still want Britain to try and speak up for Hong Kong's freedoms: Moves are under way to press the British government to be more assertive on Hong Kong affairs",,01 Dec 2017
20,Get on track by legalising car-hailing services,,01 Dec 2017
21,Trump is jeopardising both trade and diplomacy with China,,01 Dec 2017
22,"chinese, u.S. generals meet after missile test: Senior officers from two sides wrap up talks in Washington planned in August but held hours after Pyongyang's latest weapons launch",,01 Dec 2017
23,"'Big Cannon' Ren Zhiqiang compares China to North Korea over hukou policy: No other country but North Korea has household registration, notes Ren Zhiqiang",,01 Dec 2017
24,Chinese court clears man jailed 15 years over spate of attacks on women in Xinjiang,,01 Dec 2017
25,Evictions waken Beijing middle class to plight of migrant workers: More affluent and educated in capital shocked by campaign to remove poorer workers from homes,,01 Dec 2017
26,Will this artificial intelligence system keep your kindergarten toddlers safe?: Algorithm can analyse a live video stream and detect behaviour such as punching or slapping,,01 Dec 2017
27,Good to be King,,01 Dec 2017
28,"Michael Freedman's Sparkling Dragon set to shine again at Sha Tin: With a better draw, the three-year-old looks the one to beat in the Granville Handicap on Sunday, but Gallant Return could provide some competition",,01 Dec 2017
29,TRACK STARS,,01 Dec 2017
30,Veterans Flying Tourbillon and Ten Flames proves they still have something to offer after good runs at Happy Valley,,01 Dec 2017
31,a rolls-royce and five-star treatment,,01 Dec 2017
32,Sam Bird and Alex Lynn the perfect fit as DS Virgin Racing close the gap on Formula E heavy hitters: Sam Bird and Alex Lynn want to make a solid start to the Formula E season with DS Virgin Racing,,01 Dec 2017
33,Mayweather in Hong Kong? Unbeaten boxer to visit city as part of his US$3 million China tour: Mayweather brags he is getting US$3m to enjoy his 'luxury tour' with an entourage,,01 Dec 2017
34,Shanghai SIPG boss Andre Villas-Boas leaves his post at the club to pursue his dream of competing in the Dakar Rally: reports,,01 Dec 2017
35,All eyes on Opec,,01 Dec 2017
36,Hong Kong secondary home prices rise for 19th straight month in October: Growth momentum expected to ease in near term after prices for secondary homes rise for a 19th month amid supply-demand imbalance,,01 Dec 2017
37,Tech turmoil dumps Tencent out of US$500 billion clubp: Investors dump shares in top names such as Samsung as malaise spreads from Wall Street,,01 Dec 2017
38,Hong Kong market falls sharply as tech and insurance stocks plunge: HK stock market expected to correct quickly as it has risen too rapidly in previous sessions,,01 Dec 2017
39,Shareholders of Singapore logistics firm GLP approve US$11.6 billion buyout by Chinese-led consortium,,01 Dec 2017
40,Short sellers were positioning themselves for a RYB slump even before claims of abuses surfaced,,01 Dec 2017
41,Bank of East Asia sells consumer finance assets to Chinese lender QL Finance for HK$1 billion: Move comes as part of cost-cutting push by the bank while QL Finance expands its operations,,01 Dec 2017
42,China's Bank of Communications partners with Hong Kong fintech start-up to use AI in finance,,01 Dec 2017
43,"Equities to outperform bonds as volatility set to rise, say Pictet and State Street: Leading global asset managers State Street and Pictet expect stocks to outperform bonds next year even with the increase in market risks",,01 Dec 2017
44,"China to power WuXi NextCODE, the Google of human genome data: Human genome information provider WuXi NextCode in forefront of new industry to help doctors and drug firms fight diseases through use of AI",,01 Dec 2017
45,Chinese AI start-up Megvii expands into hardware with robot for iPhone X assembler Foxconn,,01 Dec 2017
46,"Restaurant review: La Piola in Wan Chai - Italian dishes are a mixed bag of hits and misses: An excellent space with a good atmosphere, but the dishes were decidedly uneven on our visit",,01 Dec 2017
47,Rock star and professor of physics Brian Cox believes the human race has a rosy future: British physicist says mankind has immortality in its grasp - as long as we don't do anything stupid,,01 Dec 2017
48,"Opportunities open up for Hong Kong companies as Dubai strives to diversify its economy: As the emirate moves away from oil, opportunities for Hong Kong firms grow, writes PETER SABINE",,02 Dec 2017
49,UAE sees mainland China and Hong Kong as integral to its multidimensional development strategy,,02 Dec 2017
50,Dubai identifies 3D printing as pivotal to its big technology push,,02 Dec 2017
51,"'I can communicate with dogs, cats and cockroaches': Hong Kong pet whisperers' confessions: Self-styled psychics are cashing in as more Hongkongers than ever own pets.",,02 Dec 2017
52,*Note to online sub: Pls take noted out short version of story and merge with PET PSYCHIC main,,02 Dec 2017
53,looking into the mind of a yorkshire terrier,,02 Dec 2017
54,Picture of a heart-warming farewell at Tsim Sha Tsui wharf captures interracial couple's 1960s love story: Veteran lensman who captured sentimental moment makes contact with widow of former soldier,,02 Dec 2017
55,"Why a job is more than just an income source for Hong Kong's mentally ill: Getting back into the workforce not only helps generate income, but also rebuilds social bonds",,02 Dec 2017
56,"How an award-winning Filipino photographer overcame personal adversity to excel in her field: Hannah Reyes Morales, who has an extraordinary backstory, is a leading light in photojournalism",,02 Dec 2017
57,Running is a way of life for Kenyan athlete Thomas Kiprotich who trains children in Hong Kong,,02 Dec 2017
58,"'i like those nice, healthy elvis films'",,02 Dec 2017
59,Hong Kong TV producer legend Robert Chua sees multimedia as future of industry: Robert Chua transformed the way Hongkongers watched television in the 1960s - and he's still buzzing with ideas about how to rescue the industry,,02 Dec 2017
60,"Explainer: A brief history of TB in Hong Kong: Tuberculosis used to be a death sentence for sufferers in Hong Kong, and even though this may not be the case today critics say the city could do a lot more to trace victims and offer treatment",,02 Dec 2017
61,Mainland-born scholar Zhang Xiang preferred candidate for top job at University of Hong Kong,,02 Dec 2017
62,Shedding light on Aids,,02 Dec 2017
63,Wang Qishan still attending top Communist Party meetings and in line for China's vice-presidency: Wang Qishan left his key party roles last month but continues to attend top-level meetings and is expected to be named vice-president in March,,02 Dec 2017
64,China is simply taking a leaf out of US book,,02 Dec 2017
65,"China will take a more active role in world problems, Xi Jinping says: More than 300 international political groups attend high-level gathering",,02 Dec 2017
66,Hong Kong equality watchdog urges sports sector leaders to comply with sexual harassment study,,02 Dec 2017
67,Pro-Beijing politicians decry Hong Kong by-elections date clash with China's 'Two Sessions': Politicians complain that Legco by-elections on March 11 will clash with annual meetings in Beijing,,02 Dec 2017
68,"What's next after North Korea's successful launch of rocket that can strike US?: Pyongyang could turn its attention to firing first rocket from submarine, military analysts believe",,02 Dec 2017
69,Going the extra mile,,02 Dec 2017
70,"Repairman 'swamped' with work did not maintain faulty escalator in Hong Kong shopping mall accident, court hears",,02 Dec 2017
71,Scholar tipped to lead HKU made his name turning science fiction into reality with 'invisibility cloak',,02 Dec 2017
72,Tree pruners 'lacked common sense' in work which led to 21 egrets dying in protected area: Report points to lack of common sense and absence of operation guidelines,,02 Dec 2017
73,"Where is Ray Wong, the alleged Mong Kok riot instigator?: Ray Wong, leader of Hong Kong Indigenous, was allowed to leave city for trip to Europe but court says he has breached multiple bail conditions",,02 Dec 2017
74,"You put safety at risk, judge tells 'lazy' technician who faked reports for Hong Kong's bridge to Zhuhai",,02 Dec 2017
75,Best of Harry,,02 Dec 2017
76,Abuse victims must follow brave Hong Kong athlete,,02 Dec 2017
77,Pope chooses right words in Myanmar,,02 Dec 2017
78,"US ramps up pressure on China, rejecting market economy status at WTO: Washington tells World Trade Organisation that it opposes Beijing being granted market status, possibly paving the way for further disputes",,02 Dec 2017
79,Xi Jinping praises Barack Obama for contributions to Sino-US ties,,02 Dec 2017
80,Alibaba launches US$1.5 billion fund to help fight poverty in China: The group will assign its top executives to work on projects in education and environment protection,,02 Dec 2017
81,Chinese state firm criticises Nepal over decision to scrap US$2.5bn dam contract,,02 Dec 2017
82,Pandas are a knockout,,02 Dec 2017
83,Formula E car v cheetah video goes viral as driver Jean-Eric Vergne reflects on South Africa shoot,,02 Dec 2017
84,Three cheers for the volunteers: the heartbeat of Hong Kong's sporting events out in force for the E-Prix: Waking up in the early hours can be an addition for some who keep coming back,,02 Dec 2017
85,Hugo Chui credits new Valley teammates with helping take his game to 'another level' in Hong Kong Premiership: The winger hopes his performances can win him a place in the Hong Kong side after his studies,,02 Dec 2017
86,Babar Hayat hits Hong Kong's first double century in first-class cricket: Captain scores 214 not out as Hong Kong race to an innings and 29-run I-Cup victory over PNG,,02 Dec 2017
87,Better a second time around: Hong Kong E-Prix rolls into action again: Big crowds are expected over the weekend as teams and drivers look for a winning start to the new Formula E season at Central Harbourfront,,02 Dec 2017
88,"Good enough to be in F1, Mitch Evans is the Formula E young gun putting New Zealand on the motorsport map",,02 Dec 2017
89,John Size leans on lessons learned to get Contentment ready for the Hong Kong Mile,,02 Dec 2017
90,Royal outing,,02 Dec 2017
91,"China mulls ways to promote e-sports industry in bid to replicate Olympics gold medal success: Rapid growth is driven by smartphones, availability of broadband network and popularity of internet cafes that encourage team-based game playing",,02 Dec 2017
92,Chart of the day: Real test yet to come,,02 Dec 2017
93,"From electronic appliances to home decoration, Chinese retailer Gome wants to have it all",,02 Dec 2017
94,HNA to extend Glencore and CWT's expertise in commodities and logistics along New Silk Road: Conglomerate plans to expand commodities and logistics businesses along 'belt and road' amid crackdown on outflows,,02 Dec 2017
95,"Hong Kong shares see biggest drop in almost a year, led by declines in Tencent and Ping An: Amid turmoil in technology stocks, Hang Seng Index sheds 2.7 per cent for the five-day period",,02 Dec 2017
96,"Key rates are poised to rise in the first quarter, but what does this mean for Hong Kong borrowers?: As Hibor hits nine-year highs, commercial banks are expected to change their best lending rate for the first time since 2008 in the next quarter",,02 Dec 2017
97,US interest rate rise may slow Hong Kong home price growth but 'will not cause a crash'Rate rise r,,02 Dec 2017
98,Electric charge,,03 Dec 2017
99,Senior EU official pushes China to live up to Xi Jinping's promise to open up country's markets: Visiting diplomat calls on Beijing to deliver on President Xi Jinping's promise to open up markets,,03 Dec 2017
100,"Is Donald Trump an idiot? The answer is truly worrying: Yonden Lhatoo finds the questions about the US president's mental fitness are not only justified but ominous as well, given the real threat of war and disaster under his leadership",,03 Dec 2017
101,Chinese piano star Lang Lang '200 per cent' confident of coming back from arm injury,,03 Dec 2017
102,Combat ready: PLA's new Y-9 transport planes put through paces in South China Sea drill: Fleet of medium-lift Y-9 aircraft in round trip from Sichuan province for airdrop,,03 Dec 2017
103,Is China chipping away at the Asean bloc?: Southeast Asian neighbours fear Beijing's greater plan is to mould them to fit its strategic interests,,03 Dec 2017
104,"As Formula E races through Hong Kong, a tax tweak has hit electric car sales hard: Purchase of environmentally friendly vehicles decline 97 per cent after budget change unveiled",,03 Dec 2017
105,"Buyers snap up flats in Hong Kong development, the Cullinan West II, ahead of possible US interest rate rise",,03 Dec 2017
106,"Law in Hong Kong doesn't protect children from abuse, charity warns after four-year-old girl left in semi-coma: Campaigners react after girl is left in semi-coma and women who were caring for her are arrested",,03 Dec 2017
107,Privacy crucial for new identity cards,,03 Dec 2017
108,Pursuing repayment from disqualified six may fuel antagonism,,03 Dec 2017
109,Does an inverted yield curve spell trouble for US economy?,,03 Dec 2017
110,In at the deep end,,03 Dec 2017
111,"An IT firm gave millions to 'China's Warren Buffett' - now he's missing: Hi-tech security company, which gave HK$590m to fund whose offices were found empty, is now struggling to explain loss to regulators, investors",,03 Dec 2017
112,"How a breast cancer survivor uses her experience to improve the self-esteem of patients: For five years, Qi Lifang has sold silicone prostheses, specially fitted bras and nightgowns to mainland women who have lost their breasts",,03 Dec 2017
113,"After a 10-year absence, former rugby star Stephanie Cuvelier is back on the netball court for Hong Kong: Former HK rugby star returns to the netball side for the Nations Cup in Singapore",,03 Dec 2017
114,Tyler Spitz feeding off winning habit as Tigers make it five on the trot in Hong Kong Premiership,,03 Dec 2017
115,Welcome to Formula E: Sam Bird crashes into garage but still wins chaotic Hong Kong E-Prix: British DS Virgin driver bounces back from mistake to claim the first leg of the HKT Hong Kong E-Prix and aims to complete the double-header today,,03 Dec 2017
116,Man v Machine: Leading the way to autonomous car advancements,,03 Dec 2017
117,Nico Rosberg says he is 'definitely interested' in return to motorsport with Formula E,,03 Dec 2017
118,Radio Ga Ga: mechanical madness adds to the Formula E drama at Hong Kong E-Prix,,03 Dec 2017
119,"Hong Kong's Just MMA gets off to an explosive start with upsets, brawling rugby players and a 16-second knockout: Headline act Schembri knocks out Filipino opponent - and then heads off for a pizza",,03 Dec 2017
120,"After trying to shut Hong Kong's media out of their own Sevens, strapping tape saga shows World Rugby are still the master of the backflip",,03 Dec 2017
121,Red is the colour,,03 Dec 2017
122,From Hong Kong's Phoon to Indonesia's Seahoarse - five rising Asian acts you must see: xxxxxxxxx,,03 Dec 2017
123,"Should Hongkongers really own cats? Experts offer seven methods to keep an indoor puss happy: With its notoriously small flats, Hong Kong is hardly a cat paradise, and many animal lovers question whether they are even suited to indoor living.",,03 Dec 2017
124,"Fears of a second Hong Kong water scare as heavy metals found in public estate tap water: Tests reveal heavy metals, but government engineer says it's safe to drink",,06 Dec 2017
125,Hong Kong financial boss Ivan Chan receives life sentence at retrial for murdering his mistress,,06 Dec 2017
126,Man accused of indecent assault in Hong Kong gets bail but at 10 times the amount he proposed,,06 Dec 2017
127,"Six pan-dems enter primary race to contest two seats in Hong Kong Legco by-election: They will compete next month to represent bloc, with the winners moving on to contest the Legco seats vacated by disqualified lawmakers",,06 Dec 2017
128,Witnesses to fatal shooting of man in 2014 at odds over whether Hong Kong police issued warning,,06 Dec 2017
129,"Hong Kong leader Carrie Lam talks up Saudi Arabia as trade partner in 'Belt and Road' push: Carrie Lam is also chief lobbyist, saying HK has much to offer in areas such as financial services",,06 Dec 2017
130,"Luxury carmaker Audi pledges HK$150,000 of earnings from car rental service to charity",,06 Dec 2017
131,"Move to end filibustering 'reasonable' so Legco meetings can go back to 'normal', says Hong Kong leader Carrie Lam: Chief executive says the council's president made a reasonable call in allowing debate on changes to the rule book to curb opposition time-wasting",,06 Dec 2017
132,"Hong Kong migrant worker group calls for more training after helper is arrested for video of children in shower: Group says domestic workers may not be aware of differences, following the arrest of woman who filmed herself showering three children",,06 Dec 2017
133,"Hong Kong private sector grows for third straight month, key index shows",,06 Dec 2017
134,Self-service library stations to provide books on demand for Hong Kong readers: Readers can choose from 300 titles as first of three stations starts operation,,06 Dec 2017
135,'No data risk' with Hong Kong's new smart ID card - and you can get into city four seconds faster,,06 Dec 2017
136,Beijing warned its tough internet controls may hurt foreign relations: Foreign experts and diplomat say China's approach could sour relations,,06 Dec 2017
137,"Cost of Sha Tin-Central rail link balloons to HK$87 billion, making it the most expensive rail project in Hong Kong history: Price tag for MTR Corporation's cross-harbour line rises to HK$87 billion, making it the most expensive railway project in the city's history",,06 Dec 2017
138,Government must stand up to the bullies from the Heung Yee Kuk,,06 Dec 2017
139,"China hopes cold war nuclear energy tech will power warships, drones: Beijing pumps billions into revival of old nuclear tech in hope 'molten salt' reactors in Gobi Desert will produce safe energy for ships and drones",,06 Dec 2017
140,"China, Canada need 'political trust' to build stable trade ties, Xi Jinping tells Justin Trudeau: Canadian premier highlights need for durable free-trade deal with China",,06 Dec 2017
141,Luxury set to come to Hong Kong Island's old industrial south side as developers pay big for land dddd: 600 flats to be built at Wong Chuk Hang appear set to fetch even higher prices,,06 Dec 2017
142,Soccer over sanctions,,06 Dec 2017
143,Task force urges Hong Kong to use caution when eyeing country park land for development,,06 Dec 2017
144,"Runaway borrowers the new face of China's personal credit boom: With Beijing preparing its annual blueprint for tackling economic challenges, the South China Morning Post is examining three of the so-called grey rhinos threatening the country's prosperity.",,06 Dec 2017
145,Beijing has to learn from kindergarten saga,,06 Dec 2017
146,There's no escaping constitutional reality for Hong Kong,,06 Dec 2017
147,Staying sharp,,06 Dec 2017
148,"US and China could exchange sanctions on telecom, chips and agriculture in trade war skirmish: analysts: Trade specialists warn that Beijing has weapons at its disposal if Trump administration imposes tariffs or quotas against exports from China",,06 Dec 2017
149,Australia warned over 'siding against' China in security group: Ex-foreign minister Bob Carr says Australia must not try to contain Beijing,,06 Dec 2017
150,Is Shenyang in China's industrial heartland the worst place in the world to start a business?: EU Chamber of Commerce says onerous governance turns investors away from ailing industrial hub,,06 Dec 2017
151,"Look past China's short-term cash squeeze to better quality growth, central bank official says: Measures to control risk follow emphasis by Xi Jinping on the need for quality growth",,06 Dec 2017
152,The show on the road,,06 Dec 2017
153,Alain Couetil says Tiberian can beat Highland Reel and Talismanic in Hong Kong Vase,,06 Dec 2017
154,No fights or abuse - the International Jockeys' Championship should be a cakewalk for Leandro Henrique compared to riding in Rio: Growing up and riding in Brazil means Henrique will be able to handle the challenge of tonight's IJC,,06 Dec 2017
155,Ricky Yiu believes a cooler Blizzard can contend in the Hong Kong Sprint after overseas trip works wonders: A trip to Japan has turned him into 'a different horse' and he can show the benefits on Sunday,,06 Dec 2017
156,Australian quarantine ban could affect yearling sales,,06 Dec 2017
157,Do Hong Kong apprentices Matthew Poon and Dylan Mo have attitude issues?: Apprentices must learn that they need to prove themselves over again if they are to succeed,,06 Dec 2017
158,Joao Moreira happy to share some inside information with the International Jockeys' Championship rookies: Magic Man takes four jockeys who are making their track debuts around the city circuit ahead of the International Jockeys' Championship,,06 Dec 2017
159,World Cup legend Lothar Matthaus dishes out advice for Hong Kong's young football talent,,06 Dec 2017
160,"China's bicycle-sharing industry may see more mergers soon, says venture capital firm",,06 Dec 2017
161,HNA eyes US$43b Thai economic zone as it aligns shopping spree with China's state policies: Mainland firm toes the line on Beijing policy as it mulls investing in US$43 billion economic zone,,06 Dec 2017
162,"With world in grip of bitcoin mania, CBOE overtakes US rival in race to offer futures first: Bourses keen to tap demand from institutional investors as prices for the digital currency soar",,06 Dec 2017
163,Foreign investment in Shenzhen stocks exceeded mainland trade in Hong Kong shares in link's first year: Cross-border scheme marks year with trade in mainland stocks exceeding that of HK shares,,06 Dec 2017
164,Shanghai subway to use Alibaba voice and facial recognition systems in AI push,,06 Dec 2017
165,Shares in China's Chalco rise after state firm reveals plans to raise US$1.90b by selling stakes in four units: Investment and swaps involving 12.6b yuan at four offshoots spark early rise in smelter,,06 Dec 2017
166,Singapore's CapitaLand goes digital to boost traffic at its Chinese shopping malls: Singapore property firm adapts to changing industry to attract customers to its shopping centres,,06 Dec 2017
167,"Starbucks expecting huge crowds at opening of biggest ever store, in Shanghai on Wednesday",,06 Dec 2017
168,Telcoin eyes digital fundraising as Asia's demand for virtual currencies rises: Company keen to meet robust demand for cryptocurrency in the region,,06 Dec 2017
169,"Hong Kong start-up set to offer navigation, signage translation app to mainland airports",,06 Dec 2017
