,title,byline,dates
170,Mixed ownership reform an opportunity for private equity to invest in state enterprises: China's mixed-ownership reform will allow the private sector to invest in state enterprises in the form of collaboration with government-led funds,,06 Dec 2017
171,Tencent and Alibaba's Taobao brands each worth over US$50b,,06 Dec 2017
172,Seven holiday fashion collections to put on your Christmas shopping list,,06 Dec 2017
173,"Shenzhen's new design museum should give Hong Kong food for thought as it awaits completion of M+ museum of visual culture: New Shenzhen institution curates exhibition with V&A, drawing on collection of 2.5 million pieces",,06 Dec 2017
174,"Why David Beckham thinks China will win the World Cup soon, plus his love of Asia, brand success - and newest Chinese tattoo: David Beckham talks about his love of Chinese culture and his ever-expanding business empire",,06 Dec 2017
175,Brisk Beijing land sales this year expected to have cooling effect on some home prices in 2018,,06 Dec 2017
176,"Die is cast: Opening of MGM China's new casino on Cotai Strip to boost Macau leasing market: Expatriate executives at the HK$26.56 billion project could take up 500 to 1,000 housing units",,06 Dec 2017
177,Veteran lawyer urges Hong Kong government not to rush through land title registration law: Buying a flat will become simpler but there are still issues to be worked out and government should ensure that property owners are well protected,,06 Dec 2017
178,Transformation into a tourism destination draws international investment to Zhuhai's Hengqin island,,06 Dec 2017
179,Follow the leader,,07 Dec 2017
180,"Hong Kong slips to third place in reading literacy ranking, behind Russia and Singapore: Decline from top spot in 2011 blamed on small percentage of parents who enjoy books and a lack of education resources in cramped homes",,07 Dec 2017
181,Mummy's little angel,,07 Dec 2017
182,Pro-establishment supporters jailed for illegal protest under same rules that saw Nathan Law put behind bars: The trio and a fourth defendant also guilty of illegal assembly at airport protest,,07 Dec 2017
183,"Showing naked images of children 'not a big problem' in Indonesia, top envoy in Hong Kong says amid footage row",,07 Dec 2017
184,Teaching Chinese in Mandarin blamed as Hong Kong pupils struggle with higher level reading skills,,07 Dec 2017
185,"Time for Beijing and Hongkongers to discuss way forward beyond 2047, constitutional expert says: But law expert Yash Ghai says the international community will have little say over the matter",,07 Dec 2017
186,Hong Kong's first postmortems for pets on offer at new City University laboratory,,07 Dec 2017
187,Link Reit 'threatened to evict' members of New People's Party over Regina Ip's criticism: New ­People's Party chief vows to continue criticism of company's business practices,,07 Dec 2017
188,Sharp increase in number of false allegations against Hong Kong police officers,,07 Dec 2017
189,Sing and be merry,,07 Dec 2017
190,Virus test developed by 15 Hong Kong university students could mean difference between life and death in an epidemic: Team from Chinese University has come up with a method to quickly identify viruses that could be crucial for doctors when faced with an epidemic,,07 Dec 2017
191,What now for Hong Kong's over-budget Sha Tin-Central Link? And why the MTR's numbers did not tell the full story,,07 Dec 2017
192,"Hong Kong's new police anti-fraud squad freezes HK$99 million in scammers' accounts in just five months: Officers respond to 450 requests from victims to freeze payments secured through online and phone rackets, with HK$99 million being blocked",,07 Dec 2017
193,What's a few billion dollars between the government and taxpayers?,,07 Dec 2017
194,All aboard,,07 Dec 2017
195,"China to keep opening up, leaders tell multinational executives at Fortune Global Forum: Vice-premier tells Fortune forum that China will ­continue pushing free trade",,07 Dec 2017
196,Chinese living on North Korean border told to prepare for nuclear disaster by state newspaper,,07 Dec 2017
197,Hong Kong set to lose global IPO crown to New York and Shanghai as fundraising halves: Failure to attract big listings and technology firms blamed for city's imminent fall to No 3,,07 Dec 2017
198,North Korean airspace could be declared no-fly zone after missile test comes within sight of Cathay Pacific passenger plane: Aviation industry's global trade body pushes for move after Cathay Pacific crew saw what was believed to be remnants of rogue state's missile test,,07 Dec 2017
199,Thailand pushes for high-speed rail link with China to be used for freight,,07 Dec 2017
200,Flaws revealed by escalator accident at Hong Kong mall,,07 Dec 2017
201,Nations would do well to heed call by Chinese President Xi Jinping,,07 Dec 2017
202,Beijing extends powers of state security agents under counter-espionage law: Agents given right to search individuals and ban foreigners from entering or leaving,,07 Dec 2017
203,Shenzhen overtakes Guangzhou as biggest economy in southern China's Guangdong province: New method of calculating GDP sees it overtake the provincial capital and Hong Kong may be next,,07 Dec 2017
204,That's snow business,,07 Dec 2017
205,Big shots arrested,,07 Dec 2017
206,China angrily denies buying political influence in Australia: Chinese embassy in Canberra warns donations controversy is 'filled with a cold war mentality and ideological bias' and may hurt political trust,,07 Dec 2017
207,Cook races to victory despite his freak injury: HK mountain biker triumphs in China after tearing muscle at school sports day,,07 Dec 2017
208,"Can Satono Aladdin grant wishes and cap his career with a Hong Kong Mile victory?: Japanese stallion is about to head to stud, but another top-flight win would increase his value",,07 Dec 2017
209,John Size says the key to his stranglehold on the Hong Kong Sprint is unraced horses: Nine-time champion trainer believes the key to his stranglehold on the Group One is unraced imports,,07 Dec 2017
210,Sam Clipperton to be Batman to Harry Dunlop's Robin Of Navan in the Hong Kong Cup: The 23-year-old Aussie jockey secures mount in HK$25 million showpiece,,07 Dec 2017
211,The four-year-old series may prove a Golden Age for Cruz: The smart youngster collects his second straight win and stamps himself as a Derby contender,,07 Dec 2017
212,Jockeys challenge: He never rated his chances highly but his 'underdog' status proved to be just perfect on the night,,07 Dec 2017
213,More trouble ahead? HKFA likely to beef security for next year's AFC Champions League clash,,07 Dec 2017
214,After the flames,,07 Dec 2017
215,"Broker, fund manager numbers hit record amid Hong Kong stock market rally: Record number of people and companies enter industry as market gains 32 per cent and daily turnover hits HK$100 billion, says regulator",,07 Dec 2017
216,Chart of the day: Money flows,,07 Dec 2017
217,"China giants CNBM and Sinoma merge to become world's largest cement maker, eye Silk Road growth",,07 Dec 2017
218,"Hong Kong stocks tumble with sell-off of year's best performers: Worries over clampdown on manipulation drive the Shanghai index below the 3,300-point level",,07 Dec 2017
219,"US reform bill puts pressure on China to tweak its tax code to avert fund flight, lure investment: Chinese businesses hunt for lower-tax regimes as American firms may get incentive to bring offshore profits back to the world's largest economy",,07 Dec 2017
220,"China must focus on innovation in manufacturing as wages rise, says Apple's Cook: Advanced manufacturing expertise also vital for countries facing rising labour costs, forum told",,07 Dec 2017
221,HSBC seeks 'creative' ideas to reach Hong Kong renewable energy targets: Banking giant aims to source 100 per cent of its global power needs from renewable sources by 2030,,07 Dec 2017
222,Nintendo's Super Mario Bros jumps into China for first time,,07 Dec 2017
223,Teaching aid: Alibaba tests AI system that can spot errors in written Chinese essays,,07 Dec 2017
224,China's Meipai bans minors from live-streaming service following nudity scandal,,07 Dec 2017
225,"Chinese tenants continue their march into Hong Kong's premium office space, driving up rents: City leads global pack in leasing costs for second year as expanding mainland companies snap up top-grade space in the central business district",,07 Dec 2017
226,Starbucks gains traction in bid to make China its largest market: Coffee chain looks to make the mainland its biggest market within a decade,,07 Dec 2017
227,"Film review: Take Me to the Moon - Vivian Sung, Jasper Liu contemplate ambitions and dreams in time-travelling romcom",,07 Dec 2017
228,Macau international film festival: everything you need to know about the 2017 edition and awards: The director of the International Film Festival and Awards Macau outlines his vision for the event,,07 Dec 2017
229,"Top five films to watch in Hong Kong this week (December 7-13), from The Bold, the Corrupt and the Beautiful to Take Me to the Moon",,07 Dec 2017
230,"Nicholas Tse talks about how cooking changed his life and how the web lets him learn anything: Popular mainland reality show lets self-taught cook mix it with some of the world's best chefs, even if his own recipes sometimes leave viewers baffled",,07 Dec 2017
231,"Meet the Hong Kong genocide educator, who reminds us of the darkest side of human nature: Simon Li is in a race against time to document some of the most horrific episodes in human history",,07 Dec 2017
232,Defending democracy,,09 Dec 2017
233,"As Hongkongers join the #MeToo movement, NGO offers support tips and alarming findings: The decision by two high-profile Hongkongers to speak out about being sexually assaulted has encouraged more women to come forward.",,09 Dec 2017
234,"Do not be ashamed, sexual assault survivor in Hong Kong urges",,09 Dec 2017
235,"'Father of Hong Kong opera', 79, laments that he may 'not live to see an opera house' at the West Kowloon Cultural District",,09 Dec 2017
236,Searching for the next game-changer in Hong Kong's thriving fashion start-up scene: Hayley Lyla is behind a start-up weekend based on The Apprentice to present innovative fashions,,09 Dec 2017
237,Toxic plastic particles in ocean should be a wake-up call for Hongkongers to recycle and reduce use of disposables: Filmmaker wants everyone to be aware we are dumping too much waste and it is poisoning the seas,,09 Dec 2017
238,Mexican's mural atop Hong Kong Island's highest mountain draws attention to 'cocaine of the sea': Artist depicts two endangered species fished to point of extinction due to demand from mainland,,09 Dec 2017
239,"Who's the full-time volunteer running a Hong Kong disabled care centre that needs HK$6 million to survive?: Priding itself on having 'no boundaries from birth to death', the 52-year-old community survives on donations, not government grants",,09 Dec 2017
240,"'COMEDY IS A BATTLE - IF PEOPLE LAUGH, THEN I WIN'",,09 Dec 2017
241,"Meet scholar-turned-celebrity Ben Sir, out to save Cantonese from a slow death: Benjamin Au quit life as a lecturer for showbiz, part of his mission to revitalise Hong Kong culture",,09 Dec 2017
242,"get your kicks from these four great hong kong hikes, but beware of the dangers A WALK ON THE WILD SIDE",,09 Dec 2017
243,TIPS FOR A SAFER HIKE,,09 Dec 2017
244,A WALK ON THE WILD SIDE,,09 Dec 2017
245,A class of his own,,09 Dec 2017
246,ICAC detains Convoy chairman at the airport as investigation expands to involve Lerado: Quincy Wong detained at airport on return to Hong Kong while Lerado chairman Mark Mak is named as one of three arrested in series of raids,,09 Dec 2017
247,"Over 2,500 Hong Kong taxi drivers sign up to cashless WeChat Pay and Alipay",,09 Dec 2017
248,Hong Kong's opposition leaders only have themselves to blame,,09 Dec 2017
249,"China denies making impossible demands for collapsed US$14 billion infrastructure deal with Pakistan: Beijing did not ask Pakistan for ownership rights to US$14 billion infrastructure project or other impossible demands, state planning official says",,09 Dec 2017
250,China's embassy in Pakistan warns of 'series of terror attacks soon' on its nationals,,09 Dec 2017
251,China's navy puts on show of strength for North Korea ... and United States' east Asia alliance: Drill with 40 ships follows air force exercise and US-South Korean displays,,09 Dec 2017
252,"Could Russia replace China as power broker on North Korea?: Move seen as sign of Beijing's waning influence over its ally, North Korea",,09 Dec 2017
253,"Police legally shot dead Hong Kong man who rushed towards wife with paper cutter, jury says: Call for better training despite verdict that man who threatened wife was lawfully killed",,09 Dec 2017
254,Animal lovers lament as Hong Kong sea creatures cleared out for man-made pleasure beach,,09 Dec 2017
255,Body of Hong Kong nightclub hostess found outside her flat,,09 Dec 2017
256,"HKU's new 'employee', therapy dog Jasper, is a campus hit this exam period",,09 Dec 2017
257,Insurance cover for beauty parlours aims to improve service after bad year for complaints in sector: Move aims to improve quality after sector faced 411 complaints in first 10 months of year,,09 Dec 2017
258,"Noise from Hong Kong marine traffic poses threat to rare Chinese white dolphins, study shows: Study reveals how sea traffic disrupts way they use clicks and whistles to communicate and find food",,09 Dec 2017
259,"Pan-dems continue protest against Legco rule book change, ask for 97 motions to be debated first: They include summoning government officials on policy matters and reprimanding Legco leaders",,09 Dec 2017
260,Flying visits,,09 Dec 2017
261,Study spells it out on the reading of Hong Kong children,,09 Dec 2017
262,Trump tax reform a challenge for China,,09 Dec 2017
263,"China's trade gap with US nears record level despite Trump's call for action: Data comes as Washington puts pressure on Beijing to narrow gap, including inquiry over dumping",,09 Dec 2017
264,"Chinese leaders identify top three economic battles: risk, poverty and pollution: Financial risk, poverty and pollution to be tackled as Politburo sets out its priorities",,09 Dec 2017
265,Flushed with pride,,09 Dec 2017
266,"All the world's a stage for Chinese city that wants to recreate Shakespeare's hometown: Stratford replica town in Jiangxi will honour Shakespeare, Tang Xianzu and Cervantes",,09 Dec 2017
267,Shenzhen economy closing in on Hong Kong under revised calculation methods: Inclusion of R&D spending in GDP calculations under revised accounting standards means border city may soon overtake its illustrious neighbour,,09 Dec 2017
268,Green light: Francois Rohaut's Signs Of Blessing to go forward in Hong Kong Sprint,,09 Dec 2017
269,"Patrick Kwok finds Hong Kong Mile contestants Beauty Only and Beauty Generation with his first two forays into ownership: Family's famous black, white and pink colours on display by two runners in tomorrow's HK Mile",,09 Dec 2017
270,"Thewizardofoz or Mr Stunning? Joao Moreira points to poor decision-making for 'form slump': Magic Man pulls the wrong rein for Sprint, but he has not given up hope of causing an upset",,09 Dec 2017
271,For the record,,09 Dec 2017
272,How Danny became Frankie and now the new trainer is etching his name into Hong Kong folk-Lor,,09 Dec 2017
273,"Weighed down by HK$383 million in bets? I can't think about it, says Hong Kong champion jockey Joao Moreira: 'I can't think about it,' says champion jockey Joao Moreira, as punters ride him for HK$380 million",,09 Dec 2017
274,"Anshuman Rath hits miaden ton, Hong Kong rack up highest ODI score in victory over Papua New Guinea: Hong Kong post their highest one-day score in victory over Papua New Guinea in Dubai",,09 Dec 2017
275,Emotions run high as California fires cast deathly pall over Stormy Liberal in Hong Kong Sprint: Connections of American contender Stormy Liberal for International Races stunned by devastation at training base and loss of dozens of racehorses,,09 Dec 2017
276,"He's taken a different path to old pal Joe Launchbury, but Jack Metters is lifting off in Hong Kong Premiership",,09 Dec 2017
277,"Tiffany Chan ready to mix it with LPGA Tour's best as she plans a festive season fine-tuning her game in Hong Kong: Back home just days after achieving her dream, the 24-year-old has high hopes for 2018 season",,09 Dec 2017
278,Farewell to fighters,,09 Dec 2017
279,How digitalisation is taking China closer to its goal of a stronger and efficient economy?: Digitalisation of the mainland's myriad industries and big and small businesses a game changer in the quest to become a strong economy,,09 Dec 2017
280,Bargain hunters and upbeat trade figures drive Hong Kong and mainland stocks higher: Mainland shares also rise as robust trade figures wipe off concerns about a possible slowdown,,09 Dec 2017
281,Chart of the day: Gaining pace,,09 Dec 2017
282,Unmanned stores in China still working on a seamless shopper experience: The concept is a retailer's dream - increasing profits while cutting costs via shops without staff - but true customer convenience is what counts,,09 Dec 2017
283,China's bike-sharing unicorns may be forced to merge with rivals to ensure survival: The closure of bicycle-sharing firm Bluegogo is expected to spur industry players on the mainland to mull merging or raising more funds to survive,,09 Dec 2017
284,"What does the popular language of the day say about the world's economies?: After the rise and fall of the economic languages of their time, what will trip off the tongue next?",,09 Dec 2017
285,Gunning for smog,,21 Dec 2017
286,"Graft complaints in Hong Kong's finance and insurance sectors up by 20 per cent, with 177 cases reported this year: First 11 months of the year sees 20pc rise in complaints against the two sectors, but ICAC says this does not point to a worsening problem",,21 Dec 2017
287,"Police hunt jewellery thief behind HK$500,000 diamond switch in Hung Hom",,21 Dec 2017
288,Pressure increases on Hong Kong leader to enact controversial national security law: Pro-Beijing veteran says government has enough time to push ahead with controversial legislation,,21 Dec 2017
289,"Woman, 37, in court charged with murder after daughter's dismembered body found in Hong Kong flat",,21 Dec 2017
290,Concern over Hong Kong's young having to wait 17 months for mental health care: Legco panel promises review after learning about 17-month-long queues at public hospitals,,21 Dec 2017
291,"Hong Kong authorities seize 8,500 mobile phones worth HK$8 million after high-speed boat chase",,21 Dec 2017
292,Hong Kong trade committee set up to tap into Belt and Road opportunities: 28-member committee set up to tap into opportunities presented by Beijing's global trade initiative,,21 Dec 2017
293,"What should you do if there is a leak at Shenzhen's Daya Bay nuclear plant? Hong Kong island residents get ready (just in case): Two-day exercise with mock evacuation held on island of Tung Ping Chau, 20km from plant",,21 Dec 2017
294,"Financial risk the 'critical battle' for Xi Jinping in next three years: Economic policy conference makes clean-up of China's soaring debt a priority for the next three years, even at the expense of fast growth",,21 Dec 2017
295,"Kim Jong-un's rejection of father's pledge led to North Korean nuclear crisis, Chinese ex-diplomat says: Retired Chinese diplomat says ties have suffered because of North Korea's belligerent leader",,21 Dec 2017
296,Preparing for worst,,21 Dec 2017
297,"With new land to trim supply shortfall, Hong Kong government sticks to target of 280,000 new public flats over next 10 years",,21 Dec 2017
298,A university education in Hong Kong still just about pays,,21 Dec 2017
299,China set to move into United States' backyard with national development plan for Grenada,,21 Dec 2017
300,"EU ruling on Uber will give Hong Kong an 'excuse' to block it, unless it follows taxi laws: Lawmaker says authorities will use its classification as transport firm instead of app to block service",,21 Dec 2017
301,Ex-Hong Kong minister Patrick Ho indicted in US over US$2.9 million in bribes to African officials: Former Hong Kong official will enter plea in a New York court next month,,21 Dec 2017
302,Guizhou cadres told promotions depend on appraisals from environment agencies,,21 Dec 2017
303,"Up to 1,000 domestic helpers affected in Hong Kong ticketing debacle, consulate fears: Diplomats urge those who bought Christmas flight tickets from agency to get in touch",,21 Dec 2017
304,Hong Kong must do more on data protection,,21 Dec 2017
305,Trump national security strategy looks flawed from the start,,21 Dec 2017
306,The Force is with us,,21 Dec 2017
307,How innovative China's growing pains point to an urgent need for IP know-how: Chinese firms likely to get in crosshairs as US vows to protect intellectual property rights,,21 Dec 2017
308,Taiwan's New Party accuses Tsai's government of political witch-hunt against Beijing-friendly forces: Officials deny any irregularity in inquiry into alleged national security violations against New Party,,21 Dec 2017
309,"LONG WAY TO GO BEFORE CARBON MARKET MATURES, ANALYSTS SAY: Observers claim launch of trading scheme by Beijing is just the first step to a fully functioning system",,21 Dec 2017
310,Pandas at play,,21 Dec 2017
311,"Promises, promises ... but still no end to China's ban on group tours to South Korea: Group visits still face restrictions despite a vow to mend bilateral ties, travel agencies say",,21 Dec 2017
312,Double Doleuze happy to go the early crow: The French jockey enjoys the wins of Winfull Patrol and Arm Runda while nine-time champion trainer Size closes in on the top of the leader board,,21 Dec 2017
313,"Hong Kong handed US$3,000 slap on the wrist by AFC for fans booing the national anthem: Regional governing body fines the HKFA US$3,000 for the conduct of a group of local fans before the Asian Cup qualifying match against Lebanon",,21 Dec 2017
314,The strongest Hong Kong line-up ever: Dream team out for glory at 24 Hours of Dubai: Racing legend comes out of retirement to form strongest local team for 24 hour race,,21 Dec 2017
315,"Fosun buys out Asahi's stake in Tsingtao Brewery as it turns its acquisitions back to its home turfTO BE: Asset-hungry group acquires Japanese investor's stake in renowned mainland brewery for HK$6.6 billion, marking return to home market",,21 Dec 2017
316,Life after work: Hong Kong employees' retirement savings fall short by about HK$2 million,,21 Dec 2017
317,Revealed: Suzhou contractor is buyer of one of Asia's priciest flats at Mount Nicholson,,21 Dec 2017
318,"This Christmas, Americans would do well to remember who they owe their gifts and prosperity to: Think tank shills would have US citizens bite the hands bearing their gifts",,21 Dec 2017
319,Chart of the day: The challenge for gold,,21 Dec 2017
320,China's stocks fall as declines in Baoshan Steel and material companies temper gains in distillers: HK indices end two days of gains following retreat in US equities after glitch hits tax bill,,21 Dec 2017
321,Chinese developers Evergrande and Vanke acquire land in Shenzhen for combined US$1.3b,,21 Dec 2017
322,"AIA eyes next frontier in China, marketing 'protection' products among consumers in smaller cities: Insurance giant to keep hiring sales agents amid demand for family protection policies, says chief",,21 Dec 2017
323,"Bitcoin dips US$2,000 after US regulators halt share trading in The Crypto: Cryptocurrency drops below US$17,000 after SEC halts trading in The Crypto Company",,21 Dec 2017
324,China Green suspends trading after being sued by Convoy as 'Enigma Network' fallout continues,,21 Dec 2017
325,"China property tax based on 'appraisal value', with legal process to be in place by 2019: Finance minister's article signals consensus on appraisal of tax and its step-by-step imposition",,21 Dec 2017
326,"China's education system kills initiative and creativity, says co-founder of Angry Birds mobile game",,21 Dec 2017
327,Qihoo 360 shuts down live-streaming video platform over privacy concerns at schools: Move comes after media raises concern about public access to content concerning children,,21 Dec 2017
328,Robot tutors set to help students take on China's daunting Gaokao college entrance exams: Yixue Education offers AI-based software learning methods to prepare students for top schools,,21 Dec 2017
329,"Top five films to watch in Hong Kong this week (December 21-27), from Paddington 2 to Oasis: Supersonic",,21 Dec 2017
330,An inspiring example of how the other half gives,,21 Dec 2017
331,"Stories behind Hong Kong districts: Tsim Sha Tsui - how the sharp, sandy point became a major tourism and shopping hub: How Tsim Sha Tsui went from a beach to the world's busiest shipping port to a major tourism hub",,21 Dec 2017
332,"Malaysia's economy continues to enjoy robust growth: Economy has seen robust growth over the past year, while inflation has moderated and the ringgit continues to strengthen against the US dollar.",,22 Dec 2017
333,MESSAGE,,22 Dec 2017
334,Upbeat business prospects,,22 Dec 2017
335,"Admit that Basic Law does not provide legal basis for joint checkpoint plan, Jasper Tsang urges Hong Kong officials",,22 Dec 2017
336,Greenpeace members arrested after protest shuts down Hong Kong observation wheel for seven hours: Police arrest 19 activists as disappointed visitors criticise 'selfish' protest,,22 Dec 2017
337,Hong Kong government proposes doubling metered parking fees to as much as HK$20 per hour: Metered charges could rise to HK$20 an hour as HKAA fears private firms could follow suit,,22 Dec 2017
338,"McDonald's tops Hong Kong fast food chain list for most plastic utensils used, Greenpeace says",,22 Dec 2017
