,title,byline,dates
2163,"Restaurants and bars face lean times ahead, trade group says: Trade group blames protest movement for HK$3 billion in lost profits, and says it could take months for business to pick up again","Kang-chung, Ng.",11 Dec 2014
2164,"Restaurants and bars fear lean times could continue, trade group says: Trade group blames protest movement for HK$3 billion in lost profits, and says it could take months for business to pick up again","Kang-chung, Ng.",11 Dec 2014
2165,The Drums,,11 Dec 2014
2166,"Moore: Master belongs with the big boys: English import can go on to bigger things after Moreira gives trainer his 1,400th career win","Cox, Michael.",11 Dec 2014
2167,HKCA faces sponsorship and cost issues over World Cup track event: HKCA wants to ensure support from key backers before committing to hosting a leg,Chan Kin-wa.,11 Dec 2014
2168,Rangers won't move away from their home ground in Kowloon Bay Park,Chan Kin-wa.,11 Dec 2014
2169,Illegal detention prompts probe,,12 Dec 2014
2170,Leaders stress 'new normal' growth: Beijing likely to tolerate slower rate with higher efficiency,"Ruan, Victoria.",12 Dec 2014
2171,"Orderly end to 75 days of turmoil: Police end Admiralty sit-in, but students vow to fight on, predicting a 'second wave of occupation'",Staff Reporters.,12 Dec 2014
2172,Let's give innocent Hong Kong shop owners a break after Occupy protests,"Lo, Alex.",12 Dec 2014
2173,"Talking Points, December 12, 2014",,12 Dec 2014
2174,"Who Said It? December 12, 2014",,12 Dec 2014
2175,Erwiana accused of 'wicked lies' in assault trial: Lawyer questions testimony given by helper on equipment used in her alleged assault,"Lau, Chris.",12 Dec 2014
2176,Erwiana claims translation led to evidence doubt: Lawyer questions testimony given by helper on equipment used in her alleged assault,"Lau, Chris.",12 Dec 2014
2177,NetEase accused of smear campaign against Momo founder,"Luo, Chris.",12 Dec 2014
2178,"Students can take a gap, start a business: Mainland's young entrepreneurs encouraged to defer studies and launch companies in move to cope with burgeoning number of graduates",Zhuang Pinghui.,12 Dec 2014
2179,Admiralty shop owners say good riddance to protest camp,"Karacs, Sarah.",12 Dec 2014
2180,Disheartened protesters express sadness as they leave Admiralty: Debris and discarded supplies strewn across area as disheartened protesters leave site,"Ngo, Jennifer.",12 Dec 2014
2181,"Occupy Central camp in Admiralty goes down quietly as police move in: No resistance as workers backed by 7,000 police clear out community that lasted 75 days, and hardcore protesters wait patiently to be arrested",Staff Reporters.,12 Dec 2014
2182,Denise Ho first celebrity to be arrested at protest site,"Chow, Vivienne; Lee, Danny.",12 Dec 2014
2183,"Hong Kong police receive 2,251 complaints related to Occupy protests","Nip, Amy.",12 Dec 2014
2184,List of who's who taken into custody: Barristers and lawmakers stay put until the end to face arrests lasting for almost five hours,"Lo, Clifford; Ng, Joyce; Kang-chung, Ng; Gao, Kathy; Siu, Phila.",12 Dec 2014
2185,Police officer in hospital after collapsing during Occupy clearance,"Nip, Amy; Mok, Danny.",12 Dec 2014
2186,"Couple detained illegally by family planning officials: Villagers locked up at local inn after failing to pay fine for third child, media reports say","Gan, Nectar.",12 Dec 2014
2187,Graft acted on Liu's mind 'like a collapsed dam',"Wu, Nan.",12 Dec 2014
2188,"Teachers must be allowed to discuss nation's social problems, professor says","Li, Jing.",12 Dec 2014
2189,"Around the nation: cook uses his noodle: Also, husband post selfies so wife can keep track of him; five-year-old lectures adult over littering",,12 Dec 2014
2190,"Taiwanese stealth 'killer' prowls the South China Sea: Video of high-speed, 500-tonne attack vessel is meant to send a message to Beijing, expert says","Chen, Andrea.",12 Dec 2014
2191,"Don't deny Japan the right to watch Angelina Jolie war film, says activist: Angelina Jolie'snew war film is causing outrage among some Japanese - but one proponent says it could be a chance to educate audiences",Julian Ryall in.,12 Dec 2014
2192,Let's now find a way forward on Hong Kong's political reform,,12 Dec 2014
2193,"Letters Question, December 12, 2014",,12 Dec 2014
2194,Torture report undermines US claim to be world's moral judge,,12 Dec 2014
2195,AIA's Mark Tucker wins Business Person of the Year award,,12 Dec 2014
2196,Ericsson lawsuit could derail Xiaomi's global expansion,"Perez, Bien.",12 Dec 2014
2197,Mainland allows 12 more firms to launch IPOs: Guosen Securities among latest batch of new listings aimed at checking wild run on market,"Ren, Daniel.",12 Dec 2014
2198,Talk of fresh easing by China's central bank stirs markets: The central bank is reported to have injected billions of yuan into the interbank market and increased loan limits for commercial lenders,Jeanny Yu and.,12 Dec 2014
2199,events,,12 Dec 2014
2200,Hong Kong takes lead in WTO deal ratification,"Sau-wai, Chim.",12 Dec 2014
2201,Impact from manufacturing shift in China on sourcing patterns expected to take years: Global sourcing patterns seen changing in five to 10 years after factories relocate from China,"Sau-wai, Chim.",12 Dec 2014
2202,Lure of stock market fast bucks shades China property appeal: Funds raised to invest in the real estate market plunge in November and October as investors chose to put them in the financial sector instead,Langi Chiang and.,12 Dec 2014
2203,Ethnic minority courses criticised: Bureau accused of guiding non-Chinese speaking students away from mainstream schools by offering classes in service industry,"Ngo, Jennifer.",12 Dec 2014
2204,Man appears in court on murder charge,,12 Dec 2014
2205,Sai Kung stray dogs centre appeals for cash,,12 Dec 2014
2206,"Summon envoy over HK ban, Cameron urged: British MPs say response has been too weak to 'confrontational act' barring entry to committee","Woodhouse, Alice; Agencies.",12 Dec 2014
2207,'Men posed as police and assaultedmainlander',"Lo, Clifford.",12 Dec 2014
2208,"Swire volunteers get their hands dirty killing bedbugs in run-down flats: Swire employees spend free time working with NGO to clean up old public housing estates, including the nasty job of eradicating bedbugs","Ngo, Jennifer.",12 Dec 2014
2209,On second thought: We can take pride in our students and learn from them: Open learning culture necessary to allow young adults to become independent thinkers,"Woon-kwong, Lam.",12 Dec 2014
2210,"Robbers used curry powder to steal HK$800,000 from couple: Two 18-year-olds jailed for five years after they joined a gang to rob a couple of HK$800,000","Chu, Julie.",12 Dec 2014
2211,"Sai Kung rescue centre needs cash to keep its canine charges safe: Sai Kung rescue centre has been offered a new lease, but that won't help the 70 animals living there unless more money can be found","Woodhouse, Alice.",12 Dec 2014
2212,Tribute to local filmmaker,,12 Dec 2014
2213,"Fog light may have obscured ferry before Lamma collision, court hears","Chan, Thomas.",12 Dec 2014
2214,"Jockey Club trainer Pierre Ng backed right horse in chasing dream: Pierre Ng's father tried to talk him out of a career in the stables, but the lifelong equestrian enjoys the trials and pressure","Gao, Kathy.",12 Dec 2014
2215,"Hong Kong hawkers stifled by government red tape demand change: Hawker markets can bring much-needed income for some of the city's poor, but welfare groups say government restrictions on their operation have made it hard to do business, writes Elaine Yau","Yau, Elaine.",12 Dec 2014
2216,"Butchery classes in Hong Kong show cleavage of Chinese and Western tastes: Western butchers cut away the bones, but Chinese ones chop through them. They are part of two different culinary traditions, reports Charley Lanyon","Lanyon, Charley.",12 Dec 2014
2217,"Hong Kong's first Ethiopian restaurant opens in Sai Ying Pun: Chef Helina Tesega is showing Hong Kong what's 'wot' when it comes to Ethiopian cuisine, writes Jenni Marsh","Marsh, Jenni.",12 Dec 2014
2218,Try cooking Ethiopian style with recipe for yellow split pea wot: Recipe by Helina Tesega,"Marsh, Jenni.",12 Dec 2014
2219,Back on the horse,,12 Dec 2014
2220,"Cruz is key to nettingTT jackpot glory: A decade after Silent Witness won his second Hong Kong Sprint, a horse owned in the same interests can act as banker in the Class Two over 1,200m","Cox, Michael.",12 Dec 2014
2221,Hope yet for Sempiternal after terrific Valley run,"Aitken, Alan.",12 Dec 2014
2222,Buffering '100 per cent' but fears remain over Ambitious Dragon,"Aitken, Alan.",12 Dec 2014
2223,Farraaj roadshow reaches Sha Tin: Improving five-year-old ready to realise trainer's ambition in Hong Kong Cup,"Hawkins, Andrew.",12 Dec 2014
2224,John Mooore adds dash of spirituality to his International Day preparations: Trainer of seven horses on international day adds an element of Chinese traditional 'bai-sun' and fung shui to his intensive preparations,"Aitken, Alan.",12 Dec 2014
2225,Volatile Aerovelocity an enigma to connections: Paul O'Sullivan-trained six-year-old has a point to prove in Group One,"Cox, Michael.",12 Dec 2014
2226,"Rational Ref: Beyond perfection, referees are the real superheroes: Displaying mortal weaknesses sees referees abused or even vilified",,12 Dec 2014
2227,Thailand's Chonburi once again stand in the way of HK's ACL ambitions,Chan Kin-wa.,12 Dec 2014
2228,"A celebration of success: As the city's top business awards programme marks its 25th anniversary, the winners demonstrate how their expertise and resilience are needed more than ever, writes Keith Chan","Chan, Keith.",12 Dec 2014
2229,Gentle touch pays off for sleuths,"Chan, Keith.",12 Dec 2014
2230,Plaza Premium taking off the world over,"Chan, Keith.",12 Dec 2014
2231,Investing in the future with a vision,"Cremer, John.",12 Dec 2014
2232,'Small fixes' not enough to solve city's big problems: Leading adviser to Beijing says 'comprehensive treatment' needed to cure Hong Kong's ills - but protest leaders say more action is likely,"Chi-fai, Cheung; Fanny W Y Fung Emily Tsang; Cheung, Tony.",13 Dec 2014
2233,"Anti-corruption watchdog to penetrate Communist Party core: Watchdog's surveillance net to cover all departments, including country's most powerful",Zhuang Pinghui.,13 Dec 2014
2234,US avoids government shutdown,,13 Dec 2014
2235,"Beijing rejects Hanoi's legal challenge on Spratly, Paracel islands disputes: Vietnam's latest manoeuvre to challenge China over the disputed Spratly and Paracel islands is a 'cat and mouse' game, analyst says","Ibrahim, Zuraidah; Kwok, Kristine.",13 Dec 2014
2236,Indonesian helper Erwiana tells court she was forced to hide injuries to feet: Maid tells court former employer threatened her family and told her to 'walk properly',"Lau, Chris.",13 Dec 2014
2237,Long-playing DJ 'Uncle' Ray Cordeiro adds another year to his record,"Chou, Oliver.",13 Dec 2014
2238,"People key to city's success, say Post's Redefining panelists",Toh Han Shih.,13 Dec 2014
2239,"People key to city's success, say Post's Redefining panellists",Toh Han Shih.,13 Dec 2014
2240,"State Council approves free-trade zones for Tianjin, Fujian and Guangdong: State Council gives green light for projects in coastal powerhouses","Meng, Angela.",13 Dec 2014
2241,Arrested Admiralty protesters all released unconditionally,"Ngo, Jennifer; Fung, Fanny.",13 Dec 2014
2242,Arrested Hong Kong activists released as pro-democracy protests continue,"Ngo, Jennifer; Fung, Fanny.",13 Dec 2014
2243,Hong Kong police to clear final protest zone on Monday: source,"Lo, Clifford; Yu, Alan; Gao, Kathy.",13 Dec 2014
2244,Now city must face the big questions in wake of Occupy: The shouting is over and the talking must begin as the city confronts the big question of how to achieve electoral reform without confrontation,"Cheung, Tony.",13 Dec 2014
2245,"As bird flu threat grows, so too does indifference: Across the delta, authorities are making little effort to educate the public",He Huifeng.,13 Dec 2014
2246,"China news in brief, December 13, 2014",,13 Dec 2014
2247,Driver's fatal error,,13 Dec 2014
2248,Watering the north,"Li, Jing.",13 Dec 2014
2249,Allow independent checks on executive power,,13 Dec 2014
2250,"Letters Question, December 13, 2014",,13 Dec 2014
2251,Urgent need for health-care reform,,13 Dec 2014
2252,A cartoonist's eye on Occupy,,13 Dec 2014
2253,Caution over bubble as China urged to ease policy amid slowdown: Analysts sound caution over bubble as the mainland's rate cut attracts speculative funds to the stock markets and results in volatility,"Ruan, Victoria.",13 Dec 2014
2254,China's retailers expected to see slow recovery,"Sun, Celine.",13 Dec 2014
2255,Chinese Estates key shareholder to gain billions from HK asset sale: Chinese Estates controlling shareholder stands to pocket HK$3.9b if special dividend is paid,"Li, Sandy.",13 Dec 2014
2256,Chart of the day: China exports deflation again,,13 Dec 2014
2257,events,,13 Dec 2014
2258,China firm starts work on Argentine railway project,"Sau-wai, Chim.",13 Dec 2014
2259,"China property sales rebound 13.1pc in November amid easing measures: Mainland sales revenue rose 13.1pc last month amid policy easing, reversing October decline","Chiang, Langi.",13 Dec 2014
2260,China's touch screen panel makers hit by smartphone competition: Closure of two Dongguan mobile screen factories this week highlights tough environment for firms that fall behind rapid technology changes,"Yu, Sophie.",13 Dec 2014
2261,Chinese brokerages face probes into financing businesses amid stock rally,"Ren, Daniel.",13 Dec 2014
2262,Squeezed Chinese developers deepen push into HK property market: China City Construction's move on Sha Tin site seen as shift from tight market at home,"Li, Sandy.",13 Dec 2014
2263,Legislation to outlaw Hong Kong LGBT discrimination a 'lengthy process',Toh Han Shih.,13 Dec 2014
2264,"LGBT community offers access to wider talent pool, says HSBC chief: Financial sector voices support for the LGBT community, noting numerous benefits such as access to wider talent pool and more customers",Toh Han Shih.,13 Dec 2014
2265,"Samsonite packed for expansion: Samsonite, the world's largest luggage maker, is riding a global tourism surge to double its size as a diversified bags supplier through acquisitions","Ap, Tiffany.",13 Dec 2014
2266,Split views over China stock mania,,13 Dec 2014
2267,Cool deals in the air as Hong Kong Brands and Products Expo begins,"Sung, Timmy.",13 Dec 2014
2268,"Girl, 18, jailed seven years for manslaughter",,13 Dec 2014
2269,"HK lawmakers approve HK$7.5b Ta Kwu Ling landfill expansion, Tuen Mun study","Chi-fai, Cheung.",13 Dec 2014
2270,Hong Kong Brands and Products Expo long on optimism and bargains,"Sung, Timmy.",13 Dec 2014
2271,Rafael Hui/Kwok brothers trial: deliberations to begin on Monday: Deliberations to begin on Monday as city's biggest ever graft trial edges towards a conclusion after more than six months,"Lau, Stuart.",13 Dec 2014
2272,"Soccer player guilty, but few know why: Magistrate gives details of match-fixing verdict to lawyers but not media","Chu, Julie.",13 Dec 2014
2273,"Doubts cast over navigation of Lamma IV in ferry crash manslaughter trial: Trial told Sea Smooth skipper should have spotted other vessel, despite fog lights","Chan, Thomas.",13 Dec 2014
2274,"Doubts cast over navigation of Lamma IV in manslaughter trial: Trial told Sea Smooth skipper should have spotted other vessel, despite fog lights","Chan, Thomas.",13 Dec 2014
2275,Experts disagree over redesign for historic Mong Kok shophouses: Planning board puts condition on project after critics say refurbishment plan lacks authenticity,"Wong, Olga.",13 Dec 2014
2276,Operation Santa Claus: Dinner for diabetics proves restricted diet doesn't have to be boring: Grilled scallops with truffles were on the menu as volunteers from Manulife helped prove that a restricted diet doesn't have to be boring,"Cheung, Elizabeth.",13 Dec 2014
2277,"Sunday, Apple Daily",,13 Dec 2014
2278,Contracted (IIB),,13 Dec 2014
2279,The Planner,,13 Dec 2014
2280,Storm Clouds,,13 Dec 2014
2281,City can thrive even without the injured Aguero: Champs have done well without Argentinian before as they travel to bottom club Leicester,,13 Dec 2014
2282,"Sorry Brendan, but the Europa League just ain't the same thing: Under-fire Liverpool boss Brendan Rodgers is trying to play up Uefa's second-tier competition, but he is failing miserably",,13 Dec 2014
2283,Purton has an Ace up his sleeve in the Mile,"Aitken, Alan.",13 Dec 2014
2284,Warriors prepare for final battle: Cirrus Des Aigles and California Memory will meet for the 'last round' of a great fight at Sha Tin,"Cox, Michael.",13 Dec 2014
2285,"Hong Kong Scottish look to continue run against Valley: With the Broony Quaich safe for Christmas, they turn their attention towards third-placed Valley","Sallay, Alvin.",13 Dec 2014
2286,Buying and selling Hong Kong Sevens tickets? New 'marketplace' to protect fans: HKRFU and online company to provide platform for reselling unwanted tickets,"Prentice, Noel.",13 Dec 2014
2287,"Caspar Fownes' Lucky Nine and Military Attack primed for big show: Lucky Nine and Military Attack are getting on in years, but the trainer says his two best hopes for international day are ready for challenge","Aitken, Alan.",13 Dec 2014
2288,Mixed day for HK paddlers in Bangkok,,13 Dec 2014
2289,New points scoring system shelved until after the Rio Olympics: BWF won't change the scoring format until after the Rio Olympics,Chan Kin-wa.,13 Dec 2014
2290,Scott MacKenzie hopes England move will lift world championship chances,Chan Kin-wa.,13 Dec 2014
2291,Landslide kills at least 18 in central Indonesia,,14 Dec 2014
2292,"Nanjing massacre can't be forgotten, Xi says: President says Japan's wartime record cannot be forgotten but also calls for peace as nation marks the first massacre memorial day","Zhou, Laura.",14 Dec 2014
2293,GLOBETROTTING CHARLEY LANYON,,14 Dec 2014
2294,Beijing's liaison chief helps kick off annual Brands and Products Expo,"Tsang, Emily.",14 Dec 2014
2295,Heat is on Macau junket operators ahead of visit by Xi Jinping: Prominent figures in the gambling hub's biggest source of revenue are coming under scrutiny ahead of visit by President Xi,"Boehler, Patrick; Harris, Bryan.",14 Dec 2014
2296,Police outline details of clearance of Causeway Bay Occupy site: Hundreds of officers to descend on vestiges of Causeway Bay protest site tomorrow morning,"So, Peter; Ngo, Jennifer.",14 Dec 2014
2297,"Talks on global ICT trade pact stall amid Beijing-Seoul deadlock: China, South Korea deadlocked on issue of flat panel displays at Geneva negotiations","Perez, Bien.",14 Dec 2014
2298,Strong election win by Shinzo Abe could affect Sino-Japan relations: Strong election victory could encourage tough nationalist stance in Japan's ties with China,"Zhou, Laura.",14 Dec 2014
2299,Hong Kong bridge worker killed as machine plunges into sea: Project's safety record under spotlight again as machinery operator falls into the sea off Lantau,"Woodhouse, Alice.",14 Dec 2014
2300,"Hong Kong briefs, December 14, 2014",,14 Dec 2014
2301,Law professor drafts plan to bridge political divide: Law professor suggests room for manoeuvre in electoral framework for chief executive election; calls on Leung not to seek second term,"Fanny WY Fung; So, Peter.",14 Dec 2014
2302,13 arrests in Hong Kong cigarette smuggling crackdown: More than HK$5m in illegal cigarettes seized in customs raids on cross-border schemes,"Lee, Danny.",14 Dec 2014
2303,"Mainland sex workers in HK seek money, travel and tend to be married with children: Mainland sex workers in city and Macau tend to come from rural areas, seek travel, work long hours and often face exploitation, study shows","Lam, Lana.",14 Dec 2014
2304,Santa gives reindeer a break with charity hash run: 200 members of hasher club follow trails for a good cause - and a beer,"Lee, Danny.",14 Dec 2014
2305,"Station appreciation as HKU, Kennedy Town MTR stops prepare to open",,14 Dec 2014
2306,"Delays on MTR link, lack of platform doors seen as suicide risk: Delays on the MTR link between Sha Tin and Central leave stations without screen doors, prompting concerns about preventable deaths","Lam, Lana.",14 Dec 2014
2307,HK role in rendition of Sami al-Saadi back in spotlight: US Senate report of CIA's use of torture has some asking what really happened to al-Saadi,"Lam, Lana.",14 Dec 2014
2308,Modest reception for tiny new flats,"Nip, Amy.",14 Dec 2014
2309,Soccer firm's director out after bizarre online rants,"Harris, Bryan.",14 Dec 2014
2310,Woman found dead in public toilet stall in tony Hong Kong neighbourhood,"Gao, Kathy; Lee, Danny.",14 Dec 2014
2311,"China news in brief, December 14, 2014",,14 Dec 2014
2312,Hongkongers find own ways to remember Rape of Nanking,"Fung, Fanny W Y.",14 Dec 2014
2313,Nanjing massacre sites lock out the public on remembrance day: Nanjing residents gather at memorial hall and at several parks only to find entry restricted,"Yan, Alice.",14 Dec 2014
2314,"Despite Beijing-Tokyo tensions, mainland tourists flock to Japan: Political relations between the neighbouring countries have their ups and downs, but visits from mainland hit record so far this year","Wu, Nan.",14 Dec 2014
2315,"For orthodontics instructor, risk of violence against doctors is worth it: Orthodonture head Wang Hongmei is proud to do work increasingly considered too dangerous",Zhuang Pinghui.,14 Dec 2014
2316,"Mainland China restricts singing national anthem to 'proper events': People must stop performing the song at weddings, funerals, new rule says","Chan, Minnie.",14 Dec 2014
2317,Traditional medicine faces challenge from upstart Western ideas,"Yan, Alice.",14 Dec 2014
2318,"Book review: Behind the Door: The Oscar Pistorius and Reeva Steenkamp Story, by Mandy Wiener and Barry Bateman",,14 Dec 2014
2319,"Letters Question, December 14, 2014",,14 Dec 2014
2320,Right choice over rail relics,,14 Dec 2014
2321,Soccer plans on track to for goals,,14 Dec 2014
2322,Organ harvesting ban could strain already troubled system: The public fears the new ban on using bodies of executed prisoners for supply will compound existing problems,"Huang, Cary.",14 Dec 2014
2323,"Photos of the week, December 14, 2014",,14 Dec 2014
2324,10 Chancery Lane Gallery,,14 Dec 2014
2325,Lang Lang2,,14 Dec 2014
2326,Contracted (IIB),,14 Dec 2014
2327,Get ready for a Sha Tin showstopper: It's the biggest meeting of the season as the Longines turf world championships kick off with unpredictable narratives to be played out,"Aitken, Alan.",14 Dec 2014
2328,Jamie Spencer aiming to go out in storming fashion in Hong Kong Mile,"Hawkins, Andrew.",14 Dec 2014
2329,BASKETBALL,,14 Dec 2014
2330,Nakamura and Kostopoulos seek AFC Cup call-up,Chan Kin-wa.,14 Dec 2014
2331,The best horse in Hong Kong history,,15 Dec 2014
2332,"Call to 'enlighten' city after protests: Top Beijing official says 'one country, two systems' must 'evolve' in remarks seen as a strong hint of a firmer line on Hong Kong",Staff Reporters.,15 Dec 2014
2333,Presidential hopeful faces challenges,,15 Dec 2014
2334,SHKP set for volatile trade ahead of court ruling,"Li, Sandy.",15 Dec 2014
2335,"Talking Points, December 15, 2014",,15 Dec 2014
2336,United States not alone in shining light on its failures,"Lo, Alex.",15 Dec 2014
2337,"Who Said It? December 15, 2014",,15 Dec 2014
2338,China's glaciers shrink by a fifth since the 1950s: Experts warn of domino effect on water supply as comprehensive study into China's glacial ice shows average of 244 sq km goes every year,"Li, Jing.",15 Dec 2014
2339,Protesters urge 'non-cooperation' as next gambit as Occupy winds down,"Ng, Joyce; Chan, Samuel.",15 Dec 2014
2340,"Shanghai board to shed light on the law: Group has power to appoint and punish judges, prosecutors - but is it just for show?","Zuo, Mandy.",15 Dec 2014
2341,The last mile: Taiwan's presidential hopeful Dr Tsai Ing-wen must prove the DPP could maintain cross-strait stability - or face a repeat of her loss in 2012,"Chung, Lawrence.",15 Dec 2014
2342,China's new farmers are using e-commerce to transform agriculture: Tech-savvy young people are transforming the agricultural industry by using e-commerce to improve the safety and quality of local produce,"Zuo, Mandy.",15 Dec 2014
2343,China's new farmers are using e-commerce to transform the agriculture: Tech-savvy young people are transforming the agricultural industry by using e-commerce to improve the safety and quality of local produce,"Zuo, Mandy.",15 Dec 2014
2344,"Lavish lifestyle of disgraced Guangzhou party chief Wan Qingliang to feature on anti-graft TV series: TV series will explore former Guangzhou boss Wan Qingliang's extravagant lifestyle, as corruption campaign widens in Guangdong","Lau, Mimi.",15 Dec 2014
2345,Makeshift homes,,15 Dec 2014
2346,"Officialdom still a breeding ground for flies, rats and fleas: Parasitic officials will continue to feast on society unless the system is changed at its core","Wang, Xiangwei.",15 Dec 2014
2347,Fake reporters arrested,,15 Dec 2014
2348,Three-cub circus,,15 Dec 2014
2349,Malay Muslims fleeing country because of increasing religious fundamentalism: Increasing religious fundamentalism and authoritarianism propel many to leave,"Chew, Amy.",15 Dec 2014
2350,"Letters Question, December 15, 2014",,15 Dec 2014
2351,"Doubts raised over US$7.1b plan for Imperial Pacific's Saipan casino: Imperial Pacific plans to build a large resort on a remote Pacific island, but analysts are concerned about its chances for success","Ap, Tiffany.",15 Dec 2014
2352,"HK-Shanghai Stock Connect turnover higher than daily quota, says HKEx","Yiu, Enoch.",15 Dec 2014
2353,Media tycoon Jimmy Lai resigns as Next Media chairman,"Yiu, Enoch.",15 Dec 2014
2354,Chart of the day: Case for oil rebound,,15 Dec 2014
2355,events,,15 Dec 2014
