,title,byline,dates
1628,"China-Japan war over Diaoyus ever more likely, says retired PLA officer: Retired PLA generalsays China is ready and rejects claims of Japanese combat superiority, although some analysts are not convinced","Chan, Minnie.",3-Apr-14
1629,First signs of MH370 crash may be found on Australian shore,"Lee, Danny.",3-Apr-14
1630,Hong Kong-born Olivia Chow urges voters in SAR to help her defeat Toronto mayor Rob Ford: Mayoral candidate Olivia Chow says Canadians in SAR 'share shame' at crack-smoker's antics,"Young, Ian.",3-Apr-14
1631,"MH370 mystery may never be solved, says top Malaysian police officer","Lee, Danny.",3-Apr-14
1632,PLA generals take rare step of swearing loyalty to President Xi Jinping,"Zhang, Hong.",3-Apr-14
1633,Top People's Liberation Army generals in rare show of loyalty to Chinese President Xi Jinping,"Zhang, Hong.",3-Apr-14
1634,Gangland link to state politics sees 26 charged in San Francisco,,3-Apr-14
1635,"China news in brief for April 3, 2014",,3-Apr-14
1636,Mistrust of Maoming officials raises concern of PX protesters,"Li, Jing.",3-Apr-14
1637,"Multiparty rule tried and failed in China, Xi says: President'sassertion during Belgium speech that experiments with other political systems ended in failure challenged by internet users","Wan, Adrian.",3-Apr-14
1638,Video of TV executive 'taking bribes' goes viral,"Zhou, Laura.",3-Apr-14
1639,When paying the taxman also requires paying bribes: Small businesses complain they must routinely pay off tax collectors to avoid trumped up fines,"Meng, Angela.",3-Apr-14
1640,"China Digest for April 3, 2014",,3-Apr-14
1641,Activists say Japan will try to bend rules of child abduction convention: Activists warn Japan will try to bend rules after ratifying UN convention,"Ryall, Julian.",3-Apr-14
1642,"Beijing laying a trap for the Philippines in South China Sea, say experts: Beijing is layinga trap for the Philippines in disputed waters, experts say, waiting for an excuse to seize territory in the oil-rich Spratlys","Robles, Alan.",3-Apr-14
1643,Ban on Japanese whaling a major victory in conservation battle,,3-Apr-14
1644,Import more workers to ease the labour crunch,,3-Apr-14
1645,"Letters to the Editor, April 03, 2014",,3-Apr-14
1646,MTR's train service enhancement will ease overcrowding,,3-Apr-14
1647,Investors watch who will follow Citic's ground-breaking restructuring: Investors awaitsecond state firm to followin footsteps of Citic's asset shuffle but conflicts of interest between officials may stall reform,"Chen, George; Li, Sandy.",3-Apr-14
1648,Occupy Central is no threat to HK Land's earnings,"van der Kamp, Jake.",3-Apr-14
1649,events,,3-Apr-14
1650,Pork producer WH lowers IPO price range: Share sale marketed at a lower valuation as Sino-US firm faces weakness of IPO market,"Chan, Ray.",3-Apr-14
1651,"Beijing mulls tax waiver and more subsidies for green car users: Development of green vehicles important, says vice-premier in announcing incentives for sector","Man-ki, Kwong.",3-Apr-14
1652,"HKEx shares soar, trading halted, on hint of Shanghai cross-trading deal","Yiu, Enoch.",3-Apr-14
1653,"Property developer shares shoot up on CE statement, China reports: Property plays rallyafter CY Leung's comments on suspension of property plan and reports of easing restrictions on mainland homebuyers","Li, Sandy.",3-Apr-14
1654,Anthony Bolton retires with unfond memories of China,,3-Apr-14
1655,"Costly government apps lag in the popularity game: Millions of dollarshave gone into creating a wide range of mobile phone applications, but many are not being used, lawmakers say","Nip, Amy.",3-Apr-14
1656,Lifts turn into traps during thunderstorm,,3-Apr-14
1657,Mugger leaves victim aged 76 critically hurt,,3-Apr-14
1658,Revolutionary art,,3-Apr-14
1659,Scholars suggest a middle way for 2017 chief executive poll,"Lam, Jeffie.",3-Apr-14
1660,Democrat lawmaker taking notes in Taipei?,,3-Apr-14
1661,EOC chief hits out at law on proposed marriage law,"Ngo, Jennifer.",3-Apr-14
1662,Equality chief hits out at marriage bill's impact on transgender community,"Ngo, Jennifer.",3-Apr-14
1663,Lean and green,,3-Apr-14
1664,Transgender refugee goes through 'hell' in Hong Kong to be recognised as a woman: Transgender Colombianfinds herself stateless after problems getting into Hong Kong following hormonal treatment that altered her looks,"Rosenman, Olivia.",3-Apr-14
1665,'Conflict of interest' questions over research cash for think tank,Tanna Chong.,3-Apr-14
1666,Anger as 'residents only' buying scheme is shelved,"Kang-chung, Ng.",3-Apr-14
1667,Balancing act,,3-Apr-14
1668,Bernard Chan may scale down public duties after heart operation: But Exco memberwon't quit all public roles despite undergoing heart surgery - and insists he never considered running for chief executive,"Cheung, Tony; Cheung, Gary.",3-Apr-14
1669,Colleges struggling to fill self-financed courses,"Zhao, Shirley.",3-Apr-14
1670,Police left puzzled by Mong Kok cat burglars: 23 British shorthairs among HK$1m worth of valuables taken in three raids in two days,"Lo, Clifford.",3-Apr-14
1671,Dress smart,"Choi, Christy.",3-Apr-14
1672,Hong Kong ready to take Cantonese opera to next stage,"Chan, Samuel.",3-Apr-14
1673,"My long walk to work was fun - but I'll stick to the MTR, reporter Ada says","Lee, Ada.",3-Apr-14
1674,Public want controls on mainland visitors: poll: Research reveals local fears amid concern that government's projections are too low,"Nip, Amy.",3-Apr-14
1675,Captain America 2: The Winter Soldier (IIA),,3-Apr-14
1676,Edge of the Forest,,3-Apr-14
1677,Recent Acquisitions 2014,,3-Apr-14
1678,Purton right on the mark as he brings up 400: Australian jockey extends lead at the top ofthe Jockeys' Championship with a double,"Hawkins, Andrew.",3-Apr-14
1679,"24pc surge in Hong Kong students studying at universities in England: Uncertainty about city's new diploma system may be a factor behind the rise, says consultant","Zhao, Shirley.",4-Apr-14
1680,More Hongkongers study in England even as foreign student numbers fall: Uncertainty about city's new Diploma of Secondary Education could be behind surge,"Zhao, Shirley.",4-Apr-14
1681,Musharraf survives assassination attempt,,4-Apr-14
1682,Chinese families' aggression won't help to find missing flight MH370,"Lo, Alex.",4-Apr-14
1683,Abused helper Erwiana to return to HK to aid ex-employer's prosecution: Erwiana to undergo medical examination ahead of prosecution of her ex-employer,"Chiu, Joanna.",4-Apr-14
1684,Chow Tai Fook in HK$1.6b deal to buy Marriott London Grosvenor Square Hotel: Group and partners bank on British tourism boom as they snap up luxury Mayfair hotel,"Liu, Yvonne.",4-Apr-14
1685,Democratic Party slow to decide on Shanghai talks after 2010 backlash,"Cheung, Tony; Lam, Jeffie.",4-Apr-14
1686,"Move to raise retirement age for new civil servants to 65: New staffwill work extra five years under move to address the issue of ageing population, with predictions that private sector could follow suit","Siu, Phila.",4-Apr-14
1687,Buddhist temple monks recruited to new Kunming anti-terror squad,"Wan, Adrian.",4-Apr-14
1688,Huge probe set stage for 'gang' trial of mining tycoon Liu Han: Hundreds of policemobilised to collect evidence before hearing against former mining tycoon accused of running triad-like group in Sichuan,"Wu, Nan; Zhai, Keith.",4-Apr-14
1689,"Stung by protests, Beijing nixes possible Xi, Ma meeting","Chan, Minnie.",4-Apr-14
1690,"Taiwan cabinet's plan for vetting cross-strait pacts fails to convince foes: Taiwanese cabinet approves increased oversight on future deals, but foes find proposal lacking","Chung, Lawrence.",4-Apr-14
1691,"China Digest for April 4, 2014",,4-Apr-14
1692,Brave spirits must break the mould,,4-Apr-14
1693,Hong Kong's Olympic body must move with the times,,4-Apr-14
1694,"Letters Question, April 04, 2014",,4-Apr-14
1695,"Letters to the Editor, April 04, 2014",,4-Apr-14
1696,"Schools or homes, city planners must strike a balance",,4-Apr-14
1697,Banned trader accuses CSRC of 'hiding evidence',"Ren, Daniel.",4-Apr-14
1698,Inefficient SOEs lack profit focus: Earlier reforms failed to address the core problem of low productivity among SOEs,"Chiang, Langi; Ruan, Victoria.",4-Apr-14
1699,"Pension fund losses may turn up heat on reform in Hong Kong: Fundsreported an average loss of 0.66pc in March, with analysts forecasting more of the same as stock market volatility continues","Yiu, Enoch.",4-Apr-14
1700,Cofco's Noble deal underscores role: Takeover of agricultural trader to help mainland maintain stable food supply and improve safety,"Tsang, Denise.",4-Apr-14
1701,events,,4-Apr-14
1702,Jack Ma invests 3.3B yuan in financial software provider,"Yu, Sophie; Perez, Bien.",4-Apr-14
1703,"Mainland bankruptcies can leave HK investors at a disadvantage: The 'one country, two systems' principle puts Hong Kong receivers at a disadvantage when dealing with assets held on the mainland","Yiu, Enoch.",4-Apr-14
1704,Banks face credit woes as market reform spurs defaults,"Kanis, Li.",4-Apr-14
1705,Beijing's mini-stimulus fails to excite market: New measuresare seen as mere implementation of the earlier stated plan whereas the market expects more policy easing to stem slowdown,"Ruan, Victoria.",4-Apr-14
1706,Fitch puts OCBC on negative watch after Wing Hang deal: Revised rating reflects bank's higher potential exposure to China after Wing Hang deal,"Kanis, Li.",4-Apr-14
1707,Kingsoft spin-off Cheetah Mobile eyes US$300M in New York IPO: Beijing-based firm to adopt dual-class share structure that is not available in Hong Kong,"Perez, Bien.",4-Apr-14
1708,"Sinopec gets creative with US$5b mixed bond issue: Several months in the making, multi-tranche bond follows similarly structured deals from Exxon Mobil and Brazilian energy giant Petrobas","Moiseiwitsch, Jasper.",4-Apr-14
1709,Fishy business on the rise in Hong Kong,,4-Apr-14
1710,Boyfriend held after woman is found dead,,4-Apr-14
1711,Extradition case must not be delayed: lawyer: Government counselsays businessman wanted by Australia over alleged insider trading should face prompt hearing despite his bid for asylum,"Chu, Julie.",4-Apr-14
1712,ICC you,,4-Apr-14
1713,Radical lawmakers plan to filibuster budget debate to press for pensions: Pensions for all and pay cuts for 'useless' officials among demands ahead of debate,Tanna Chong.,4-Apr-14
1714,Call for action to prevent infections,"Lo, Wei.",4-Apr-14
1715,"HK$40 disaster relief bag that makes the difference between life or death: Teaching survivalskills to people in disaster-prone areas needn't be expensive, Chinese University's relief team is proving","Lo, Wei.",4-Apr-14
1716,"Rainfall at peak of Sunday storm a record for March, Observatory says: 56mm of rain that fell between 9pm and 10pm was highest since Observatory records began",Staff Reporter.,4-Apr-14
1717,"300 places, 19 filled...but it's unfair to judge sub-degrees on the numbers, says college","Zhao, Shirley.",4-Apr-14
1718,Packing their trunks,,4-Apr-14
1719,Removing Falun Gong banners 'breached right to free speech': Falun Gong practitionerssay displays taken down by government officials during 'poster war' were political speech and protected by law,"Chiu, Austin.",4-Apr-14
1720,Tycoon Joseph Lau meets ICAC after his graft conviction in Macau: Tycoon 'consults' Hong Kong graft-buster - but details of the discussion remain confidential,"Chan, Samuel; Lee, Ada; Chi-fai, Cheung.",4-Apr-14
1721,"Carrie Lam hails 'compromise' plans for 2017, but remains pessimistic: Chief secretarywelcomes ideas for 2017 poll that stick to the Basic Law - but is still pessimistic on finding a reform plan lawmakers will back","Kang-chung, Ng.",4-Apr-14
1722,Law firm's archives shed light on the tycoons of Hong Kong's past,"Nip, Amy.",4-Apr-14
1723,"Court's landmark benefits ruling could cost taxpayers an extra HK$197m a year: Figure is based on minister's projection of an increase in CSSA applications of 7,000 a year","Lau, Stuart.",4-Apr-14
1724,Democrat councillor Ted Hui injured by his own council's guards,"Mok, Danny.",4-Apr-14
1725,Treasures from across centuries: Auction house's spring sale has diverse collection ranging from Chinese ceramics to rare wines,"Furniss, Tracey.",4-Apr-14
1726,(I Am) In a Microcosm World,,4-Apr-14
1727,Ashkenazy and Gabetta Return,,4-Apr-14
1728,Captain America 2: The Winter Soldier (IIA),,4-Apr-14
1729,"Nepalese community struggles for acceptance in the city they call home: In the second of a two-part series,Mark Sharplooks at how the Nepalese community struggles for acceptance in a city they call home","Sharp, Mark.",4-Apr-14
1730,Jowett Yu's childhood experiences helped shape his new restaurant: Jowett Yu' s childhood in Taiwan planted the seed for a career in food.Kylie Knotttalks to the chef about his first venture in the city,"Knott, Kylie.",4-Apr-14
1731,Brief Encounters: Jed Root,,4-Apr-14
1732,Jewellery designer Nicholas Liu launches everyday collection,,4-Apr-14
1733,"Plukka's Joanna Ooi takes online jewellery retailer into the real world: Joanne Ooi founded an e-tailer with a business model as captivating as its dazzling designs. Now she's trying a pop-up store, writesJing Zhang","Zhang, Jing.",4-Apr-14
1734,"More retirees buying offices as private spaces to work, relax or entertain","Chan, Charmaine.",4-Apr-14
1735,"Look to Size and Whyte to 'get' Triple Trio pot: Debutant Do You Get Itcan win at his first start in the opening leg, even if the son of Elusive City is as tardy away as he has been in his trials","Cox, Michael.",4-Apr-14
1736,Peniaphobia a long way from poor at Happy Valley,"Aitken, Alan.",4-Apr-14
1737,Moore hoping Able Friend makes a meal of Chairman's Trophy field: Sunday's Group Two an entree for 'eating machine' with Royal Ascot a main course,"Aitken, Alan.",4-Apr-14
1738,Reaching out,,4-Apr-14
1739,Chief Executive C.Y. Leung hints that government is considering controls on number of tourists: Chief executivesays government is aware that growing visitor total is affecting residents' lives and is investigating ways to 'regulate' influx,"Cheung, Tony.",5-Apr-14
1740,Mainland police to get extra arms training,,5-Apr-14
1741,US offers Anson Chan and Martin Lee a poor example of demoracy,"Lo, Alex.",5-Apr-14
1742,"What you liked on SCMP.com , April 5, 2014",,5-Apr-14
1743,'Go home' mental health experts urge families of missing MH370 passengers,"Ng, Teddy.",5-Apr-14
1744,"'Go home', mental health experts urge families of missing Chinese passngers on flight MH370","Ng, Teddy.",5-Apr-14
1745,Hunger strike for universal suffrage starved of support: Radicals within pan-democratic camp pour scorn on fasting,Tanna Chong.,5-Apr-14
1746,Beijing seeks closer EU ties on cybercrime: Policy document says collaboration will help tackle hacking and other offences on internet,"Zhang, Hong.",5-Apr-14
1747,China seeks closer co-operation on cybersecurity with European Union: Policy document says collaboration will help tackle hacking and other offences on internet,"Zhang, Hong.",5-Apr-14
1748,Chinese police to get more arms training after Kunming knife attack: Officers across mainlandto receive three months of intensive weapons tuition in the wake of the knife rampage at Kunming railway station,"Chen, Stephen.",5-Apr-14
1749,Mainland police to get more arms training: Officers across mainlandto receive three months of intensive weapons tuition in the wake of the knife attacks at Kunming railway station,"Chen, Stephen.",5-Apr-14
1750,"China Digest for April 5, 2014",,5-Apr-14
1751,Empty office buildings point to deeper malaise: Authorities built waves of new towns believing demand would continue unchecked for decades,"Ren, Daniel.",5-Apr-14
1752,Empty office buildings point to deeper malaise in China's wealthiest region: Authorities built waves of new towns believing demand would continue unchecked for decades,"Ren, Daniel.",5-Apr-14
1753,One dead in Ningbo apartment collapse,"Chen, Stephen.",5-Apr-14
1754,People in Maoming and Shenzhen stage fresh protest over planned PX plant: Hundreds demonstratein Maoming and Shenzhen against proposal; school pupil and parents asked to sign pledge not to join in,"Li, Jing.",5-Apr-14
1755,Residents continue to fight chemical plant project: Hundreds protestin Maoming and Shenzhen over planned paraxylene facility; officials say earlier demonstrators accidently injured,"Li, Jing.",5-Apr-14
1756,Japan PM Shinzo Abe to sign deal with Australia PM Tony Abbott on military gear,"Ryall, Julian.",5-Apr-14
1757,Cross-Strait Trade in Services Agreement will benefit Taiwan,,5-Apr-14
1758,"Letters Question, April 05, 2014",,5-Apr-14
1759,"Letters to the Editor, April 05, 2014",,5-Apr-14
1760,Prevention is best cure for city's hidden crisis on homelessness,,5-Apr-14
1761,Take the tension out of discussion over secondary school class cuts,,5-Apr-14
1762,What a wet week in Hong Kong,,5-Apr-14
1763,Alibaba IPO poised for reality check as internet stocks decline: Mainland internet stocks expected to experience short-term fluctuations after surging in value,"Perez, Bien; Yu, Sophie.",5-Apr-14
1764,"HK home completions rise with land supply: Pricesare expected to decline 10pc in HK this year as the number of private flats to be built heads for a nine-year high, led by the rural areas","Liu, Yvonne.",5-Apr-14
1765,State Grid joins queue to sell assets amid SOE reform push,"Keira Lu Huang; Chan, Ray.",5-Apr-14
1766,China's miners to step up overseas push: More dealsare expected this year amid robust demand for commodities after weakening metal prices dampen the mood for M&A activity in 2013,Toh Han Shih.,5-Apr-14
1767,events,,5-Apr-14
1768,"Lumena denies allegations of fraud: Chemical firm says allegations 'not based on any facts', and it may take legal action",Toh Han Shih.,5-Apr-14
1769,"New bond issue signals Kingsoft's investment push: Mainland firmseeks HK$2.3 billion from second convertible bond issue, tapping the market for cheap funds for asset building and acquisitions","Perez, Bien.",5-Apr-14
1770,Back in the black: World'sseventh largest smartphone supplier eyes growth opportunities in Europe and the wearable computer market after return to profit,"Perez, Bien.",5-Apr-14
1771,Ivanhoe Pictures bets on Crazy Rich Asians,,5-Apr-14
1772,Yuan anti-speculation drive brings ill wind from the north,,5-Apr-14
1773,Big purse strings,,5-Apr-14
1774,Chief Executive Leung Chun-ying conspicuously absent from reform publicity stunt: Open-top bus paradefeaturing casually dressed politicians bypasses protests as it weaves along its route...and where is the chief executive?,Tanna Chong.,5-Apr-14
1775,"City briefs, April 5, 2014",,5-Apr-14
1776,High-risk groups may get H7N9 jab by end of year,"Tsang, Emily.",5-Apr-14
1777,Man rushed to hospital from border has H7N9: 65-year-old found to have fatal strain of bird flu virus after entering city,"Lee, Ada; Tsang, Emily.",5-Apr-14
1778,Teenagers plead guilty to stealing bus route plates,"Chu, Julie.",5-Apr-14
1779,Leung Chun-ying issues reminder on 24th anniversary of Basic Law promulgation: All reform proposals must remain within mini-constitution's framework: Leung,"Tsang, Emily.",5-Apr-14
1780,Shanghai trip is 'not a matter of life and death': lawmaker seeks to calm expectations for Legco delegation: Lawmaker seeks to calm expectations as 14 pan-democrats sign-up for mainland visit,Tanna Chong.,5-Apr-14
1781,"Sunday, Ming Pao Daily",Paper Talk.,5-Apr-14
1782,Man held over mother-in-law attack,"Lo, Clifford.",5-Apr-14
1783,Education minister comes under fire for $2.6m bill for trips,"Zhao, Shirley.",5-Apr-14
1784,Government wins out in battle with Sun Hung Kai over Tai Po site: Town planners opt for scaled-down government estate and reject Sun Hung Kai subsidiary's private development scheme,"Fung, Fanny W Y.",5-Apr-14
1785,"Guard 'killed girlfriend, chopped love rival': Man denies murdering lover but admits attacking colleague she took an interest in","Chiu, Austin.",5-Apr-14
1786,"New twist in public-private battle over Tai Po housing site: Government scales downits planned public estate, while developer agrees to give up some land as town planners decide site's future","Fung, Fanny W Y.",5-Apr-14
1787,Pan-democrats condemn district council over grants to Beijing-loyalists,"Lau, Stuart.",5-Apr-14
1788,Parents demand government protects Hong Kong's freedom of speech,,5-Apr-14
1789,Captain America 2: The Winter Soldier (IIA),,5-Apr-14
1790,Existence of Life and the Disorderly Present,,5-Apr-14
1791,Ludacris,,5-Apr-14
1792,BASEBALL: Major League Baseball.,,5-Apr-14
1793,"Divine Ten can mix it with the big boys in feature, says Douglas Whyte","Cox, Michael.",5-Apr-14
1794,"Sports briefs, South China Morning Post, April 5, 2014",,5-Apr-14
1795,"Chinese vessel detects 'pulse signal' in ocean in hunt for flight MH370: But expertsurge caution, with no link confirmed to black box of missing Malaysia Airlines plane","Ng, Teddy.",6-Apr-14
1796,GLOBETROTTING CHARLEY LANYON,,6-Apr-14
1797,Malaysian Prime Minister Najib Razack set for caution in 40th anniversary visit to China: Malaysian prime ministerhas to balance celebration of 40 years of ties with feeling for grieving relatives of missing passengers,"Ng, Teddy.",6-Apr-14
1798,"Actress Catherine Deneuve redefines age and beauty: Catherine Deneuve's new movie is about 'ageing beauty' and at 70 she's gorgeous proof that one can age beautifully, writesEdmund Lee","Lee, Edmund.",6-Apr-14
1799,30-year term stays for,,6-Apr-14
1800,Documentary director Matthew Torne says Hong Kong is 'still a colony',"Lam, Lana.",6-Apr-14
1801,"Mystery deepens over delay to Ferris wheel a year after contract awarded: Mystery surroundsproposed harbourfront attraction, with no sign of it being constructed almost a year after the contract was awarded","Nip, Amy.",6-Apr-14
1802,Rwandan student in Hong Kong eyes hopeful future on 20th anniversary of genocide,"Lam, Lana.",6-Apr-14
1803,Stormy clouds loom without united front: Hong Kong's climate forum heard the city needs a co-ordinated plan to deal with severe weather,"Choi, Christy.",6-Apr-14
1804,Conflict in paradise: government's resort plan divides Lamma islanders,"Choi, Christy.",6-Apr-14
1805,Hong Kong's intimate venues carve out indie music niche,"Lam, Lana.",6-Apr-14
1806,"On Purkha Diwas, Gurkhas commemorate their past: Started in Hong Kong, Purkha Diwas is a day of Nepali remembrance","Ngo, Jennifer.",6-Apr-14
1807,"Rolling Stones concert pushes Macau into the big league for entertainment: Alreadythe world'smost cash-rich gaming destination, Macau is now seeking the top Asian spot for concerts and other entertainment","Lam, Lana.",6-Apr-14
1808,China stands to benefit as Russia clashes with West over Ukraine: China's best course of action with Ukraine is the status quo as Moscow and Washington face off,"Huang, Cary.",6-Apr-14
1809,Former top officials from China Three Gorges Corporation moved to new posts: Former headof scandal-hit corporation becomes Hubei deputy governor and general manager assigned to construction office,"Zhai, Keith.",6-Apr-14
1810,Guangzhou protests against proposed Maoming chemical plant,"Chan, Minnie.",6-Apr-14
1811,"Jewellery queen was constantly in motion: Zhou Xiaoguang,whose Yiwu business empire is valued at US$1.3billion, says entrepreneurs can play an influential role in shaping policies","Wu, Nan.",6-Apr-14
1812,PLA sets up leading group to boost training,"Zhang, Hong.",6-Apr-14
1813,Citic Group's plan opens door to greater economic reforms,,6-Apr-14
1814,"Letters Facebook, April 06, 2014",,6-Apr-14
1815,"Letters Question, April 06, 2014",,6-Apr-14
1816,"Letters to the Editor, April 06, 2014",,6-Apr-14
1817,New rules will help keep beauty treatments safe,,6-Apr-14
1818,Now's the time for city's government to get on its bike - literally,,6-Apr-14
1819,"Book review: Unbalanced - the Codependency of America and China, by Stephen Roach",Politics.,6-Apr-14
1820,Newsmaker: Hong Kong-born Olivia Chow's challenge for Toronto mayor against wildman Rob Ford: Hong Kong-bornOlivia Chow's challenge to Toronto's Rob Ford sees a byword for dignity and compassion up against a crack-smoking wildman,"Young, Ian.",6-Apr-14
1821,It's time for our civil servants to work on being happy - not miserable,,6-Apr-14
1822,Obsession with Chinese actor's affair outshines concerns over flight MH370: Some newspapers say interest in personal affairs of stars is lamentable; another says concern reflects mainstream values,"Chen, Stephen.",6-Apr-14
1823,The Wynners,,6-Apr-14
1824,Captain America 2: The Winter Soldier (IIA),,6-Apr-14
1825,Legends of the Giant Dinosaurs,,6-Apr-14
1826,Kitchee win third league title in four years after victory over Sun Hei,Chan Kin-wa.,6-Apr-14
1827,BASEBALL: Major League Baseball.,,6-Apr-14
1828,Day to day tidbits from the world of sport,,6-Apr-14
1829,Street Child World Cup brings attention to a serious issue,,6-Apr-14
1830,"Modi, in the steps of Margaret Thatcher",,7-Apr-14
1831,US defence chief Chuck Hagel calls on China to respect its neighbours amid tensions with Japan: US defence chieftells Beijing on eve of visit that 'great powers have great responsibilities' as he announces deployment of warships to Japan,"Wan, Adrian.",7-Apr-14
1832,The complexities of setting up a June 4 exhibit in Hong Kong,"Lo, Alex.",7-Apr-14
1833,"Talking Points, April 7, 2014",,7-Apr-14
1834,"Who Said It? April 7, 2014",,7-Apr-14
1835,China drills 7km borehole in 'roof of world',"Chen, Stephen.",7-Apr-14
1836,Hong Kong 'should adopt national security law until own version is ready',"Lam, Jeffie; Cheung, Gary.",7-Apr-14
1837,Jasper Tsang 'shocked' by mainland academics' security law proposal,"Lam, Jeffie; Cheung, Gary.",7-Apr-14
1838,Land ahoy,,7-Apr-14
1839,"Lawmakers file record 6,825 queries on city budget: Lawmakersfile a record6,825 questions on this year's spending plan, angering critics who say public resources are being squandered","Cheung, Tony; Cheung, Gary.",7-Apr-14
