,title,byline,dates
2244,"Letters Question, April 13, 2014",,13-Apr-14
2245,"Letters to the Editor, April 13, 2014",,13-Apr-14
2246,Maoming chemical plant failed to build trust with residents,,13-Apr-14
2247,Chuck Hagel's visit to carrier spurs media talk on PLA transparency: Editorial says the military should open its doors to ordinary Chinese in the same way it did with US defence secretary,"Ng, Teddy.",13-Apr-14
2248,We must not change our tune for the copyright trolls,,13-Apr-14
2249,Membra Jesu Nostri,,13-Apr-14
2250,Campus Confidential (IIA) (Mandarin),,13-Apr-14
2251,The Planner,,13-Apr-14
2252,Zac Purton proves a point with Sacred success in Sydney,"Aitken, Alan.",13-Apr-14
2253,"We must rise to the occasion, says Caroliners captain: South Chinacaptain urges his players to give it their best shot against rivals Kitchee in an intriguing Cup quarter-final clash",Chan Kin-wa.,13-Apr-14
2254,"Historic Chengdu meeting another hoof in the door: Dubai-led initiativehailed a success, but viable system of mainland competition remains distant","Cox, Michael.",13-Apr-14
2255,BADMINTON: Singapore Open.,,13-Apr-14
2256,Day by day tidbits from the week in sports,,13-Apr-14
2257,Don't expect trade quota to rise: minister,,14-Apr-14
2258,Money laundering investigations in Hong Kong up sharply following 2012 law: But reports of 'brain drain' plague agencies investigating financial crimes under new law,"Toh Han Shih; Chan, Samuel.",14-Apr-14
2259,Pair of aces,,14-Apr-14
2260,"Pan-democrats not ruled out of 2017 chief executive election: But in a meetingwith lawmakers, mainland officials reject possibility of public or parties putting forward names for chief executive","Lam, Jeffie.",14-Apr-14
2261,"Senior mainland officials rule out possibility of public nominations for chief executive in 2017: Seniormainland officialstell lawmakers that such a move would go against Basic Law, but door could be open for pan-democrat to run","Lam, Jeffie.",14-Apr-14
2262,Stars' big night,,14-Apr-14
2263,"Talking Points, April 14, 2014",,14-Apr-14
2264,When computers take over high-frequency trading,"Lo, Alex.",14-Apr-14
2265,"Who Said It? April 14, 2014",,14-Apr-14
2266,"Beijing officials, Hong Kong pan-democrats no closer after holding talks on political reform in Shanghai: The two sidesexchange gifts with pointed political messages before liaison office chief promises to hold further talks with lawmakers","Cheung, Tony; Lam, Jeffie.",14-Apr-14
2267,Martial arts epic The Grandmaster scoops 12 prizes at Hong Kong Film Awards,"Tam, Johnny.",14-Apr-14
2268,US revives HK report to Congress after plea,"Siu, Phila.",14-Apr-14
2269,US revives HK report to Congress after plea by Martin Lee,"Siu, Phila.",14-Apr-14
2270,The Way We Dance an early winner at Hong Kong Film Awards,"Tam, Johnny.",14-Apr-14
2271,Kung fu lessons on timetable in Jiangsu province: Officials say move will improve fitness and pass on part of traditional Chinese culture,"Lau, Mimi.",14-Apr-14
2272,Largest cache of illegal weapons confiscated,,14-Apr-14
2273,Huge leak of Shanghai police informants' personal data,"Zhai, Keith.",14-Apr-14
2274,Prison term upheld,,14-Apr-14
2275,Article 23 national security law is too hot to handle for now,,14-Apr-14
2276,"Letters Question, April 14, 2014",,14-Apr-14
2277,"Letters to the Editor, April 14, 2014",,14-Apr-14
2278,The pros and cons of working past 60,,14-Apr-14
2279,Real conservation can enhance the way our city develops,,14-Apr-14
2280,New tunnel opens door for minority Derung people of China's Yunnan province,,14-Apr-14
2281,Home price declines hit development site values: Government tenders indicate that land prices have fallen to cost of building mass housing,"Li, Sandy.",14-Apr-14
2282,Investors told not to count on quota top-up: Financial services ministerdescribes caps on trading under the 'through train' share scheme as an 'important risk-management mechanism',"Yiu, Enoch.",14-Apr-14
2283,"Equity-averse developers in a bind: With bond marketspooked by the first default, mainland property firms may have to overcome resistance to tapping share market for funds","Moiseiwitsch, Jasper.",14-Apr-14
2284,events,,14-Apr-14
2285,Taiwan banks put clamps on loans to mainland firms,"Moiseiwitsch, Jasper.",14-Apr-14
2286,'Through train' dispute risks voiced,"Yiu, Enoch.",14-Apr-14
2287,Beijing likely to add curbs on cross-selling fund agreement: Beijingis likely to limit the amount of HK-based products to be sold on the mainland to protect its domestic industry from rising competition,"Yiu, Enoch.",14-Apr-14
2288,Dymocks plans growth despite changing habits: Bookseller upbeat as it seeks to open three shops amid tough competition and the internet,"Tsang, Denise.",14-Apr-14
2289,Doubts over litigation investment fund: Raidon former office of Buttonwood Legal Capital raises questions over claimed HK$1.2b fund as named business partners deny links,"Robertson, Benjamin.",14-Apr-14
2290,"Graft crackdown fuels concerns over laundering in HK: HK's legal and financial firms now need to know their clients, especially those from the mainland",Toh Han Shih.,14-Apr-14
2291,"China Everbright goes full steam on expansion after painful restructuring: Aftera painful restructuring and asset disposals, the red chip looks to double its assets under management in three years from HK$33b now","Chan, Ray; Yu, Jeanny.",14-Apr-14
2292,Debutants' winning run on mainland raises questions: Strip out the stellar first-day gains and stock markets across the border continue declines,"Chan, Ray.",14-Apr-14
2293,Europeans drawn to high yields in Chinese bond market: Fund houses with fresh offshore yuan quotas are lining upto offer products,"Yu, Jeanny.",14-Apr-14
2294,"HK yuan business lures non-local banks: Instead of taking OCBC's acquisition approach, Industrial Bank first sets up a branch in the city","Kanis, Li.",14-Apr-14
2295,Lack of stimulus to drag on China's retail sales,"Sun, Celine.",14-Apr-14
2296,Reform drive faces: Expectationsof first-quarter growth coming in below the year's target rate may weaken the premier's resolve to make tough decisions,"Ruan, Victoria.",14-Apr-14
2297,"Is the market reform a true 'win-win' for Shanghai and HK?: For Hong Kong to maintain its financial hub status in the long run, new edges are needed other than just relying on its offshore yuan business",,14-Apr-14
2298,"City digest, April 14, 2014",,14-Apr-14
2299,"Country park building plan cuts off coastal family trail: Path lies underproposed village house, and with the sea on one side and a steep slope on the other, walkers would hit a dead end","Chi-fai, Cheung.",14-Apr-14
2300,The mystery of border enclave Luk Keng's 'special administrative region',"Chi-fai, Cheung.",14-Apr-14
2301,Six cats found dead on rooftops in Tsuen Wan,"Chan, Samuel.",14-Apr-14
2302,"Store owner enlightens thief of Buddha swag bag: Suspect may have struck before at same store, when stolen statues were mysteriously returned","Siu, Phila.",14-Apr-14
2303,Green study reveals rare seahorses at risk from government development: Study by green groupsreveals rare species of fish breeding in river estuaries that may be threatened by government land reclamation,"Kao, Ernest.",14-Apr-14
2304,Local concerns complicate hopes of a cap on visitors: Negotiating a limit on individual visits proves far harder than persuading Beijing to allow them,"Tam, Tammy.",14-Apr-14
2305,'Abalone king' Yeung Koon-yat sees Hong Kong society turning sour: 'Abalone king' Yeung Koon-yatsays hard work may not be enough for today's young people,"Ngo, Jennifer.",14-Apr-14
2306,Cultural district now has wheel appeal: Visitors can cycle along the promenade at West Kowloon on one of 50 new bicycles,"Lee, Ada.",14-Apr-14
2307,More live-chicken retailers join boycott over prices: Vendors protest against costs after bird-flu scare; chickens and sympathy in short supply,"Lo, Wei.",14-Apr-14
2308,Dockers offered 10pc pay rise,"Siu, Phila.",14-Apr-14
2309,No pressure to avoid going after banks for money laundering: police: Investigators deny facing pressure to focus on low-level 'stooges' rather than major players,"Chan, Samuel; Toh Han Shih.",14-Apr-14
2310,"Pan-democratic hunger strikers break fast, plan to return for second helping: Pan-democratic protesterseat porridge to end record 16-day fast, but a new strike is planned next month to continue universal suffrage fight","Kao, Ernest.",14-Apr-14
2311,Parents at ousted kindergarten reject offer of places at replacement,"Chan, Samuel.",14-Apr-14
2312,Passing grade,"Lo, Wei.",14-Apr-14
2313,Campus Confidential (IIA) (Mandarin),,14-Apr-14
2314,Pick of the day,,14-Apr-14
2315,The Planner,,14-Apr-14
2316,"Filipino painter sells his art to raise money for typhoon victims: After seeing the devastation from Super Typhoon Haiyan for himself, one Hong Kong-based Filipino decided to do what he could to ease the suffering of his compatriots, writesMischa Moselle","Moselle, Mischa.",14-Apr-14
2317,Top academic says Britain lags behind the US in research and innovation,"Yeung, Linda.",14-Apr-14
2318,Even sugar-free soft drinks erode children's teeth,"Dutt, Sunory.",14-Apr-14
2319,"Good dental hygiene can improve overall health: Good dental hygiene does more than benefit teeth - it can improve overall health, writesDavid Tan","Tan, David.",14-Apr-14
2320,"Mercury is toxic, but is still used in amalgam fillings","Whitehead, Kate.",14-Apr-14
2321,Magazine's 'domestic abuse' fashion shoot shows nothing but bad taste,"Zhang, Jing.",14-Apr-14
2322,Nicola Formichetti reboots Diesel with debut autumn-winter collection: Nicola Formichetti is rebooting Diesel with his debut collection.Jing Zhangcatches up with him and the label's owner in Venice,"Zhang, Jing.",14-Apr-14
2323,Nicola Formichetti's Diesel Tribute collection is streets ahead,,14-Apr-14
2324,Australian jockey indicates he is preparing to leave Hong Kong,,14-Apr-14
2325,Cruz experiences roller coaster ride of emotions,"Aitken, Alan.",14-Apr-14
2326,Doleuze and Chang enjoy Sunshine day on the dirt,"Hawkins, Andrew.",14-Apr-14
2327,"Four for Whyte as he signals title intentions: Reigning champion jockeyhas won 13 premierships, but he indicated a 14th may not be out of the question just yet after a plethora of winners","Aitken, Alan.",14-Apr-14
2328,Travel Brand confirms Queen Mother plans,"Cox, Michael.",14-Apr-14
2329,ATHLETICS: London Marathon.,,14-Apr-14
2330,Kitchee close in on another cup final,Chan Kin-wa.,14-Apr-14
2331,Seventh gong for Shen Jinkang who hopes to pass baton,Chan Kin-wa.,14-Apr-14
2332,Big data changes the rules: Digitaltechnology requires analytical and interpretation skills. Reports byKeith Chan,"Chan, Keith.",14-Apr-14
2333,Xi takes lead as nation steps up protection,"Chan, Keith.",14-Apr-14
2334,Graft investigators turn their sights on Shanxi,,15-Apr-14
2335,Philippine delegation to visit HK to ease anger over 2010 hostage tragedy,"Robles, Raissa.",15-Apr-14
2336,Where militias rule,,15-Apr-14
2337,A contradictory mix of preconceptions over China's role in the world,"Lo, Alex.",15-Apr-14
2338,"Talking Points, April 15, 2014",,15-Apr-14
2339,"Who Said It? April 15, 2014",,15-Apr-14
2340,"Pan-democrats' talks in Shanghai only first step in reform debate with Beijing: Outcome suggestsBeijing is willing to continue dialogue with pan-democratic camp over 2017 chief executive election, but only up to a point","Cheung, Gary.",15-Apr-14
2341,PLA plans local offices to combat graft and protect troops' rights,"Zhang, Hong.",15-Apr-14
2342,"Prosecution of Ma Sik-chun ruled out in 2005, say Hong Kong officials: But judge decides against revoking arrest warrant over drug charges","Chu, Julie.",15-Apr-14
2343,Real Madrid donates signed team shirt to thalassemia sufferer in Guangzhou,,15-Apr-14
2344,"The man who questioned Mao: Hu Yaobang's colleagues look back: Hu Yaobang,the liberal leader whose death sparked the Tiananmen Square protests, encouraged the public to reassess Maoist dogma","Yu, Verna.",15-Apr-14
2345,"Son of reformer Hu Yaobang rues lost chance for change, 25 years after his death: Twenty-five yearsafter the death of respected liberal Hu Yaobang, his son laments the lack of progress on political front and press freedom","Yu, Verna.",15-Apr-14
2346,"China news in brief, April 15, 2014",,15-Apr-14
2347,Dongguan hotel boss in sex-trade scandal stripped of NPC seat,"Lau, Mimi.",15-Apr-14
2348,"Water supplies return to Lanzhou after benzene spill, but residents are wary: Authorities warn that 'danger is not yet over' and benzene contamination could occur again",Zhuang Pinghui.,15-Apr-14
2349,"China Digest, April 15, 2014",,15-Apr-14
2350,'Iron Chef' Zhou Fude popularised Chinese food in Japan and overseas,Zhou Fude.,15-Apr-14
2351,"In Indonesia, fair and peaceful elections must be the priority",,15-Apr-14
2352,"Letters to the Editor, April 15, 2014",,15-Apr-14
2353,More talks vital to narrow divide on political reform,,15-Apr-14
2354,Taiwan aims to be a free-trade island,,15-Apr-14
2355,Don't let Hong Kong remain the 'worst city for cyclists',,15-Apr-14
2356,Cross-border stock trading scheme is not a through train but a milk train,"van der Kamp, Jake.",15-Apr-14
2357,MMG leads group buying Peruvian copper project for US$5.85b: Investorsshow enthusiasm for a joint-venture agreement that gives the mainland state-backed miner a majority stake in Peru copper project,"Ng, Eric.",15-Apr-14
2358,WH Group defends remuneration plan for two top executives: Pork processor says fast sales growth justifies US$681m remuneration to two top executives,"Chan, Ray.",15-Apr-14
2359,events,,15-Apr-14
2360,"Ghost towns still a risk if local officials fail to do their homework: Uneasesurfaces for Baoding after property prices rise, but another Beijing satellite shows how work to lay a solid industrial base can pay off","Chiang, Langi.",15-Apr-14
2361,Why Hong Kong retail investors may not board the through train: Curbs in latest version of cross-border share scheme will likely deter HK's smaller investors,,15-Apr-14
2362,Young homebuyers in China can't be too proud to accept parents' help: Concerns grow as the mainland's elderly are using life savings to make down payments,,15-Apr-14
2363,Experts say mainland not ready for Hong Kong-Shanghai through train: Market watcherssay the economy has yet to establish the preconditions needed to allow mutual stock trading between HK and Shanghai,Jeanny Yu and.,15-Apr-14
2364,"New stock scheme: less toot, more chug","Moiseiwitsch, Jasper.",15-Apr-14
2365,Chow Tai Fook eyes 20 per cent growth after 9 per cent drop in sales,Keira Lu Huang.,15-Apr-14
2366,Switzerland-based Partners Group poised to increase mainland investment deals: European private equity fund manager is poised to inject more capital into real estate market as opportunities for acquisitions arise,"Sito, Peggy.",15-Apr-14
2367,Too much focus on fishing boats as pleasure craft are neglected,,15-Apr-14
2368,"'Bullied worker was taking revenge': Party to celebrate his departure prompted chopper attack on women, court told","Chu, Julie.",15-Apr-14
2369,Man who kept wild pig denies mistreating it: Man who kept wild boar after it had apparently been attacked by dogs denies cruelty charge,"Chan, Samuel.",15-Apr-14
2370,Reform: Liberal plan too 'conservative',"Cheung, Tony.",15-Apr-14
2371,Surgeons trying to reattach worker's hand,,15-Apr-14
2372,"We'll talk, say pan-democrats, if they'll listen: Invitation for more talkson electoral reform with mainland officials in Hong Kong gets positive response, but with a couple of provisos","Cheung, Tony; Tanna Chong.",15-Apr-14
2373,New liver op helps save child of six,"Lo, Wei.",15-Apr-14
2374,"Online database of breast cancer patients launched: Case historiesof 13,000 patients - about a third of those with the disease - will give doctors and their patients a clearer idea of what to expect","Lo, Wei.",15-Apr-14
2375,Creative crowd welcome new Central showcase PMQ: PMQ will provide subsidised studios for local creative enterprises in renovated heritage site,"Harris, Bryan.",15-Apr-14
2376,Lawmakers plan court action if Jasper Tsang cuts short budget filibuster,Tanna Chong.,15-Apr-14
2377,Revealed: turnout figures for Executive Council meetings: 'Breakthrough' asattendance figuresfor the Executive Council are released for the first time; one member has a 100 per cent record,"Tanna Chong; Cheung, Gary.",15-Apr-14
2378,Activist Yang Kuang speaks out for human rights at trial in Shenzhen: Yang Kuang tells judge that even if he is jailed he will only work harder for human rights on the mainland and the right to visit his family,He Huifeng.,15-Apr-14
2379,"Chicken row: prices high and stocks low as sellers and suppliers clash: Supply of live poultry from farmers to retailers drops by half in a day, as sellers' boycott goes on","Lo, Wei.",15-Apr-14
2380,Dockers lukewarm on HIT pay offer: union,"Siu, Phila.",15-Apr-14
2381,HK activist speaks outat his trial in Shenzhen: Yang Kuang tells judge that even if he is jailed he will only work harder for human rights on the mainland and the right to visit his family,He Huifeng.,15-Apr-14
2382,Hong Kong couple return home to find burglars ransacking their flat,"Lo, Clifford.",15-Apr-14
2383,Lawmakers round on government's planned new technology bureau: Questions raised about structure while radicals plan filibuster of funding application,"Fung, Fanny W Y.",15-Apr-14
2384,"Ocean Park's new additions: small fry, but a big deal in the seahorse world","Tam, Johnny.",15-Apr-14
2385,Avenue Q,,15-Apr-14
2386,Campus Confidential (IIA) (Mandarin),,15-Apr-14
2387,The Planner,,15-Apr-14
2388,"No request is too strange or small for two online personal service providers: No request is too strange or small for two online personal service providers, whose members are happy to lend a hand as long as it doesn't involve sleaze or violence, writesElaine Yau","Yau, Elaine.",15-Apr-14
2389,Fit & Fab: globetrotting Pearly Chen takes her fitness routine with her,"Rachel, Jacqueline.",15-Apr-14
2390,Health bites,"Wang, Jeanette.",15-Apr-14
2391,"Jury still out on the benefits of slow juicers: Slow juicing is becoming more popular amid claims that high-speed processing destroys nutrients in the food. But some health experts aren't swallowing it, writes Nan-Hie In",Nan-Hie In.,15-Apr-14
2392,Slow juicer guide,Nan-Hie In.,15-Apr-14
2393,Jump Cut films festival offers a platform for young filmmakers,"Sze, Audrey.",15-Apr-14
2394,Guangzhou face tough task without Diamanti: Evergande have to overcome the loss of injured playmaker for their away clash in Melbourne,"Church, Michael.",15-Apr-14
2395,Far from a sham,,15-Apr-14
2396,Yip has a Weapon of choice up his sleeve,"Aitken, Alan.",15-Apr-14
2397,"Yung's High can keep on stepping up in Triple Trio: First-season trainerhas found success with the likes of the six-year-old, who can be a flagbearer for punters in the middle leg tomorrow night","Cox, Michael.",15-Apr-14
2398,Wills' wallop,,15-Apr-14
2399,Plea to delay Hong Kong Stadium closure to host Liverpool visit: HKFA bossBrian Leung seeks government review of renovation plan to pave way for summer visit by league giants Liverpool,Chan Kin-wa.,15-Apr-14
2400,"China's National Security Commission holds its first meeting: Xi Jinping presides over meeting, says body will focus on both domestic and international threats","Zhai, Keith.",16-Apr-14
2401,New laws on card to battle pollution,,16-Apr-14
2402,Minister argues case for waste-site schemes,,16-Apr-14
2403,"Mixing powerful with the vulnerable, as at Hunan Gymnastics School, seems an invitation to evil","Lo, Alex.",16-Apr-14
2404,who said it?,,16-Apr-14
2405,"Dissident Chen Yizi, former aide to Zhao Ziyang, dies in Los Angeles: Official who urged talks with 1989 Tiananmen protesters, then fled amid crackdown, dies",Chen Yizi.,16-Apr-14
2406,Lawmakers blast MTR Corp officials over express rail line's delay,"Lee, Ada; Kang-chung, Ng.",16-Apr-14
2407,Lanzhou court bars residents' lawsuit over benzene contamination of water supply,"Zuo, Mandy.",16-Apr-14
2408,State film group pours millions into Hollywood: China Film Groupis hoping to buy some Hollywood magic with a major cash investment in tinseltown productions,"Meng, Angela.",16-Apr-14
2409,State-owned China Film Group invest millions in Hollywood productions Seventh Son and Warcraft: China Film Groupis hoping to buy some cinematic magic with an 'eight figure' investment in two Tinseltown productions,"Meng, Angela.",16-Apr-14
2410,"China Digest, April 16, 2014",,16-Apr-14
2411,Thousands strike at shoe factories in Dongguan: Workers at plants in Dongguan in dispute with Hong Kong-listed firm over welfare payments,"Lau, Mimi.",16-Apr-14
2412,"Uygurs protest over teenager's fatal shooting in Aksu city, Xinjiang: Crowd parades body of student shot by police after 'refusing to stop at checkpoint'",Zhuang Pinghui.,16-Apr-14
2413,Uygurs protest over teen's fatal shooting: Residents parade body of student shot by police after 'refusing to stop at checkpoint',Zhuang Pinghui.,16-Apr-14
2414,Yue Yuen shoe factory workers' strike at Dongguan plants continues: Workers at plants in Dongguan in dispute with Hong Kong-listed firm over social benefits,"Lau, Mimi.",16-Apr-14
2415,"China 'frustrated' by what it sees as US efforts to contain it in Asia: Recent oppositionto an 'Asian Nato' shows Beijing's frustration over what it sees as American efforts to contain its rise, analysts say","Kwok, Kristine.",16-Apr-14
2416,North Korea demands Japan allow international ferry services to resume,"Ryall, Julian.",16-Apr-14
2417,Courage needed to undertake political reforms,,16-Apr-14
2418,HK educators doing their best to help children with autism,,16-Apr-14
2419,"Letters Facebook, April 16, 2014",,16-Apr-14
2420,"Letters Question, April 16, 2014",,16-Apr-14
2421,"Letters to the Editor, April 16, 2014",,16-Apr-14
2422,Live-chicken sellers' protest over rising wholesale price benefits no one,,16-Apr-14
2423,"Investors want Hong Kong's IPO rules unchanged: Hong Kong listing regulations do not needto be altered after losing Alibaba, poll finds","Yiu, Enoch.",16-Apr-14
2424,Through train threatens sales in quota scheme,"Yu, Jeanny.",16-Apr-14
2425,Developer Great Eagle in deal for US office fund,"Yu, Sophie.",16-Apr-14
2426,events,,16-Apr-14
2427,HKMA sees little risk in bank loans to mainland: Most of the HK$2.6trin lending goes to big state and global firms and the HKMA has taken steps to ensure liquidity in the system,"Moiseiwitsch, Jasper.",16-Apr-14
2428,"Move to metal casings for smartphones to benefit BYD Electronic, Ju Teng: Chinese smartphone brands tipped to follow Apple, aiding firms such as BYD and Ju Teng","Perez, Bien.",16-Apr-14
2429,Chinese find their calling as smartphone shoppers,"Yu, Sophie.",16-Apr-14
2430,"Citic's reverse takeover spurs interest in backdoor listings: Inspired byasset injection move, mainland private enterprisesactively seek GEM listings as stepping stone towards main board","Chan, Ray.",16-Apr-14
2431,Mainland land price inflation slows,"Chiang, Langi.",16-Apr-14
2432,Oil rig giant is key to Titan's restructuring: Bond issue worth 400m yuan intended to get mothballed Fujian shipyard up and running,"Ng, Eric.",16-Apr-14
2433,Sunshine Oilsands opts for debt issue to raise funds as shares plunge,"Ng, Eric.",16-Apr-14
2434,"Weak money supply growth hits markets: M2 expansionof 12.1pc for March is the lowest on record, reflecting tight credit on the mainland and sparking sell-offs in share and money markets","Ruan, Victoria.",16-Apr-14
2435,Deborah Annells remanded in custody after fresh charges,,16-Apr-14
2436,'Drunk motorist drives into PLA barracks',,16-Apr-14
2437,Cancer-causing toxin found in pet food sparks alarm: Consumer Councilcalls for regulations on animal food after it finds carcinogen and other contaminants in one-fifth of products tested,"Nip, Amy.",16-Apr-14
2438,"Champion jockey Matthew Chadwick fined HK$3,000 for damaging bus: But Matthew Chadwick is cleared of assault over incident that took place after party","Siu, Phila.",16-Apr-14
2439,Not recommended - scholar writes off compromise plan: Beijing law expert rejects proposal for public to suggest rather than nominate 2017 candidates,"Tanna Chong; Lam, Jeffie; Cheung, Tony.",16-Apr-14
2440,Bare artefacts,,16-Apr-14
2441,Catamaran ferry slams into TST sea wall: Crew members escape unhurt as mechanical problems prevent vessel from reversing,"Lo, Clifford.",16-Apr-14
2442,"Ignore our wishes for 2017 and we'll occupy, students warn government: Young leaderswill consider non-violent action if government rejects reform plan to allow nominees who have support of 35,000 voters","Cheung, Tony.",16-Apr-14
2443,Justice chief Rimsky Yuen defends handling of Ma Sik-chun case: Ex-secretary may have informed Ma in 2005 about lack of evidence,"Tam, Johnny.",16-Apr-14
2444,"Life sentence for jealous security guard who stabbed girlfriend to death: Security guard also tried to murder his love rival colleague, court finds","Chu, Julie.",16-Apr-14
2445,TV consultant's HK$4m claim has 'good chance',"Lee, Ada.",16-Apr-14
2446,Arrest made after possible attempt to drug teen during attack in Tin Shui Wai,"Lo, Clifford.",16-Apr-14
2447,"No more shocks at supermarkets as prices stabilise: Checkout billstabilises at last, with 0.9pc rise - compared with 4.3pc increase in inflation","Nip, Amy.",16-Apr-14
2448,Study finds some cigarette brands have 15 times as much tar as others,"Tsang, Emily; Nip, Amy.",16-Apr-14
2449,Ten years' jail too little for serial sex offender: judge: Judge says maximum penalty may need changing after sex offender strikes again,"Chu, Julie.",16-Apr-14
2450,Brief Encounters,,16-Apr-14
2451,Campus Confidential (IIA) (Mandarin),,16-Apr-14
2452,The Planner,,16-Apr-14
2453,BASEBALL: Major League Baseball.,,16-Apr-14
2454,Group One globalisation impacts on Hong Kong features,,16-Apr-14
