,title,byline,dates
832,Chelsea and Manchester City to challenge Leicester in HKFC Sevens,Staff Reporter.,14-Mar-14
833,"Kitchee's Fernando Recio does not have rubella, coach says: Spanish defender is cleared by doctors and is hoping to be fit for the Citizen clash",Chan Kin-wa.,14-Mar-14
834,"Don't rule out Designs On Rome for Hong Kong Derby, John Moore says: Trainersays gate 10 may actually suit the horse even though one of his other runners, Able Friend, appears better placed in gate five","Aitken, Alan.",14-Mar-14
835,"Joseph Lau Luen-hung, Steven Lo Kit-shing sentenced to jail for land deal: Tycoonand businessman Steven Lo sentenced to jail over bribes-for-land scheme in Macau - but they're unlikely to spend a day behind bars","Lee, Ada.",15-Mar-14
836,"Joseph Lau, Steven Lo sentenced to jail for Macau land deal bribe: Tycoonand businessman Steven Lo sentenced to jail over bribes-for-land scheme in Macau - but they're unlikely to spend a day behind bars","Lee, Ada.",15-Mar-14
837,"Street vendor stabs fellow Uygur to death in Changsha, kills 4 passers-by","Keira Lu Huang; Zhou, Laura.",15-Mar-14
838,"Uygurs' street fight leaves six dead in Changsha, Hubei province","Keira Lu Huang; Zhou, Laura.",15-Mar-14
839,Xi and Obama set up date in Netherlands,,15-Mar-14
840,"Flight 370 families deserve the truth, just as Lockerbie families do","Fraser, Niall.",15-Mar-14
841,Groups invited to debate broadcasting licences,,15-Mar-14
842,who said it?,,15-Mar-14
843,Beijing 'positive' about restoring pan-democrats' home-return permits: Legco chief says liaison office is willing to help pan-democrats get mainland travel documents,"Cheung, Tony; Tanna Chong.",15-Mar-14
844,Censors were at WeChat officers before crackdown on accounts,"Jiang, Sijia.",15-Mar-14
845,"Chinese museums, collectors set for fierce bidding on iconic bronze",Xu Donghuan.,15-Mar-14
846,Conspiracies and other theories about what happened to Malaysia Airlines Flight MH370,,15-Mar-14
847,Conspiracies and other theories about what happened to Flight MH370,,15-Mar-14
848,"Insurers of flight MH370's passengers have no precedent for policy payouts: Thoughthe Malaysia Airlinescase is unprecedented and the flight's fate unknown, insurers are more likely to pay out sooner rather than later","Yiu, Enoch.",15-Mar-14
849,"Kindergartens secretly fed children flu pills for five years, police say","Wee, Darren.",15-Mar-14
850,Xi likely to meet Obama during European tour: Bothpresidentswill attend global Nuclear Security Summit being hosted in The Hague later this month during Xi's four-nation visit,"Zhang, Hong.",15-Mar-14
851,"Xian kindergartens secretly fed pupils flu pills for 5 years, police say","Wee, Darren.",15-Mar-14
852,Open look at city budgets more than just window-dressing in graft fight: Guangzhou sets strong example for other cities by releasing budgets for all government sectors,"Zhai, Ivan.",15-Mar-14
853,"China Digest, March 15, 2015",,15-Mar-14
854,Japanese newspaper accuses China of starting a new 'cold war': Paper loyal to Prime Minister Abe alleges China is spreading anti-Japan propaganda worldwide,"Ryall, Julian.",15-Mar-14
855,Air quality index should provide more accurate information,,15-Mar-14
856,China must work with other nations to rein in North Korea,,15-Mar-14
857,"Letters to the Editor, March 15, 2014",,15-Mar-14
858,Mainland and Hong Kong must work together to deal with crush of visitors,,15-Mar-14
859,New World taps market for HK$18.6b to buy out mainland unit: Developer to use funds raised from rights issue for buying out investors in mainland subsidiary,"Liu, Yvonne.",15-Mar-14
860,"PBOC halts plans by Tencent, Alibaba for virtual credit cards: Central bank'temporarily' suspends mobile internet payment products from Tencent and Alibaba due to customer security concerns","Ruan, Victoria.",15-Mar-14
861,"UBS traders tried to rig Hibor, HKMA probe finds","Kanis, Li.",15-Mar-14
862,events,,15-Mar-14
863,Hong Kong banks battle for deposits earlier this year: Lendersraise interest rates in recent weeks to attract cash after the HKMA orders players to fund loans with deposits of longer tenure,"Kanis, Li.",15-Mar-14
864,Developer Sino-Ocean aims for boost in contract sales,"Chiang, Langi.",15-Mar-14
865,Hutchison Whampoa has 25 billion reasons to sell assets now,"Tsang, Denise.",15-Mar-14
866,Kerry Logistics pins growth hopes on e-commerce on mainland: Logistics firm reports 71.5pc net profit growth on one-off revaluation gains from investments,"So, Charlotte.",15-Mar-14
867,Luxury menswear group Trinity cautious amid China economic slowdown,"Ap, Tiffany.",15-Mar-14
868,Ping An Insurance expects tough year ahead: Mainland insurance giantsays there will be more market volatilitybut returns will be stable because of change in investment curbs,"Man-ki, Kwong.",15-Mar-14
869,"Changing environment needs new breed of business leaders: Technologicaladvances and tighter regulations mean corporate leaders now require a broader skill set, says Rajeev Vasudeva of Egon Zehnder","Yiu, Enoch.",15-Mar-14
870,"Game developer Kabam reveals its mobile ambitions: Mobile gamesare the fastest-growing segment of the video game industry, with revenue forecast to reach US$22b in 2015 from last year's US$13.2b","Perez, Bien.",15-Mar-14
871,High costs mean Lamma housing plan doesn't add up,,15-Mar-14
872,"Money Matters Column: Saturday, March 15, 2014","Yam, Shirley.",15-Mar-14
873,Apps 'able to hand over control of your phone',"Nip, Amy.",15-Mar-14
874,"City digest, March 15, 2014",,15-Mar-14
875,"HK$1,500 fixed penalty proposed for shops that spill into the street: Consultation paper suggests HK$1,500 fine for shopkeepers whose businesses spill into streets","Zhao, Shirley.",15-Mar-14
876,"Two-year reprieve for Tin Hau school: International Montessori Schoolsays landlord has agreed to renew tenancy, just months before pupils were to be left without a building","Fung, Fanny W Y.",15-Mar-14
877,Woman who cut off lover's penis not a 'murderer': Jury finds mainlander guilty of manslaughter instead and she is sentenced to 7 years in jail,"Chiu, Austin.",15-Mar-14
878,Asylum seeker 'abused system' in MTR claim,"Chiu, Austin.",15-Mar-14
879,Court spares milkshake murderer Nancy Kissel from paying costs of lost appeal,"Chiu, Austin.",15-Mar-14
880,HKTV boss Ricky Wong stirs takeover rumours with televised 'toast' to ATV: HKTV boss fuels talk of a deal with station he briefly ran by appearing on one of its shows,"Chow, Vivienne; Lau, Stuart; Nip, Amy.",15-Mar-14
881,Legal loophole may let HK tycoons escape jail in Macau,"Siu, Phila.",15-Mar-14
882,"Macau graft trial sees downfall of Joseph Lau and Steven Lo: Joseph Lau and Steven Lo'sinvolvement in the luxury La Scala project turned out to be their undoing, and the development has hit a brick wall","Lee, Ada.",15-Mar-14
883,"Paper Talk, March 15, 2014",,15-Mar-14
884,Restaurateurs to pay 20pc more for fire checks: Industry leaders say fire department's first increase in fees since 2006 is 'unreasonable',"Cheung, Tony.",15-Mar-14
885,All 9 Hong Kong suspects in editor case released: Eight men and a woman freed on bail as the two alleged hitmen remain detained on mainland,"Lo, Clifford; Tsang, Emily.",15-Mar-14
886,All 9 Hong Kong suspects in Lau case released: Eight men and a woman freed on bail as the two alleged hitmen remain detained on mainland,"Lo, Clifford; Tsang, Emily.",15-Mar-14
887,Drama on the low seas,,15-Mar-14
888,Egyptian pair must shell out fines for trying to import rare tortoises,"Chu, Julie.",15-Mar-14
889,Lamma quarry plan stokes transport fears,"Fung, Fanny W Y.",15-Mar-14
890,"Classic repeat unlikely in showdown for Hong Kong Derby, says Berry: Australiansays while Designs on Rome had a tactical advantage last time over Able Friend, it's a case of 'best horse wins' for the Derby","Cox, Michael.",15-Mar-14
891,Queen's Silver Jubilee Cup an insight into crop of four-year-olds,"Aitken, Alan.",15-Mar-14
892,China doubles yuan trading range against the US dollar to 2 per cent: Currency will be allowed to move 2pc up or down in further liberalisation move,"Ruan, Victoria.",16-Mar-14
893,Tsai joins race to be head of Taiwan's DPP,,16-Mar-14
894,GLOBETROTTING CHARLEY LANYON,,16-Mar-14
895,Ricky Wong Wai-kay,,16-Mar-14
896,Ruhi Kumar,,16-Mar-14
897,who said it?,,16-Mar-14
898,"'Deliberate act' took missing plane off course, says Malaysia PM Najib Razak: Malaysian PMstops short of blaming hijacking, as search refocused on two specific flight corridors","Wan, Adrian.",16-Mar-14
899,'My friend is not a terrorist': member of Malaysian opposition party defends captain of missing flight MH370,"Wan, Adrian.",16-Mar-14
900,Events since MH370 went missing,"Tsang, Emily.",16-Mar-14
901,Government House and garden open to the public on March 16,"Tsang, Emily.",16-Mar-14
902,Government House and garden open to the public from 10am on Sunday,"Tsang, Emily.",16-Mar-14
903,"No one can say how many CCTV cameras are spying on Hongkongers: While the technology has some legitimate uses, critics say privacy is being sacrificed","Lam, Lana.",16-Mar-14
904,European art museums flock to Asia to exhibit - and attract donations: Europe's top museumshave courted rich Asian benefactors by showing some of their art in the region; now smaller players are joining in,"Chow, Vivienne.",16-Mar-14
905,"CCTV cameras run into the tens of thousands across Hong Kong: Housing Authorityleads surveillance pack with over 20,000 CCTV cameras, showing extent of everyday intrusions into people's lives","Lam, Lana.",16-Mar-14
906,"CCTV cameras run into the thousands across Hong Kong: Housing Authorityleads the surveillance pack with more than 20,000 CCTVs, bearing out warning of everyday intrusions into people's lives","Lam, Lana.",16-Mar-14
907,"Hong Kong news in brief, March 16, 2014",,16-Mar-14
908,Hong Kong triads using Indonesian domestic workers to smuggle Ice,"Harris, Bryan.",16-Mar-14
909,Hong Kong triads using Indonesian domestic workers to smuggle methamphetamine into archipelago,"Harris, Bryan.",16-Mar-14
910,Plane bomb hoax lands mainlander in trouble,,16-Mar-14
911,"Tributes for Hong Kong-based radio reporter Nils Horner, Sweden's 'Voice of Asia' shot dead in Afghanistan","Lam, Lana.",16-Mar-14
912,"Tributes for Nils Horner, Sweden's 'Voice of Asia', shot dead in Kabul","Lam, Lana.",16-Mar-14
913,"Extradition pact with Macau in works, Hong Kong says, after pair sentenced to jail for bribery: With businessmensentenced to jail in gambling hub but able to dodge serving sentence, officials confirm talks on extradition pact under way","Lee, Ada.",16-Mar-14
914,Government offers to lend HK$45b to NGOs to run private hospitals: Government seeks new way on top of health insurance reform to get more using private care,"Tsang, Emily.",16-Mar-14
915,"Handicrafts chain Chinese Arts and Crafts claims its now only selling mammoth, not elephant ivory","Choi, Christy.",16-Mar-14
916,Ireland set to open first consulate in Hong Kong,"Lam, Lana.",16-Mar-14
917,Ofca's Eliza Lee slams HKTV's Ricky Wong amid mobile television row: Eliza Lee hits back in row over HKTV's thwarted plans for mobile broadcasting,Tanna Chong.,16-Mar-14
918,Postcard: Los Angeles,"Teh, Yvonne.",16-Mar-14
919,China moves to protects rights of buyers in online transactions,"Lau, Mimi.",16-Mar-14
920,Tsai Ing-wen to seek chair of Taiwan's Democratic Progressive Party again: Tsai Ing-wen's bidcould open the door to a 2016 presidential run and increase the infighting over the party's stance on cross-strait relations,"Chung, Lawrence.",16-Mar-14
921,"Chinese psychotherapist working in Japan seeks to build ties between the peoples of the two countries: A Chinese psychotherapistbased in Tokyo seeks to build ties between the peoples of the two countries, just as his grandfather did",,16-Mar-14
922,Airport should tackle competition before building third runway,,16-Mar-14
923,"Letters Facebook, March 16, 2014",,16-Mar-14
924,"Letters Question, March 16, 2014",,16-Mar-14
925,"Letters to the Editor, March 16, 2014",,16-Mar-14
926,Removing chains on deposit rates will free capital for more efficient use,,16-Mar-14
927,Rules governing Hong Kong's district councils outdated,,16-Mar-14
928,"Malaysian aviation chief Azharuddin Abdul Rahman the butt of criticism: Missing flight 370has thrust little-known Malaysian bureaucrat Azharuddin Abdul Rahman into front line of a crisis, and he's struggled","Cheney, Satish.",16-Mar-14
929,Long-suffering stock market investors Shanghaied,,16-Mar-14
930,"Practice among some Chinese students of mailing dirty laundry home prompts debate: Some students mail their laundry to their parents for washing, prompting a debate over the pros and cons of the unusual practice","Zhang, Hong.",16-Mar-14
931,"I've got a beauty for the Derby, says Cruz: Former champion jockeyand long-time trainer feels that he has the horse to upset Moore's fancied Designs On Rome and Able Friend","Aitken, Alan.",16-Mar-14
932,"Sports briefs, Sunday Morning Post, March 16, 2014",,16-Mar-14
933,Cornel Li hopes to finally taste success in Derby,"Aitken, Alan.",16-Mar-14
934,Owner David Boehm turns lucky break into lasting Hong Kong legacy: The owner of Secret Sham and Dan Excel has brought a number of quality horses to the city,"Cox, Michael.",16-Mar-14
935,AUSSIE RULES: Australian Football League.,,16-Mar-14
936,"Barry Bonds still has the power to polarise the world of baseball: Go ahead and blast Barry Bonds for his central role in the steroids era, but please keep some perspective on the matter",,16-Mar-14
937,Day by day tidbits from the world of sports,,16-Mar-14
938,Baucus seeks level playing field in China,,19-Mar-14
939,"Jail holds no fear for me, says Anwar Ibrahim, Malaysian opposition leader: But opposition leader says he is disgusted by Malaysian government's control over courts","Wan, Adrian.",19-Mar-14
940,Scene of the crime,,19-Mar-14
941,Security issues may hinder huge hunt for missing flight MH370: Malaysiacalls on neighbours to 'put passengers first' and provide potentially sensitive military data as mystery of missing flight enters day 12,"Lee, Danny; Wan, Adrian.",19-Mar-14
942,Chinese dissenters dying in jail is a disgrace,"Lo, Alex.",19-Mar-14
943,"Talking Points, March 19, 2014",,19-Mar-14
944,"Who Said It? March 19, 2014",,19-Mar-14
945,Chinese scientists urged to develop new thorium nuclear reactors by 2024,"Chen, Stephen.",19-Mar-14
946,"Health Authority to spend HK$14m to subsidise private care for 6,000 people: Health Authorityannounces pilot plan in which more than 6,000 people suffering from chronic diseases will be treated by private doctors","Tsang, Emily.",19-Mar-14
947,Myanmar reporters in court over China chemical-arms-plant stories: 5 charged in Myanmar with leaking secrets after alleging China-linked plant made chemical arms,"Boehler, Patrick.",19-Mar-14
948,"Number of Hong Kong millionaires is up, but many want out","Kanis, Li.",19-Mar-14
949,Pan-democrats attach strings to joining lawmakers' visit to mainland,"Lam, Jeffie; Cheung, Tony.",19-Mar-14
950,Malaysian politician Anwar Ibrahim admits MH370 pilot is in-law's relative,"Wan, Adrian.",19-Mar-14
951,"HKU's Tsui Lap-chee reflects on his 12 years as vice chancellor: From Sarsto a policing controversy to building a new campus, Tsui Lap-chee reflects on his 12 years as vice chancellor, which end on April 1","Chou, Oliver.",19-Mar-14
952,Outgoing HKU chief Tsui Lap-chee says academic freedom crucial,"Chou, Oliver.",19-Mar-14
953,"Chinese insurer offers smog insurance policy, the first of its kind: Residents can get protection from illnesses tied to pollution, but conditions may be hard to meet","Li, Jing.",19-Mar-14
954,Film chief Han Sanping retires amid links to Zhou probe,"Li, Jing.",19-Mar-14
955,"Mainland insurer offers smog insurance policy: Residents can get protection from illnesses tied to pollution, but conditions may be hard to meet","Li, Jing.",19-Mar-14
956,"Tourism, school stops dominate Michelle Obama's China itinerary","Zhang, Hong.",19-Mar-14
957,"China Digest, March 19, 2014",,19-Mar-14
958,Beijing's ban on pan-democrats serves no one's interests,,19-Mar-14
959,Everyone must make sacrifices if Hong Kong is to hit flats target,,19-Mar-14
960,Hong Kong's efforts against money laundering recognised,,19-Mar-14
961,"Letters Facebook, March 19, 2014",,19-Mar-14
962,"Letters Question, March 19, 2014",,19-Mar-14
963,"Letters to the Editor, March 19, 2014",,19-Mar-14
964,Lobbyists work to change pension rule that has cost workers HK$20b: Legislators and unionists make little progress on changing rule that has cost workers HK$20b,"Yiu, Enoch.",19-Mar-14
965,Price growth of mainland new homes slows further: Average increaseweakens for second month to 11.1 per cent in February as tighter credit places pressure on developers to reduce housing costs,"Chiang, Langi.",19-Mar-14
966,events,,19-Mar-14
967,Shanghai official's vow on freeing up of yuan a bone of contention: Responseto Shanghai PBOC official's view that rules for capital account liberalisation in free port will be out within months highlights divisions,"Chen, George.",19-Mar-14
968,"Yuan still rising based on real effective exchange rate, ministry says: Ministry official says recent fluctuations are normal in the face of exchange rate reform","Ruan, Victoria.",19-Mar-14
969,Aoyuan aims for 50pc boost in sales,"Chiang, Langi.",19-Mar-14
970,"Developers in Singapore and on mainland also hit by falling margins: Risingland, construction material and labour costs are squeezing the earnings of developers in a market hard hit by government measures","Sito, Peggy; Chiang, Langi.",19-Mar-14
971,Shanghai developer Greenland's back-door move aids reform drive: Shanghai officials see listing as way to expand financing options under revamp of state firms,"Ren, Daniel.",19-Mar-14
972,HK's listing hub status under growing threat after loss of Alibaba IPO deal: Time to review the IPO regime as the city struggles to win prominent deals,"Chan, Ray.",19-Mar-14
973,"Regulators backed on governance stance: Despite the cost, fund managersand brokers say the stock exchange and SFC were justified in sticking to the rule book in Alibaba case","Yiu, Enoch.",19-Mar-14
974,A tale of two internet leaders: Tencent vs Alibaba,"Yu, Sophie.",19-Mar-14
975,Valuations in US shade Hong Kong's appeal as a city to go public,"Robertson, Benjamin.",19-Mar-14
976,Chalco warns of change in competitive landscape after return to the black,"Ng, Eric.",19-Mar-14
977,Huaneng warns of output challenge: Mainland power firmsays it is being squeezed by increased supplies of clean energy rivals and anti-pollution controls on its coal-fired plants,"Ng, Eric.",19-Mar-14
978,Singamas profit dives 43pc on drop in demand: Container box maker expects improved business this year after drop in global supplies,"So, Charlotte.",19-Mar-14
979,Xiaomi and Hutchison seek to deepen collaboration in Asia,"Perez, Bien.",19-Mar-14
980,When do we declare the cruise terminal a white elephant?,,19-Mar-14
981,"'Police pore over hours of CCTV to track Lau hitmen': The two 37-year-old suspects are taken, hooded and chained, on route mapped out by detectives","Lo, Wei; Lo, Clifford.",19-Mar-14
982,Anti-vice raids net 25 mainland women,,19-Mar-14
983,"Finally, the Hongkongerarrives on world stage: Amid anti-mainland sentiment, Oxford dictionary recognises city's local identity","Lam, Jeffie.",19-Mar-14
984,"Mark Six, March 19, 2014",,19-Mar-14
985,More services to ease the crush on Island and Kwun Tong MTR lines: Kwun Tong and Island linesget more frequent trains in the evening rush hour from next month; off-peak trains added on other lines,"Lee, Ada.",19-Mar-14
986,"The cat's out of the bag: Hello Kitty's secret to 40 years of success: Sanrio reveals that with no mouth, fans are free to interpret her emotions","Nip, Amy.",19-Mar-14
987,New police trial of body-mounted video cameras sparks concern: Lawmakers and activistsworry plans to extend use of body-mounted video devices to film confrontations could lead to abuse of power,"Chan, Samuel.",19-Mar-14
988,'Tactile' Jackie Chan shrugs off controversy over snuggle with singer at CPPCC meeting: Actor is 'amazed' by furore over interaction with Song Zuying during CPPCC meeting,"Wee, Darren.",19-Mar-14
989,"1,100 public flats in Kwun Tong get green light: Rare victory for government as district council approves project despite concerns over impact","Wong, Olga.",19-Mar-14
990,"Government to launch HK$227m study into building man-made islands: Government will ask for HK$227 million to study where to build them, and how many","Fung, Fanny W Y.",19-Mar-14
991,TVB source rebuffs Ricky Wong's claims over mobile TV services: Source rebuffsRicky Wong's claim that free-to-air operators are breaching licences because services can be picked up on portable TVs,"Chow, Vivienne; Nip, Amy; Lau, Stuart.",19-Mar-14
992,"The egg comes first, engineers find: Earthworks halted after birdwatchers warn egret breeding season at risk","Kao, Ernest.",19-Mar-14
993,Legislators give nod to parody law proposal,"Kang-chung, Ng.",19-Mar-14
994,"Magazines dispute privacy orders over nude, intimate photos of TVB stars","Chiu, Austin.",19-Mar-14
995,"More Form One classes to be axed this year, say education officials: But policy to shrink class sizes will help sustain some schools, education officials say","Zhao, Shirley.",19-Mar-14
996,"Pollster dismisses 'political' criticism: HKU's poll chiefRobert Chungsays their methods are fair and transparent, and questions motivation behind recent attacks",Tanna Chong.,19-Mar-14
997,Tip of the hat,,19-Mar-14
998,Caveman,,19-Mar-14
999,Her (IIB),,19-Mar-14
1000,Where Art Meets Jewellery,,19-Mar-14
1001,A Derby thriller that raised the bar: Designs On Rome's breathtaking duel with Able Friend a fitting climax to a great day of entertainmentat the track,,19-Mar-14
1002,Dibayani's trainer deserves an honourable mention,,19-Mar-14
1003,Seeing is believing,,19-Mar-14
1004,BASKETBALL: National Basketball Association.,,19-Mar-14
1005,"F1 may pay the price for quieter cars, says Bernie Ecclestone: Commercial chiefsays organisers and teams are complaining that fans are being cheated by the lack of noise from the new V6 turbo engines",Reuters.,19-Mar-14
1006,"Sports briefs, South China Morning Post, March 19, 2014",,19-Mar-14
1007,England Sevens legend Gollings back in the fray: All-time top scorer over his World Series career will join a strong line-up for Samurai in the Tens,Staff Reporter.,19-Mar-14
1008,Power hitting,,19-Mar-14
1009,South China face exit from AFC Cup after losing to Yangon United: South China are on the brink of elimination but Kitchee have high hopes in the AFC Cup,Chan Kin-wa.,19-Mar-14
1010,Steven Lo hands ownership of Military Attack to his wife,"Aitken, Alan.",19-Mar-14
1011,Centaline prepares to build up its online business on the mainland: Property agency set to launch e-commerce platform on the mainland,"Liu, Yvonne.",19-Mar-14
1012,China's logistics property market expands amid focus on consumption: Deals for landused for storage of goods up as investors expect greater domestic consumption amid structural change in mainland economy,"Chiang, Langi; Sito, Peggy.",19-Mar-14
1013,HOME,,19-Mar-14
1014,Tai Po flat prices cut after bids for Pak Shek Kok site don't meet reserve price: Sale of plot in Tai Po scrapped after developers' bids fail to meet reserve price,"Sito, Peggy.",19-Mar-14
1015,Maturing Centaline China winning market share in China's second- and third-tier cities: Centaline Groupchairman Sherman Lai foresees further mainland growth by expanding to more cities and taking on strong competition from the likes of online property agency Home Link,"Liu, Yvonne.",19-Mar-14
1016,Suzhou's office market facing glut of new supply in next two years: 30 per cent vacancy rate likely because of city's mismatch between supply and demand,"Li, Sandy.",19-Mar-14
1017,Salaries of corporate real estate executives in Asia-Pacific going up,"Sito, Peggy.",19-Mar-14
1018,"Skilled workers in short supply in Hong Kong's construction industry: Hong Kongfaces a shortage of skilled workers in the construction sector, with projects in Macau and mainland drawing workers away","Sito, Peggy.",19-Mar-14
1019,Duo behind new newspaper attacked in street,"Chan, Samuel; Lo, Clifford.",20-Mar-14
1020,"Ex-PLA top general Xu Caihou held in cash for rank probe: Xu Caihou, former Central Military Commission vice-chairman who is suffering from terminal cancer, hauled from his sick bed to face probe",Staff Reporters.,20-Mar-14
1021,Father defends flight-engineer son on board missing Malaysian plane: Malaysian investigators say navigation skills were needed to divert plane,"Meng, Angela; Wan, Adrian; Cheney, Satish.",20-Mar-14
1022,Yuan slides again as economic risks mount,,20-Mar-14
1023,Adult fetishes mark Hello Kitty's 40th birthday,"Lo, Alex.",20-Mar-14
1024,"Talking Points, March 20, 2014",,20-Mar-14
1025,Guarantor in HK$30m bail case warned he might forfeit HK$5m: Businessman faceslosing HK$5m if he can't convince magistrate he did his best to ensure alleged money launderer did not abscond,"Jiang, Sijia.",20-Mar-14
1026,"Retired top PLA general Xu Caihou held in cash-for-rank probe: Xu Caihou,who is dying of cancer, is hauled from his sick bed to answer allegations that he raked in millions by selling military ranks",Staff Reporters.,20-Mar-14
1027,"Yuan tumbles to 11-month low, with fears it could fall further still","Yu, Jeanny.",20-Mar-14
1028,Angry Chinese family members storm Malaysia press briefing to protest slow MH370 search,"Lee, Danny; Wan, Adrian; Cheney, Satish.",20-Mar-14
1029,Businessman 'hired dancers' with names matching Flight 370 passports,"Jiang, Sijia.",20-Mar-14
