,title,byline,dates
985,Trains take the strain as Hong Kong commuters flock to new MTR stations: Commuters escape congested roads and flock to new Ho Man Tin and Whampoa stations on first working day of Kwun Tong Line extension,,25 Oct 2016
986,"Two police officers allegedly asked Occupy activist Ken Tsang to unlock phone over photos of his injuries, court told",,25 Oct 2016
987,On high alert,,25 Oct 2016
988,Plans for expanded living space and scenic areas in HK's post-2030 blueprint,,25 Oct 2016
989,"Threat of second walkout had 'some effect', Legco president admits as he ponders U-turn on oath-taking saga: Andrew Leung examines 'new circumstances' and admits threat of another walkout is a factor in revisiting decision on localist pair",,25 Oct 2016
990,Values back in vogue as nations seek to define their own identity,,25 Oct 2016
991,"British banker tortured woman for three days before cutting her throat, Hong Kong court told: Banker denies murders as jury is warned of 'unpleasant' evidenceto be put before court",,25 Oct 2016
992,China to build second Palace Museum - 25km from Forbidden City - to house unseen treasures: A second facility will be built 25km from the Forbidden City site to ease space constraints,,25 Oct 2016
993,New party rules to keep cadres loyal New party rules to keep cadres loyal: Flagship paper invokes Mao in call for obedience to communist leadership,,25 Oct 2016
994,"Resting and sitting becomes major preoccupation for Hong Kong retirees, survey finds: More than 60 per cent of those polled list resting and sitting as their favourite pastime, a finding that has some experts worried",,25 Oct 2016
995,"As the MTR expands, it must maintain its service quality",,25 Oct 2016
996,US Navy exercise in South China Sea is dangerous and provocative,,25 Oct 2016
997,"Time to fix Hong Kong's wasteful, throwaway society: Peter Kammerer says the modern craze for built-in obsolescence has to end and we should all start to promote a fix-it culture in Hong Kong",,25 Oct 2016
998,A cheaper yuan fails to cheer up Chinese exporters at Canton fair: Suppliers at Canton Fair say better products and stronger offshore markets - rather than the exchange rate - are more likely to boost demand,,25 Oct 2016
999,Beijing blasts Taipei over 'meddling in HK affairs',,25 Oct 2016
1000,Poor quality of air purifiers in China doesn't help buyers breathe easy: Roughly a quarter of appliances tested by quality inspectors fail to meet standards in nationwide survey as country heads into peak smog season,,25 Oct 2016
1001,China's tax authorities take aim at under-reported overseas income: Days of underpaying taxes to end soon as China takes part in worldwide scheme on swapping information on foreign residents' financial assets,,26 Oct 2016
1002,Chinese property market sees effects of cooling measures just weeks after record price gains: Price growth slows in 15 top-tier mainland cities amid concerns over speculation and affordability,,26 Oct 2016
1003,Fright nights and blind dates: China's malls put on a new face to combat online shopping Ma: Bricks-and-mortar outlets on the mainland offer experience-based shopping for families to counter growing threat from e-commerce firms,,26 Oct 2016
1004,Government land sales are doing something they haven't done since 2009,,26 Oct 2016
1005,Luxury flat at 39 Conduit Road withdrawn from sale after bids fail to meet reserve price,,26 Oct 2016
1006,Oppo and Vivo vault ahead in China's smartphone market: Xiaomi sees its share of domestic market shrink further as shipments in China cross 120m units,,26 Oct 2016
1007,"Winter is Coming: China wants big coal mines to produce more, while small mines should shutterBn",,26 Oct 2016
1008,'MTR effect' rubs off on property sales in Whampoa and Ho Man Tin,,26 Oct 2016
1009,"Goodbye tour buses and loud hailers: Chinese tourists now choosing the more personal approach: As tourism booms on the mainland, more people are choosing one-stop shops in selecting leisure trips for in-depth sightseeing experiences",,26 Oct 2016
1010,China's elderly care market offers rich pickings for private developers: Developers tap the specialist care market for China's elderly population,,26 Oct 2016
1011,China's Xiaomi launches two new large screen handsets,,26 Oct 2016
1012,"Hong Kong fashion group I.T back in the black on strong sales in Japan, China",,26 Oct 2016
1013,"Hong Kong's land prices likely to continue on upward trend, JLL's Lau Chun-kong says: As land costs keep rising in Hong Kong in the wake of tight supply, JLL's Lau Chun-kong says the government should pursue its development plans despite opposition from affected residents",,26 Oct 2016
1014,Italy approves CK Hutchison-VimpelCom mobile network merger,,26 Oct 2016
1015,Maple Leaf shares plunge as Shanghai tightens rules on operating international schoolsM: Education policy ruling may hurt operator of private international schools,,26 Oct 2016
1016,"Swire set to release flats of just 142 square feet for rent: Star Studios on Wing Fung Street in Wan Chai to replace Wisdom's AVA62 in Jordan as smallest living space in HK, with units as tiny as 142 sq ft",,26 Oct 2016
1017,"China and Hong Kong stocks end little changed, as analysts see market momentum turning upwards",,26 Oct 2016
1018,How natural gas seller Blue Sky plans to profit from China's bad air problem: Natural gas distribution company to add new projects in coastal areas with access to cheap imported LNG and other hinterland regions,,26 Oct 2016
1019,Securities regulator allows electronic signatures for cross-border account opening,,26 Oct 2016
1020,"Yili's share placement dilutes its near-term earnings but enhances long-term growth, say analysts: Shengmu deal to strengthen firm's position as China's largest dairy producer by retail sales",,26 Oct 2016
1021,"Bigger than ever, it's hard to ignore what a force Shanghai Fashion Week has become",,26 Oct 2016
1022,Head,,26 Oct 2016
1023,Six things Scad Hong Kong's David Pugh can't live without,,26 Oct 2016
1024,"Inside Hong Kong's skateboarding scene - hurdling bureaucracy, one ollie at a time: Skateboarding is one of the world's most popular extreme sports, but exponents in Hong Kong often find themselves entangled in red tape due to a government that doesn't quite get it, writes Kylie Knott",,26 Oct 2016
1025,"Jockey Howard Cheng cops six-month suspension for refusing to give stewards bank records: Howard Cheng receives six-month ban to go with an earlier three-month suspension, essentially ending the career of the successful local jockey",,26 Oct 2016
1026,Ramp it up: six of the best skateparks,,26 Oct 2016
1027,"'There will be no redemption for me,' British banker Rurik Jutting says in detailed video shown on murder trial's second day: Chilling footage filmed by a British banker accused of killing two Indonesian women in 2014 was played at the High Court on the second day of his trial yesterday. Rurik Jutting, 31, has denied two counts of murder over the deaths of Sumarti Ningsih, 23, and Seneng Mujiasih, 26. Some of the clips recorded how Jutting purportedly tortured Sumarti before killing her, and were played only to the jurors. Other parts were filmed after the deaths took place, and were played openly in court. Here are the graphic descriptions of -violence contained in the transcript:",,26 Oct 2016
1028,Canto-pop veteran Shirley Kwan rescued in waters off Discovery Bay: Canto-pop star Shirley Kwan entered water off Discovery Bay after talking of work woes,,26 Oct 2016
1029,Hong Kong court jails Wong Yuk-man two weeks for hurling glass at Chief Executive CY Leung: Ex-lawmaker jailed for throwing glass at CY Leung but magistrate granted him bail pending appeal,,26 Oct 2016
1030,Hong Kong domestic helper in custody over suspected strangling of toddler,,26 Oct 2016
1031,Aiming at family to retain workers: Awards recognise companies that offer family-friendly policies such as more leave,,26 Oct 2016
1032,Beijing just won't allow Hong Kong localist duo to take up their seats,,26 Oct 2016
1033,"Report about alleged assault not made immediately as Occupy activist Ken Tsang did not trust police, court hears: Activist did not file complaint on alleged beating immediately as he said police were not reliable",,26 Oct 2016
1034,"Use shipping containers for temporary housing, Hong Kong social welfare group urges: Creative lodging mooted by NGO and costing HK$190,000 to build is more liveable alternative for families facing four-year public housing wait",,26 Oct 2016
1035,District council votes against suspending controversial housing project,,26 Oct 2016
1036,"Emotional thanks from 71-year-old cleaner as Hong Kong rallies to save her from HK$1,500 finesdfsdf: After her story went viral online, elderly worker Zhou Zhuan has avoided a hefty HK$1,500 bill with her work agreeing to cover the penalty",,26 Oct 2016
1037,Hong Kong woman scammed out of HK$1.4 million by Nigerian 'lover': Company manager persuaded to send HK$1.4m to Nigerian 'project developer',,26 Oct 2016
1038,"More misery for retailers as yuan depreciation hits sales: Brands forced to raise prices by 2 to 3 per cent to offset fall, adding to tourism industry woes",,26 Oct 2016
1039,ViuTV warned over ads and 'disgusting' content,,26 Oct 2016
1040,"Localists' oaths on hold pending Hong Kong court ruling on judicial review, Legco president says: Andrew Leung says he will wait for outcome of judicial review as chief executive seeks court permission to declare localist pair's seats vacant",,26 Oct 2016
1041,Offshore yuan drops to six-year low even as central banker sought to sooth market's concernsOff: Central bank official says 'no basis' for continued depreciation of Chinese currency,,26 Oct 2016
1042,Hong Kong's shame: the wealthy who occupy public housing,,26 Oct 2016
1043,Beijing adds free Wi-fi to city buses: Service will be fast enough to support internet access for up to 50 passengers,,26 Oct 2016
1044,Blueprint for new towns to favour pedestrians over cars Plazas set for new towns to get people walking: The city's chief planner reveals his vision for plazas with street-level shopping and parks,,26 Oct 2016
1045,Chilling video evidence shows British banker Rurik Jutting threatening victim: Self-made recordings show accused British banker saying he was disgusted with himself for torturing people brutally but that he had no sense of guilt,,26 Oct 2016
1046,"China sees flurry of high-profile confessions, jail sentences ahead of this week's plenumcvbcvcbcvbcvbcbvcvcv",,26 Oct 2016
1047,"US likely to increase patrols off disputed South China Sea islands after 'pivot to Asia' hits choppy waters, experts say: Washington must prove to allies it can withstand any loss of support from Manila, analysts say",,26 Oct 2016
1048,"A hurtful word: Thousands are expected to protest today over two newly elected lawmakers' use of the term ""Chee-na"" during their oath-taking ceremony",,26 Oct 2016
1049,Young Chinese 'must learn from history to improve the world',,26 Oct 2016
1050,Hong Kong can and must do more to help the elderly,,26 Oct 2016
1051,Nervous times for US as Manila and Beijing forge closer ties,,26 Oct 2016
1052,China's growing capital flight is a sure thing - but not so the indicators that measure it: The PBOC's three monthly gauges for money flowing out of the country might not always add up but it's how they diverge that's key to watch,,26 Oct 2016
1053,readback sent,,26 Oct 2016
1054,"Chinese hostages receive tearful welcome home after four-year ordeal at hands of Somali pirates: End of ordeal at hands of Somali pirates a second chance at life, sailor says",,26 Oct 2016
1055,Chinese officials questioned after cotton wool shoved in equipment to monitor air pollution: report,,26 Oct 2016
1056,"Senior Chinese official visiting North Korea expected to discuss Pyongyang's nuclear tests, says expert",,26 Oct 2016
1057,"Thousands vie for single civil service job with Chinese minority party: Government hopefuls pass on Urumqi customs, say no to Hohhot rail police, but flock to chance to be receptionist for symbolic political party",,26 Oct 2016
1058,Bank of China Q3 profit rises 2pc to 41.8 billion yuan,,27 Oct 2016
1059,China Gas partners with insurers to invest in gas ventures via investment fund: New investment fund to focus on company's energy distribution businesses,,27 Oct 2016
1060,Customs' direct action against parallel imports makes us look like fools: HK's measures are beyond the normal purview of copyright laws and protect foreign interests,,27 Oct 2016
1061,Li Ka-shing sells Shanghai complex for US$2.95 billion while yuan takes a tumble: Disposal of the office and retail complex to company majority owned by China Life Insurance comes amid further weakening of mainland currency,,27 Oct 2016
1062,"Front-loaded property boom makes outlook in 2017 more stressful: As policymaker s push to maintain economic stability, analysts warn of risks from too many measures to cool the booming real estate sector",,27 Oct 2016
1063,Record breaker,,27 Oct 2016
1064,China's central bank raises obscure rate to send clear messageChin: China's central bank raises obscure interest rate to send clear messagethat it is no longer willing to provide limitless cheap funds to lenders,,27 Oct 2016
1065,"Facebook, Google, SCMP band together to spur Hong Kong's growth in digital advertising: SCMP-backed alliance to set guidelines for growth of online advertising in city",,27 Oct 2016
1066,Hong Kong improves in World Bank's 'doing business' survey but New Zealand takes top spotHK: New Zealand takes top slot from Singapore after it unveils more business-friendly initiatives,,27 Oct 2016
1067,Hong Kong oil stocks thumped as crude prices fall below US$50 threshold,,27 Oct 2016
1068,What retail slowdown? India's 'Diamond King' Nirav Modi to launch flagship shop on Canton Road,,27 Oct 2016
1069,China's second-largest good conglomerate continues its global expansion,,27 Oct 2016
1070,Didi Chuxing eyes global growth as next step after Uber China merger: Company eyeing partnerships with local ride-sharing firms in key markets,,27 Oct 2016
1071,"This one consumer group is about to have a huge impact on the future of online shopping in China: Convenience, pricing prompting customers to use e-commerce platforms, says survey",,27 Oct 2016
1072,"Benedict Cumberbatch talks Doctor Strange, and how he'd fit into Avengers: Infinity War: British actor Benedict Cumberbatch, best known for portraying eccentric geniuses, talks to Edmund Lee about taking on one of the strangest roles in his storied career",,27 Oct 2016
1073,Film review: Nessun Dorma - a pedestrian pulp thriller,,27 Oct 2016
1074,Top 5 films to watch in Hong Kong this week: October 27-November 2,,27 Oct 2016
1075,"From Venice to Vancouver, Hong Kong artist Tsang Kin-wah spreads words of wisdom: From Venice to West Kowloon and Vancouver, artist Tsang Kin-wah seems determined to raise the bar on the meaninglessness of his work, writes Enid Tsui",,27 Oct 2016
1076,How Hammad Nasar named as curator of the UAE's national pavilion at the Venice Biennale,,27 Oct 2016
1077,"a stray rake wreaks havoc on valley gates: Punters left perplexed as a garden tool causes the barriers to fail, with stewards declaring the fourth event void in a Hong Kong racing first",,27 Oct 2016
1078,Alibaba's sports division to pump US$100 million into rugby in China in bid to popularise sportxxxxxxxx: The company is to invest US$100m in an ambitious plan to set up professional leagues and produce thousands of coaches and officials,,27 Oct 2016
1079,"Mile is best for Able Friend but Sprint a fall back, says trainer John Moore: Trainer says his former Horse of the Year will only compete over 1,200m as a 'fall back position'",,27 Oct 2016
1080,Super Svetlana,,27 Oct 2016
1081,"Japan's teen Princess Aiko misses school for a month for health reasons: Doctors have been unable to identify the cause of Aiko's health issues, but an official has cited 'fatigue' as a reason for absence after a recent check-up",,27 Oct 2016
1082,Double murder linked to cocaine use: Rurik Jutting says in police film that the drug brought out his dark side,,27 Oct 2016
1083,"Fake banknotes trigger warning: Police urge public to be wary about low-quality bills, with number of HK$100 fake notes jumping more than four times from same period last year",,27 Oct 2016
1084,Investigation launched after Hong Kong man found dead in Tsim Sha Tsui guest house,,27 Oct 2016
1085,Hong Kong judge who found his forte as a colourful election watchdog: Woo Kwok-hing will know all about what it takes to win the chief executive race - he oversaw the first two contests after the city's handover,,27 Oct 2016
1086,Hong Kong waiter jailed four years over cheating bid in District Council elections: Judge says jail term is necessary as such crimes damage voter confidence,,27 Oct 2016
1087,Local households willing to spend on going green,,27 Oct 2016
1088,"No escape from loans for local Houdini: Government sues Hong Kong magician Louis Yan Chak-kuen over unpaid HK$330,520",,27 Oct 2016
1089,Step forward,,27 Oct 2016
1090,"Hongkong Post employee conspired with two others to defraud post office: Trio set to be sentenced tomorrow over scheme to defraud Hongkong Post out of HK$450,000",,27 Oct 2016
1091,Win a book a month for life - the only problem in Hong Kong is finding space to store them: Upscale London store Heywood Hill is using an intriguing competition to raise its profile in the digital age as it expands with outpost in the city,,27 Oct 2016
1092,paralysis and protests over oaths: Chaos reigns again in Legco as localist pair barred from retaking their oaths barge into chamber flanked by pan-democrats amid demonstrations outside,,27 Oct 2016
1093,Retired judge Woo Kwok-hing first to officially throw hat in the ring for Hong Kong's 2017 chief executive election: Woo Kwok-hing raises eyebrows for 'brave' bid in declaring he will stand for city's top job,,27 Oct 2016
1094,Can Hong Kong afford to let separatists into Legco?,,27 Oct 2016
1095,"Banker almost severed victim's head as she put up struggle, Hong Kong court told: Jury shown police tapes in which accused British banker told officers how he picked his 'prey' and sought sexual satisfaction by torturing people",,27 Oct 2016
1096,"China's capital outflows set to grow in Q3 and accelerate further in 2017, analysts say",,27 Oct 2016
1097,Chinese firm that helped build islands in South China Sea wins contract with rival claimant the Philippines,,27 Oct 2016
1098,"Shanghai private schools warned to focus more on official subjects, including ideology: Institutions offering international curriculum ordered to teach ideology",,27 Oct 2016
1099,"Crowd demands oath pair quit Legco: Businessmen, politicians and former anti-Japan resistance fighters join coachloads of angry protesters in decrying China slurs in chamber",,27 Oct 2016
1100,Hong Kong pan-democrats' division and inaction comes to the fore as pro-Beijing anger rages,,27 Oct 2016
1101,"National People's Congress might step in to interpret Basic Law if oath-taking case ends up in Court of Final Appeal, scholar warns",,27 Oct 2016
1102,Andrew Leung and why they despise him,,27 Oct 2016
1103,Legislature could be paralysed for several weeks: Any return to orderly business would depend on the progress and outcome of the government's judicial review of the Youngspiration pair's oaths,,27 Oct 2016
1104,Youngspiration duo remains in legislative limbo over oaths,,27 Oct 2016
1105,Ensure accountability when subsidising sports and cultural events with public money,,27 Oct 2016
1106,Let cool heads prevail in the Legco oath fracas,,27 Oct 2016
1107,"Chinese police offer 100,000 yuan reward in hunt for poachers suspected of poisoning hundreds of swans",,27 Oct 2016
1108,Multi-agency push to tackle debt: Economic planner to bring together more than a dozen top government agencies to mount united policy front but there is no easy fix in sight,,27 Oct 2016
1109,readback sent: Tourism authorities might suggest extending visa periods to counter drop in cross-strait visitors,,27 Oct 2016
1110,"Taipei's 'export' of phone scams to mainland 'no good', says former president: Cross-strait efforts vital to combat scourge of telephone fraud, former president says",,27 Oct 2016
1111,"Xi Jinping's former Shanghai colleagues dubbed 'New Shanghai Faction' after leapfrog promotions: A clutch of officials from the president's stint in the city have landed in top posts, continuing financial hub's tradition of influence on political stage",,27 Oct 2016
1112,John Tsang will 'actively consider' joining race for Hong Kong's chief executive job,,04 Dec 2016
1113,The life and death of Fidel Castro,,04 Dec 2016
1114,"call for 'intersex' option in city census: LGBTI advocate pledges to launch campaign for a third category, saying it is crucial to recognising existence of highly marginalised group",,04 Dec 2016
1115,China's local governments call time on tradition of heavy drinking at official functions,,04 Dec 2016
1116,Families that sheltered Snowden want to leave HK,,04 Dec 2016
1117,"Trump call casts doubts over future of weapons sales: US arms sales are not just business deals but have had a vital stabilising effect, analysts say",,04 Dec 2016
1118,FINDIng may curb Legco challenges: At least three judicial reviews against lawmakers could be hit by observation made during Leung and Yau appeal,,04 Dec 2016
1119,Local lawyer goes the distance for trafficking victims,,04 Dec 2016
1120,Major choral work gets premiere after 24 years,,04 Dec 2016
1121,"When deprived of information, Hong Kong victims miss out on justice: Government criticised for failing to notify couple of court ruling, narrowing review prospects",,04 Dec 2016
1122,Wing Ding,,04 Dec 2016
1123,Mainland China's lifting of pan-dem entry ban is to be welcomed,,04 Dec 2016
1124,Ordination of Catholic bishops in mainland China an encouraging step,,04 Dec 2016
1125,Capping mainland capital outflows won't strengthen yuan,,04 Dec 2016
1126,36 trapped following gas blast at coal mine in Inner Mongolia coa: Gas blast in Inner Mongolia is third serious incident in over a month as production swings into high gear amid soaring commodity prices,,04 Dec 2016
1127,From the ground up,,04 Dec 2016
1128,Phone call fallout: how analysts see China reactingLetAnd now the fallout: how analysts see Beijing reacting to Trump callAnd now the fallout: how analysts see Beijing reacting to Trump callA,,04 Dec 2016
1129,"China's military-foreign ministry divide 'muddies South China Sea waters': The foreign ministry differs with the military over what course of action to take in the South China Sea, which complicates talks, experts say",,04 Dec 2016
1130,Death casts spotlight on financial sector strain,,04 Dec 2016
1131,"Former businessman now a crusader for safe kids' products: WEI WENFENG was an established inspection engineer at Zhejiang customs when he noticed an odd smell emanating from the plastic covers of his daughter's schoolbooks. He paid to have them tested and discovered they were dangerously toxic. Wei, 40, speaks with MAGGIE ZHANG about how the event prompted him to start a new venture",,04 Dec 2016
1132,AFC women's Coach of the Year Chan Yuen-ting unable to inspire Eastern in goalless draw with Kitchee,,04 Dec 2016
1133,Champion Hong Kong jockey Douglas Whyte faces serious charge for ride in Perth,,04 Dec 2016
1134,Derek Leung concedes he's 'lucky to be alive' as he reflects on horror Sha Tin fall: Derek Leung reflects on the horror Sha Tin fall that nearly killed him as he returns to the track ahead of an action-packed international week,,04 Dec 2016
1135,xx,,04 Dec 2016
1136,"Cheaper than golf? Polo pioneers hoping to encourage more Hong Kong common folk to saddle up: Fledgling Hong Kong Polo Team seeking to bring the sport back to the city after a break of over 30 years, with a focus on making it accessible to all",,04 Dec 2016
1137,united in grief,,04 Dec 2016
1138,"We won't die, says LeSports ... but plenty will trying to crack the Chinese sports market",,04 Dec 2016
1139,BEA expands London branch as mainland investment in Britain remains strong despite Brexit,,05 Dec 2016
1140,Hot stuff: spicy Thai dishes continue to tantalise Hong Kong taste buds,,05 Dec 2016
1141,HSBC launches its first credit cards in China: Bank has set a short- to medium-term target of three million users,,05 Dec 2016
1142,Off the beaten track in Thailand: northern cities and islands offer escape from the crowds,,05 Dec 2016
1143,"Gold price may go 50 per cent up next year amid eurozone uncertainties: Industry experts predict metal will rise to at least US$1,500 after hitting US$1,377 this year",,05 Dec 2016
1144,Modern Land takes multiple green strides to stay in the black: Beijing-based developer plans to issue green bond on Shenzhen bourse at a time when financing avenues for Chinese developers are becoming difficult,,05 Dec 2016
1145,"Spreading boardroom battles could threaten real economic development, warn experts: Chinese companies listed on A-share market may face flurry of hostile takeovers as cash-rich investors leave no stone unturned for control",,05 Dec 2016
1146,Asian textiles: Yeh Group's breakthrough technologies help create sustainable future for industry,,05 Dec 2016
1147,Thai cuisine: Tep Kinsho spices up Asia's frozen food sector with sustainable menu,,05 Dec 2016
1148,Thai Plastic Industries formulates chemicals for Asia's evolving needs,,05 Dec 2016
1149,Thailand: SCBAM buoyant on increased government infrastructure spending,,05 Dec 2016
1150,"Too few of Hong Kong's listed companies treat sustainability reporting seriously, claims leading advisory agency: Only few HK companies appreciate benefits of being environmentally and socially responsible",,05 Dec 2016
