,title,byline,dates
482,"Chinese tourists skipped Hong Kong, Taiwan and headed farther afield during Golden WeekG: More Chinese tourists travelled to far-off destinations like Russia, US, Morocco, Tunisia and Tonga",,12 Oct 2016
483,CLP says it's keen to bid 17% of Yangjiang power plant put up for auction by CGN,,12 Oct 2016
484,"Hang Seng retreats from 24,000 on weak southbound flows, falling property stocks",,12 Oct 2016
485,HNA to buy eight golf courses in the US for US$137.5m,,12 Oct 2016
486,"Hong Kong hotel market still promising, Magnificent Hotel continues expand at home and in London: Though there has been a shortfall in the number of visitors from the mainland, William Cheng, chairman of Magnificent Hotel Investments believes that there is still room for growth",,12 Oct 2016
487,"Hong Kong's businesses more upbeat than global peers about yuan's stability, HSBC poll saysHj: City businesses more confident than global peers about prospects for Chinese currency, expect volatility to taper off soon, says HSBC survey",,12 Oct 2016
488,"Investors in student housing assets hunt for new growth pastures in mainland Europe: Investment volumes surge amid strong demand for properties in US, UK",,12 Oct 2016
489,Nasdaq and Hong Kong exchange sharing information on blockchain technology,,12 Oct 2016
490,"Have faith, we're here to stay and the future's bright says LV boss: Despite a luxury slowdown in the region, it's full steam ahead in China for Louis Vuitton CEO and chairman Michael Burke tells Jing Zhang",,12 Oct 2016
491,Hong Kong fall to Thailand in women's cricket T20 World Cup qualifier; Nepal beat China,,12 Oct 2016
492,Positive performance by Kim's charges: Hong Kong sink Singapore 2-0 in a friendly to negate recent bad press,,12 Oct 2016
493,"Sayonara Stosur: Hibino sends Australian packing in stunning Hong Kong Open victory: Japanese notches biggest result of her career as Australian's erratic form continues, while local hope Zhang Ling bows out at Hong Kong Open",,12 Oct 2016
494,"Us journalist recalls the crazy days of Beatlemania in new Ron Howard documentary: As a young journalist, Larry Kane travelled with The Beatles on their 1964 and 1965 US tours. He talks to Kylie Knott about the Fab Four and Ron Howard's documentary",,12 Oct 2016
495,World No 14 Branden Grace loses himself in Macau aura but plans to find his way in time to stake Open title claim,,12 Oct 2016
496,"Four in 10 Hongkongers want to leave city, with some already planning their exit: It found 10% of them have put wheels in motion, with crowded conditions among factors for move",,12 Oct 2016
497,Hong Kong police hope to have anti-riot vehicles ready in time for 20th anniversary of handover to China,,12 Oct 2016
498,What the tide brought in,,12 Oct 2016
499,Anyone but CY: it's all BS whoever wins Hong Kong's next chief executive election,,12 Oct 2016
500,Battle between Hong Kong government and lawmakers set to resume on several fronts: Leung Chun-ying faces three motions for probes and will be constantly attacked as pan-democrats try to stop him being re-elected as chief executive,,12 Oct 2016
501,Legco presidential hopeful grilled over British nationality,,12 Oct 2016
502,"Still too early to talk about popularity of potential Hong Kong chief executives, CY Leung says: Chief executive says HKU poll unreliable as no one has yet declared candidacy for top job",,12 Oct 2016
503,"Hong Kong's richest earn 29 times more than poorest despite government efforts to fight poverty: report: City also sees more low-income households, according to aid agency report",,12 Oct 2016
504,"Hong Kong's rural kingpin has shares in 65 firms, topping lawmakers' list of business interests: Kenneth Lau declares interests in businesses ranging from property investment to sauce",,12 Oct 2016
505,Illegal stay,,12 Oct 2016
506,United States envoy highlights business advantages of respecting gay rights during Hong Kong visit: US official Randy Berry says companies need to move their best people as they see fit; he also urges LGBTI advocates to be more visible in the city,,12 Oct 2016
507,"Former Hong Kong leader Donald Tsang faces additional bribery charge over Shenzhen penthouse: Former chief executive accused of corruption over redecoration of Shenzhen penthouse, in addition to two counts of misconduct in office",,12 Oct 2016
508,"Samsung recalls 191,000 Note 7 smart phones in China, puts Hong Kong users on hold",,12 Oct 2016
509,"Love him or loathe him, Joshua Wong keeps Hong Kong in global political spotlight",,12 Oct 2016
510,"Li Keqiang hails third-quarter performance as China economy steps out of slump: On visit to Macau, premier also offers assurances on employment and the housing market",,12 Oct 2016
511,"Mind your language, new lawmakers told: Newly elected legislative councillors warned they risk losing their seats if they fail to take their oath of office strictly according to the Basic Law",,12 Oct 2016
512,"Familiarity and contempt: Hillary Clinton's 21-year relationship with China: If Hillary Clinton is elected US president next month she will represent a known quantity for Beijing, but that doesn't make her an ideal choice",,12 Oct 2016
513,A history of tense relations,,12 Oct 2016
514,Appallingly small living spaces put Hong Kong to shame,,12 Oct 2016
515,Nobel prize for Colombian leader can act as an incentive to forging a lasting peace with rebels,,12 Oct 2016
516,13 top Chinese research labs demand independent inquiry into scientist's controversial DNA claims: Top mainland laboratories say they cannot replicate a Chinese researcher's 'breakthrough',,12 Oct 2016
517,Boys to vastly outnumber girls in China for years: population official,,12 Oct 2016
518,Grave concern,,12 Oct 2016
519,"A step backwards? Chinese cities' harsh draft rules against taxi-hailing apps 'hinder innovation': If adopted, proposals may violate the law and could turn back time to 'when getting a cab was like winning a lottery', critics say",,12 Oct 2016
520,"China, Russia close ranks against U.S. Missile shield: Military officials from Moscow and Beijing use security forum to condemn plans by Washington to deploy anti-missile systems in Asia and Europe",,12 Oct 2016
521,Chinese military's anti-graft drive targets mid-level officers to root out disgraced leaders' influenceChinese military's anti-graft drive targets mid-level officers to root out disgraced leaders' influence: All PLA party chiefs warned to beware harmful influence of disgraced former Central Military Commission officials Guo Boxiong and Xu Caihou,,12 Oct 2016
522,"Despite the recent results, horses embroiled in running and handling cases aren't a sure thing: Some say runners who've been under scrutiny will win in next outing is a hit-and-miss theory",,12 Oct 2016
523,"Track rotation the key to Valley times, say experts",,12 Oct 2016
524,Aborted property acquisition points to power shift at Li Ka-shing controlled companies: Aborted property acquisition points to power shift at companies controlled by Li Ka-shing,,13 Oct 2016
525,"China's TMT deals top US$100bn for second straight year: Pace of global mergers and acquisitions being driven by the high-value acquisitions made by firms like Tencent and Didi Chuxing, says report",,13 Oct 2016
526,Lenovo retains PC market lead as global shipments continue to decline,,13 Oct 2016
527,Chart of the day: The power of demand,,13 Oct 2016
528,"Hong Kong shares drop as southbound Stock Connect inflows fall well below daily normal: Heavy selling seen in property, financial, banking and transportation stocks amid lack of fresh cues",,13 Oct 2016
529,"Regulators begin the delicate task of cooling, but not stalling or crashing, China's sizzling property market: Regulators tread with caution despite steep price surges as wrong moves could trigger a stock market crash similar to what happened a year ago",,13 Oct 2016
530,"Wind power propelling China into cleaner energy era: Sector profits could see sharp uptick for the rest of the year, says report from BOCI",,13 Oct 2016
531,"Hedge funds outshine their mutual rivals: Slowing economy, worsening business climate prompts investors to seek alternative options for maximising returns from high-risk investments",,13 Oct 2016
532,"Macau to become a centre for yuan settlement, Chinese Premier Li Keqiang confirms: Premier Li Keqiang says move will help diversify the economy of the former Portuguese enclave",,13 Oct 2016
533,all zones lead to wan chai: HKTDC adds Startup and Virtual Reality to the list of attractions at the Convention and Exhibition Centre,,13 Oct 2016
534,Exhibitors use their window to the world,,13 Oct 2016
535,China car sales grow at quickest pace in 3.5 years as tax-break expiry looms,,13 Oct 2016
536,China property market saw 'strong recovery' before new government cooling measures: States growth policies lift prices but restrictions on down payments and home buying to continue,,13 Oct 2016
537,"Infiniti's autonomous cars could hit Hong Kong's streets by 2020, if regulations permit",,13 Oct 2016
538,"Postal Savings Bank is worst at creating shareholder value, says McKinsey: Lender poorest performer among 40 banks in the mainland in terms of generating economic profits for shareholders in 2015, says McKinsey report",,13 Oct 2016
539,Film review: Special Female Force - scantily clad girls with guns in Hong Kong action thriller,,13 Oct 2016
540,"Love, loss, comedy, horror and execution among the 12 highlights of the 2016 Hong Kong Asian Film Festival: The Hong Kong Asian Film Festival is back with a fine selection of the best works from around the continent. Edmund Lee shares his 12 favourites",,13 Oct 2016
541,Top 5 films to watch in Hong Kong this week: October 13-19,,13 Oct 2016
542,"Chinese artist Zhang Xiaogang determined to put Bloodline series to bed: Zhang Xiaogang's 'Bloodline' series made him a household name, but he hopes an exhibition of his latest works alongside those of the late, great conceptual artist Sol LeWitt will prove he has moved on, writes Enid Tsui",,13 Oct 2016
543,"Joao Moreira lives up to the title of 'Magic Man' with five winners at Happy Valley: The Magic Man dominates at the Valley, delivering four winners for leading trainer Caspar Fownes to highlight his position as Hong Kong's top jockey",,13 Oct 2016
544,New-media's golden boy is just getting started,,13 Oct 2016
545,'Should Chinese football start from scratch?' asks state media after another World Cup qualifying defeat: Mainland media are calling for major changes in the national side after their third loss in four matches in World Cup Asian zone qualifiers,,13 Oct 2016
546,"From Lang Ping to Big Sam, five candidates who could become China's next manager - and three who almost certainly won't",,13 Oct 2016
547,Guy Ullens 'attacked at board meeting' for seeking profit from sale of gallery,,13 Oct 2016
548,"How China's most bankable artist, Zeng Fanzhi, found new way to make art: Zeng Fanzhi is China's most bankable artist and has managed to stay ahead of his peers by painting what he wants and not trying to pander to the public, writes Enid Tsui",,13 Oct 2016
549,"Darren Clarke defends Ryder Cup captaincy in face of criticism - 'the guys could not have given me an inch more': Northern Irishman , who is in Macau for the first time since 1999, insists that his team of players gave as much as they could have at Hazeltine",,13 Oct 2016
550,"Greater people power for 2017 Formula E race, with organisers looking to expand eVillage and offer more entertainment: Ex-HKAA president Yu wants to increase public involvement and raise the fun factor",,13 Oct 2016
551,head here,,13 Oct 2016
552,Moreira picks Heartbreak City for Melbourne Cup as Purton goes for Articus in Caulfield Cup: Australian jockey is slimming down for German stayer as he looks for his second Caulfield Cup,,13 Oct 2016
553,David Bowie artworks go on display at Sotheby's Hong Kong gallery: One painting could fetch as much as HK$33 million in next month's sale,,13 Oct 2016
554,FUNERAL12,,13 Oct 2016
555,Samsung offers refund or replacement for Note 7 as Hong Kong lawmaker calls for tighter laws on mobile phone safety: Technology giant says HK and Macau consumers can get money back or cheaper model; policy for telecommunication service providers is less clear,,13 Oct 2016
556,"Cross-harbour race to be bigger, fairer and safer",,13 Oct 2016
557,Hong Kong driver dies after crashing minibus into parked roadwork vehicles: Case is fifth accident with parked maintenance vehicles in four months,,13 Oct 2016
558,"Hong Kong masseur, 64, jailed 12 months for indecent assault on schoolgirl, 16: He touched teenager's genitals, breasts during massage; judge says it was a breach of trust",,13 Oct 2016
559,Top British tennis player serves ace in Hong Kong canteen for deprived elderly,,13 Oct 2016
560,"What now for woman in breast assault case on cop? Supporting democracy, more protests and ... a vacation: Originally jailed for 3 months, Ng Lai-ying reflects on making international headlines, anti-mainland sentiment and possible civil lawsuit against officers",,13 Oct 2016
561,Hong Kong ranks third in region for efforts to curb illicit trade: Study puts Hong Kong just behind Australia and New Zealand when it comes to combatting the flow of counterfeit and illicit goods in the region,,13 Oct 2016
562,Law Reform Commission recommends funded arbitration scheme be given green light: Law Reform Commission says more disputes could be settled out of court,,13 Oct 2016
563,Man accused of rape in Mong Kok flat,,13 Oct 2016
564,"No proper labelling in 'half of beauty products in HK shops': Greenpeace survey finds such items did not state clearly they contain microplastics, a big pollutant",,13 Oct 2016
565,Block on helpers cleaning windows: Philippine consulate orders new contracts must explicitly state the task is not allowed,,13 Oct 2016
566,"Declaration of war as Legco opens: Protest banners, questions of nationality and modified oaths signal a turbulent start to the new term",,13 Oct 2016
567,So half of our youth want to leave Hong Kong? We need to make sure they have reasons to stay,,13 Oct 2016
568,"Apple to open Shenzhen R&D hub, boosting city's plan to remake itself as China's 'Silicon Valley': Tech giant plans to tap into huge pool of talent in a city that the central government hopes will be transformed into the 'Silicon Valley' of China",,13 Oct 2016
569,China looks for answers after 2018 World Cup dream nears its end,,13 Oct 2016
570,Commencing countdown,,13 Oct 2016
571,"Duterte will drop South China Sea ruling during his trip to Beijing: Philippine leader's trip may yield deals in other maritime areas, such as fisheries, analysts say",,13 Oct 2016
572,"Promotion on the cards for 'political survivor' who worked with disgraced Bo Xilai and corrupt Shanxi Gangpollll: After weathering storms elsewhere, Wu Zhenglong appointed Nanjing boss",,13 Oct 2016
573,Andrew Leung becomes president of Hong Kong Legco after dispute over British nationality,,13 Oct 2016
574,"Hong Kong's coughing, yelling lawmakers don't stick to the script",,13 Oct 2016
575,Three rejections and four deviations mark Hong Kong Legislative Council swearing-in: Two Youngspiration election winners and one pan-democrat have their oaths rejected as others face no repercussions,,13 Oct 2016
576,words of intent,,13 Oct 2016
577,Chaos on first day bodes ill for the proper functioning of Legco,,13 Oct 2016
578,Safety takes back seat in the rush to roll out ever newer gadgets,,13 Oct 2016
579,"Chinese lawyers call for justice minister's dismissal over 'unlawful rules that violate rights': Some rules introduced on Wu Aiying's watch are unlawful and violate rights, petition claims",,13 Oct 2016
580,Convicted Chinese protest leader renounces bribery confession after getting heavy sentence: Lin Zuluan backtracks on admission to taking bribes as he appeals in a Foshan court against his 37-month sentence handed down last month,,13 Oct 2016
581,KMT leader to meet Xi ahead of inter-party talks,,13 Oct 2016
582,'Near collision' at Shanghai airport: China Eastern plane takes off as another jet crosses runway: Air traffic controllers might be to blame for jets coming close to collision,,13 Oct 2016
583,Chinese scientist who sparked controversy over DNA claims 'needs time to provide proof': Han Chunyu says it's inconvenient to name laboratories that have replicated experiment,,13 Oct 2016
584,"Communist Party the top boss of China's state firms, Xi Jinping asserts in rare meeting: After decades of fading into background, Communist Party's leadership must be boosted in SOEs, president tells extraordinary work meeting",,13 Oct 2016
585,"Aston Villa owner Tony Xia sets his sights on Hollywood with studio investments: While diversifying his business empire to the filmmaking industry in Hollywood, Tony Xia vows to take Aston Villa back to the Premier League within two years",,15 Oct 2016
586,Tony Xia,,15 Oct 2016
587,Brokerages in mass dash to raise fresh funds: Mainland securities companies at home and in HK race to replenish capital bases amid tighter regulatory requirements,,15 Oct 2016
588,Chart of the day: The beauty of tax cut,,15 Oct 2016
589,Hong Kong stocks rebound on upbeat China inflation data: Growth in mainland consumer prices lifts HSI despite downside risk and lack of momentum,,15 Oct 2016
590,Cashless future rapidly emerging as the most bankable option: Transactions through a digital wallet on your smartphone are becoming a way of life for many and three of China's biggest internet companies are hoping to drive its adoption around the world,,15 Oct 2016
591,QFPay poised to help bring mainland's mobile payment services to a global audience,,15 Oct 2016
592,'Sit last and come home fast' - trainer Tony Cruz says there will be no change of tactics for Pakistan Star: Tony Cruz says he will stick to tried and tested tactics as the 'wonder horse' goes for win No 3,,15 Oct 2016
593,Cricket Hong Kong - rebranded governing body has new look to reflect city's status in global game,,15 Oct 2016
594,India's Anirban Lahiri set to turn up the heat at Macao Open: Indian consistently shoots low scores at the event and is on fire again,,15 Oct 2016
595,Wozniacki eyes second triumph in Asian swing: Danish ace overcomes China's Wang Qiang to reach the semi-finals in what the former No 1 describes as a 'difficult' year that was interrupted by injury,,15 Oct 2016
596,"Ailing Chinese Estates boss Joseph Lau striving to outwit God: Gone are the HK$28.4 billion worth of its crown jewels, which are then replaced by receivables",,15 Oct 2016
597,Black day for Thais in Hong Kong as news of king's death sinks in,,15 Oct 2016
598,Chinese tourists being dissuaded from visiting grieving Thailand: Tourists told to dress conservatively and not to laugh out loud in public,,15 Oct 2016
599,"Ethnic chinese mourn death of 'father': In Bangkok's Chinatown, members of the minority group recall how the monarch changed their lives and treated them with respect",,15 Oct 2016
600,Hong Kong conservationist hails victory of getting endangered pangolins on list to restrict their trade: Sharon Kwok Sau-wan lobbied for maximum protection for animal species,,15 Oct 2016
601,Why owning a dog in Hong Kong is still harder than in many international cities,,15 Oct 2016
602,"Bans and barriers: trials and tribulations of owning a dog in Hong Kong: Animal welfare campaigners say city should become more dog-friendly, particularly for tenants of public housing estates",,15 Oct 2016
603,"Family firms struggle to merge tradition with young ambition: Family-run companies could face messy breakups if succession handled badly, consultancy says",,15 Oct 2016
604,Homeless snap photos of life on streets: Diary project seeks to spur awareness as numbers in city more than double,,15 Oct 2016
605,"Escaping the pace of the city with Hong Kong's tea appreciation society: Tea business owner shares her enthusiasm for the leaf by starting group to teach others ways to drink it, match with food and properly savour it",,15 Oct 2016
606,Top teas,,15 Oct 2016
607,The woman with a ringside seat as Hong Kong's lawmakers battled it out: Pauline Ng recalls her years as Legco's admin chief and why lawmakers took a path that led to chaos,,15 Oct 2016
608,Donating organs to save lives,,15 Oct 2016
609,Doctors urge heart donation for ailing 10-year-old boy: Hospital team describes ideal transplant as one coming from someone similar in size to the child,,15 Oct 2016
610,Philippines delays ban on exterior window cleaning after Hong Kong government plea: Pleas from city officials and helpers' employers convince consulate to suspend plan 30 days,,15 Oct 2016
611,"Forget filibustering, it will be guerilla warfare in the new Legco",,15 Oct 2016
612,Aston Villa's Chinese owner seeks to defy odds and return team to Premier League in 2 years,,15 Oct 2016
613,"It pays to be friends with Beijing, but why is big China wooing small Cambodia?: Beijing hopes its relations with Phnom Penh can set a precedent for others in Southeast Asia",,15 Oct 2016
614,New faces at West Kowloon board: Five appointees are mostly local business leaders as government seeks to move troubled arts hub project forward after criticism of blown budgets,,15 Oct 2016
615,Service resumed on Hong Kong's Airport Express and Tung Chung rail lines after five-hour disruption,,15 Oct 2016
616,Students' experiment ready for launch: School pupils' skin treatment trial will be tested on the Tiangong 2 space station,,15 Oct 2016
617,Boastful triad leader gets two years,,15 Oct 2016
618,Hospitals that treat Hong Kong's poorest could get more money under revised funding model,,15 Oct 2016
619,LEGCO04: Youngspiration duo initially denied access to House Committee's opening meeting while chief executive 'angry and disappointed' over oaths,,15 Oct 2016
620,Rare Monet painting to get public showing in Hong Kong next week: Display reflects growing demand for Impressionist art in region,,15 Oct 2016
621,"Supermarket chains sell threatened marine species, WWF Hong Kong claims: WWF Hong Kong points finger at nine groups including Wellcome, ParknShop",,15 Oct 2016
622,A king for all seasons,,15 Oct 2016
623,Estimate scheme a step forward in the effort to curb complaints over private hospitals,,15 Oct 2016
624,"Thailand must strive for unity, cooperation and consensus",,15 Oct 2016
625,Airhead,,15 Oct 2016
626,"Positive signs as China's prolonged industrial deflation finally ends after demand grows for coal, steel: After 54 straight months of decline, industrial inflation rose 0.1pc in September, giving the People's Bank of China more room to manoeuvre",,15 Oct 2016
627,"Have China setbacks scarred Trump?: Trump's unsuccessful business forays in China might have influenced his attitude towards the US' growing geopolitical rival, an analyst says",,15 Oct 2016
628,Trump's fans in China are sticking with him despite lewd remarks,,15 Oct 2016
629,"Choking smog hits Beijing, with clear skies not expected until Monday: Heavy pollution expected to persist in the capital until Monday as limits put on activity at construction sites",,15 Oct 2016
630,Internationals lining up to take Caulfield Cup away from Australia: International trainers Charlie Appleby and Andreas Wohler are confident their horses can upstage the local hopes in the Australian Group One,,15 Oct 2016
631,"The party's over: Bangkok's wild nightlife falls silent out of respect for late king: Events including concerts, fun runs, weddings and festivals also cancelled",,16 Oct 2016
632,"Time of uncertainty lies ahead for Bangkok's ethnic Chinese: Political turmoil, economic uncertainty and king's death make nation 'feel like a ship without a rudder'",,16 Oct 2016
633,Chinese government plays hardball with dishonest property agents and developers,,16 Oct 2016
634,Haiti hit by disaster ... again,,16 Oct 2016
635,"Government flayed as poverty figure hits six-year high Government flayed as poverty hits six-year high: Report says 20,000 more people were living below official line in 2015 than in previous year",,16 Oct 2016
636,Hong Kong doctors to be trained up as city faces shortage of clinical genetics experts,,16 Oct 2016
637,"Hong Kong's long-awaited new MTR station, the city's largest, draws crowds but is it too large?",,16 Oct 2016
638,"Mainland graft buster finds raft of issues in Hong Kong, Macau office: 'Corruption risks', unsatisfactory personnel and weak leadership were all identified in government's assessment",,16 Oct 2016
639,Three Australians among 18 Crown staff held: reports,,16 Oct 2016
640,Blaze of glory,,16 Oct 2016
641,Hong Kong Legislative Council president seeks legal advice over oath-taking: Andrew Leung to consult senior counsel over retaking of oaths by Youngspiration members,,16 Oct 2016
642,Hong Kong minibus driver arrested in connection with death of workman in hit-and-run accident,,16 Oct 2016
643,Hong Kong targets 'Belt and Road' countries for transport contracts and links,,16 Oct 2016
644,"Hong Kong woman begs for a liver donor to save husband who is days away from death: 'I can't live without him,' heartbroken spouse says in appeal for stricken former school principal, who could die in days without a liver transplant",,16 Oct 2016
645,Safety must come first for all those doing domestic chores,,16 Oct 2016
646,There is no reason why agreement can't be reached on labour issues,,16 Oct 2016
647,"You won't get rich from your MPF fund, but your bankers certainly will",,16 Oct 2016
648,Judiciary nominee sparks questions on Tsai's endgame: Mainland Affairs Council moves to reassure after candidate says ties are 'special state to state',,16 Oct 2016
649,Residents of penghu reject casino plans: About 80pc of voters reject proposal to introduce gambling businesses in tourist resort community in Taiwan Strait,,16 Oct 2016
