,title,byline,dates
0,Applying for uni? Here's five ways you can make your Student Learning Profile stand out: Is your Student Learning Profile up to scratch? Melody Tam and Ng Po-shing tell Ben Pangthe top five things you can do to make your SLP stand out from the crowd,,20 Aug 2016
1,"In Macau's casinos, high rollers come and go, but one man stands above them all: Galaxy Entertainment chairman Lui Che-woo sees grandeur in Macau in the next few years when the Hong Kong-Zhuhai-Macau bridge opens",,20 Aug 2016
2,Chart of the day: China on spending spree,,20 Aug 2016
3,"Hong Kong stocks in three week rally on upbeat corporate earnings, Stock Connect optimism: Sentiment improves as big companies report better-than-expected half-yearly performance",,20 Aug 2016
4,"Shenzhen-Hong Kong stock link heightens expectations for fresh outbound QDII, QDLP quota: Coming launch of Shenzhen-HK cross-border share trading reveals investor interest in foreign-listed equities is high",,20 Aug 2016
5,Strict rules imposed on HK independence talk at schools: Students can discuss the controversial topic - as long as it falls within Basic Law limits (whatever that means),,20 Aug 2016
6,Swimmers caught in a lie,,20 Aug 2016
7,Trump plays nice - sort of,,20 Aug 2016
8,A young survivor faces the dirty realities of war,,20 Aug 2016
9,"Brokers believe Hong Kong stock market circuit breaker fails to address market's real problem: Volatility control mechanism is unlikely to cause a repeat of Black Monday market meltdown in 1987 or China's circuit breaker chaos in January, but some brokers say that by concentrating on Hang Seng Index and H-share constituent stocks it is aiming at the wrong targets",,20 Aug 2016
10,"Bank of East Asia pushes ahead with cost saving programme as pre-tax profit dips 30pc in first half: Lender to further diversify income sources, manage operating costs as pre-tax profit falls during first six months of the year",,20 Aug 2016
11,China rings up US$32.4b sales of smartphones in second-quarter,,20 Aug 2016
12,China's CR Beer says cost controls boosted first half profit by 45pc despite lower sales,,20 Aug 2016
13,Guotai Junan International half-yearly profit declines 10 pc: Brokerage firm expects upcoming Shenzhen-HK connect to bolster future growth after posting better than expected half-yearly performance,,20 Aug 2016
14,Struggling to beat the System,,20 Aug 2016
15,ZTE gets 3-month reprieve from US ban on components,,20 Aug 2016
16,"Music Maestros: Sir Elton John: Each week, we look at musicians who have had a big impact on the world. This week, it's Elton John, one of the most successful singer-songwriters to ever sit at the piano",,20 Aug 2016
17,all about movies: Lights! Camera! Action! Can you find all 100 of these movie-related words in today's puzzle?,,20 Aug 2016
18,Old World charm: practical layout and efficiency add to appeal of spacious Conway Mansion flat on Hong Kong Island's Conduit Road,,20 Aug 2016
19,Bracket me with Ali and Pele: Usain Bolt on brink of 'triple-triple' after superb 200m win: Jamaican wants to be seen in the same bracket as Pele and Muhammad Ali as he seeks third Games relay gold,,20 Aug 2016
20,'Irritable' Yu retires with regrets as pressure tells,,20 Aug 2016
21,Hong Kong's last medal hope aiming to give mountain biking a boost with strong Rio showing,,20 Aug 2016
22,"World class: Hong Kong's best can cut it in the Olympics, but there are too few of them",,20 Aug 2016
23,"'Look beyond just medals': Hong Kong Olympic chief Kenneth Fok defends athletes' performance at Rio Games: Having sent 38 athletes to Brazil, Hong Kong are set to come back empty-handed from Rio",,20 Aug 2016
24,'Where is clean sport?' Furious China 4x100m relay team edged out of final after USA reprieve: Chinese women lose their place in the 4x100 metres final after the US win a controversial appeal to get rerun,,20 Aug 2016
25,Born to dive: China's latest teenaged Olympic champion destroys the field to claim gold,,20 Aug 2016
26,Victory at last: Lee Chong Wei defeats arch-rival Lin Dan in men's singles badminton semi-final: Malaysian superstar overcomes his great rival to move into gold medal match in Rio,,20 Aug 2016
27,Politics will decide whether: Partnering with China Resources is the only way for Hui to win in the game of control for Vanke,,20 Aug 2016
28,Replacement poster of sci-fi movie Arrival arrives quietly: Poster showing iconic tower against Hong Kong skyline pulled after fuelling anti-mainland sentiment,,20 Aug 2016
29,Beloved Hong Kong litterbug Lap Sap Chung gets clean start: Childhood memories of character in anti-litter drive flood back with green dragon Ah Tak,,20 Aug 2016
30,Did hipsters kill Lan Kwai Fong's oldest nightclub? Hong Kong party district to farewell Club 97: Closure of 34-year-old nightspot at end of the month comes as revellers seem to prefer quieter times out,,20 Aug 2016
31,"ice bucket challenge turns to cash freeze: Just two years on from the fundraising craze for sufferers of a rare type of motor neurone disease, a Hong Kong charity tells how interest is dwindling",,20 Aug 2016
32,"Hong Kong running group going the distance for the city's sexual minorities: A New York gay pride event inspired the setting up of OutRunners HK, a group that seeks to promote the inclusion of sexual minorities",,20 Aug 2016
33,The man helping you get about town: inventor of the Octopus card tells how his team revolutionised Hong Kong transport: Engineer Paul Chan Mo-lim welcomes retirement after 35 years of implementing Asia's first automatic fare collection system,,20 Aug 2016
34,privacy pointers,,20 Aug 2016
35,"Simple steps advised to prevent webcam footage going public in wake of controversy over Hong Kong exhibit footage: Cybersecurity experts and privacy advocates recommend taking steps to better protect users, including taping the webcam lens when it's not in use",,20 Aug 2016
36,"Not only a blunder, but also possible foul play: police to probe suspected sabotage over supply of tainted pigs to Hong Kong",,20 Aug 2016
37,Government should not pass the buck on independence talk,,20 Aug 2016
38,"Conscript army needed if Hong Kong were to split from China, says pro-independence group led by secondary school students",,20 Aug 2016
39,New circuit breaker to kick in on Monday on Hong Kong's bourse: Mechanism will halt trading in a stock on HK bourse if price rises or falls 10pc within minutes,,20 Aug 2016
40,"NSA put chinese cyberfirms in cross hairs, experts say: Data apparently stolen from the US spy agency shows one victim was Topsec, a Beijing-based firm that provides network security for the government and PLA, according to analysts",,20 Aug 2016
41,"PLA general who helped organise Hong Kong handover committed suicide in Shenzhen, sources say: General who helped organise Hong Kong's handover ceremony in 1997 found dead from overdose of sleeping pills in Shenzhen barracks",,20 Aug 2016
42,Arnold Schwarzenegger arrives in Hong Kong for Asian debut of signature sports festival: Terminator star extols his friendship with fellow actor Jackie Chan,,20 Aug 2016
43,"Firms at buddhist site told way to go: Ruling in legal battle between builder, developer of monastery sponsored by Li Ka-shing says they must strive to agree on claims and counterclaims",,20 Aug 2016
44,"Hong Kong's power firms must invest greater sums in making customers' energy use more efficient, WWF says",,20 Aug 2016
45,I disagree with his judgment: Hong Kong Legco president distances himself from CY Leung,,20 Aug 2016
46,"We're doing our best, say pollsters in wake of criticism",,20 Aug 2016
47,Frame Games,,20 Aug 2016
48,First steps to mending the fracture ties between China and the Philippines,,20 Aug 2016
49,Olympic pride is more than medals for Hong Kong's athletes,,20 Aug 2016
50,China falls back on fiscal stimulus to revive growth in ailing northeast rust belt,,20 Aug 2016
51,"China unveils stock ownership plan for state enterprise employees: Three years in the making, the plan is seen as small but key step towards privatisation",,20 Aug 2016
52,Rising star in China's police force removed from top security commission: Question mark over Fu Zhenghua's political career as spot taken by more junior official,,20 Aug 2016
53,CEO training course on offer in China ... for three-year olds,,20 Aug 2016
54,"Local officials 'fail to learn lessons' of deadly disaster: Survivors of fatal floods - as well as country's top leaders - appalled by incompetence and bungling by local cadres, saying human error was a major factor in the high death toll",,20 Aug 2016
55,"Britpop's Suede spill the secrets about their latest album, Night Thoughts: Former Britpop heartthrobs Suede talk to Lauren James about ambition, Hong Kong food they love, and finding new ways to fail",,21 Aug 2016
56,Po les Ap art,,21 Aug 2016
57,Last time you literally LOL'd?,,21 Aug 2016
58,Things we heart this week,,21 Aug 2016
59,A North Korean diplomat defects while a Hollywood movie causes controversy in Hong Kong... or should that be Shanghai?,,21 Aug 2016
60,Hong Kong's vinyl junkies have a reason to rejoice,,21 Aug 2016
61,"OPINION: Hongkongers, stop bashing mainland over city's filthy beaches",,21 Aug 2016
62,"How Hong Kong taxis became red, green and blue",,21 Aug 2016
63,Can Manzhouli work its magic on the South China Sea disputes?: A city that once heated up Sino-Russian tensions is helping to keep the temperature down in talks between China and Asean,,21 Aug 2016
64,"Like League of Legends played with Greek gods, Defense of the Ancients 2 is great fun",,21 Aug 2016
65,Generationwhy is a meal of an album,,21 Aug 2016
66,A sign of future sparkling success,,21 Aug 2016
67,Why China's gold medal count at the Rio Olympics is so low: CHINA AND INDIA An Olympic divide,,21 Aug 2016
68,"The Wow and Flutter Weekend festival brought Hong Kong's weirdest and wildest rock to Kowloon City: From shoegazing to death metal, with a touch of rap thrown in, more than 40 bands came together for the first Weekend festival from Wow and Flutter, writes Lauren",,21 Aug 2016
69,"Oscar-worthy 'Ben Hur' remake combines Jesus Christ's teachings, vengeance and redemption",,21 Aug 2016
70,"Kickin' it with Arsenal Soccer School's goalkeeper Alric Lam: Being a goalkeeper is tough, but this South Island School student tells Lauren James how he keeps moving forward, even under stress",,21 Aug 2016
71,How a legendary armada shines light on Chinese civilisation's greatest strengths,,21 Aug 2016
72,"In snubbing Chinese investment, Australia and Britain play into anti-globalisation forces",,21 Aug 2016
73,"Central Asia's Dubai? In Kazakhstan's Astana, reality bites: Amid the glitzy towers and preparations for a mega expo in Kazakhstan's capital, uncertainty over the future is fuelled by a commodities crash, a falling currency and a slowdown in China",,21 Aug 2016
74,Kadoorie Farm comes to the rescue in China and Laos,,21 Aug 2016
75,"How to get thicker, longer lashes in Hong Kong",,21 Aug 2016
76,Shanghai Tang's lacquered backgammon board - an antidote for junk-weary Hongkongers: xxxxxxxxxxxx,,21 Aug 2016
77,Singapore hotel M Social is all about getting guests to mingle,,21 Aug 2016
78,Susan Jung's recipes for dishes that require zero cooking: These refreshing summer dishes require no cooking but good knife skills.,,21 Aug 2016
79,"New York chef on changing careers in her 30s: The chef-owner of Birds & Bubbles and City Grit in New York, who was in Hong Kong to cook at a pop-up at Isono restaurant, talks about changing careers at 34 and why every day is a celebration.",,21 Aug 2016
80,The NoMad Cookbook by Daniel Humm and Will Guidara: By Daniel Humm and Will Guidara,,21 Aug 2016
81,The divine onion and sound waves that move matter - Hong Kong exhibition's New Age riffs: Cromniomancy is the practice of predicting the future by studying a certain vegetable - and it's the name of a new exhibition by Adrian Wong and Shane Aspegren.,,21 Aug 2016
82,"Will I get married? Maybe, but it won't stop me from competing at the next Olympics in Tokyo, says Sarah Lee: HK cycling star says she is determined to compete in the Tokyo Games",,21 Aug 2016
83,The Syrian situation,,21 Aug 2016
84,"Chinese-American jailed for trying to sell military secrets: Woman worked with spy in China to put fighter jet engines in hands of the PLA, court heard",,21 Aug 2016
85,Ghost malls: Hong Kong mini-shop owners and operators find the going tough amid retail downturn: Small shops in centres sub-divided when market was booming are now struggling to survive,,21 Aug 2016
86,Hong Kong government to mull new ways of stamping live pigs to confirm consumption safety before slaughter,,21 Aug 2016
87,No way: Hong Kong education minister rejects calls for guidelines on discussing independence in schools: Education minister says he will leave it to the 'professionalism' of teachers and principals to curb advocacy of independence in schools,,21 Aug 2016
88,Hong Kong government gives HK$150 million to needy local families,,21 Aug 2016
89,Hong Kong has failed its domestic helpers: advocates say not enough support services and safety guidelines in place: Supporters urge mental wellness services and job safety guidelines for domestic workers,,21 Aug 2016
90,"Hong Kong needs change of heart on asylum seekers, says refugee from Congo based in South Korea: South Korea-based academic from Congo calls for better screening system",,21 Aug 2016
91,No more puppy mills: Tighter animal welfare laws will clamp down on unscrupulous breeders: Inhumane dog breeding hoped to be curbed by licencesand inspections,,21 Aug 2016
92,A show of all sports,,21 Aug 2016
93,Government must intervene if developers threaten wildlife sanctuaries,,21 Aug 2016
94,More steps must be taken to conserve fish stocks and prevent disputes,,21 Aug 2016
95,"GDP, wealth and the big bad wolf just round the corner",,21 Aug 2016
96,'Blood brothers',,21 Aug 2016
97,"rough subbed by sam: Despite decade-old anti-discrimination rules, sufferers say doctors still fear treating them",,21 Aug 2016
98,Scientists study feasibility of manned lunar radar station,,21 Aug 2016
99,"Thought for food: online grocery founder Matilda Ho wants to raise understanding of what we eat, not just deliver it: Online farmers' market Yimishiji aims to support growers committed to organic growing. MATILDA HO, the company's founder and an ex-consultant, tells MANDY ZUO about delivery headaches, sourcing avocados and her new food-service incubator",,21 Aug 2016
100,"'We're heartbroken for China', says victorious USA 4x100m relay team after golden run: The Americans defend their 4x100m women's relay title, but only after being handed a reprieve",,21 Aug 2016
101,Commissioner asks for support despite Rio flop,,21 Aug 2016
102,No gold again: Heartbreak for Lee Chong Wei as he loses to Chen Long in badminton singles final: Malaysian superstar ends his final bid for glory at the Summer Games on another losing note as world number two pulls off surprise win in final,,21 Aug 2016
103,Olympic digest,,21 Aug 2016
104,China's Liu secures nail-biting 20km race walk win,,21 Aug 2016
105,xx,,21 Aug 2016
106,Agony for China as Yin Junhua loses out on boxing gold on 'preferred winner' ruling: Lightweight fighter is defeated by France's Estelle Mossely by the 'preferred winner' rule,,21 Aug 2016
107,"Japan catching up quickly with China, says ITTF chief",,21 Aug 2016
108,Hong Kong's circuit breaker takes the risk out of the market - but without risk there is no market: Circuit breaker removes the charm and appeal for ordinary investors,,23 Aug 2016
109,"Markets calm as Hong Kong stocks circuit breaker launches: Little chance of liquidity upsets or market chaos as HK system has adequate triggers, say analysts",,23 Aug 2016
110,"Maryknoll Convent School students discover World Youth Day is a Catholic experience that goes beyond prayers and mass: World Youth Day took place in Poland last month, and some Hong Kong students were surprised by what the event taught them, writes YP cadet Pauline Wong",,23 Aug 2016
111,"Vanke holds its ground, reiterates management's preference for Shenzhen Metro as its white knight: Railway operator's land bank around subway network can help Vanke to tap projects with high traffic flow for growth, say company officials",,23 Aug 2016
112,WH Group sees China's pork prices falling over next 15 months after hitting record high in May,,23 Aug 2016
113,Chart of the day: China outflows gain pace,,23 Aug 2016
114,"Chinese lingerie makers urged to innovate to survive: Domestic companies need to be more innovative in product design and branding to combat competition from foreign brands, offset sluggish sales",,23 Aug 2016
115,Delisting candidate Xintai sees shares soar on last trading day,,23 Aug 2016
116,First day photo contest!,,23 Aug 2016
117,"Flash Wolves get a bite of the cherry: Taiwanese team secure their spot at World Championships in the US but they still have a long way to go, analyst says",,23 Aug 2016
118,Legco candidate Chan Chak-to promotes Hong Kong independence on air,,23 Aug 2016
119,"Mainland exchanges can learn lessons from HK's smooth circuit breaker launch: To avoid repeat of January's fiasco, the mainland may try what HK has done - listen to the market",,23 Aug 2016
120,Prince's pills wrongly labelled,,23 Aug 2016
121,"Baidu of China sues rivals Tencent, Sohu over articles on food delivery service",,23 Aug 2016
122,Hong Kong's Towngas posts better than expected HK$4.33 billion interim profit,,23 Aug 2016
123,Sinopec Engineering says it can meet 2016 profit target even as first-half income falls: Firm pins hopes on success in bidding for large projects in Saudi and China,,23 Aug 2016
124,"Veteran Hong Kong broker and lawmaker calls for suspension of listing reform proposals: Duplication of listing processes will damage HK's financial centre reputation, broker says",,23 Aug 2016
125,"Bright and breezy: After a rainy week, sunny days are here again. And with the start of a new school year just around the corner, this is a good time to try the latest craze, colouring in for adults. We've brought you your very own difficult, charming, absorbing and stress-relieving picture. So grab your coloured pencils and free your mind.",,23 Aug 2016
126,Back to school: Hong Kong amateur Tiffany Chan Tsz-ching sets sights on LPGA Tour card after Olympic Games adventure: The 22-year-old Hong Kong amateur will start bid in California to qualify for an LPGA tour card,,23 Aug 2016
127,Citrus fruits may help in battle against lifestyle diseases,,23 Aug 2016
128,Evolution may play large role in why some cancers are more common than others,,23 Aug 2016
129,"Meet Hong Kong's intrepid, upwardly mobile 'Everesters': Climbing the equivalent of Mount Everest's 8,848 metres on a bike seems an impossible challenge, but 1,200 people around the world have succeeded, writes Rachel Jacqueline",,23 Aug 2016
130,Could this edible food packaging be the answer to Hong Kong's plastic waste problems?,,23 Aug 2016
131,Hongkongers hit Sun Yat Sen Memorial Park for free regular early-morning workout: Three expats have formed a fitness pop-up that holds a free morning boot camp each week at Sun Yat Sen Memorial Park. Jeanette Wang signed up,,23 Aug 2016
132,Cut up at claims,,23 Aug 2016
133,"Fire services unions make poll appeal to members: Call to vote for candidates who support their work does not affect political neutrality, they maintain",,23 Aug 2016
134,Fried chicken ruling limits freedom of expression: TVB: Broadcaster seeks a judicial review after falling foul of rules on programme sponsorship,,23 Aug 2016
135,"Hong Kong election pollsters in U-turn on methodology after complaints by parties: After outcry by parties, respondents will now be told who is running second on each list",,23 Aug 2016
136,Does marriage make you an owner of the family home?,,23 Aug 2016
137,Hong Kong truck driver fined for beating his son badly over his poor school performance,,23 Aug 2016
138,Hong Kong water department employee accused of fraud now working under ICAC prosecution witness: Waterworks inspector accused of rigging contracts has not been suspended from duty,,23 Aug 2016
139,Mainland tour guide who led group to use bogus Hong Kong visas jailed: Four elderly women were issued with bogus travel documents in order to qualify for group discount,,23 Aug 2016
140,Orchestra marks 40 years of high notes for so many: Welcoming Pan Asia Symphony has provided the perfect platform for those seeking a life in music,,23 Aug 2016
141,Two elderly men critical as 60 flee Hong Kong block of flats after fire in garbage collection room,,23 Aug 2016
142,ACCOUNTANTS22: But poll by watchdog also indicates tougher time for job seekers as fewer firms plan to hire,,23 Aug 2016
143,Junior Hong Kong nurses set for supervision in performing risky procedures in bid to reduce hospital blunders: Hospital Authority mentor training scheme will focus on high-risk procedures and is aimed at reducing the number of medical blunders,,23 Aug 2016
144,Lawyers for Hong Kong radical fighting obstruction charge rest hopes on freedom of expression: Radicals accused of obstruction in storming school debating competition,,23 Aug 2016
145,Wrongly detained environmentalists hit back at Hong Kong police over 'arbitrary' arrest,,23 Aug 2016
146,"Foreign ministers of China, Japan and South Korea to meet in Tokyo on Tuesday despite Wang Yi's delay",,23 Aug 2016
147,"Special police units to prevent trouble when Hongkongers vote: Additional 2,000 officers from special response teams to tackle any disturbances, after lessons learned from Occupy protests and Mong Kok riot",,23 Aug 2016
148,Pictures that tell of a woman's true bravery,,23 Aug 2016
149,China tightens grip over social groups through greater Communist Party presence,,23 Aug 2016
150,"Pro-independence localist groups on the rise in schools: At least 21 organisations have been established, and some do not rule out the use of violence",,23 Aug 2016
151,"Rio Olympic Games end on a high note Olympics end on a high note: Triumphs, tears cap the sporting extravaganza, but nothing for Hong Kong",,23 Aug 2016
152,Seafood 'smuggled from Fukushima',,23 Aug 2016
153,"Tickets sold out after Hongkongers queue overnight for chance to meet mainland Chinese Olympic medallists: Despite concern that visit by Chinese gold medallists could backfire due to growing independence sentiment, fans remain eager to meet their idols",,23 Aug 2016
154,"Tunnel vision: Confusion surrounds attempts to sort out the Hong Kong cross-harbour toll mess: Hongkongers were expecting action on prices when the government took over the Eastern Harbour Tunnel, but instead it ordered another study",,23 Aug 2016
155,All that glitters is not just Olympic gold,,23 Aug 2016
156,Let the harrowing images of Syria's children be a force to end the fighting,,23 Aug 2016
157,"Eight years on from Beijing 2008, an Olympic summer of love has turned sour in Hong Kong: Gary Cheung says given the growing ranks of Hong Kong youth disillusioned with China, banning independence talk in schools can only fan the antipathy",,23 Aug 2016
158,"To become a global leader, China must first be ready to do some heavy lifting: Zhou Xin says for the G20 summit to succeed, aspiring global leader China must learn to behave like one",,23 Aug 2016
159,From Rio to Tokyo,,23 Aug 2016
160,"As Suu Kyi heads home, solving dam deadlock remains key to improving ties between China and Myanmar: Stalled Myitsone project stands in the way of restored bilateral relations, despite some signs of progress during visit by Myanmese leader Suu Kyi",,23 Aug 2016
161,China vows again to cut business costs: State Council lists policy priorities for the country's bureaucracy as growth in the world's second-biggest economy continues to sputter,,23 Aug 2016
162,Hot enough to fry an egg: China issues severe weather alerts as large areas of country swelter in heatwave,,23 Aug 2016
163,"Prisoner organ claims 'ridiculous': China must introduce law banning harvesting from executed convicts, critic says",,23 Aug 2016
164,Chinese sprinter Su sets his sights on challenging Japan after seeing rivals smash Asian record,,23 Aug 2016
165,Hong Kong's Chan Chun-hing brings down the curtain on his career with best Olympic finish in Rio: The 35-year-old biker finishes 32nd in strong field as the last Hong Kong athlete to compete in Rio,,23 Aug 2016
166,China Telecom on expansion drive after first-half earnings top market estimates: Operator seeks to improve efficiency after net income beats forecasts,,24 Aug 2016
167,Henderson Land reports 12.1pc fall in core earnings as Hong Kong property sales tumble: Uncertain outlook in global markets leads to fall in HK property sales in first six months,,24 Aug 2016
168,Higher sales after gas price-cut boost ENN Energy's interim profit,,24 Aug 2016
169,"Hong Kong students head down under to take to the skies: Hong Kong students got to experience the thrill of flying first-hand, when they visited Cathay Pacific's pilot training programme in Australia. Lauren James tagged along to see their dreams soar",,24 Aug 2016
170,Let' s go Pokemon hunting!,,24 Aug 2016
171,Outlet malls booming in China as department stores feel the pinch: Rapid growth of designer outlets is in sharp contrast to the struggles of department stores,,24 Aug 2016
172,"SHKP's low price strategy boosts interest in Grand Yoho project: Developer cuts prices, offers interest-free loans to buyers amid recovery in HK property prices",,24 Aug 2016
173,Wang On looks to buck the retail gloom with Ginza-style projects,,24 Aug 2016
174,"Gold price rally still to peak, as global economic worries continue: Uncertainties in the global economy and interest rate direction are likely to support the price of the yellow metal after a 26pc jump in the first half",,24 Aug 2016
