,title,byline,dates
676,'We want to be a Hong Kong club': China's Guangzhou R&F hope to win over local fans: The Guangzhou outfit want to put down roots here and win over the fans as they look forward to their debut in the local Premier League,,05 Sep 2016
677,"Hong Kong customs officers detect rising trend of gold and silver bars being smuggled from mainland China: Investigators suspect trend linked to desire by those on the mainland to cash in as prices rise and trading, tax restrictions make life difficult",,05 Sep 2016
678,Innocent put their faith in legal battler,,05 Sep 2016
679,Macau protesters want Uber legalised: Demand comes as ride-hailing company prepares to leave city this week,,05 Sep 2016
680,pop-up border mall misses its latest deadline: Project that aimed to capitalise on huge visitor numbers from across the border in 2013 has been held up by government rules and a wet summer,,05 Sep 2016
681,German carmakers look to muscle in on Tesla's dominance of Hong Kong's burgeoning electric market: Diplomat says the government has to 'set the right framework' for the industry as dominance of US Tesla Motors faces European challenge,,05 Sep 2016
682,Hong Kong businesses have cashed in on Pokemon Go and are still optimistic despite waning excitement for game,,05 Sep 2016
683,Hong Kong elections and Hangzhou summit could reveal clues about Beijing's attitude towards city: Potential CE candidate John Tsang may seek talks with mainland officials at G20 summit,,05 Sep 2016
684,Relatives of deceased Hong Kong victims in Egypt hot-air balloon crash seek over HK$10.6m from travel agency: Travel agency Kuoni sued for negligence over Egypt flight that killed nine from city,,05 Sep 2016
685,INSIDE,,05 Sep 2016
686,record turnout for bitterly fought poll: Long queues form at polling stations as about two million Hongkongers vote in most critical Legislative Council election since the 1997 handover,,05 Sep 2016
687,Xi tries to rally G20 leaders around world growth cause: Geopolitical problems are pushed to the sidelines as Chinese president focuses on global economy,,05 Sep 2016
688,Climate deal agreement should be model for Sino-US ties,,05 Sep 2016
689,Fire breaks out at Yau Ma Tei Wholesale Fruit Market in Hong Kong: About 40 people evacuated as third-alarm blaze destroys at least 10 stalls,,05 Sep 2016
690,"G20 'staircase snub' for Obama was United States' decision, reveals Chinese officialsdsdasdasdasdasdasdasdasdasdasdasdagr: Chinese official says trouble on the tarmac over presidential treatment in Hangzhou came after US officials opted for little-used plane exit",,05 Sep 2016
691,"Law shake-up yet to lower fees, three years on: Allowing solicitors to address higher courts was meant to widen the market, but so far only 40 have qualified, with 82pc failing the assessment",,05 Sep 2016
692,"'Strategic' voting has pan-dems on brink: Benny Tai's controversial scheme, which listed recommended candidates based on pre-polling, blamed for putting several veterans at risk",,05 Sep 2016
693,First-time voters show a mixed bag of views,,05 Sep 2016
694,Localist candidates look to shake up political landscape,,05 Sep 2016
695,"Fairytale ending? Romance novelist and Democrat Roy Kwong may grab last 'super seat' in Hong Kong elections: Democrat Roy Kwong is tipped to win final 'super seat', endangering chances of DAB's Holden Chow and maybe colleague James To",,05 Sep 2016
696,fury over irregularities,,05 Sep 2016
697,raising their voices,,05 Sep 2016
698,Stars and patients come out for favourites on a noisy day full of colour,,05 Sep 2016
699,China holds three high cards in hand to gain bigger say in global economy at G20 summit: China is betting that it has a strong hand to rebalance the global economic and financial agenda,,05 Sep 2016
700,A crumbling BRICS bloc? China tries to hold club together to champion developing nations: President says group of top developing nations must push for greater role in global governance,,05 Sep 2016
701,Little real progress seen in Xi's talk with Obama: Putting spotlight on climate change deal 'glossed over' serious tensions,,05 Sep 2016
702,China's President Xi Jinping and Russian President Putin call for firm mutual support,,05 Sep 2016
703,EU pressures China to rectify its steel overcapacity: European Commission says Beijing hasn't matched its words with actions to address overcapacity,,05 Sep 2016
704,Japan may not get things all its own way in Africa push,,05 Sep 2016
705,Signs of tolerance of refugees is a chance for the government to reform the asylum system,,05 Sep 2016
706,Hong Kong goes to the p o l ls,,05 Sep 2016
707,"Classical Chinese design, with a few modern comforts",,05 Sep 2016
708,Little things matter for world leaders at China's G20 summit ... such as where they stand for photographs,,05 Sep 2016
709,The right-hand men: some of the key people at President Xi Jinping's side during major events,,05 Sep 2016
710,China's retail stock investors increase buying of Hong Kong-listed shares,,06 Sep 2016
711,"Crosstec shares oversubscribed 1,000 times as Hong Kong's IPO punters chase 'easy money': City-based interior designer becomes second-highest overbought public offering this year after shares are oversubscribed more than 1,000 times",,06 Sep 2016
712,Hong Kong stock exchange doing just fine without following stagnant Singapore or cowboy markets of New York: Do not let HKEX sell our best protection chasing Singapore or New York,,06 Sep 2016
713,"Hong Kong, mainland stocks edge up on better economic data, easing US rate hike fears: Mainland stocks extend gains after improvement in China's manufacturing, services sectors",,06 Sep 2016
714,China's economy falls into 'confidence trap' as corporates shun long term investment: Corporates park funds in short-term deposits and stay away from long-term investments,,06 Sep 2016
715,"Hong Kong bourse walks a fine line on new market for start-ups despite huge risks: New board should be for professional, rather than retail investors due to high failure risks",,06 Sep 2016
716,"Hong Kong edges out Tokyo as world's fourth largest forex hub: While the city bypasses Tokyo to take the No 4 spot in forex turnover, most of the trade involves investors switching yuan into stronger currencies",,06 Sep 2016
717,AAG Energy cuts gas output target on poor weather and equipment failure,,06 Sep 2016
718,Brokers signal caution as HSBC shares scale new heights in Hong Kong: Stock surges to highest level this year as lender continues repurchases,,06 Sep 2016
719,facing the test of time: HK fair showcases brands seeking greater exposure in the region,,06 Sep 2016
720,"Majority of small brokers in Hong Kong not interested in joining Shenzhen stock connect: High upgrade costs, limited demand from local investors for A shares contributory factors for lukewarm response from small brokers in city",,06 Sep 2016
721,Sands China comes up short on tables at The Parisian as Macau seeks to diversify away from gaming,,06 Sep 2016
722,Watching out for the public,,06 Sep 2016
723,"Deloitte China eyes more business from One Belt, One Road, Going Global strategies: China's regional and global trade initiatives will grow demand for financial services as auditor moves away from its traditional businesses",,06 Sep 2016
724,Hong Kong's HKT expands mobile payment service as part of fintech push,,06 Sep 2016
725,"Ride hailing giant Didi Chuxing raises prices in China's biggest cities: Didi Chuxing confirms trip increases in some cities, adding strategy adjustments will continue",,06 Sep 2016
726,"New hopes for immunotherapies to cure, not just treat, cancer: Doctors see immunotherapy as the greatest hope in the battle against cancer after recent successes in clinical trials, writes Jeanette Wang",,06 Sep 2016
727,"Zika virus will disappear in three to five years then return, say immunology experts",,06 Sep 2016
728,Can eating chicken tails cause cancer or any other diseases?,,06 Sep 2016
729,"Hongkongers have a novel way to relax: strip off, close the door, turn off the lights and float away: Enter a flotation tank and you can separate your mind from your senses in complete safety and come out deeplyrelaxed and with silky smooth skin. Kate Whitehead strips off, closes the door, hits the lights and floats away",,06 Sep 2016
730,Court date,,06 Sep 2016
731,HKU leads local universities once again,,06 Sep 2016
732,Stranded vessel auctioned to pay debts: Casino ship goes for US$1.46m leaving spokesman for ex-owner unhappy,,06 Sep 2016
733,Wrong bet on oil prices leads to HK$109 surcharge for Cathay and Dragonair passengers flying into Hong Kong: Fee will apply to Cathay Pacific and Dragonair passengers flying into Hong Kong after profits slump and hedging loss of HK$4.49 billion,,06 Sep 2016
734,Father accused of gas murder bid 'a danger to himself',,06 Sep 2016
735,Key Hong Kong economic index for August shows worst of downturn may be over: Analysts optimistic after Nikkei index shows signs of Hong Kong business conditions stabilising amid promising housing and retail sales figures,,06 Sep 2016
736,More expensive fruits for Mid-Autumn Festival: wholesalers warn fire at Yau Ma Tei market may jack up prices: Festival revellers face having to pay more in wake of heavy losses at Yau Ma Tei market,,06 Sep 2016
737,Paralysed woman set on fire by cheating husband begs Hong Kong court to show him mercy: Paralysed wife tells court she has forgivenlove cheat who found life to be meaningless,,06 Sep 2016
738,Time for action not words on agony of human trafficking,,06 Sep 2016
739,more inside,,06 Sep 2016
740,"voters change political landscape: Hongkongers choose a new breed of localists and younger faces for the Legislative Council, taking politics and governance of the city into uncharted waters",,06 Sep 2016
741,Xi Jinping closes G20 with pledge to include emerging markets: Members also vow to look beyond monetary policy to spur global growth,,06 Sep 2016
742,'King of Votes' scrapes home after scare: Democrat James To beats Beijing loyalist to win fifth 'super seat' after party's tactics almost cost him,,06 Sep 2016
743,Results set to bring headaches for Beijing: Localists emboldened by wins in no mood to compromise with government,,06 Sep 2016
744,"Discord ahead as council's splits set to only widen: Legco's new complexion, with a broader mix of ideologies and a spike in independents and one-seat parties, will challenge government",,06 Sep 2016
745,"Hong Kong pan-democrats boost functional constituency tally, taking 11 including three from 'super seats'",,06 Sep 2016
746,Legco losses for veteran pan-democrats signal end of era,,06 Sep 2016
747,Time for a break: Legco radical Wong Yuk-man to focus on radio station after losing to localist: Wong Yuk-man says 'too many enemies' and 'not enough effort' led to him losing seat,,06 Sep 2016
748,'It's a miracle': ex-student leader Nathan celebrates new status as Hong Kong's youngest ever lawmaker,,06 Sep 2016
749,"He's the king of votes, but Eddie Chu warns of 'storm of political violence' after landslide Legco election win",,06 Sep 2016
750,Localist challenge: role of Hong Kong Indigenous remains unanswered after double Youngspiration election victory,,06 Sep 2016
751,Peaceful localists triumph over militants: The big winners among two dozen localist candidates call for 'democratic self-determination',,06 Sep 2016
752,"'Old faces' may run into trouble, analysts warn: DAB leader defends the pro-establishment camp's conservative tactics, but academics question this safe approach as young politicians enter the scene",,06 Sep 2016
753,The battle for Hong Kong Island: Ricky Wong blames his supporters for Legco election snub: Ricky Wong says loss in Legco polls doesn't mean anti-CY Leung drive was unpopular,,06 Sep 2016
754,From controversial security minister to 'queen of votes': Regina Ip locks down Legco position: Former security chief remains tight-lipped on whether she will join 2017 leadership race,,06 Sep 2016
755,"China and Japan should 'put aside disruptions', Xi tells AbeX: Long-awaited meeting at summit should cool Sino-Japanese tensions in the short term, analysts say",,06 Sep 2016
756,The Takeaway,,06 Sep 2016
757,US president steers clear of South China Sea,,06 Sep 2016
758,Xi Jinping warns South Korea to handle missile shield row properly or risk worsening regional tensions,,06 Sep 2016
759,Political points at home from wins on world stage: President Xi uses major gathering of global leaders to strengthen his domestic position ahead of next year's crucial Communist Party congress,,06 Sep 2016
760,"Relations with China still golden, says May: British PM sidesteps Hinkley issue but says free trade is vital for post-Brexit Britain",,06 Sep 2016
761,Why China's so keen on defending multilateral trade at G20 summit,,06 Sep 2016
762,"World leaders Wouldn't keep eyes on the ball: Beijing wanted the summit focus to be on global economic renewal, but despite its best efforts it saw thorny bilateral matters take precedence",,06 Sep 2016
763,Poll marks start of a new era in Hong Kong's political life,,06 Sep 2016
764,"A long night ... and a big day for Hong Kong's political novices: Gary Cheung says in politically polarised Hong Kong, veterans with a good track record of service were no match for fresh-faced candidates in the Legco election, reflecting the failure of Beijing's hardline approach",,06 Sep 2016
765,"Cartoons, games and technology: G20 host Hangzhou draws on creativity to promote itself as 'city of innovation'",,06 Sep 2016
766,Chinese director Zhang Yimou's G20 concert serenades world leaders with 'global language' of music,,06 Sep 2016
767,Silence of the fans: China's G20 censorship blocks social media praise of first lady Peng Liyuan's stunning banquet dress,,06 Sep 2016
768,Opening day throws up Brilliant horses to follow,,06 Sep 2016
769,"rely on leading man bogart for stellar start at valley: Moore-trained galloper impressed towards the back end of last season,and he looks set to rise even further through the grades this time around",,06 Sep 2016
770,TRACK STARS,,06 Sep 2016
771,What a feeling,,06 Sep 2016
772,Corporate investment flooding into China's sports sector: Kaisa creates 10 billion yuan fund amid government support for sector,,08 Sep 2016
773,"Volkswagen plans to use Jianghuai electric car plan to forge its third venture in China: Possible venture, which challenges partnership limits, will conduct R&D, manufacture, market and sell vehicles and components in mainland",,08 Sep 2016
774,"Fitch warns of over-reliance on wealth management products by smaller Chinese banks: Rating agency warns mid-tier lenders too reliant on wealth management products, placing them under increasing credit and liquidity pressure",,08 Sep 2016
775,HK stocks halt 4-day bull run as Tencent falls back from record highs: Trading remains positive as investors bank on Fed delay in raising US interest rates,,08 Sep 2016
776,Online Video grow fast,,08 Sep 2016
777,"Tingyi sees uncertain recovery after disappointing first half, analysts say: Drop in sales of noodle and beverage producer points to uncertainty in industry, analysts say",,08 Sep 2016
778,China Vanke buys office building in London for Pounds 115 million: Mainland's largest homebuilder shrugs off control battle for a while to pick up Mayfair office building for Pounds 115 million as it continues diversifying,,08 Sep 2016
779,"Henderson Land to unveil tiny flats in North Point amid Hong Kong's hot property market: Henderson releases price list, with smallest 163 sq ft unit costing HK$3.9m",,08 Sep 2016
780,Maker of Po Chai Pills kicks off HK$750 million IPO to fund expansion plans in Asia,,08 Sep 2016
781,Singyes Solar shifts focus from north to south of the country: Company cites grid bottlenecks and delays in subsidy payments as reasons for decision,,08 Sep 2016
782,"Time for Chinese companies to rethink their debt book, says JP Morgan: Study finds mainland indutrial and materials companies take on too much short-term debt",,08 Sep 2016
783,ZTE first to complete all key technology tests for China's national 5G network,,08 Sep 2016
784,"ZTE's Nubia aims to become top five smartphone brand globally: Nubia products are still largely unknown outside China, but the company plans to become the No 5 global smartphone brand within three years",,08 Sep 2016
785,Second round winners,,08 Sep 2016
786,"Film review: Happiness - Kara Wai, Carlos Chan bond in one of best Hong Kong films of 2016",,08 Sep 2016
787,"How At Cafe 6's director Neal Wu turned teenage heartbreak into a successful career: Neal Wu turned teenage heartbreak into a career as one of Taiwan's most successful youth romance writers. Now he's directedhis first feature film, writes Edmund Lee",,08 Sep 2016
788,Top 5 films to watch in Hong Kong this week: September 8-14,,08 Sep 2016
789,Hong Kong artist Meilo So illustrates a special book - written by her mum,,08 Sep 2016
790,"what a marvel as Fownes gets speedy treble: Leading trainer determined to regain his Valley King title, but the night didn't go so well for ace jockey Moreira, hit with a HK$60,000 fine",,08 Sep 2016
791,"48 hours in Chungking Mansions: living in another world: In the first of a two-part series, Kylie Knott chronicles 48 hours in the life of Chungking Mansions - a city within a city",,08 Sep 2016
792,Hong Kong eye Scotland ODIs after winning T20 series against Ireland: Nizakat Khan aims for another century to add to outstanding effort in Ireland matches,,08 Sep 2016
793,"xx: Magic Man will ride Group One favourite in Sydney, seeking to boost record Down Under",,08 Sep 2016
794,All in the blend,,08 Sep 2016
795,"Better to have loved and lost? Court rejects billionaire Eric Hotung's bid to recoup 55-year-old debt from ex-lover: Judge finds evidence unacceptable in dispute involving HK$2 million that Eric Hotung gave lover Winnie Ho, which was invested in casino business",,08 Sep 2016
796,"Collapsed building at 150-year-old former Central Police Station will 'inevitably' lose heritage value with restoration project, Jockey Club says: None of the recovery options for collapsed building at old Central Police Station is perfect, experts say",,08 Sep 2016
797,'I could have done better': Hong Kong's former chief executive Donald Tsang Yam-kuen reflects on his housing policies: Ex-chief executive Donald Tsang concedes that he should have developed more land to boost housing supply during his seven years in office,,08 Sep 2016
798,Lukewarm welcome: Hong Kong alum returns to secondary school to promote localism but sent off campus: Advocates of Hong Kong independence ordered not to bother pupils,,08 Sep 2016
799,Voter forms forged in bid for residency,,08 Sep 2016
800,Charging ahead,,08 Sep 2016
801,Cheers: Hong Kong researchers work to recycle blended textiles in process akin to making beer: Scientists use a process akin to making beer to overcome problem of dumping old garments,,08 Sep 2016
802,Hong Kong digital station DBC set to end broadcasting new programmes at midnight on Thursday,,08 Sep 2016
803,Pilot subsidy scheme to be expanded to 18 districts: More elderly citizens will receive funding for vital community care services from October,,08 Sep 2016
804,Spreading the love of lobster: Expo traders say Asia wants more crustaceans: Expanding middle-class has growing appetite for the premium crustacean,,08 Sep 2016
805,Veteran politician promises CY Leung 'an eye for an eye': Wong Yuk-man says Leung still prosecuted him over throwing glass despite being advised against it,,08 Sep 2016
806,China and Asean bloc make progress on maritime disputes: China and leaders from the Southeast Asian bloc are working 'substantively' towards early adoption of code of conduct for South China Sea,,08 Sep 2016
807,Costly lessons for parents as kindergartens raise fees,,08 Sep 2016
808,Salute Eddie Chu on his quest to rid New Territories of corruption,,08 Sep 2016
809,"Bourse must raise its game, banker says",,08 Sep 2016
810,"Chinese village chief at centre of land grab protests to stand trial this week on corruption charges: Lin Zuluan faces charges of graft, prompting Wukan residents to say they will rally twice daily",,08 Sep 2016
811,traffic in central to slow as Formula E hits full throttle: Buses to be diverted and roads blocked for city's first electric race but organiser says disruption worth it,,08 Sep 2016
812,'King of votes' seeks democracy from bottom up Chu seeks democracy from bottom up: Eddie Chu Hoi-dick also plans to continue taking on the powerful Heung Yee Kuk as a lawmaker,,08 Sep 2016
813,Hong Kong pro-establishment lawmakers divided over how to deal with radicals: Some pro-establishment newcomers want rule changes to curb filibustering; others think this will be futile because any move can be blocked,,08 Sep 2016
814,ADPL sees exodus,,08 Sep 2016
815,"Beijing trio threatened me, Chow says",,08 Sep 2016
816,Hong Kong Occupy co-founder concedes deficiencies in 'ThunderGo' strategic voting scheme,,08 Sep 2016
817,Fixing Brazil's problems must take priority over politics,,08 Sep 2016
818,Nations and leaders must remember the importance of diplomatic behaviour,,08 Sep 2016
819,"Beijing looks to Laos as mediator: As Premier Li Keqiang visits the Southeast Asian country, he's expected to consolidate its role as China's backer, including over the South China Sea",,08 Sep 2016
820,Li Keqiang calls on Singapore to help forge ties between China and Asean members,,08 Sep 2016
821,China's serial killer left ample evidence in rape-murder spree but escaped capture for decadesS,,08 Sep 2016
822,Forex reserves tumble US$15.89b,,08 Sep 2016
823,"Humid southern China, a hotbed for mosquitoes, steps up Zika checks as Singapore reports 30 Chinese nationals with virus: China advises citizens to watch for symptoms of the Zika virus while travelling in the city state, where the number of cases has reached 275",,08 Sep 2016
824,Not simply black and white: disagreement on status of China's iconic panda after they're taken off 'endangered' list: Forestry authorities disagree with change from 'endangered' to 'vulnerable',,08 Sep 2016
825,Under starter's orders,,08 Sep 2016
826,Hang Seng Bank opens Qianhai venture to sell mutual funds to 1.3 billion people: Bank venture with city financial arm eyes launch in six months and aims to sell products across the mainland from its special economic zone base,,09 Sep 2016
827,Hong Kong developer SHKP has no overseas expansion plans after reaching record HK$40 billion in contract sales: HK's largest property developer has no plans to expand abroad after growth in full-year profit,,09 Sep 2016
828,PBOC intervention signs intensify as yuan's borrowing costs soarYuan,,09 Sep 2016
829,"China data, casino rally propel Hong Kong stocks to fresh one-year high: Renewed optimism on China's economic growth prospects lifts sentiment, fuels buying interest",,09 Sep 2016
830,Rally far from over for Hong Kong's newest blue chip AAC Technologies: iPhone component supplier sees further uptick after Apple unveils new products,,09 Sep 2016
831,"Young, wealthy Chinese choose entertainment, travel and health ahead of shopping: Entertainment, travel, e-commerce and healthy living are new favouritesas changing lifestyle habits make deep inroads into consumer spending",,09 Sep 2016
832,"Chinese insurers receive approval to trade Hong Kong shares through Shanghai stock link: Regulator permits insurers to make equity purchases in city through the Shanghai trading link under the ""prudential and safe"" principle",,09 Sep 2016
833,"Hong Kong developer Henderson Land launches more tiny flats, this time in Kowloon: Seven Victory Avenue in Ho Man Tin will feature 250 flats between 161 and 390 sq ft in size",,09 Sep 2016
834,The Asian suppliers behind some of the iPhone 7's key components: Taiwan-based Foxconn and two Shenzhen companies among those likely to benefit,,09 Sep 2016
835,"China's housing market to remain robust in 2017, says Citigroup: Liquidity levels will not be tightened to curb price increases amid concerns that sector may bottom out early next year, say top industry analysts",,09 Sep 2016
836,China's cross-border e-commerce trade facing uncertainties amid government regulation,,09 Sep 2016
837,China-made ball-sized camera to give video streamers the make-over they have been pouting for,,09 Sep 2016
838,"UK Fintech Awards select trading simulator, artwork registry as competition winners: Security card maker Hengbao also feted in competition to promote financial innovation",,09 Sep 2016
839,Joyous streak,,09 Sep 2016
840,"Magic man moreira to make mark after sluggish start: Champion Brazilian rider has only ridden two wins from the first 18 races, well below his usual strike rate of 25 per cent, but he can atone on Sunday",,09 Sep 2016
841,TRACK STARS,,09 Sep 2016
842,Witness one to follow on dreary return to Valley,,09 Sep 2016
843,"5 places to enjoy Hong Kong's best coconut-based hot pots and other coconut dishes: Many of the city's restaurants are celebrating the coconut's elevationto a superfood by incorporating ita number of dishes - including hotpots, writes Elaine Yau",,09 Sep 2016
844,"Favourite Hong Kong restaurants of Fabrizio Napolitano, NOM head chef",,09 Sep 2016
845,"Hong Kong menu specials: caviar, sake pairing, Italian wines, and a London chef's pop-up",,09 Sep 2016
846,Newly opened Eiffel Bistro in Taikoo Shing - a tour de force with some French classics,,09 Sep 2016
847,Restaurant review: 8 Pots in Tsim Sha Tsui - pungent Taiwanese-style hot pots,,09 Sep 2016
848,"Restaurant review: Sake Beya Masu, Wan Chai - generous pours of sake complement delicious fish",,09 Sep 2016
849,High hopes: Hong Kong target gold medal haul at Paralympic Games: Squad seeks to improve on the three victories at the 2012 London Games,,09 Sep 2016
