,title,byline,dates
0,Airline approval needed for banned items,Anonymous.,03 Sep 2010
1,City,Anonymous.,03 Sep 2010
2,CLP in talks on saving art deco HQ Utility explores alternatives to demolition for tower already approved,"Ng, Joyce.",03 Sep 2010
3,Courts,Anonymous.,03 Sep 2010
4,Courts: [1],Anonymous.,03 Sep 2010
5,Courts: [2],Anonymous.,03 Sep 2010
6,"EU report raps China over drop in fairness, openness Almost 40pc expect the situation to get worse","Tsang, Denise.",03 Sep 2010
7,examiners,Anonymous.,03 Sep 2010
8,HK$42m triplex offers tranquility,Anonymous.,03 Sep 2010
9,HK-flagged ship to blaze Arctic route HK-flagged ship to blaze Arctic route to China,"Wallis, Keith.",03 Sep 2010
10,Horse Racing,Anonymous.,03 Sep 2010
11,In or out?,Anonymous.,03 Sep 2010
12,Investment,Anonymous.,03 Sep 2010
13,Manila raps HK police over bullets in luggage Pair lacked permit to fly out with hostage evidence,Raissa Robles in Manilaand Martin Wong.,03 Sep 2010
14,National,Anonymous.,03 Sep 2010
15,NEWS SECTION A; scmp.com today; CITY.LIFE.SPORT SECTION C; BUSINESS SECTION B,Anonymous.,03 Sep 2010
16,Property deals in HK climb to 31-month high,"Sito, Peggy.",03 Sep 2010
17,Regulator plans rescue of rural credit co-ops,Daniel Ren in Shanghai.,03 Sep 2010
18,Research key to buying beautiful pieces of art,Anonymous.,03 Sep 2010
19,Restorers achieve a Mid-Levels Renaissance,Anonymous.,03 Sep 2010
20,Soderbergh to shoot scenes for Sars film in city,"Chow, Vivienne.",03 Sep 2010
21,"US carrier in Yellow Sea soon, S Korean envoys sayUS carrier 'in Yellow Sea soon'",Cary Huang in Beijing.,03 Sep 2010
22,winners,Anonymous.,03 Sep 2010
23,Agency pays tribute to tour guide,"Leung, Paggie.",03 Sep 2010
24,Announcements,Anonymous.,03 Sep 2010
25,Assessing Quality,Anonymous.,03 Sep 2010
26,"Call for a change to emergency protocol Clear diplomatic hurdles in crises, lawmakers say",Tanna Chong.,03 Sep 2010
27,Citic 1616 taps into mainland VPN market,"Yu, Sophie.",03 Sep 2010
28,Corrections & clarifications: [1],Anonymous.,03 Sep 2010
29,Corrections & clarifications,Anonymous.,03 Sep 2010
30,"Don't sit on my elephant, says would-be pro wrestler turned designer",Anonymous.,03 Sep 2010
31,Employee bit hand that feeds,"Ng, Maggie.",03 Sep 2010
32,Events,Anonymous.,03 Sep 2010
33,Five hurt on pedestrian crossing,"Lo, Clifford.",03 Sep 2010
34,Good thing their clones can take the heat of co-stars' hot embrace,Anonymous.,03 Sep 2010
35,In Brief,Anonymous.,03 Sep 2010
36,Inspiring young movie-goers top priority for new film festival chief,"Chow, Vivienne.",03 Sep 2010
37,IPO Corner,Anonymous.,03 Sep 2010
38,"Lobster and chocolate sauce just one exotic pairing from Mr Bean, ambassador of cocoa",Anonymous.,03 Sep 2010
39,Manila team may interview two survivors in HK,Irene Jay Liu in Manila.,03 Sep 2010
40,Mark Six,Anonymous.,03 Sep 2010
41,Qi takes positive step in wireless charging,"Perez, Bien.",03 Sep 2010
42,Table of Contents,Anonymous.,03 Sep 2010
43,"ZTE sales set record pace amid push abroad, mainland demand","Perez, Bien.",03 Sep 2010
44,Awards help industries reach new heights,Anonymous.,03 Sep 2010
45,Doctor's plea for a lawyer's help,"Man, Joyce.",03 Sep 2010
46,Dying tradition... [Derived Headline; Caption text only],Anonymous.,03 Sep 2010
47,"Esprit to spend HK$1.1b on mainland push With earnings down 11pc, retailer sees Asia growth contributing bigger share of revenue","Steger, Isabella.",03 Sep 2010
48,Glass ceiling lower for HK women,"Yuk-hang, Ng.",03 Sep 2010
49,Macau hike to be held despite fight over name Oxfam doesn't want unrelated event to use Trailwalker moniker,"Eng, Dennis.",03 Sep 2010
50,MEMBERS OF THE ORGANISING COMMITTEE,Anonymous.,03 Sep 2010
51,messages Chairman praises firms for raising standards,Anonymous.,03 Sep 2010
52,PANEL OF JUDGES,Anonymous.,03 Sep 2010
53,Ping An takes control of SDB for 29b yuan,"So, Charlotte.",03 Sep 2010
54,Salute to companies that strive for quality,Anonymous.,03 Sep 2010
55,Sino Land core profit falls 2.6pc on dive in sales,"Liu, Yvonne.",03 Sep 2010
56,SPONSORS,Anonymous.,03 Sep 2010
57,Tang's whirlwind trip to Beijing causes a stir,"Leung, Ambrose.",03 Sep 2010
58,Wage woes... [Derived Headline; Caption text only],Anonymous.,03 Sep 2010
59,China Sanjiang targets HK$790m in IPO Chemicals manufacturer to use proceeds to pay for construction of new plant in Jiangxi,"Lee, Amanda.",03 Sep 2010
60,Damages for distress a long shot,Anonymous.,03 Sep 2010
61,Li brothers move into property development,"Ng, Eric.",03 Sep 2010
62,"Slower cargo growth at Hactl, but forwarders not worried","So, Charlotte.",03 Sep 2010
63,The terrible toll of drink on just one crash survivor,Yu Aitong.,03 Sep 2010
64,Watchdog knew of camellia oil danger Secret recalls kept quiet to avoid panic,"Zhai, Ivan.",03 Sep 2010
65,Beijing Shops join forces to deter thieves... [Derived Headline],Anonymous.,03 Sep 2010
66,Consumer banking professionals sought How much you earn,Anonymous.,03 Sep 2010
67,Customer Relationship Manager... [Derived Headline],Anonymous.,03 Sep 2010
68,Identity crackdown hits SIM card sales,"Jiao, Priscilla.",03 Sep 2010
69,top jobs,Anonymous.,03 Sep 2010
70,Police question staff of HIV-rights group Activists cry harassment after court takes first Aids-related suit for job discrimination,"Yu, Verna.",03 Sep 2010
71,Career progression,Anonymous.,03 Sep 2010
72,in the news,Anonymous.,03 Sep 2010
73,Vital characteristics,Anonymous.,03 Sep 2010
74,Beijing's reassuring response to an air crash,Anonymous.,03 Sep 2010
75,Big spenders.,Anonymous.,03 Sep 2010
76,Even the government accepts a minimum wage will cost jobs,Anonymous.,03 Sep 2010
77,Lessons to be learned over swine-flu vaccine,Anonymous.,03 Sep 2010
78,Lingerie launch deserves nothing but a stiff upper lip... [Derived Headline],Anonymous.,03 Sep 2010
79,Taxation not the answer for hot property market... [Derived Headline],Anonymous.,03 Sep 2010
80,Wet markets the only escape from duopoly's 'organic' obsession,Anonymous.,03 Sep 2010
81,"Anne Klein New York IFC Mall, Central, T 2234 738... [Derived Headline]",Anonymous.,03 Sep 2010
82,Banks report rise in loans that could turn sour,Reuters in Beijing.,04 Sep 2010
83,Business,Anonymous.,04 Sep 2010
84,City,Anonymous.,04 Sep 2010
85,Courts,Anonymous.,04 Sep 2010
86,Courts: [1],Anonymous.,04 Sep 2010
87,Courts: [2],Anonymous.,04 Sep 2010
88,"Daily danger on nation's bridgesA deadly, daily crossing As Beijing spends heavily on railways and roads, villagers risk their lives every day on the nation's many crumbling bridges","Chen, Lulu.",04 Sep 2010
89,HK & Delta,Anonymous.,04 Sep 2010
90,"Illegal structures cost taxpayers HK$10m Occupiers of government land exploit loopholes to avoid prosecution, paying for restoration","Chi-fai, Cheung.",04 Sep 2010
91,NEWS SECTION A; scmp.com today; CITY.LIFE.SPORT SECTION C; BUSINESS SECTION B,Anonymous.,04 Sep 2010
92,Octopus asks tribunal to strike out claim,"Chiu, Austin; Leung, Paggie.",04 Sep 2010
93,"PLA navy repels pirates with grenades, bullets PLA navy repels pirates with grenades and machine-gun fire","Torode, Greg.",04 Sep 2010
94,Police,Anonymous.,04 Sep 2010
95,Police break up triad drug-packaging centre in public housing flat,"Lo, Clifford.",04 Sep 2010
96,Ports,Anonymous.,04 Sep 2010
97,"Property speculators head for provinces Cashed-up property speculators head for provincial Zhengzhou Investors are buying big in Zhengzhou, driving up prices and raising risks of a bubble","Rovnick, Naomi; Lulu Chen in Zhengzhou.",04 Sep 2010
98,Statistics bureau taking closer look at signs of speculation,Anonymous.,04 Sep 2010
99,Technology,Anonymous.,04 Sep 2010
100,Vehicles,Anonymous.,04 Sep 2010
101,Author's masterpiece set at HKU,"Lo, Wei.",04 Sep 2010
102,Barking up the wrong tree at pet shop,Anonymous.,04 Sep 2010
103,"Conmen using HK for lottery scam, say police","Simpson, Cheung.",04 Sep 2010
104,Events,Anonymous.,04 Sep 2010
105,Fugitive boss claims US$1b tax support for car plant,"So, Charlotte.",04 Sep 2010
106,"In a cultural war against their oppressors, women have rewritten the ABC of desire",Anonymous.,04 Sep 2010
107,Ma takes oath as HK's second chief justice,"Chiu, Austin.",04 Sep 2010
108,Manila shooting victims remembered,"Simpson, Cheung; Kang-chung, Ng; Wong, Martin.",04 Sep 2010
109,Planners reject developer call for park on North Point site,"Ng, Joyce.",04 Sep 2010
110,Quotes of the Week,Anonymous.,04 Sep 2010
111,Sell-down sends warning signal,Daniel Ren in Shanghai.,04 Sep 2010
112,Students preparing a 'surprise' welcome for new vice-chancellor,Anonymous.,04 Sep 2010
113,Table of Contents,Anonymous.,04 Sep 2010
114,Woo gets top award at Venice film festival,Reuters.,04 Sep 2010
115,"AIA listing tipped to be prime attraction Insurer's brand name, market share stand it in good stead with investors, say brokers","Yiu, Enoch.",04 Sep 2010
116,Another Ede Road site set for auction,"Liu, Yvonne.",04 Sep 2010
117,"Caritas finds value in old computers Used machines are fixed and given to the poor, or components are recycled","Simpson, Cheung.",04 Sep 2010
118,Christina Chan acquitted of police assault,"Ng, Maggie.",04 Sep 2010
119,Esprit slumps after drop in earnings,"Steger, Isabella.",04 Sep 2010
120,Focus on economics education,Anonymous.,04 Sep 2010
121,In Brief,Anonymous.,04 Sep 2010
122,Legislator and law partners seek HK$2m in election libel suit,"Man, Joyce.",04 Sep 2010
123,Mainland driver jailed for robbery bid,"Man, Joyce.",04 Sep 2010
124,Mental illnesses plague gambling addicts: survey,"Wong, Martin.",04 Sep 2010
125,Newbridge Capital sells Ping An stake for HK$9.1b,"Yu, Sophie.",04 Sep 2010
126,Ningbo Port to feed off Shanghai's strength,Toh Han Shih.,04 Sep 2010
127,Political assistants' trip to mainland stirs scorn,"Leung, Ambrose.",04 Sep 2010
128,Techtronic to increase range of products,"Perez, Bien.",04 Sep 2010
129,Tiananmen veteran joins Democrats,"Leung, Ambrose.",04 Sep 2010
130,Tien slams 'miserly' welfare spending Officials urged to tap reserves to help poor,"Cheung, Gary.",04 Sep 2010
131,Demand for answers as gridlock returns,Will Clem in Shanghai.,04 Sep 2010
132,Estudio Iberico Tapas Bar,Anonymous.,04 Sep 2010
133,Fines of up to 5m yuan for mine bosses who refuse to work in pits,"Tam, Fiona.",04 Sep 2010
134,Firing of editors tied to story critical of Tencent,"Jiao, Priscilla.",04 Sep 2010
135,In Brief,Anonymous.,04 Sep 2010
136,Virtual Meetings by Marriott,Anonymous.,04 Sep 2010
137,Disney's advocate for excellence appointed last year as vice-president of park operations at Hong Kong Disneyland Resort,Anonymous.,04 Sep 2010
138,"Katherine Wong, general manager, Prince Hotel, Hong Kong... [Derived Headline]",Anonymous.,04 Sep 2010
139,Popular newspaper sacrifices bold image for self-censorship,"Tam, Fiona.",04 Sep 2010
140,Wage regulation wouldgive workers new clout Draft rules on labour 'may ease tensions',"Tze-wei, Ng.",04 Sep 2010
141,East/Southeast Man caught impersonating police... [Derived Headline],Anonymous.,04 Sep 2010
142,"Elderly enjoy new lease on life HSBC makes senior citizens feel good about themselves again with its 'Smart Seniors' programme, writes Jan Chan",Anonymous.,04 Sep 2010
143,Investment bank seeks new talent,Anonymous.,04 Sep 2010
144,Plane failure fuels worries over air safety,"Clem, Will; Zhuang Pinghui.",04 Sep 2010
145,Sino-Japanese war remembered amid concern truth is distorted,"Chan, Minnie.",04 Sep 2010
146,Money isn't everything... [Derived Headline],Anonymous.,04 Sep 2010
147,"Proud to serve the motherland Determined to help society, academic is involved in the mainland's social work programmes, writes Nora Tong",Anonymous.,04 Sep 2010
148,Political factors far outweigh financial gains in yuan bonds,Anonymous.,04 Sep 2010
149,TDC all at sea over invitations to meet Ukrainian president... [Derived Headline],Anonymous.,04 Sep 2010
150,Falstaffian spirit is missing on mainland,Anonymous.,04 Sep 2010
151,Hong Kong's glitzy malls are pricey and uncomfortable,Anonymous.,04 Sep 2010
152,Obama's challenge in Iraq and Afghanistan,Anonymous.,04 Sep 2010
153,Philippines has regressed into chaotic state... [Derived Headline],Anonymous.,04 Sep 2010
154,Well prepared.,Anonymous.,04 Sep 2010
155,HK & Delta,Anonymous.,05 Sep 2010
156,International,Anonymous.,05 Sep 2010
157,Mass dredging works raise fears for harbourPlans for mass dredging works raise harbour fears A dozen marine projects will transform the sea bed A dozen marine projects will transform the sea bed,"Chi-fai, Cheung.",05 Sep 2010
158,NEWS SECTION; scmp.com today; SUNDAY SPORT; THE REVIEW,Anonymous.,05 Sep 2010
159,Sport,Anonymous.,05 Sep 2010
160,Sports fans face threat of TV viewing drought,"Carney, John.",05 Sep 2010
161,Auction chief slams claim by Jackson's ex-lawyer,"Wan, Adrian.",05 Sep 2010
162,Introducing children to world of chimps,"Lam, Lana.",05 Sep 2010
163,Mark Six,Anonymous.,05 Sep 2010
164,Ukraine in visa deal with HK amid warming trade ties with China,"Torode, Greg.",05 Sep 2010
165,Zimmerman arrested after campaign fracas,"Fung, Fanny W Y.",05 Sep 2010
166,Courts,Anonymous.,05 Sep 2010
167,Luxury exile of Kim Jong-il's banished son Man once groomed to rule North Korea lives life of leisure in Macau,Mark O'Neill in Macau.,05 Sep 2010
168,Smuggling,Anonymous.,05 Sep 2010
169,Woo honour 'a triumph for HK',"Chow, Vivienne.",05 Sep 2010
170,Could aliens be trying to get in touch with us?,"Chow, Vivienne.",05 Sep 2010
171,Just pie in the sky?,Anonymous.,05 Sep 2010
172,How one sailor battled corned beef - and won,"Carney, John.",05 Sep 2010
173,Niche design tops concerns for residents,"Fung, Fanny W Y.",05 Sep 2010
174,Police target under-age drinkers,"Carney, John.",05 Sep 2010
175,Travel council revokes 'Bus Auntie's' tour guide licence over outburst,"Simpson, Cheung.",05 Sep 2010
176,In Brief,Anonymous.,05 Sep 2010
177,Pilot error may have caused Yichun crash,Staff Reporter.,05 Sep 2010
178,Plans to ease highway gridlock,"Chan, Minnie.",05 Sep 2010
179,Thinking outside the box strikes a funny bone,Changing Faces.,05 Sep 2010
180,"US, S Korea postpone drills as tropical storm nears","Chan, Minnie.",05 Sep 2010
181,Beijing's outside hires must relish a challenge,Anonymous.,05 Sep 2010
182,Change in mentality vital to stop drivers drinking,Anonymous.,05 Sep 2010
183,Cycle option could put commuters at risk from exhaust fumes... [Derived Headline],Anonymous.,05 Sep 2010
184,It is difficult to know where you draw the line with new public holidays,Anonymous.,05 Sep 2010
185,Steep bill.,Anonymous.,05 Sep 2010
186,Cross-strait conundrums Taipei's relations with Beijing have progressed faster than the SAR's with the island. Now Hong Kong is finding itself on the back foot in formalising working pacts. Fanny W. Y. Fung and Lawrence Chung report,Anonymous.,05 Sep 2010
187,"Pride and dogmatism worsened Great Famine, author says",Anonymous.,05 Sep 2010
188,"Revisiting a calamitous time In a fresh look at the Great Leap Forward, a Hong Kong scholar estimates up to 45 million people may have died during the dark period. Mark O'Neill reports",Anonymous.,05 Sep 2010
189,'Heritage' mansion perfect for a dim sum tourist hang-out,with Jake van der Kamp jake.vanderkamp@scmp.com.,05 Sep 2010
190,Crime,Anonymous.,06 Sep 2010
191,"Dirty and dangerous coal mines becoming less deadly Dirty and dangerous coal mines less deadly Fatality rate falls as closures clean up industry, report says","Winn, Howard.",06 Sep 2010
192,"Happy heart, liver transplant woman counts her blessings","Moy, Patsy.",06 Sep 2010
193,Health,Anonymous.,06 Sep 2010
194,Health: [1],Anonymous.,06 Sep 2010
195,HK police handed 3 phones by mistake after Manila siege 3 phones mistakenly handed over Member of Philippine investigating panel confirms mix-up,"Robles, Raissa; Agence France-Presse in Manila.",06 Sep 2010
196,Hongkonger feared to be one of twohikers dead on Slovak mountainside,"Simpson, Cheung.",06 Sep 2010
197,International,Anonymous.,06 Sep 2010
198,Long road ahead for electric cars on mainland,Neil Gough in Tianjin.,06 Sep 2010
199,Mainland firms brace for rush of Taiwanese rivals Mainland firms brace for flood of cross-strait competitors,Denise Tsang in Dongguan.,06 Sep 2010
200,"Masters to set up world's first fung shui body Group will regulate standards, education and fight charlatans","Chow, Vivienne.",06 Sep 2010
201,National,Anonymous.,06 Sep 2010
202,NEWS SECTION A; CITY.LIFE.SPORT SECTION C; BUSINESS SECTION B,Anonymous.,06 Sep 2010
203,No payouts in sight for Dalian oil spill victimsNo payouts in sight after oil spill,Raymond Li in Dalian; Liaoning.,06 Sep 2010
204,Property tycoons sit on massive land reservesProperty tycoons sit on massive land reserves,"Kwok, Vivian.",06 Sep 2010
205,Recent court cases that have damaged the reputation of ancient Taoist arts,Anonymous.,06 Sep 2010
206,Resources,Anonymous.,06 Sep 2010
207,RTHK boss vows editorial integrity,Tanna Chong.,06 Sep 2010
208,Sport,Anonymous.,06 Sep 2010
209,'Rip' Hamilton jumps at the chance to return to Asia for NBA tour,Anonymous.,06 Sep 2010
210,Announcements,Anonymous.,06 Sep 2010
211,Bayer's mainland chief predicts strong growth in green vehicles,Daniel Ren in Shanghai.,06 Sep 2010
212,A canine trainer's dogged devotion,"Lam, Lana.",06 Sep 2010
213,Events,Anonymous.,06 Sep 2010
214,Finance chief defends funding for needy,"Wan, Adrian.",06 Sep 2010
215,Guests embrace their inner pirates to honour the fun and fearless,Anonymous.,06 Sep 2010
216,In Brief,Anonymous.,06 Sep 2010
217,IPO Corner,Anonymous.,06 Sep 2010
218,Natural disasters an inspiration as fashionistas gather,Anonymous.,06 Sep 2010
219,"Ocean Park under fire over whale exhibit Display should not be built before research is complete, scientist says","Ng, Joyce; Chi-fai, Cheung.",06 Sep 2010
220,Table of Contents,Anonymous.,06 Sep 2010
221,Young enjoy swine flu immunity,"Yuk-hang, Ng.",06 Sep 2010
222,Zimmerman wins poll as tensions resurface,Tanna Chong.,06 Sep 2010
223,Fertiliser firm hopes for better second halfafter drop in demand,"Ng, Eric.",06 Sep 2010
224,Guangzhou Autounveils its model,Kandy Wong in Guangzhou.,06 Sep 2010
225,In Brief,Anonymous.,06 Sep 2010
226,Staff learn how to avoid patients' attacks,"Yuk-hang, Ng.",06 Sep 2010
227,Theme is upbeat as Disneyland eyes a good year More visitors with looser purse strings augur well for pre-tax profit,"Eng, Dennis.",06 Sep 2010
228,Traders in breach of nutrition label law,"Moy, Patsy.",06 Sep 2010
229,Yahoo HK spreads mainland net wider Company wants ads to reach across to US,"Perez, Bien.",06 Sep 2010
230,ACTIVITY LIST ASIA WATCH CONFERENCE,Anonymous.,06 Sep 2010
231,Admission,Anonymous.,06 Sep 2010
232,"All the time in the world Industry professionals can stay up to the minute on trends at the event featuring 700 exhibitors, writes Tanya Lind",Anonymous.,06 Sep 2010
233,Christopher Marshall Partner KPMG China,Anonymous.,06 Sep 2010
234,"Edward Cheung Chief executive, Greater China DTZ",Anonymous.,06 Sep 2010
235,"Family turns on itself for control of firm Founder of leather company in bitter fight with father, brothers and 'sold-out' officials",Daniel Ren in Shanghai.,06 Sep 2010
236,"Guy Dickinson Director, head of FX trading, Singapore HSBC",Anonymous.,06 Sep 2010
237,"Hans Diederen Country executive, Hong Kong ABN Amro Bank",Anonymous.,06 Sep 2010
238,Hirotoshi Iwamoto Partner KPMG China,Anonymous.,06 Sep 2010
239,In Brief,Anonymous.,06 Sep 2010
240,"Irene Leung Executive vice-president, mass market CSL",Anonymous.,06 Sep 2010
241,"Joanne Ng Head of institutional FX sales, Singapore HSBC",Anonymous.,06 Sep 2010
242,"K.H. Kang Head of trading, Korea BNY Mellon",Anonymous.,06 Sep 2010
243,Matthew Ding Partner KPMG China,Anonymous.,06 Sep 2010
244,Monster traffic jams run rings around officials China Briefing,"Wang, Xiangwei.",06 Sep 2010
245,Patrick Perret-Green Head of FX and local markets strategy for Asia ex-Japan Citi,Anonymous.,06 Sep 2010
246,"Paul Jackson General manager Mandarin Oriental, Sanya",Anonymous.,06 Sep 2010
247,registration,Anonymous.,06 Sep 2010
248,"Sean Jeon Head of institutional FX sales, Korea HSBC",Anonymous.,06 Sep 2010
249,Shippers say antitrust law is needed to rein in cartel Asian shipping council attacks container lines' extra rates,"Wallis, Keith.",06 Sep 2010
250,Tony Brennan Head of equity market strategy for Australia and New Zealand Citi,Anonymous.,06 Sep 2010
251,"Yip Ly Executive vice-president, corporate and business market CSL",Anonymous.,06 Sep 2010
252,Pirate alert after spate of attacks on ships Anti-piracy unit seeks closer policing ties,"Wallis, Keith.",06 Sep 2010
253,East/Southeast Abortion forced over dad's age... [Derived Headline],Anonymous.,06 Sep 2010
254,IT provider enjoys steady rise in revenue Automated Systems Holdings,Anonymous.,06 Sep 2010
255,Firm to consolidate mainland momentum Dah Chong Hong Holdings,"Wang, Ana.",06 Sep 2010
256,Mainland orders to power growth at state rail builders Government investment cushions drop in overseas contracts,Toh Han Shih.,06 Sep 2010
257,"Profit surges for plastic pipe producer Increased environmental awareness has brought impressive growth in the first half of the year for HK-listed mainland company, writes Ana Wang China Liansu Group holdings",Anonymous.,06 Sep 2010
258,Disciples to offer valuable lessons,Anonymous.,06 Sep 2010
259,Inn crowd urged to keep moving forward Hong Kong's three-day hospitality fair offers local operators the chance to ensure they stay one step ahead of the competition,Anonymous.,06 Sep 2010
260,Absence of bias in judiciary is impossible... [Derived Headline],Anonymous.,06 Sep 2010
261,Arts hub residential design code could create park for super-rich,Anonymous.,06 Sep 2010
262,Cricket overshadowed by a cloud of doubt,Anonymous.,06 Sep 2010
263,Ex-astronaut knows to expect unexpected Apollo 13 veteran offers crisis management tips,"Yiu, Enoch.",06 Sep 2010
264,HK caught between investors' greed and policy-makers' fear,Anonymous.,06 Sep 2010
265,HK must not let this Taiwan chance slip,Anonymous.,06 Sep 2010
266,Unequal partners.,Anonymous.,06 Sep 2010
267,Balancing risk key for mainland firms,Anonymous.,07 Sep 2010
268,Business,Anonymous.,07 Sep 2010
269,Court hears of dispute before killing at market,"Man, Joyce.",07 Sep 2010
270,Courts,Anonymous.,07 Sep 2010
271,Earnings,Anonymous.,07 Sep 2010
272,Freedom of information,Anonymous.,07 Sep 2010
273,Hungry Ghost team's office gets another life URA says festival planners can stay,"Wan, Adrian.",07 Sep 2010
274,International,Anonymous.,07 Sep 2010
275,Internet makes 'kubi' mark on Chinese dictionary Internet makes 'kubi' mark on new Oxford Chinese dictionary,"Kang-chung, Ng.",07 Sep 2010
276,Investment,Anonymous.,07 Sep 2010
277,"Investment environment not worsening, Beijing says FDI may hit US$100b this year on strong economic growth",Jane Cai in Beijing.,07 Sep 2010
278,Labour,Anonymous.,07 Sep 2010
279,Manila police have no trained negotiatorsManila police have no trained negotiators Officer lacked backup in talks with hostage-taker,Raissa Robles in Manila.,07 Sep 2010
280,National,Anonymous.,07 Sep 2010
281,NEWS SECTION A; scmp.com today; CITY.LIFE.SPORT SECTION C; BUSINESS SECTION B,Anonymous.,07 Sep 2010
282,"PSA in output, export drive on mainland",Neil Gough in Tianjin.,07 Sep 2010
283,Regulation,Anonymous.,07 Sep 2010
284,Shenzhen speeches show divide on 'political reform' Sharp division on 'political reform',"Yu, Verna.",07 Sep 2010
285,Speculating in classic cars will leave you staring at the dust,with Jake van der Kamp jake.vanderkamp@scmp.com.,07 Sep 2010
286,That time again. ...[Derived Headline; Caption text only],Anonymous.,07 Sep 2010
287,Announcements,Anonymous.,07 Sep 2010
288,Artworks dispute CUHK head's big challenge,Tanna Chong.,07 Sep 2010
289,Caught in the middle. ...[Derived Headline],Anonymous.,07 Sep 2010
290,Cellphones given to HK police by mistake back with Manila officials,"Robles, Raissa; Irene Jay Liu in Manila; Wong, Martin.",07 Sep 2010
291,China Strategic stock plunges as bid fails,"Lee, Amanda.",07 Sep 2010
292,Designer sees into soul of a more feminine future,Anonymous.,07 Sep 2010
293,Drivers urged to leave cars at home once a month,"Wong, Olga.",07 Sep 2010
294,Events,Anonymous.,07 Sep 2010
295,Hu offers condolences and support for Hong Kong's follow-up work,Anonymous.,07 Sep 2010
296,In Brief,Anonymous.,07 Sep 2010
297,IPO Corner,Anonymous.,07 Sep 2010
298,"It's no longer de rigueur to take your hat off indoors, milliner reveals",Anonymous.,07 Sep 2010
299,Long share suspensions are unfair to investors White Collar,"Yiu, Enoch.",07 Sep 2010
300,Ombudsman upholds hostage-taker's sacking,Alan Robles in Manila.,07 Sep 2010
301,Table of Contents,Anonymous.,07 Sep 2010
302,Two men convicted of taking pictures up women's skirts,"Ng, Maggie.",07 Sep 2010
303,Wal-Mart finds Elec-Tech plant unsafe,"Perez, Bien.",07 Sep 2010
304,When a summer break leads to fallout... [Derived Headline],Anonymous.,07 Sep 2010
305,Zimmerman win a 'victory for reason',"Leung, Ambrose.",07 Sep 2010
306,Beijing to ease asset limits on launch of QDII funds Analysts say relaxation will boost market competitiveness,Daniel Ren in Shanghai.,07 Sep 2010
307,Body set up to bid for 2023 Asian Games Committee to gauge public support and assess costs and benefits to city,"Eng, Dennis; Tanna Chong.",07 Sep 2010
308,Brother on a mission to cultivate leaders New head ends elite Catholic school's 6-year experiment with lay principals,"Heron, Liz.",07 Sep 2010
309,Courts,Anonymous.,07 Sep 2010
310,Health,Anonymous.,07 Sep 2010
311,Insurers get more options on investment,"Yiu, Enoch.",07 Sep 2010
312,Mainland steps up consolidation campaign in select industries,"Wong, Kandy.",07 Sep 2010
313,Man accused of transferring millions to Ao Man-long appears in court,"Ng, Maggie.",07 Sep 2010
314,Postal tributes to Nobel laureate,"Chiu, Austin.",07 Sep 2010
