,title,byline,dates
3094,Chinese investors cash in on overseas markets,"Lai, Chloe.",27 Oct 2010
3095,Cities institute rules to keep HK speculators out of market,Anonymous.,27 Oct 2010
3096,"Climate change HK's topglobal concern, poll finds","Wan, Adrian; Ng, Joyce.",27 Oct 2010
3097,Cool idea,Anonymous.,27 Oct 2010
3098,Deals collapse as cooling measures bite Mainland homebuyers default on purchases rather than risk falling prices,"Li, Sandy.",27 Oct 2010
3099,Fireman almost missed body,"Lam, Anita.",27 Oct 2010
3100,Hi-tech graffiti,Anonymous.,27 Oct 2010
3101,In Brief,Anonymous.,27 Oct 2010
3102,Legco nominations hurdle for new seats,"Cheung, Gary; Fung, Fanny W Y.",27 Oct 2010
3103,"Money-making first at arts hub for HK architect Focus on revenue earners to beat rising hub costs, Rocco Yim says","Wong, Olga.",27 Oct 2010
3104,"Pay packets boosted by IPO resurgence Top financial professionals can expect salary rises of 15 to 20 per cent, says survey","So, Charlotte.",27 Oct 2010
3105,"Queen's Cube developer may 'learn lesson' High prices are risky but URA must play by market rules in project, Carrie Lam says","Ng, Joyce.",27 Oct 2010
3106,Secondary market deals rise 33pc,"Sito, Peggy.",27 Oct 2010
3107,Tight schedule for poll,Anonymous.,27 Oct 2010
3108,Tourism fears over customs tax rules,"Leung, Paggie.",27 Oct 2010
3109,Wartime air-raid tunnels prompt questions,Anonymous.,27 Oct 2010
3110,HK tops returns for Asian property,Reuters.,27 Oct 2010
3111,Intel launches US$2.5b wafer production factory in Dalian,"Perez, Bien.",27 Oct 2010
3112,Lending curb seen further depressing London market,Richard Warren in London.,27 Oct 2010
3113,Liu's kin add to calls on G20to press Beijing,"Chan, Minnie.",27 Oct 2010
3114,Shipowners await clarity on oil-spill laws Chinese authorities yet to approve key elements of prevention and clean-up regulations,"Wallis, Keith.",27 Oct 2010
3115,Three Gorges Dam reaches full capacity - for an hour Reservoir at 175 metres but some say barrage far from ready,"Chen, Stephen.",27 Oct 2010
3116,US congressmen seek action on blind lawyer,Anonymous.,27 Oct 2010
3117,Vertu may add media tablets to its exclusive gem-laden phones,"Perez, Bien.",27 Oct 2010
3118,Hamptons prices drop 14pc as buyers opt for cheaper homes,Anonymous.,27 Oct 2010
3119,Ningxia records first mainland cases of drug-resistant superbug from India,Zhuang Pinghui.,27 Oct 2010
3120,Premier orders report on buses lost to Megi,Lawrence Chung in Taipei.,27 Oct 2010
3121,Public housing repairs stall on lack of funds US$32b needed for rehabilitation,The New York Times.,27 Oct 2010
3122,Anti-Japan demonstrations spread to Chongqing,"Chi-yuk, Choi; Agencies.",27 Oct 2010
3123,Beijing: Wild animals off the menu,Anonymous.,27 Oct 2010
3124,Ireland haunted by 'ghost estates',Reuters in Dublin.,27 Oct 2010
3125,Slums make way for high-rise society At least 30 skyscrapers under construction as Mumbai turns to 'vertical growth',Agence France-Presse in Mumbai.,27 Oct 2010
3126,Trial over killing moved,"Jiao, Priscilla.",27 Oct 2010
3127,"Event offers chance to brighten lives A record number of exhibitors will showcase innovative and environmentally friendly products at one of the largest exhibitions in the world, writes Bernice Chan",Anonymous.,27 Oct 2010
3128,SWITCH ON TO INDUSTRY'S PREMIER EVENT,Anonymous.,27 Oct 2010
3129,Xi hails veterans of Korean conflict Vice-president's first speech in military role,Staff Reporter in Beijing.,27 Oct 2010
3130,Hong Kong officials talk rubbish,Anonymous.,27 Oct 2010
3131,"Like it or not, Hong Kong will stay shackled to the US dollar",Anonymous.,27 Oct 2010
3132,The No 1 position that is nothing to be proud of,Anonymous.,27 Oct 2010
3133,Project in prime Central location shows predatory nature of URA,Anonymous.,27 Oct 2010
3134,Rubbish mountain,Anonymous.,27 Oct 2010
3135,We must broaden our horizons without delay,Anonymous.,27 Oct 2010
3136,Wrong to see ulterior motive with care fund,Anonymous.,27 Oct 2010
3137,Accident,Anonymous.,29 Oct 2010
3138,Apartment style matters to tenants,Anonymous.,29 Oct 2010
3139,Aviation,Anonymous.,29 Oct 2010
3140,Banking,Anonymous.,29 Oct 2010
3141,Business,Anonymous.,29 Oct 2010
3142,Class act: Lion City grooms China's rising starsSingapore grooms China's rising star cadres,He Huifeng.,29 Oct 2010
3143,Commodities,Anonymous.,29 Oct 2010
3144,"Economy faces testing times, official says Rising costs and currency will make stable industrial expansion for mainland tough",Cary Huang in Beijing.,29 Oct 2010
3145,Education,Anonymous.,29 Oct 2010
3146,Electronic alert system on way for travellers,"Tsang, Phyllis.",29 Oct 2010
3147,HK & Delta,Anonymous.,29 Oct 2010
3148,"Man denies murdering family of four Husband stabbed 79 times, wife and daughters suffocated and strangled, court told","Man, Joyce.",29 Oct 2010
3149,Marina Bay Sands is Adelson's new jewel in the crown,"Gough, Neil.",29 Oct 2010
3150,Officials won't say what caused Tai Po flood,"Ng, Joyce.",29 Oct 2010
3151,Saving Nemo,Anonymous.,29 Oct 2010
3152,Sport,Anonymous.,29 Oct 2010
3153,Taikoo Shing flat prices pass 1997 record,"Li, Sandy.",29 Oct 2010
3154,Transport,Anonymous.,29 Oct 2010
3155,Underused tunnel can't take much more traffic Bypass delays blamed for low western tunnel flow,Staff Reporters.,29 Oct 2010
3156,Use of surrogacy draws Catholic diocese rebuke,"Mok, Danny.",29 Oct 2010
3157,www.fuel.hk,Anonymous.,29 Oct 2010
3158,Announcements,Anonymous.,29 Oct 2010
3159,Beijing denies rare earths being used as political tool,"Rovnick, Naomi; Cary Huang in Beijing.",29 Oct 2010
3160,Blass fills palates and conversation,Anonymous.,29 Oct 2010
3161,"Book fair may lack pseudo-models, but it can still set the pulses racing",Anonymous.,29 Oct 2010
3162,Corrections & clarifications,Anonymous.,29 Oct 2010
3163,Events,Anonymous.,29 Oct 2010
3164,Jing Wong in form for shop opening,Anonymous.,29 Oct 2010
3165,Ocean Park pulls out all stops to save Nemo's eye,"Nip, Amy.",29 Oct 2010
3166,Provisions for bad loans hit Bocom profits,Daniel Ren in Shanghai.,29 Oct 2010
3167,Surplus now tipped to be US$180b,"Tsang, Denise.",29 Oct 2010
3168,Table of Contents,Anonymous.,29 Oct 2010
3169,Tam hopes trial will help clear up election law holes,"Leung, Ambrose.",29 Oct 2010
3170,Tommy Cheung stirs the minimum wage pot one more time,Tanna Chong.,29 Oct 2010
3171,49 new billionaires join ranks of super rich amid IPO frenzy Wahaha chief tops wealth list with personal fortune of US$8b,Daniel Ren in Shanghai.,29 Oct 2010
3172,Action stations,Anonymous.,29 Oct 2010
3173,Australia-NZ rugby clash in HK won't be aired live on television,"Carney, John.",29 Oct 2010
3174,China Telecom plans 3G push,"Perez, Bien.",29 Oct 2010
3175,Critics slam non-experts on arts advisory body,"Chow, Vivienne.",29 Oct 2010
3176,Drunk US student tries to blame cabbie for death,"Man, Joyce.",29 Oct 2010
3177,Finance chief warns homebuyers to think about what they can afford,Tanna Chong.,29 Oct 2010
3178,Fling with love-rat catcher has a sting in the tail,"Chiu, Austin.",29 Oct 2010
3179,In Brief,Anonymous.,29 Oct 2010
3180,Lucky escape for car park attendant as runaway bus crashes into booth,"Lo, Clifford.",29 Oct 2010
3181,Money laundering,Anonymous.,29 Oct 2010
3182,"Nightclub fire began in toilet rolls: expert Tightly packed rolls ignited by cigarette or joss stick, inquest into 4 deaths in club told","Chiu, Austin.",29 Oct 2010
3183,Oil price rise helps to boost Sinopec profit,"Ng, Eric.",29 Oct 2010
3184,Politics,Anonymous.,29 Oct 2010
3185,Pushing an old issue,Anonymous.,29 Oct 2010
3186,Rising yuan-trade popularity depletes annual settlement quota,"Yiu, Enoch.",29 Oct 2010
3187,Technology,Anonymous.,29 Oct 2010
3188,Basic insurance needs covered in new law,"Chi-yuk, Choi.",29 Oct 2010
3189,Corridor diplomacy keeps the doors open,"Tze-wei, Ng.",29 Oct 2010
3190,Japan keen to get over differences with China,Greg Torode in Hanoi.,29 Oct 2010
3191,Anger at Shenzhen home subsidies for super-rich,Staff Reporter.,29 Oct 2010
3192,Battle machines reveal interest in the military,Anonymous.,29 Oct 2010
3193,Dramatic reaction to portrayal of betrayal,Anonymous.,29 Oct 2010
3194,Genius of Leonardo spans the ages Futuristic flying machines and weapons of war prove the creator of the Mona Lisa was more than just a talented artist,Anonymous.,29 Oct 2010
3195,Media recall reporters after ban on coverage of hit-and-run case,"Tam, Fiona.",29 Oct 2010
3196,Souvenir promotion,Anonymous.,29 Oct 2010
3197,Taiwan identifies missing tourist's remains Anxious relatives of mainland visitors lost in storm question ability of island's rescuers,Lawrence Chung in Ilan.,29 Oct 2010
3198,Beijing: Spy in car nabs tyre spiker,Anonymous.,29 Oct 2010
3199,High-stakes surge helps Galaxy's cash flow,"Gough, Neil.",29 Oct 2010
3200,Record-low blood stocksforce delay tooperations,Zhuang Pinghui.,29 Oct 2010
3201,"Region will see mergers, airline boss predicts","So, Charlotte.",29 Oct 2010
3202,"Series a treat for classical lovers The music programme features famous Chinese string players Lin Cho-liang and Wang Jian, and dizi virtuoso Tang Junqiao",Anonymous.,29 Oct 2010
3203,Telecom firm seeks future leaders How much you earn,Anonymous.,29 Oct 2010
3204,'Singapore is the crossroads of East and West. It sharpened my mind',Anonymous.,29 Oct 2010
3205,Discovering the right path survival tips,Anonymous.,29 Oct 2010
3206,in the news,Anonymous.,29 Oct 2010
3207,Contents,Anonymous.,29 Oct 2010
3208,Masthead,Anonymous.,29 Oct 2010
3209,Brand mulls regional expansion,Anonymous.,29 Oct 2010
3210,Onyx has eye on mainland updates,"Munish, Mukul.",29 Oct 2010
3211,Commercial market robust Updates,"Munish, Mukul.",29 Oct 2010
3212,Developers drawn to awards,Anonymous.,29 Oct 2010
3213,"Market boom leads to gloom Luxury Despite government cooling measures, prices continue to head skywards and buyers are now feeling left out Luxury",Alex Frew McMillanAlex Frew McMillanAlex Frew McMillan.,29 Oct 2010
3214,"HKEx is under threat, but not from a Singapore-ASX deal",Anonymous.,29 Oct 2010
3215,Is the internet making us stupid?,Anonymous.,29 Oct 2010
3216,Demolish this wall of secrecy around dams,Anonymous.,29 Oct 2010
3217,Kerbside showrooms make a mockery of pollution measures,Anonymous.,29 Oct 2010
3218,Missing the principle of preservation,Anonymous.,29 Oct 2010
3219,Our sports officials need to learn a rugby lesson,Anonymous.,29 Oct 2010
3220,Waste disposal,Anonymous.,29 Oct 2010
3221,Bright and breezyfurniture There's plenty of colour this year to brighten up living rooms and lift the gloom following the global economic meltdown furniture,Peta TomlinsonPeta Tomlinson.,29 Oct 2010
3222,Members only Lifestyle Developers are investing far greater resources into recreational facilities to attract high-net-worth buyers Lifestyle,Kenneth KoKenneth Ko.,29 Oct 2010
3223,Ups and downs of the luxury market Mainland Analysts predict a mild upswing in selected first-tier cities after government measures to cool down the sector have the desired effect Mainland,Kenneth KoKenneth Ko.,29 Oct 2010
3224,Room to move A green environment and convenient location have made the area a target for those looking for more space and comfort Tai Po,Alex Frew McMillan.,29 Oct 2010
3225,Acquisitions,Anonymous.,30 Oct 2010
3226,AIA shares close 17pc up on market debut Insurer step closer to repaying US rescue cash,"Lee, Amanda; Westra, Nick.",30 Oct 2010
3227,China's voice is about to get louder all around the world Beijing to beam its view to 100 countries,"Yu, Sophie.",30 Oct 2010
3228,Confused at pedestrian crossings? You are not alone It can be a pressing problem with 3 different control boxes,"Simpson, Cheung.",30 Oct 2010
3229,Council may try to cut multiple IVF births Council may try to cut multiple IVF births,"Lee, Ella.",30 Oct 2010
3230,Courts,Anonymous.,30 Oct 2010
3231,Empty MTR train car derails heading to depot,"Simpson, Cheung.",30 Oct 2010
3232,Factory set to become apple of Sichuan's eye Foxconn plant set to become the apple of Sichuan's eye,Jane Cai in Chengdu.,30 Oct 2010
3233,Filled quota brings yuan party to abrupt halt,"Yiu, Enoch.",30 Oct 2010
3234,Fire,Anonymous.,30 Oct 2010
3235,Firemen lacked oxygen to fight deadly blaze,"Chiu, Austin.",30 Oct 2010
3236,International,Anonymous.,30 Oct 2010
3237,National,Anonymous.,30 Oct 2010
3238,News,Anonymous.,30 Oct 2010
3239,NEWS SECTION A; scmp.com today; CITY.LIFE.SPORT SECTION C; BUSINESS SECTION B,Anonymous.,30 Oct 2010
3240,Sino-Japan ties run aground in Hanoi Sino-Japanese relations run aground in Hanoi Beijing accuses Tokyo of 'untrue' statements,Greg TorodeChief Asia correspondent in Hanoi.,30 Oct 2010
3241,Telecoms,Anonymous.,30 Oct 2010
3242,Transport,Anonymous.,30 Oct 2010
3243,Vehicles,Anonymous.,30 Oct 2010
3244,Church to review plan to tear down parts of wall,"Ng, Joyce.",30 Oct 2010
3245,Conflicted only by what shares to buy,Anonymous.,30 Oct 2010
3246,Conglomerate New Hope sows seeds of an agricultural giant,Jane Cai in Chengdu.,30 Oct 2010
3247,Couple killed as novice motorcyclist crashes in morning rush hour,"Lo, Clifford.",30 Oct 2010
3248,Events,Anonymous.,30 Oct 2010
3249,"Legco rejects thanks for policy address, again","Fung, Fanny W Y.",30 Oct 2010
3250,Marine officials scupper regatta,Anonymous.,30 Oct 2010
3251,Prosecutors get time off to study for law courses,Staff Reporter.,30 Oct 2010
3252,Quotes of the Week,Anonymous.,30 Oct 2010
3253,"Rare-earth exports a mess, veteran says","Rovnick, Naomi.",30 Oct 2010
3254,Readership surveys {hellip} it's just child's play,Anonymous.,30 Oct 2010
3255,Sacking in sick-leave row disputed,"Moy, Patsy.",30 Oct 2010
3256,Table of Contents,Anonymous.,30 Oct 2010
3257,Was it the nefarious hand of Simon Cowell?,Anonymous.,30 Oct 2010
3258,Zhuhai smooths the waters for owners of luxury yachts Coastal city aims to become regional hub for pleasure boats,"Tam, Fiona; Kang-chung, Ng.",30 Oct 2010
3259,ZTE wins security certificate vital for it to supply sensitive US firms,"Perez, Bien.",30 Oct 2010
3260,Absence atwork madecolleaguessuspicious Murder trial told of phone calls to couple,"Moy, Patsy.",30 Oct 2010
3261,Activist charged with tearing police epaulette,"Chiu, Austin.",30 Oct 2010
3262,Beijing proposes eightfold rise in vehicle tax for gas guzzlers,"Gough, Neil.",30 Oct 2010
3263,Better governance education,Anonymous.,30 Oct 2010
3264,Change to insurance beneficiary checks,"Tsang, Phyllis.",30 Oct 2010
3265,"Developers factor in bonus area when bidding, 'so it's not free'","Leung, Paggie.",30 Oct 2010
3266,The height of fashion,Anonymous.,30 Oct 2010
3267,HK-owned factories in delta win concessions on labour rules,"Tsang, Denise.",30 Oct 2010
3268,In Brief,Anonymous.,30 Oct 2010
3269,Island gets fast-charge station for electric cars,"Lee, Ada.",30 Oct 2010
3270,Mainland banks report strong earnings growth Bad loan provisions set to increase,Daniel Ren in Shanghai.,30 Oct 2010
3271,"Make adoption easier, lawmaker urges",Anonymous.,30 Oct 2010
3272,Reproductive technology: the basics,Anonymous.,30 Oct 2010
3273,Results,Anonymous.,30 Oct 2010
3274,Start date forcross-harbourrail line set;costs up 60pc,"Lam, Anita.",30 Oct 2010
3275,Strong demand lifts third-quarter net profit of ASM Pacific,"Perez, Bien.",30 Oct 2010
3276,Taxing times,Anonymous.,30 Oct 2010
3277,'City of light' night faces blackout,Mimi Lau in Guangzhou.,30 Oct 2010
3278,"China has fastest supercomputer - for games at least Tianhe-1 beats US champion, but doubts are raised over capabilities","Chen, Stephen.",30 Oct 2010
3279,Many parents resist lure to declare second child - and head for HK,He Huifeng.,30 Oct 2010
3280,Downhill in diplomacy,Anonymous.,30 Oct 2010
3281,"John Wang, managing director, Avaya Greater China",Anonymous.,30 Oct 2010
3282,Ambitious team players needed,Anonymous.,30 Oct 2010
3283,Beijing: GRE results killed by blunder,Anonymous.,30 Oct 2010
3284,Fine work,Anonymous.,30 Oct 2010
3285,Were Megi's victims carried far away? Sea currents may have moved Taiwan tour bus,Lawrence Chung in Ilan.,30 Oct 2010
3286,Bid to stop activists attending Nobel award,"Yu, Verna.",30 Oct 2010
3287,Fluorescent fish,Anonymous.,30 Oct 2010
3288,Cheers all round the buzz is back,Anonymous.,30 Oct 2010
3289,Drawing found on fallen father finds its way home,japan Julian Ryall in Tokyo.,30 Oct 2010
3290,Taking over another exchange is the last thing we need,Anonymous.,30 Oct 2010
3291,Investors can do more to make MPF work,Anonymous.,30 Oct 2010
3292,Move with the times by taking less time to eat,Anonymous.,30 Oct 2010
3293,New bridge will cut time and cost of cross-border transport,Anonymous.,30 Oct 2010
3294,New faces,Anonymous.,30 Oct 2010
3295,Tsunami a reminder of need for protection,Anonymous.,30 Oct 2010
3296,"Scholars feud over Cao Cao claims Controversy surrounds discovery of legendary warlord's tomb, reports Raymond Li",Anonymous.,30 Oct 2010
3297,Railway professionals are needed for projects specialist talent,"Tong, Nora.",30 Oct 2010
3298,Agenda,Anonymous.,31 Oct 2010
3299,Full report Page 2 Record breakers,Anonymous.,31 Oct 2010
3300,Hong Kong,Anonymous.,31 Oct 2010
3301,International,Anonymous.,31 Oct 2010
3302,New data on HK convictions sinks 'N Korea' jibe New data on HK convictions ends hot debate,"Liu, Irene Jay; Ng, Maggie.",31 Oct 2010
3303,NEWS SECTION; scmp.com today; SUNDAY SPORT; THE REVIEW,Anonymous.,31 Oct 2010
3304,"Smaller parties slam poll plans as unfairPoll plans upset smaller parties, independents","Fung, Fanny W Y.",31 Oct 2010
3305,Wen's 'sea of peace' talk raises hopes Wen's 'sea of peace' talk raises hopes Regional S China Sea pact may be back on,Greg Torode Chief Asia correspondent in Hanoi.,31 Oct 2010
3306,Corrections & clarifications,Anonymous.,31 Oct 2010
3307,ESF parents warned,Anonymous.,31 Oct 2010
3308,The key points of the electoral proposals for 2012,Anonymous.,31 Oct 2010
3309,Mark Six,Anonymous.,31 Oct 2010
3310,Mini-rugby players' epic proves Guinness World Records breaker,"Sallay, Alvin.",31 Oct 2010
3311,Parents disappointed as ESF rejects freeze on fees,"Parry, Simon.",31 Oct 2010
3312,Halloween is easy sell whenghosts are everywhere Festival a hit because of Chinese belief in spirit world,"DeWolf, Christopher.",31 Oct 2010
3313,An improved Link awaits tenants,"Yau, Elaine.",31 Oct 2010
3314,In Brief,Anonymous.,31 Oct 2010
3315,Jockey Club has sinking feeling at Sha Tin stables,"Carney, John.",31 Oct 2010
3316,World prices show why coins don't make cents Metal moves mean small change is a big problem,"Nip, Amy.",31 Oct 2010
3317,"Wan Chai bars shock transgender experts, barring them as 'lady boys'","Carney, John; Lam, Lana.",31 Oct 2010
3318,"After tense day,Wen and Kan chat at Hanoi summit Worsening Sino-Japanese row over islands sparks flurry of diplomacy",Greg Torode Chief Asia Correspondent in Hanoi.,31 Oct 2010
3319,Japan's top diplomat blamed for arousing Beijing's ire,Analysis Minnie Chan.,31 Oct 2010
3320,Brand new business spreads the word,Changing Faces.,31 Oct 2010
3321,All this waste for recycling and there is nowhere to take it in Hong Kong,Anonymous.,31 Oct 2010
3322,Asylum seekers deserve a reasonable chance in life,Anonymous.,31 Oct 2010
3323,Developers must disclose concessions they have obtained,Anonymous.,31 Oct 2010
3324,Halloween a fun festival because we've made it so,Anonymous.,31 Oct 2010
3325,Solar solution,Anonymous.,31 Oct 2010
3326,"China winning currency war Beijing may be using exchange-rates battle to weaken US role in the world, writes Alex Lo",Anonymous.,31 Oct 2010
3327,Sino-US storm clouds gather over Africa aid,Kristin Jones in New York.,31 Oct 2010
3328,"Steady, sport. Singaroo not worth jumping up and down about",with Jake van der Kamp jake.vanderkamp@scmp.com.,31 Oct 2010
3329,"Testing times as easy picks have disappeared It's time to look at portfolios, writes Nick Westra",Anonymous.,31 Oct 2010
3330,Asian Games,Anonymous.,01 Nov 2010
3331,Business,Anonymous.,01 Nov 2010
3332,City,Anonymous.,01 Nov 2010
3333,Currencies,Anonymous.,01 Nov 2010
3334,Drug-driving charge after minibus hits car,"Simpson, Cheung.",01 Nov 2010
3335,Economy,Anonymous.,01 Nov 2010
3336,Environment,Anonymous.,01 Nov 2010
3337,Former runaway is a hit at police dog trial,Anonymous.,01 Nov 2010
3338,Greenery cools concrete jungle,Anonymous.,01 Nov 2010
3339,Gripping display Full report City C1,Anonymous.,01 Nov 2010
3340,Health care,Anonymous.,01 Nov 2010
3341,Key proposals,Anonymous.,01 Nov 2010
3342,Kindle hot property as it leaps Great Firewall Kindle popular as it leaps firewall,"Wan, Adrian.",01 Nov 2010
3343,Legco pushes for animal rights,"Nip, Amy; Fanny W.Y. Fung.",01 Nov 2010
3344,National,Anonymous.,01 Nov 2010
3345,New floor area rules overshadow next auction,"Liu, Yvonne.",01 Nov 2010
3346,NEWS SECTION A; scmp.com today; CITY.LIFE.SPORT SECTION C; BUSINESS SECTION B,Anonymous.,01 Nov 2010
3347,Road racing,Anonymous.,01 Nov 2010
3348,Spirit of Lan Kwai Fong,Anonymous.,01 Nov 2010
3349,Third of Love HK ideas fail to make grade 674 proposals aim to benefit needy,Staff Reporter.,01 Nov 2010
3350,Time for Hang Seng Bank chefs to cook up a stormHang Seng Bank chefs to cook up a storm Lender's annual snake soup banquets a coveted tradition,"Yiu, Enoch.",01 Nov 2010
3351,Uncertainty over QE2 has markets rattled,"Westra, Nick.",01 Nov 2010
3352,Vietnam shares port prize to contain China Vietnam shares port prize to keep lid on China's presence,Greg Torode Chief Asia correspondent in Hanoi.,01 Nov 2010
3353,Waiting times for surgery to be revealed Surgery wait times to be exposed Cataract patients able to join shortest queue,"Lee, Ella.",01 Nov 2010
3354,Announcements,Anonymous.,01 Nov 2010
3355,"Editorial independence remains, says RTHK's chief adviser","Leung, Ambrose.",01 Nov 2010
3356,Events,Anonymous.,01 Nov 2010
3357,"Expenses ceiling of HK$6m challenged Legco voting plan favours rich, critics say",Tanna Chong.,01 Nov 2010
3358,Former residents sought to bring estate's history to life,"Ng, Joyce.",01 Nov 2010
3359,Glittery studs appear for the ladies at denim brand's show,Anonymous.,01 Nov 2010
3360,In Brief,Anonymous.,01 Nov 2010
3361,A silent world to go on display,"Wan, Adrian.",01 Nov 2010
3362,Table of Contents,Anonymous.,01 Nov 2010
3363,The temperature rises as shoe designer sets foot in his new Harbour City premises,Anonymous.,01 Nov 2010
3364,Tom Dixon pops in for one-day cafe and shop plug,Anonymous.,01 Nov 2010
3365,Villagers set to fight removal,"Lam, Anita.",01 Nov 2010
3366,Aids groups eye Community Care Fund for cash Campaigners see opportunity to bypass stigma in business sector,"Yuk-hang, Ng.",01 Nov 2010
3367,All-British faculty for HK's first course in arts leadership,"Chou, Oliver.",01 Nov 2010
3368,Mainland's Daifu sees gold in medical waste,Daniel Ren in Shanghai.,01 Nov 2010
3369,Nuclear fallout,Anonymous.,01 Nov 2010
3370,Sponsors expand reach of message,Anonymous.,01 Nov 2010
3371,Spooking investors,Anonymous.,01 Nov 2010
3372,StanChart plans push for wealthy customers Asia's rich targeted by private banking arm,"Yiu, Enoch.",01 Nov 2010
3373,Unions push for bigger pay rises,"Lam, Anita.",01 Nov 2010
3374,Will a 'revolving door' widen the talent pool?,"Fung, Fanny W Y.",01 Nov 2010
3375,'Redevelopment fever' sweeps through cities China Briefing,"Wang, Xiangwei.",01 Nov 2010
3376,Businessmen invest in their families as stay-at-home dads,"Chan, May.",01 Nov 2010
3377,Six million get ready to knock on doors Mainland's 2010 census will be 'the biggest social mobilisation in peace time',"Zuo, Mandy.",01 Nov 2010
3378,Police chief sentenced for causing girl's death,"Chi-yuk, Choi.",01 Nov 2010
3379,Why China is wary of US stepping in over Diaoyus,"Huang, Analysis Cary.",01 Nov 2010
3380,Angela Wang Fixed income sales Oppenheimer Investments Asia,Anonymous.,01 Nov 2010
3381,Barry Tong Corporate finance principal Grant Thornton,Anonymous.,01 Nov 2010
3382,Curtain drawn on Expo in a blaze of neon glory,Will Clem in Shanghai.,01 Nov 2010
3383,Elisa Yu Assurance principal Grant Thornton,Anonymous.,01 Nov 2010
3384,"Evelyn Kang Director, equity sales Oppenheimer Investments Asia",Anonymous.,01 Nov 2010
3385,"Faces, and little cabbages, behind the scenes",Anonymous.,01 Nov 2010
3386,Jeroen van Son Head of Hong Kong and Macau MasterCard,Anonymous.,01 Nov 2010
3387,John Beresford General manager Marco Polo Wuhan,Anonymous.,01 Nov 2010
3388,"Julie Yang Head, Taiwan MasterCard Worldwide",Anonymous.,01 Nov 2010
3389,"Kevin Li Market development and marketing, Greater China MasterCard Worldwide",Anonymous.,01 Nov 2010
3390,Satsuki Kaneko Director in fixed income sales Oppenheimer Investments Asia,Anonymous.,01 Nov 2010
3391,Beijing: Child height change for rail fares,Anonymous.,01 Nov 2010
3392,A long history of commercial and political misunderstanding,Anonymous.,01 Nov 2010
3393,"Simple desires fire up Schroders chief, 77 iPhone and a trip to Mongolia high priorities","Yiu, Enoch.",01 Nov 2010
3394,Case where remorse needed to be shown,Anonymous.,01 Nov 2010
3395,Hongkongers must learn to foot the bill for disposal of e-waste,Anonymous.,01 Nov 2010
3396,Inaction over inequality is unacceptable,Anonymous.,01 Nov 2010
3397,Jail time,Anonymous.,01 Nov 2010
3398,The right solution to a rare-earth problem,Anonymous.,01 Nov 2010
3399,Aviation,Anonymous.,04 Nov 2010
3400,China-bashing may end as US faces gridlock,Kristin Jones in New York.,04 Nov 2010
3401,Climate experts hold out little hope Hong Kong conference sceptical about Cancun,"Chi-fai, Cheung.",04 Nov 2010
3402,Courts,Anonymous.,04 Nov 2010
3403,Culture tour dogged by meat controversyDog meat row hits Kaiping tour,"Nip, Amy.",04 Nov 2010
3404,Currency,Anonymous.,04 Nov 2010
3405,"The devil you should know, oh ye faithful, is in the detail",with Jake van der Kamp jake.vanderkamp@scmp.com.,04 Nov 2010
3406,Earnings,Anonymous.,04 Nov 2010
3407,HK & Delta,Anonymous.,04 Nov 2010
