,title,byline,dates
1532,Courts,Anonymous.,28 Sep 2010
1533,Economy,Anonymous.,28 Sep 2010
1534,Henderson scion in talks on TVB stake Lee in talks on TVB Shanghai's SMG 'offers HK$10b',"Yu, Sophie; Perez, Bien.",28 Sep 2010
1535,HK & Delta,Anonymous.,28 Sep 2010
1536,Killing suspected before suicide,"Lo, Clifford.",28 Sep 2010
1537,Man on murder charge,"Ng, Maggie.",28 Sep 2010
1538,More firms join rush to launch share offerings,"Lee, Amanda.",28 Sep 2010
1539,National,Anonymous.,28 Sep 2010
1540,NEWS SECTION A; scmp.com today; CITY.LIFE.SPORT SECTION C; BUSINESS SECTION B,Anonymous.,28 Sep 2010
1541,Property: [1],Anonymous.,28 Sep 2010
1542,Property,Anonymous.,28 Sep 2010
1543,Revised Chinese Bible's launch marks end of three-decade quest,"Chou, Oliver.",28 Sep 2010
1544,"Short visit, tall ship. ... [Derived Headline]",Anonymous.,28 Sep 2010
1545,Software helps banks stay secure,Anonymous.,28 Sep 2010
1546,Takeovers,Anonymous.,28 Sep 2010
1547,Tokyo's demands intensify Diaoyus disputeDemands by Tokyo intensify dispute Japan orders boats to leave Diaoyus area,Cary Huang in Beijing; Agencies in Tokyo.,28 Sep 2010
1548,"After a gap of over 20 years, Lionel Ritchie returning to say 'Hello' one more time",Anonymous.,28 Sep 2010
1549,Announcements [Derived Headline],Anonymous.,28 Sep 2010
1550,Art and cocoa on the menu as diners are kept in the dark for two hours of sensory overload,Anonymous.,28 Sep 2010
1551,Cooling measures hit industrial profits,Jane Cai in Beijing.,28 Sep 2010
1552,Corrections & clarifications,Anonymous.,28 Sep 2010
1553,Events,Anonymous.,28 Sep 2010
1554,Evolution of the city's monument to power,"Simpson, Cheung.",28 Sep 2010
1555,"Greater workload, by any other name... [Derived Headline]",Anonymous.,28 Sep 2010
1556,Henderson's TVB bid may raise questions,"Eng, Dennis.",28 Sep 2010
1557,Hospital given the go-ahead for towers Happy Valley residents fear blocked views,"Yuk-hang, Ng; Lam, Anita.",28 Sep 2010
1558,Lau Wong-fat admits failing to declare banned property deals,Tanna Chong.,28 Sep 2010
1559,London's still calling the shots at HSBC White Collar,"Yiu, Enoch.",28 Sep 2010
1560,The right man. ... [Derived Headline],Anonymous.,28 Sep 2010
1561,RTHK advisers agree to post minutes on Web,"Simpson, Cheung; Kang-chung, Ng.",28 Sep 2010
1562,TABLE OF CONTENTS,Anonymous.,28 Sep 2010
1563,TABLE OF CONTENTS: [1],"Corner, IPO.",28 Sep 2010
1564,Three arrested in police crackdown on speeding,"Lo, Clifford.",28 Sep 2010
1565,Villagers set for final stand against eviction,"Mok, Danny.",28 Sep 2010
1566,Apple widens network for its latest smartphone,"Perez, Bien.",28 Sep 2010
1567,Bible project team find common ground Revisions founded on consensus among disparate groups on testing subject,"Chou, Oliver.",28 Sep 2010
1568,Hang Lung acts to avert rising yuan costs,Sandy Li in Dalian.,28 Sep 2010
1569,History lesson. ... [Derived Headline; Caption text only],Anonymous.,28 Sep 2010
1570,In Brief: [1],Anonymous.,28 Sep 2010
1571,In Brief,Anonymous.,28 Sep 2010
1572,Judge refuses to abort criminal trial,"Ng, Maggie.",28 Sep 2010
1573,Ombudsman's tragedy probe may beat Aquino to the punch,Raissa Robles in Manila.,28 Sep 2010
1574,"Scrap landfill plan, warn lawmakers","Chi-fai, Cheung.",28 Sep 2010
1575,Two sites may fetch more than HK$900m Auction result to reflect developers' outlook,"Liu, Yvonne.",28 Sep 2010
1576,Unions decide it's time to wage war on hours,"Nip, Amy.",28 Sep 2010
1577,"1,600 get fake rabies vaccine",Zhuang Pinghui.,28 Sep 2010
1578,Beijing Hu lunch bill in anti-graft exhibit... [Derived Headline],Anonymous.,28 Sep 2010
1579,"Fair gives fashionistas a head start in life The latest trends in accessories and materials will be on display in a three-day event which will draw buyers from around the world, writes Richard Watt",Anonymous.,28 Sep 2010
1580,Business' charm fades for second generation,Anonymous.,28 Sep 2010
1581,Good education risks turning youngsters off the family firm,"Yan, Alice.",28 Sep 2010
1582,Bad odour. ... [Derived Headline],Anonymous.,28 Sep 2010
1583,Be generous to those who helped build HK,Anonymous.,28 Sep 2010
1584,Games will not help with sports development... [Derived Headline],Anonymous.,28 Sep 2010
1585,Harbour tunnel fees must balance off queues,Anonymous.,28 Sep 2010
1586,Reserves of land would allow cultural district to expand,Anonymous.,28 Sep 2010
1587,Classical lunch listening with the Sinfonietta,Anonymous.,28 Sep 2010
1588,Taking the audience on a journey through time World-class conductor Christopher Hogwood returns with fine baroque and neo-classical pieces,Anonymous.,28 Sep 2010
1589,Value of a view,Anonymous.,28 Sep 2010
1590,Wizard plans adventure,Anonymous.,28 Sep 2010
1591,"When city's image is at stake, get Asia's finest... [Derived Headline]",Anonymous.,28 Sep 2010
1592,'Steel princess' trading company in liquidationTrading company of mainland's 'steel princess' put in liquidation,"Rovnick, Naomi.",30 Sep 2010
1593,13 held in yoga closures probe13 ex-directors and staff held in yoga probe,"Lo, Clifford; Nip, Amy.",30 Sep 2010
1594,City,Anonymous.,30 Sep 2010
1595,Courts,Anonymous.,30 Sep 2010
1596,Crime,Anonymous.,30 Sep 2010
1597,"Cyber worm hits mainland industry Cyber worm hits mainland industry Stuxnet virus attacks 'nearly 1,000' facilities using Siemens control systems; HK at risk","Chen, Stephen; Finsterbusch, Stephan; Lam, Anita.",30 Sep 2010
1598,Disposals,Anonymous.,30 Sep 2010
1599,Expo 'landscape' may visit HK,"Leung, Paggie.",30 Sep 2010
1600,Insight,Anonymous.,30 Sep 2010
1601,Investments,Anonymous.,30 Sep 2010
1602,National,Anonymous.,30 Sep 2010
1603,NEWS SECTION A; scmp.com today; CITY.LIFE.SPORT SECTION C; BUSINESS SECTION B,Anonymous.,30 Sep 2010
1604,"Protests, officialdom and now ghosts dog Yuen Long project","Lee, Sherry.",30 Sep 2010
1605,Vehicles,Anonymous.,30 Sep 2010
1606,Villages torn apart in rural niche rush Homes under siege as developers race to cash in on columbariums,"Lee, Sherry.",30 Sep 2010
1607,Wasting billions on Asian Games won't give kids a place for sports,with Jake van der Kamp jake.vanderkamp@scmp.com.,30 Sep 2010
1608,Wealth,Anonymous.,30 Sep 2010
1609,'National hero' Jet Li appears in the flesh at Madame Tussauds,Anonymous.,30 Sep 2010
1610,'Non-stop' grind at TVB leaves Fala Chen with her first wrinkle at 28,Anonymous.,30 Sep 2010
1611,'Prophet of doom' warns to prepare,Keith Wallis in Singapore.,30 Sep 2010
1612,"50,000 households warm to idea of no air cons for a night","Chi-fai, Cheung.",30 Sep 2010
1613,"Beach-party organiser aims above, beyond",Anonymous.,30 Sep 2010
1614,Catholics left without a prayer... [Derived Headline],Anonymous.,30 Sep 2010
1615,CitySeen correction,Anonymous.,30 Sep 2010
1616,Elite boys' school has woman head for first time in its 135 years,Anonymous.,30 Sep 2010
1617,Events,Anonymous.,30 Sep 2010
1618,"Ginseng suppresses tumours, researchers find","Nip, Amy.",30 Sep 2010
1619,HSBC plans to stay based in London despite China expansion,Daniel Ren in Shanghai.,30 Sep 2010
1620,Illegal jobs scam uncovered in joint swoop on fake ID syndicate,"Leung, Paggie.",30 Sep 2010
1621,In Brief,Anonymous.,30 Sep 2010
1622,Incentives for cutting students set to grow,"Yau, Elaine.",30 Sep 2010
1623,IPO Corner [Derived Headline],Anonymous.,30 Sep 2010
1624,More announcements in Classified Notices... [Derived Headline],Anonymous.,30 Sep 2010
1625,Table of Contents,Anonymous.,30 Sep 2010
1626,Balanced performer. ... [Derived Headline; Caption text only],Anonymous.,30 Sep 2010
1627,Boardroom fight at Jackin sees chairman trying to oust deputy,"Rovnick, Naomi.",30 Sep 2010
1628,Contractors to plead guilty over ICC lift mishap,"Ng, Maggie.",30 Sep 2010
1629,Critics hit out at foot-dragging over legal aid Lawyers say help funding court cases still doesn't go far enough,"Man, Joyce.",30 Sep 2010
1630,Early start. ... [Derived Headline; Caption text only],Anonymous.,30 Sep 2010
1631,Exco's Lau tells public to be fair,"Leung, Ambrose.",30 Sep 2010
1632,Five accused of driving into 'human roadblock',"Ng, Joyce.",30 Sep 2010
1633,KMB bus crashes into stalled truck,Anonymous.,30 Sep 2010
1634,No takers for site next to cemeteries Former Housing Department quarters withdrawn from auction by government,"Liu, Yvonne.",30 Sep 2010
1635,PayPal shuts down gay groups' accounts Firm says it's playing by the rules on donations,"Lai, Chloe.",30 Sep 2010
1636,"Prosecution, defence agree in Moulin case",Toh Han Shih.,30 Sep 2010
1637,Trio convicted of HK$18.7m watch heist in Japan,"Ng, Maggie.",30 Sep 2010
1638,"Art lovers, collectors spoilt for choice Exquisite items at the sales include fine Chinese ceramics and works of art, modern Asian art and magnificent jewellery, watches and wine",Anonymous.,30 Sep 2010
1639,Beijing Retired nurse offers home to cop... [Derived Headline],Anonymous.,30 Sep 2010
1640,"Meeting the rich was a success, insist Gates and Buffett Biscuits and photos but no demand for donations","Zhuang Pinghui; Finsterbusch, Stephan.",30 Sep 2010
1641,PCCW sees big future in 'cloud computing' idea Internet means nowhere is offsite,"Perez, Bien.",30 Sep 2010
1642,TPV expands TV business with Philips sales deal for mainland,"Perez, Bien.",30 Sep 2010
1643,"Energy, emissions cuts not met, but 5-year plan to set new targets",Shi Jiangtao; Reuters in Beijing.,30 Sep 2010
1644,Taiwan's former premier revels in cultural role Liu Chao-shiuan has more scope for innovative cross-strait ideas,"Chan, Minnie.",30 Sep 2010
1645,"Chagall masterpiece set for HK auction Classic works by Picasso, Warhol and Hirst will also go under the hammer at an event featuring lots worth up to HK$100 million Western art Japanese artKorean artChinese art",Anonymous.,30 Sep 2010
1646,Korean master to be shown for the first time in the city,Anonymous.,30 Sep 2010
1647,Park Soo-keun Exhibition... [Derived Headline],Anonymous.,30 Sep 2010
1648,Sino-US rivalry raising tensions in region Australian study says Beijing's tussle with Washington is spilling over to Southeast Asia,Defence Greg Torode.,30 Sep 2010
1649,Even expensive flats in HK can be substandard... [Derived Headline],Anonymous.,30 Sep 2010
1650,Innovative solutions keep us competitive,Anonymous.,30 Sep 2010
1651,It's time to end this injustice on legal aid,Anonymous.,30 Sep 2010
1652,Plan to use more nuclear power will meet practical obstacles,Anonymous.,30 Sep 2010
1653,Under fire. ... [Derived Headline],Anonymous.,30 Sep 2010
1654,Top model show tops HSBC's shambolic selection process... [Derived Headline],Anonymous.,30 Sep 2010
1655,Accidents,Anonymous.,02 Oct 2010
1656,City,Anonymous.,02 Oct 2010
1657,Competition,Anonymous.,02 Oct 2010
1658,Customs seizes armoured vehicleCustoms seizes armoured vehicle,"Lo, Clifford.",02 Oct 2010
1659,Death,Anonymous.,02 Oct 2010
1660,Diaoyus row marks shift in Beijing's diplomatic postureDiaoyus row marks a shift by Beijing to a more aggressive diplomatic posture Growing power emboldens China to be more aggressive,Cary Huang in Beijing.,02 Oct 2010
1661,Economy,Anonymous.,02 Oct 2010
1662,Environment,Anonymous.,02 Oct 2010
1663,Geoghegans miss out on HSBC's 'Taipan House' Geoghegans miss out on 'Taipan House',"Yiu, Enoch.",02 Oct 2010
1664,Health,Anonymous.,02 Oct 2010
1665,Hong Kong home sales climb to highest level since 1997,"Li, Sandy.",02 Oct 2010
1666,"Hospitals urged to keep boys, girls apart Alleged rape of five-year-old patient on ward prompts calls to separate the sexes","Moy, Patsy; Lo, Clifford.",02 Oct 2010
1667,Macau turns HK social worker away,"Leung, Ambrose.",02 Oct 2010
1668,"Mainland PMI surges on strong domestic demand Economy resilient, but analysts fear protectionist backlash",Toh Han Shih.,02 Oct 2010
1669,National,Anonymous.,02 Oct 2010
1670,NEWS SECTION A; scmp.com today; CITY.LIFE.SPORT SECTION C; BUSINESS SECTION B,Anonymous.,02 Oct 2010
1671,Shipping,Anonymous.,02 Oct 2010
1672,Sport,Anonymous.,02 Oct 2010
1673,Windfall paper profit for key Winsway backers,"Ng, Eric.",02 Oct 2010
1674,Another gap in Lau's records,"Leung, Ambrose.",02 Oct 2010
1675,Author heads to book fair armed with a liberal attitude to the subject of sex,Anonymous.,02 Oct 2010
1676,Beijing lifts land deal ban on PCPD,"Sito, Peggy.",02 Oct 2010
1677,Beijing offersManila jointtraining pact,Raissa Robles in Manila; AFP.,02 Oct 2010
1678,Democratic Party radicals form new group,"Simpson, Cheung.",02 Oct 2010
1679,Doctor prescribed blood thinner based on dubious diagnosis,"Kang-chung, Ng.",02 Oct 2010
1680,Edison Chen befriends 'king of the snapshot',Anonymous.,02 Oct 2010
1681,Events,Anonymous.,02 Oct 2010
1682,Happy families. ... [Derived Headline; Caption text only],Anonymous.,02 Oct 2010
1683,An uncanny likeness as government and Bauhinia double up,Anonymous.,02 Oct 2010
1684,"We may be next to be barred, activists fear","Nip, Amy; Moy, Patsy.",02 Oct 2010
1685,4 more weeks for Games bid consultation Application deadline for 2023 event extended to give competing cities more time,"Fung, Fanny W Y; Leung, Paggie.",02 Oct 2010
1686,Beijing transport well off world-class mark,Toh Han Shih in Shenzhen.,02 Oct 2010
1687,"Call to stop giving points for faith inschool places race Parents, educators say scheme unfair","Yau, Elaine.",02 Oct 2010
1688,Catholics decide to defy officials over service,"Moy, Patsy.",02 Oct 2010
1689,China's answer to New Age music,"Chow, Vivienne.",02 Oct 2010
1690,"Hongqiao flights in high demand, Dragonair says",Sophie Yu in Shanghai.,02 Oct 2010
1691,How the marks add up,Anonymous.,02 Oct 2010
1692,Rallying to the cause. ... [Derived Headline; Caption text only],Anonymous.,02 Oct 2010
1693,"Rival sees Shanghai port as busiest Singapore admits mainland city on course for top spot, but sees upsides",Keith Wallis in Singapore.,02 Oct 2010
1694,Tax rebate option may boost health plan success,"Yuk-hang, Ng.",02 Oct 2010
1695,Unicom's 3G network lures top customers,"Perez, Bien.",02 Oct 2010
1696,'China threat' hangs on a phrase Deng's motto advising nation to lie low in diplomatic affairs remains ambiguous,"Yu, Verna.",02 Oct 2010
1697,"Artistic treasures hold timeless appeal Antiques, modern and contemporary masterpieces will be on display at the region's premier event",Anonymous.,02 Oct 2010
1698,Fast facts,Anonymous.,02 Oct 2010
1699,Has Beijing got what it takes to be a global player?,"Yu, Verna.",02 Oct 2010
1700,InterContinental Grand Stanford Hong Kong,Anonymous.,02 Oct 2010
1701,The Kowloon Hotel,Anonymous.,02 Oct 2010
1702,Central/South Payrise for Foxconn workers... [Derived Headline],Anonymous.,02 Oct 2010
1703,Chang'e II satellite's mission brings the moon a step closer,"Clem, Will; Chen, Stephen.",02 Oct 2010
1704,Costly reality of getting a good start in education,He Huifeng.,02 Oct 2010
1705,Hu praised for paying tribute to war heroes,"Li, Raymond.",02 Oct 2010
1706,"Mark Bainbridge, general manager - Ketchum Shanghai, Ketchum Greater China... [Derived Headline]",Anonymous.,02 Oct 2010
1707,Travel warning issued after Japanese attack on tourist bus,Minnie Chanand Agence France-Presse in Tokyo.,02 Oct 2010
1708,Mid-life crisis comes earlier... [Derived Headline],Anonymous.,02 Oct 2010
1709,"Employees deserve say on MPF, and soon",Anonymous.,02 Oct 2010
1710,ESF has worked hard at evading parents' fears... [Derived Headline],Anonymous.,02 Oct 2010
1711,Global warming article confused weather with long-term trends,Anonymous.,02 Oct 2010
1712,Revised Chinese Bible - good news for a new era,Anonymous.,02 Oct 2010
1713,SFC feels the sting of Wong's influence despite being in jail,Anonymous.,02 Oct 2010
1714,Vulnerable sites. ... [Derived Headline],Anonymous.,02 Oct 2010
1715,"'End fung shui compensation' Compensation for fung shui challenged Come clean on spending to placate villagers over projects, officials told","Lee, Sherry.",03 Oct 2010
1716,A heat island hooked on air cons A heat island hooked on air cons,"DeWolf, Christopher.",03 Oct 2010
1717,Hong Kong,Anonymous.,03 Oct 2010
1718,International,Anonymous.,03 Oct 2010
1719,Masterstroke. ... [Derived Headline; Caption text only],Anonymous.,03 Oct 2010
1720,National,Anonymous.,03 Oct 2010
1721,NEWS SECTION; scmp.com today; SUNDAY SPORT; THE REVIEW,Anonymous.,03 Oct 2010
1722,Best foot put forward. ... [Derived Headline; Caption text only],Anonymous.,03 Oct 2010
1723,Funding woes put gay pride march on hold,"Wan, Adrian.",03 Oct 2010
1724,Reformist group hasn't split party: Albert Ho,"Fung, Fanny W Y.",03 Oct 2010
1725,Teens in uniformed groups 'better able to resist temptation',"Nip, Amy.",03 Oct 2010
1726,ESF chief riles parents with 'customers' tag Subsidised-schools' head reignites tensions over foundation's lack of transparency,"Lam, Lana.",03 Oct 2010
1727,Indoors no escape from bad air,Anonymous.,03 Oct 2010
1728,Call to block 'fung shui bridge' amid claims of land grab,"Lee, Sherry.",03 Oct 2010
1729,"Envoy basks in mutual attraction of HK, Taiwan","O'Neill, Mark.",03 Oct 2010
1730,Getting the feelof science. ... [Derived Headline; Caption text only],Anonymous.,03 Oct 2010
1731,In Brief,Anonymous.,03 Oct 2010
1732,"Bollards are killing us, manager of Kowloon Bay car body shop says","DeWolf, Christopher.",03 Oct 2010
1733,Eclectic array. ... [Derived Headline; Caption text only],Anonymous.,03 Oct 2010
1734,Industry gets tougher on tour guides Travel council proposes demerit-points scheme to punish rogue agencies and guides,"Lam, Anita.",03 Oct 2010
1735,New measures,Anonymous.,03 Oct 2010
1736,Protests,Anonymous.,03 Oct 2010
1737,Survey,Anonymous.,03 Oct 2010
1738,Chongqing execution raises political spectre,"Mooney, Paul.",03 Oct 2010
1739,Neighbours fear China has produced stealth submarine,"Torode, Greg.",03 Oct 2010
1740,Rocket's nose cone bangs down in Jiangxi farmers' back yards,Will Clem in Shanghai.,03 Oct 2010
1741,Singing the praises of mainland rap,Changing Faces.,03 Oct 2010
1742,"Civic responsibility wilts, air conditioners sprout",Anonymous.,03 Oct 2010
1743,Employers may be losing out by forcing staff to work long hours,Anonymous.,03 Oct 2010
1744,Family ties. ... [Derived Headline],Anonymous.,03 Oct 2010
1745,Tourism and heritage do not have to be in conflict,Anonymous.,03 Oct 2010
1746,We can make people eco-friendly with carrot and stick approach... [Derived Headline],Anonymous.,03 Oct 2010
1747,More gains ahead forecast for yuan,"Westra, Nick.",03 Oct 2010
1748,Delay to MPF reforms just takes contributors for even bigger ride,with Jake van der Kamp jake.vanderkamp@scmp.com.,03 Oct 2010
1749,Clock ticking for 'Swiss made' component makers Clock ticking for 'Swiss made' component makers,"Gough, Neil.",04 Oct 2010
1750,Death,Anonymous.,04 Oct 2010
1751,Disposals,Anonymous.,04 Oct 2010
1752,Economy,Anonymous.,04 Oct 2010
1753,Elderly,Anonymous.,04 Oct 2010
1754,Gala performance. ... [Derived Headline; Caption text only],Anonymous.,04 Oct 2010
1755,"Hopes for deal fade as China hostsclimate talks China hosts climate talks as gulf grows over key issues Breakthrough unlikely in Tianjin, observers sayBreakthrough unlikely in Tianjin ahead of Cancun gathering",Shi Jiangtao in Tianjin.,04 Oct 2010
1756,International,Anonymous.,04 Oct 2010
1757,"Landfill row minister refuses to back down Stretch of country park lost in scheme is of little ecological value, Edward Yau says","Wan, Adrian.",04 Oct 2010
1758,National,Anonymous.,04 Oct 2010
1759,Neighbours see red over 'green' billboard lights Neighbours see red over 'green' billboard lights,"Simpson, Cheung.",04 Oct 2010
1760,NEWS SECTION A; scmp.com today; CITY.LIFE.SPORT SECTION C; BUSINESS SECTION B,Anonymous.,04 Oct 2010
1761,Security guard arrested after shotgun fired in mall,"Simpson, Cheung; Mok, Danny.",04 Oct 2010
1762,Sport,Anonymous.,04 Oct 2010
1763,Tighter rules in Shenzhen on home purchases,"Sito, Peggy.",04 Oct 2010
1764,Top two developers pocket HK$11b from salesDevelopers pocket HK$11b in sales,"Li, Sandy.",04 Oct 2010
1765,Events,Anonymous.,04 Oct 2010
1766,Getting poorer,Anonymous.,04 Oct 2010
1767,Hush is on the quiet no more!,Anonymous.,04 Oct 2010
1768,In the pink. ... [Derived Headline; Caption text only],Anonymous.,04 Oct 2010
1769,Korean heartthrob mobbed by adoring fans,Anonymous.,04 Oct 2010
1770,Letters of thanks for the postmen who deliver,"Leung, Paggie.",04 Oct 2010
1771,MARCHERS SEEK FUNDING. ... [Derived Headline; Caption text only],Anonymous.,04 Oct 2010
1772,Number of Hongkongers in poverty at record high,"Yuk-hang, Ng.",04 Oct 2010
1773,Pregnancy tonic may damage mothers' health,"Yuk-hang, Ng.",04 Oct 2010
1774,Public pose a problem by posing on police motorbikes,"Simpson, Cheung.",04 Oct 2010
1775,Skincare line lifts off with high-flying launch party,Anonymous.,04 Oct 2010
1776,"Transport costs a heavy burden, residents say",Anonymous.,04 Oct 2010
1777,Arrests,Anonymous.,04 Oct 2010
1778,Awards,Anonymous.,04 Oct 2010
1779,Central sites expose patchy heritage regime Mixed reviews for government performance on landmark conservation projects,"Ng, Joyce.",04 Oct 2010
1780,Democrats reject league's demand to cut Beijing link,Tanna Chong.,04 Oct 2010
1781,Heart of the matter. ... [Derived Headline; Caption text only],Anonymous.,04 Oct 2010
1782,HK aims to sustain edge as aviation hub Chek Lap Kok sees rising air travel traffic as demand from Pearl River Delta grows,Toh Han Shih.,04 Oct 2010
1783,Hongkongers warned to take extra care if they visit Japan amid protests,Staff Reporters.,04 Oct 2010
1784,Rethink on children's wards,"Yuk-hang, Ng.",04 Oct 2010
1785,Stage set for flurry of art sales and shows Hong Kong becomes the centre of the Asian fine art world as galleries come to town,"Chow, Vivienne.",04 Oct 2010
1786,Anger over industrial unit columbarium plan,"Kang-chung, Ng.",04 Oct 2010
1787,Focus on politics and the pace of growth China Briefing,"Wang, Xiangwei.",04 Oct 2010
1788,Government pressed on affordable homes,Anonymous.,04 Oct 2010
1789,Human rights protesters use National Day to reject Beijing's claim of improvements,Anonymous.,04 Oct 2010
1790,More public housing for struggling singles urged,"Yau, Elaine.",04 Oct 2010
1791,Wen vows to keep on pressing for reform,"Li, Raymond.",04 Oct 2010
1792,Beijing A day for seeing double... [Derived Headline],Anonymous.,04 Oct 2010
1793,"Jonathan Dubois-Phillips Senior vice-president, corporate finance Ivanhoe Capital",Anonymous.,04 Oct 2010
1794,"Lawrence Chiu Broker, PBG Newedge",Anonymous.,04 Oct 2010
1795,Marc de Cure Chief financial officer AIA Group,Anonymous.,04 Oct 2010
1796,"Matthew Kirkby Head of global banking, Asia-Pacific Royal Bank of Scotland",Anonymous.,04 Oct 2010
1797,May Yan Director and head of China banks research Barclays Capital,Anonymous.,04 Oct 2010
1798,Richard Harris Chief executive Quam Asset Management,Anonymous.,04 Oct 2010
1799,"Roger Bacon Head, managed investments and advisory, Asia-Pacific Citi Private Bank",Anonymous.,04 Oct 2010
1800,"Vineet Sharma Director, head of consumer research, Asia ex-Japan Barclays Capital",Anonymous.,04 Oct 2010
1801,Wilson Cheung HR operations manager Newedge,Anonymous.,04 Oct 2010
1802,MPF switch. ... [Derived Headline],Anonymous.,04 Oct 2010
1803,Send fung shui claims to Audit Commission,Anonymous.,04 Oct 2010
1804,Set maximum hours to stop exploitation... [Derived Headline],Anonymous.,04 Oct 2010
1805,Time to change overall housing and land supply policies,Anonymous.,04 Oct 2010
1806,Welcome moves to protect our countryside,Anonymous.,04 Oct 2010
1807,Barclays sails through global storm profitably John Varley says bank will stick to its course,"Yiu, Enoch.",04 Oct 2010
1808,Anglo Irish crash shows again why it's unwise to bet the farm,with Jake van der Kamp jake.vanderkamp@scmp.com.,05 Oct 2010
1809,China holds firm on climate change talksChina firm on climate change talks UN calls for common ground to be found before end-of-year summit,Shi Jiangtao in Tianjin.,05 Oct 2010
1810,Courts: [2],Anonymous.,05 Oct 2010
1811,Courts: [1],Anonymous.,05 Oct 2010
1812,Courts,Anonymous.,05 Oct 2010
1813,"Driver, nanny arrested after boy, 4, left in bus","Lo, Clifford.",05 Oct 2010
1814,Economy,Anonymous.,05 Oct 2010
1815,Economy: [1],Anonymous.,05 Oct 2010
1816,Eldest son loses out in SHKP trust rejig Latest snub for Walter Kwok in family feud,"Li, Sandy; Sito, Peggy.",05 Oct 2010
1817,Exchange rates,Anonymous.,05 Oct 2010
1818,HK & Delta,Anonymous.,05 Oct 2010
1819,"Mainland insurers, Kuwait eye AIA stakes Market growth potential a draw as IPO kicks off","Yiu, Enoch.",05 Oct 2010
1820,Mainland takes lead in clean energy,Anonymous.,05 Oct 2010
1821,Mainland visitors up37pc despite bad press,"Eng, Dennis.",05 Oct 2010
1822,Market surges to 10-month high,"Westra, Nick.",05 Oct 2010
1823,Master puts estimate to shame,Anonymous.,05 Oct 2010
1824,National,Anonymous.,05 Oct 2010
1825,NEWS SECTION A; scmp.com today; CITY.LIFE.SPORT SECTION C; BUSINESS SECTION B,Anonymous.,05 Oct 2010
1826,Sport,Anonymous.,05 Oct 2010
1827,Traffic delays ahead as rail works set in train,"Lam, Anita.",05 Oct 2010
1828,"Tutor jailed for sexual assaults on girl, 13 Ex-primary school teacher, , conditioned pupil into 'master and servant' relationship","Man, Joyce; Lo, Wei.",05 Oct 2010
1829,Allies needed to salvage landfill extension plan,"Chi-fai, Cheung.",05 Oct 2010
1830,Beautiful people,Anonymous.,05 Oct 2010
1831,Cogo bets on mainland for US$1b revenue,"Perez, Bien.",05 Oct 2010
1832,Fishing village's culture and geology go on show in Kat O,"Ng, Joyce.",05 Oct 2010
1833,France won't join in yuan pressure at G20 summit,"Chung-yan, Chow; Tsang, Denise.",05 Oct 2010
1834,HK set to sign tax treaty with France next month,Anonymous.,05 Oct 2010
1835,It's 3pm and time for some more patriotism,Anonymous.,05 Oct 2010
1836,Second guard arrested over shot fired inside mall,"Wong, Martin.",05 Oct 2010
1837,"Sihuan, Springland plan HK listings",Toh Han Shih; Agencies.,05 Oct 2010
1838,Surfwear brand offers an Insight into art,Anonymous.,05 Oct 2010
