,title,byline,dates
4661,Tetra Pak lawsuit hangs over IPO candidate,"Ng, Eric.",26 Nov 2010
4662,Unlawful killing verdict sought in overdose death of widow,"Chiu, Austin.",26 Nov 2010
4663,AIG sees US$180m paper profit on Iran-linked stake,"Gough, Neil.",26 Nov 2010
4664,Baby budget,Anonymous.,26 Nov 2010
4665,Beijing mall sells for record 6b yuan,"Liu, Yvonne.",26 Nov 2010
4666,Business,Anonymous.,26 Nov 2010
4667,Cheung Kong executive may face inquiry over 'misleading' remarks,Staff Reporters.,26 Nov 2010
4668,Could do better?,Anonymous.,26 Nov 2010
4669,Finance,Anonymous.,26 Nov 2010
4670,Galeries Lafayette will return to China market Chain to open Beijing store with HK partner,"Leung, Paggie.",26 Nov 2010
4671,Helping the poorest of the poor Project offers social services support for people who rummage in rubbish,"Lam, Lana.",26 Nov 2010
4672,In Brief,Anonymous.,26 Nov 2010
4673,Mark Six,Anonymous.,26 Nov 2010
4674,"Named and shamed, school heads target Education Bureau","Yau, Elaine.",26 Nov 2010
4675,Quake widow avoids forced abortion by giving birth in HK,He Huifeng.,26 Nov 2010
4676,Call to scrutinise statutory bodies before passing competition bill,Tanna Chong.,26 Nov 2010
4677,Crime,Anonymous.,26 Nov 2010
4678,Man denies taking toddler in park,"Chiu, Austin.",26 Nov 2010
4679,Outcry over online clips showing 'crush fetishists' mangling rabbits,Agence France-Presse in Beijingand Choi Chi-yuk.,26 Nov 2010
4680,Pressure grows over land 'gift',"Leung, Ambrose; Ng, Joyce.",26 Nov 2010
4681,"Probe of disgraced mayor over, Shenzhen chief says","Tam, Fiona.",26 Nov 2010
4682,Pupils protest over food price rises School canteen vandalised as children demonstrate against inflation,Zhuang Pinghui.,26 Nov 2010
4683,Sport,Anonymous.,26 Nov 2010
4684,Training planned to help traffic police spot drug-drivers,"Wan, Adrian.",26 Nov 2010
4685,contents and editor's note,Anonymous.,26 Nov 2010
4686,Management firm seeking new recruits How much you earn,Anonymous.,26 Nov 2010
4687,Rising to the challenge,"Tong, Nora.",26 Nov 2010
4688,Beijing: Lonely dad sues his six children,Anonymous.,26 Nov 2010
4689,"Police take Christian leader, family from home","Yu, Verna.",26 Nov 2010
4690,Government takes aim at speculators,Anonymous.,26 Nov 2010
4691,Masthead,Anonymous.,26 Nov 2010
4692,The secret's in preparation survival tips,Anonymous.,26 Nov 2010
4693,Northern wilderness transformed into grain basket on Mao's orders,Cary Huang in Jiamusi; Heilongjiang.,26 Nov 2010
4694,"Too little, too late for country's largest wetland?",Anonymous.,26 Nov 2010
4695,extra-curricular pointers,Anonymous.,26 Nov 2010
4696,"Tourist island offers a deadly souvenir In Bali, where quarter of sex workers have HIV, prostitutes say they try to have safe sex",aids Fabio Scarpello in Denpasar; Indonesia.,26 Nov 2010
4697,Growing danger that markets' reversal may not be short-term,Anonymous.,26 Nov 2010
4698,Singapore gets crotchety over swimming trunks,Anonymous.,26 Nov 2010
4699,Don't throw the baby out with the bath water,Anonymous.,26 Nov 2010
4700,Government must do more to protect Mai Po's rare visitors,Anonymous.,26 Nov 2010
4701,Ill-defined stamp duty rules cause confusion,Anonymous.,26 Nov 2010
4702,Milk hero's case shows how pressure can work,Anonymous.,26 Nov 2010
4703,On the move,Anonymous.,26 Nov 2010
4704,"Annual low-pay study possible, minister says","Wan, Adrian.",27 Nov 2010
4705,Business,Anonymous.,27 Nov 2010
4706,Courts,Anonymous.,27 Nov 2010
4707,Courts: [1],Anonymous.,27 Nov 2010
4708,Crime,Anonymous.,27 Nov 2010
4709,Exchanges,Anonymous.,27 Nov 2010
4710,"French consul general recalled to Paris, placed under investigationFrench envoy recalled and under investigation","Liu, Irene Jay; Leung, Ambrose.",27 Nov 2010
4711,French nuclear waste deal a hot topic French nuclear waste deal fuels debate in China Experts split on China's plan to be an international spent fuel recycling centre,"Chen, Stephen.",27 Nov 2010
4712,HK & Delta,Anonymous.,27 Nov 2010
4713,International,Anonymous.,27 Nov 2010
4714,Investigations,Anonymous.,27 Nov 2010
4715,Maritime industry calls for a boost Hong Kong slipping as competition increases,"Wallis, Keith.",27 Nov 2010
4716,Memorial trail considered for Bruce Lee,"Nip, Amy.",27 Nov 2010
4717,Microblogs keep mainland censors on toes Microbloggers keep mainland internet censors on their toes,"Yu, Sophie.",27 Nov 2010
4718,More pickpockets hit city streets as drug seizures increase,"Tsang, Phyllis.",27 Nov 2010
4719,NEWS SECTION A; scmp.com today; CITY.LIFE.SPORT SECTION C; BUSINESS SECTION B,Anonymous.,27 Nov 2010
4720,Rio Tinto banks on mainland's steel usage,"Rovnick, Naomi.",27 Nov 2010
4721,"Son of KMT chief gunned down on campaign trail Lien Sheng-wen survives being shot in face, supporter killed",Lawrence Chung in Taipei.,27 Nov 2010
4722,"Third of Chinese medicine products may have to go As a deadline looms, non-licensed products will be pulled","Yuk-hang, Ng.",27 Nov 2010
4723,Trading,Anonymous.,27 Nov 2010
4724,Transport,Anonymous.,27 Nov 2010
4725,'Green' listing proposal gains wide support,"Yiu, Enoch.",27 Nov 2010
4726,Collar your four-footed friends and head for The Peak for walkies and a day of furry fun,Anonymous.,27 Nov 2010
4727,Commissioner defends land 'gift',"Cheung, Gary.",27 Nov 2010
4728,The day Bruce Lee lifted the lid on an anniversary surprise,Anonymous.,27 Nov 2010
4729,Developers' fund-raising plans to be vetted in latest cooling measure,"Liu, Yvonne.",27 Nov 2010
4730,DSS schools face cash reserves 'ceiling' Revamp of funding claimed to be on way after damning report by Audit Commission,"Yau, Elaine.",27 Nov 2010
4731,Events,Anonymous.,27 Nov 2010
4732,Has he or hasn't he? Heart-throb keeps us all guessing,Anonymous.,27 Nov 2010
4733,Humanities will 'lose out' in new funding regime,"Yau, Elaine.",27 Nov 2010
4734,KMB asks for 10 times official rate,Anonymous.,27 Nov 2010
4735,"Lenovo seeks tie-up with China Mobile to sell 3G phone, tablet","Perez, Bien.",27 Nov 2010
4736,Minibus operators offer fare freeze for increase in seats,"Lee, Ada.",27 Nov 2010
4737,Modern Dairy suffers from sector's troubles,"Westra, Nick.",27 Nov 2010
4738,Quotes of the Week,Anonymous.,27 Nov 2010
4739,See no future,Anonymous.,27 Nov 2010
4740,Shareholders give Great Wall the go-ahead for a Shanghai listing,"Gough, Neil.",27 Nov 2010
4741,Table of Contents,Anonymous.,27 Nov 2010
4742,Beauty at a price,Anonymous.,27 Nov 2010
4743,Beijing cracks down on commodity trades,Daniel Ren in Shanghai.,27 Nov 2010
4744,Columbarium in industrial building rejected,"Chiu, Austin.",27 Nov 2010
4745,"Defeating defeatism is crucial Managers must learn how to break cycle of decline by maintaining staff communication, writes Rex Aguado",Anonymous.,27 Nov 2010
4746,Earnings,Anonymous.,27 Nov 2010
4747,Exhibition calls for visitors to brush up on their body language,"Wan, Adrian.",27 Nov 2010
4748,"Help on way for youngsters at risk Two projects to focus on victims of child abuse, teenage suicides","Lee, Ada.",27 Nov 2010
4749,In Brief,Anonymous.,27 Nov 2010
4750,Kuk chief ends speculation and decides to run in poll,"Cheung, Gary.",27 Nov 2010
4751,New jobs in media education,Anonymous.,27 Nov 2010
4752,Patient had stroke after tube error,"Simpson, Cheung.",27 Nov 2010
4753,Stamp duty increase prompts warning of 'collateral damage',"Liu, Yvonne.",27 Nov 2010
4754,Treasury bill sale falls short of target Bank reserves order to blame for poor interest,Jane Cai in Beijing.,27 Nov 2010
4755,Beijing: Home filled with mud,Anonymous.,27 Nov 2010
4756,It's getting harder to buy groceries at a steal,"Tam, Fiona.",27 Nov 2010
4757,Universities told to hold canteen prices down,Zhuang Pinghui.,27 Nov 2010
4758,'China's Madonna' hoaxes the UK media,Will Clem in Shanghai.,27 Nov 2010
4759,"Adelyn Ngion, regional director, TMS Academy",Anonymous.,27 Nov 2010
4760,Smart training grooms leaders,Anonymous.,27 Nov 2010
4761,5 hurt in attack on newspaper,"Jiao, Priscilla.",27 Nov 2010
4762,KMT in last-minute push before mayoral elections,Lawrence Chung in Taipei.,27 Nov 2010
4763,Tour company on recruitment trail,Anonymous.,27 Nov 2010
4764,Employers face skills shortage next year,Anonymous.,27 Nov 2010
4765,There's no better policy than to change with the times,Anonymous.,27 Nov 2010
4766,Community can help our drivers switch on to the electric dream,Anonymous.,27 Nov 2010
4767,Environment protection is a community effort,Anonymous.,27 Nov 2010
4768,Hong Kong and Shanghai can work together,Anonymous.,27 Nov 2010
4769,More effort needed to ensure gender equality,Anonymous.,27 Nov 2010
4770,Tough job,Anonymous.,27 Nov 2010
4771,Hong Kong,Anonymous.,28 Nov 2010
4772,International,Anonymous.,28 Nov 2010
4773,Naval exercises send clear signal to BeijingNaval exercises send clear signal to Beijing,Greg Torode in Seoul.,28 Nov 2010
4774,NEWS SECTION; scmp.com today; SUNDAY SPORT; THE REVIEW,Anonymous.,28 Nov 2010
4775,Out with a bang,Anonymous.,28 Nov 2010
4776,Records of fung shui payouts 'disposed of'Records of fung shui rail payouts 'disposed of',"Lee, Sherry.",28 Nov 2010
4777,Shooting helps lift votes for embattled KMTShooting helps lift votes for embattled KMT Tight fight for Taiwan's mayoral seats,Lawrence Chung in Taipei.,28 Nov 2010
4778,Your Money,Anonymous.,28 Nov 2010
4779,Drug-maker Europharm sued after boy's death,"Man, Joyce.",28 Nov 2010
4780,Former police chief gets some wall space,"Tsang, Phyllis.",28 Nov 2010
4781,Mark Six,Anonymous.,28 Nov 2010
4782,UN reports HK's abuse of crystal meth is rising fast,"Carney, John.",28 Nov 2010
4783,Educators sound off to free Zhao,"Fung, Fanny W Y.",28 Nov 2010
4784,Protected in HK but denied right to work Torture claimant challenges system that means he has to rely on handouts to survive,"Ip, Chris.",28 Nov 2010
4785,The struggling asylum seeker who snapped and knifed flat-mate,"Martin, Michael.",28 Nov 2010
4786,Album given to sailor in 1945 finds a home,"Carney, John.",28 Nov 2010
4787,Courts,Anonymous.,28 Nov 2010
4788,Crime,Anonymous.,28 Nov 2010
4789,Crime: [1],Anonymous.,28 Nov 2010
4790,A sight that's no longer for sore eyes For years all you could do was look at it. Now you can swim there as well,"DeWolf, Christopher.",28 Nov 2010
4791,Pressure group set up over abuse of claims,Anonymous.,28 Nov 2010
4792,Speech project aims to give children a voice,"Lee, Ada.",28 Nov 2010
4793,Mayoral winners and their vote share,Anonymous.,28 Nov 2010
4794,"An NGO that looks at spiritual development, not just exams",Changing Faces.,28 Nov 2010
4795,Questions surround rally shooting of Lien's son,Lawrence Chung in Taipei.,28 Nov 2010
4796,Relief and pride after 16 days of sporting fever,Mimi Lau in Guangzhou.,28 Nov 2010
4797,Xinjiang taps into booming red wine market,Minnie Chan in Urumqi; Xinjiang.,28 Nov 2010
4798,Loopholes mean genuine asylum seekers suffer,Anonymous.,28 Nov 2010
4799,Playing safe,Anonymous.,28 Nov 2010
4800,"Price isn't everything, but such errors are farcical",Anonymous.,28 Nov 2010
4801,Some lawmakers make groundless objections to competition law,Anonymous.,28 Nov 2010
4802,With proper recycling we will not need landfills or incinerators,Anonymous.,28 Nov 2010
4803,"Conscript families wary of war After the attacks on the Korean border, Greg Torode finds one group of people worried about calls for a tougher response",Anonymous.,28 Nov 2010
4804,Love blossoms in war,Anonymous.,28 Nov 2010
4805,"Will India's Chinese finally get justice? Efforts are under way to persuade New Delhi to acknowledge persecution of citizens after the 1962 border war, writes Maseeh Rahman",Anonymous.,28 Nov 2010
4806,Consumption revolution a long way off in China,Anonymous.,28 Nov 2010
4807,Solid assets draw the dollars Investors have trashed cash and gone out buying. Nick Westra takes a look at the best investments this year,Anonymous.,28 Nov 2010
4808,Accident,Anonymous.,29 Nov 2010
4809,Banking,Anonymous.,29 Nov 2010
4810,Beijing makes offer to host emergency talksBeijing offers to host emergency talks China seeks six-nation meeting on Korean crisis,Ng Tze-wei in Beijing; Greg Torode in Seoul.,29 Nov 2010
4811,Business,Anonymous.,29 Nov 2010
4812,CNOOC acquires BP asset to boost presence in South America,"Ng, Eric.",29 Nov 2010
4813,Economy,Anonymous.,29 Nov 2010
4814,Education,Anonymous.,29 Nov 2010
4815,EU set to ban purchase of carbon credits,"Ng, Eric.",29 Nov 2010
4816,Grey areas the battleground in NT fightGrey areas the battlefield in New Territories fight Zoning loopholes and red tape often prevent officials from acting against illegal developers,"Wong, Olga; Chi-fai, Cheung.",29 Nov 2010
4817,HK blooms as back door for books likely to ruffle mainland feathers HK blooms as back door for books likely to ruffle Beijing's feathers,"Cheung, Gary.",29 Nov 2010
4818,Kuk chief's land to take waste from rail project,"Chi-fai, Cheung.",29 Nov 2010
4819,Manufacturing,Anonymous.,29 Nov 2010
4820,National,Anonymous.,29 Nov 2010
4821,National/Business,Anonymous.,29 Nov 2010
4822,NEWS SECTION A; scmp.com today; CITY.LIFE.SPORT SECTION C; BUSINESS SECTION B,Anonymous.,29 Nov 2010
4823,Parents fight funding for loss-making ESF colleges ESF parents question funding for loss-making private colleges,"Parry, Simon.",29 Nov 2010
4824,Smiles backfire if the system fails,Anonymous.,29 Nov 2010
4825,"TCL bets on 3-D TVs to crack mainland, overseas markets",Sophie Yu in Guangzhou.,29 Nov 2010
4826,Advisers help balance risks and rewards,Toh Han Shih.,29 Nov 2010
4827,Beauty and the Brain: how an unlikely pair met next to a Christmas tree,Anonymous.,29 Nov 2010
4828,Beekeeper creates a real buzz for prison design date,Anonymous.,29 Nov 2010
4829,Cartoon creator finds a little child's play is the key to success,"Nip, Amy.",29 Nov 2010
4830,Coffee revolution hits the home of China's finest tea,Celine Sun in Beijing.,29 Nov 2010
4831,Events,Anonymous.,29 Nov 2010
4832,Fund-raising,Anonymous.,29 Nov 2010
4833,Harsh reality forimmigrants deniedwelfare payments,"Wong, Martin.",29 Nov 2010
4834,In Brief,Anonymous.,29 Nov 2010
4835,IPO Corner,Anonymous.,29 Nov 2010
4836,Liberals to back Tien despite rift,Tanna Chong.,29 Nov 2010
4837,Medal success spurs support for Games bid,"Zhou, Mandy.",29 Nov 2010
4838,Renowned library serves as focal point for China studies,Anonymous.,29 Nov 2010
4839,Shining a light on fine diamond jewellery {hellip} and a lot of talent,Anonymous.,29 Nov 2010
4840,Table of contents,Anonymous.,29 Nov 2010
4841,93pc happy with their family lives,"Yuk-hang, Ng.",29 Nov 2010
4842,Alliance re-elects Szetodespite worsening health,Tanna Chong.,29 Nov 2010
4843,CR Cement embarks on expansion course Lending curbs not stopping mainland company from doubling production capacity,Toh Han Shih.,29 Nov 2010
4844,HK banks urged to offer green mortgages Building council wants overseas lending practices on energy-efficient homes adopted,"Wong, Olga.",29 Nov 2010
4845,Mainlanders lose faith in mutual funds,Daniel Ren in Shanghai.,29 Nov 2010
4846,Nature lovers,Anonymous.,29 Nov 2010
4847,"Two businesses help put people to work Canteen, gift products firm create opportunities","Lee, Ada.",29 Nov 2010
4848,"KMT may cool slightly towards mainland Rising support for DPP in Taiwan could slow cross-strait exchanges a bit, analysts say",Lawrence Chung in Taipei.,29 Nov 2010
4849,Shooting victim recovering after surgery on face,Anonymous.,29 Nov 2010
4850,Beijing: Pinyin names system in works,Anonymous.,29 Nov 2010
4851,Expanding overseas investment will boost competitiveness China Briefing,"Wang, Xiangwei.",29 Nov 2010
4852,Aaron Smith Managing director Superfund Financial,Anonymous.,29 Nov 2010
4853,Alvin Miu Group chief financial and operational officer MF Jebsen Group,Anonymous.,29 Nov 2010
4854,Ashley Young Banking partner Allen & Overy,Anonymous.,29 Nov 2010
4855,"Baldwin Cheng Partner, global banking White & Case",Anonymous.,29 Nov 2010
4856,"Charlie Wilson Partner, global mergers and acquisitions White & Case",Anonymous.,29 Nov 2010
4857,Climate talks a stepping stone to new deal Delegates meet for UN's Cancun conference without much hope of progress on big issues,Shi Jiangtao in Beijing.,29 Nov 2010
4858,Cody Szeto Consulting manager Kelly Selection Hong Kong,Anonymous.,29 Nov 2010
4859,"Dickon Purvis Vice-president, strategic marketing and business development ThyssenKrupp Elevator Asia Pacific",Anonymous.,29 Nov 2010
4860,"Dong Chen General manager, China Hoffman Agency",Anonymous.,29 Nov 2010
4861,EuroSibEnergo to put US$2.85b into expansion,"Ng, Eric.",29 Nov 2010
4862,"Hou Yang Assistant vice-president, local trading Citi",Anonymous.,29 Nov 2010
4863,"Mayda Jutahkiti General manager, Singapore Hoffman Agency",Anonymous.,29 Nov 2010
4864,Rance Lan Vice-president Citi,Anonymous.,29 Nov 2010
4865,"Shingo Nomura Vice-president, North Asia Hoffman Agency",Anonymous.,29 Nov 2010
4866,Touch of home profitable for BEA in London Bank finds niche market in UK,Enoch Yiu in London.,29 Nov 2010
4867,"Wendy Wang Wenjun Assistant vice-president, bond sales Citi",Anonymous.,29 Nov 2010
4868,"Yuji Ogiwara Partner, global commercial litigation White & Case",Anonymous.,29 Nov 2010
4869,"For outspoken TV host, even officials are not off-limits","Zuo, Mandy.",29 Nov 2010
4870,In Brief,Anonymous.,29 Nov 2010
4871,Attraction of property as an investment begins to fade,"Gonsalves, Christine.",29 Nov 2010
4872,"Investors are trapped in no-man's land In these uncertain times, financiers are watching the world's two biggest economies for signs of what opportunities 2011 may bring, writes Mukul Munish",Anonymous.,29 Nov 2010
4873,"Managers bullish on emerging markets Being in growth regions and having lots of liquidity are viewed as grounds for optimism, writes Christine Gonsalves",Anonymous.,29 Nov 2010
4874,Price wobble clouds short-term outlook for commodities,Anonymous.,29 Nov 2010
4875,"Shift from 'bonds to equity' Intense market volatility is causing uneasy investors to change course, writes Christine Gonsalves",Anonymous.,29 Nov 2010
4876,Mainland must learn from its painful lesson,Anonymous.,29 Nov 2010
4877,Measures to cool property market flawed,Anonymous.,29 Nov 2010
4878,Planned projects on both sides of harbour ensure congestion,Anonymous.,29 Nov 2010
4879,Price rise,Anonymous.,29 Nov 2010
4880,Rule-breaking schools set the wrong example,Anonymous.,29 Nov 2010
4881,Corruption takes shine off dazzling growth,"Kumar, Hari.",29 Nov 2010
4882,"Leighton Asia chief gets the most from his team Working together is what matters, Australian says","Ng, Eric.",29 Nov 2010
4883,Shooting down some common misconceptions about the HK$,Anonymous.,29 Nov 2010
4884,Arts,Anonymous.,30 Nov 2010
4885,Bias watchdog probes MTR over sick worker,"Wong, Martin.",30 Nov 2010
4886,Bookbuilding begins for bank's HK share sale,Daniel Ren in Shanghai.,30 Nov 2010
4887,Businesses face social challenges,Anonymous.,30 Nov 2010
4888,Cathay flight makes emergency landing Plane diverted to Kazakhstan after losing pressure,"Parry, Simon.",30 Nov 2010
4889,Catholic clergy face crucial choiceMainland clergy face crisis of conscience,"Leung, Ambrose.",30 Nov 2010
4890,City,Anonymous.,30 Nov 2010
4891,Correction,Anonymous.,30 Nov 2010
4892,Courts,Anonymous.,30 Nov 2010
4893,ESF chief admits levy could have been avoided,"Heron, Liz.",30 Nov 2010
4894,Health care,Anonymous.,30 Nov 2010
4895,Justice puts a cork in the case against champagne activist,"Leung, Ambrose.",30 Nov 2010
4896,Legal disputes,Anonymous.,30 Nov 2010
4897,Logistics blaze,Anonymous.,30 Nov 2010
4898,Macau,Anonymous.,30 Nov 2010
4899,"MPF failing to deliver, says authority chief","Wong, Martin.",30 Nov 2010
4900,National,Anonymous.,30 Nov 2010
4901,NEWS SECTION A; scmp.com today; CITY.LIFE.SPORT SECTION C; BUSINESS SECTION B,Anonymous.,30 Nov 2010
4902,The past is gone -- spending HK's cash won't bring it back,with Jake van der Kamp jake.vanderkamp@scmp.com.,30 Nov 2010
4903,Property,Anonymous.,30 Nov 2010
4904,Shipping,Anonymous.,30 Nov 2010
4905,Sport,Anonymous.,30 Nov 2010
4906,Sports stars state the case for 2023 Asian Games bid Athletes' plea for major event fails to sway lawmakers,"Wan, Adrian.",30 Nov 2010
4907,"After Cartier's two-day store-opening bash, we definitely like our parties on the rocks",Anonymous.,30 Nov 2010
4908,Barrister found guilty of stealing HK$350 bra,"Man, Joyce; Simpson, Cheung.",30 Nov 2010
4909,Competition bill to have sample guidelines,Tanna Chong.,30 Nov 2010
4910,"Director entitled to see minutes, court told","Man, Joyce.",30 Nov 2010
4911,Drivers held at school,"Mok, Danny.",30 Nov 2010
4912,EuroSibEnergo offering is delayed,Anonymous.,30 Nov 2010
4913,Events,Anonymous.,30 Nov 2010
4914,Happy chappy,Anonymous.,30 Nov 2010
4915,Happy inside?,Anonymous.,30 Nov 2010
4916,"Hermes writes its own fairytale with lavish soiree at Shaw Studios, complete with merry-go-round",Anonymous.,30 Nov 2010
4917,IPO Corner,Anonymous.,30 Nov 2010
4918,Legal dispute hangs over China New Materials share sale,Toh Han Shih.,30 Nov 2010
4919,MIE targets HK$1.4b in IPO,"Lee, Amanda.",30 Nov 2010
4920,Second valve issue for Cathay,"Parry, Simon; Kang-chung, Ng.",30 Nov 2010
4921,The smiling faces of executive rivalry,Anonymous.,30 Nov 2010
4922,Social worker's trial for rape opens,"Man, Joyce.",30 Nov 2010
4923,Spot checks sought on audio recordings,"Tsang, Phyllis; Simpson, Cheung.",30 Nov 2010
4924,Stamp duty riles agents,"Leung, Paggie; Eng, Dennis.",30 Nov 2010
4925,Table of contents,Anonymous.,30 Nov 2010
4926,Chain sees costs rising HK$120m,"Sun, Celine.",30 Nov 2010
4927,Children to get the gift of a smile About 300 youngsters on the mainland to benefit from surgery,"Lam, Lana.",30 Nov 2010
4928,Confident ICBC aims for HK$52b from rights issue Bank is on target to meet new ratios,"Chen, Lulu.",30 Nov 2010
4929,"Education chief admits 'poor job' of checks on DSS schools Malpractice is a historical problem, Michael Suen tells hearing","Yau, Elaine.",30 Nov 2010
4930,Home Credit China wins licence to extend business on the mainland,Jane Cai in Beijing.,30 Nov 2010
4931,In Brief,Anonymous.,30 Nov 2010
4932,Li flagships buy two mainland sites,"Sito, Peggy.",30 Nov 2010
4933,Retail,Anonymous.,30 Nov 2010
4934,Season of light,Anonymous.,30 Nov 2010
4935,Technology,Anonymous.,30 Nov 2010
4936,Why we must have checks and balances,ANALYSIS Liz Heron.,30 Nov 2010
4937,Bustling London feels anything but a city facing biting austerity plans White Collar,"Yiu, Enoch.",30 Nov 2010
4938,Lower-tier stocks in demand amid rally,"Westra, Nick.",30 Nov 2010
4939,Seven pupils severely injured in stampede to school playground,Zhuang Pinghui.,30 Nov 2010
4940,Shipping market buoyant despite mainland crackdown Carriers little affected by moves on speculation in commodities,"Wallis, Keith.",30 Nov 2010
4941,SiS sells core business to Jardine unit,"Perez, Bien.",30 Nov 2010
4942,A touch of Red Army hardship to train cadres,"Li, Raymond.",30 Nov 2010
4943,"Yuan may rise 5pc a year and top 30pc in five years, Ulrich says",Ed Zhang in Beijing.,30 Nov 2010
4944,Beijing acts to contain the spread of Aids Free HIV tests for mums-to-be among controls,"Chi-yuk, Choi.",30 Nov 2010
4945,Dissident vows to fight on after 12 years in jail,"Yu, Verna.",30 Nov 2010
4946,Beijing: Teachers sacked for abusing child,Anonymous.,30 Nov 2010
4947,"For new recruits, PLA is their one true love As more graduates join the army, many find relationships are falling by the wayside","Chan, Minnie.",30 Nov 2010
4948,Bookies may be behind shooting at KMT rally,Lawrence Chung in Taipei.,30 Nov 2010
4949,Two foreign freighters collide off Shandong,"Chi-yuk, Choi.",30 Nov 2010
4950,HK's greenhouse gas proposals will be ineffective and expensive,Anonymous.,30 Nov 2010
4951,Providing a meaningful learning experience,Anonymous.,30 Nov 2010
4952,Toxic wasteland hardly the place for universities,Anonymous.,30 Nov 2010
4953,Dangerous silence Greg Torode,greg.torode@scmp.com.,30 Nov 2010
4954,"Leaks could wreck trust in governments, Chinese experts say","Zhai, Ivan.",30 Nov 2010
4955,54 arrested in raids across city as police target triad kingpins,"Lo, Clifford.",01 Dec 2010
4956,Acquisitions,Anonymous.,01 Dec 2010
4957,Business,Anonymous.,01 Dec 2010
4958,Business: [1],Anonymous.,01 Dec 2010
4959,Cathay Mayday was second on same planeSecond Mayday on same plane,"Parry, Simon.",01 Dec 2010
4960,China innew pushfor talks onN Korea China in new push for N Korea talks Beijing unlikely to get six-nation talks going,Greg Torode in Seoul; Ng Tze-wei in Beijing.,01 Dec 2010
4961,CityU scholarship honours brave student,"Yau, Elaine.",01 Dec 2010
4962,"Confusion for buyers of Chinese medicine Registration law starts, but delay for labelling","Yuk-hang, Ng.",01 Dec 2010
4963,Courts: [1],Anonymous.,01 Dec 2010
4964,Courts,Anonymous.,01 Dec 2010
4965,Golden years from casino boom over for Macau,"Liu, Yvonne.",01 Dec 2010
4966,Health,Anonymous.,01 Dec 2010
4967,HK & Delta,Anonymous.,01 Dec 2010
4968,HK sets date for inquest into Manila bus drama,"Simpson, Cheung; Tsang, Phyllis.",01 Dec 2010
4969,"HK's hot market drops to freezing point Home sales fall to lowest level in months, as players digest government curbs","Leung, Paggie.",01 Dec 2010
4970,A licence to sell,Anonymous.,01 Dec 2010
4971,Mechanism to set delta wage floor urged HK bosses based in Guangdong want pay guidelines to be 'transparent and predictable',"Tsang, Denise.",01 Dec 2010
4972,NEWS SECTION A; scmp.com today; CITY.LIFE.SPORT SECTION C; BUSINESS SECTION B,Anonymous.,01 Dec 2010
4973,No move,Anonymous.,01 Dec 2010
4974,Property,Anonymous.,01 Dec 2010
4975,Rush as second HK yuan bond issue launched,"Chen, Lulu.",01 Dec 2010
4976,Sport,Anonymous.,01 Dec 2010
4977,Technology,Anonymous.,01 Dec 2010
4978,US security plans threaten HK air cargo hub Security plans threaten HK role as air cargo hub,"Wallis, Keith.",01 Dec 2010
