,title,byline2
0,A blooming success in Tian'anmen,01 Oct 2013
1,Li praises foreign experts for contribution,01 Oct 2013
2,74 fishermen missing as typhoon sweeps South China Sea,01 Oct 2013
3,FTZ 'negative list' defines maximum opening possibilities,01 Oct 2013
4,IN BRIEF (Page 2),01 Oct 2013
5,Premier vows to deepen reform,01 Oct 2013
6,Floral firms wither in face of policy change,01 Oct 2013
7,IN BRIEF (Page 4),01 Oct 2013
8,A love affair with African gem stones,01 Oct 2013
9,Tales of two countries,01 Oct 2013
10,Asia's Geriatric City?,01 Oct 2013
11,Behind all this meddling,01 Oct 2013
12,"Challenges, opportunities",01 Oct 2013
13,Let's liberate Central instead,01 Oct 2013
14,"Prudential regulation, not price management in housing market",01 Oct 2013
15,Artists talk about life on NY's streets,01 Oct 2013
16,Sky-high ambition on a plate,01 Oct 2013
17,Mulling a mall move,01 Oct 2013
18,Paragons of pleasure,01 Oct 2013
19,It's great to be back in Beijing,01 Oct 2013
20,Score board,01 Oct 2013
21,Impasse in Congress shuts down services,02 Oct 2013
22,Travel becomes passport to a new look,02 Oct 2013
23,IN BRIEF (Page 2),02 Oct 2013
24,Leaders study at 'Silicon Valley',02 Oct 2013
25,Manufacturing field shows positive growth,02 Oct 2013
26,Search for fishermen continues,02 Oct 2013
27,Tour guides face fines if they make clients shop,02 Oct 2013
28,"It's relatively painless, says bartender",02 Oct 2013
29,Students go under the knife in search for better jobs,02 Oct 2013
30,IN BRIEF (Page 4),02 Oct 2013
31,Market strategist eyes China's rising taste for luxury,02 Oct 2013
32,Master of his craft,02 Oct 2013
33,Portrait of an amateur Waltz dancer,02 Oct 2013
34,Market in antiques booms in Shanghai,02 Oct 2013
35,Virtual learning broadens horizon,02 Oct 2013
36,China aims for high fashion,02 Oct 2013
37,The charms of Provence,02 Oct 2013
38,Museum tells true story of lavender,02 Oct 2013
39,"Small towns offer beauty, variety Valensole",02 Oct 2013
40,Score board,02 Oct 2013
41,I will continue to stay positive,02 Oct 2013
42,QB Freeman says he has ADHD,02 Oct 2013
