,title,byline2
0,Day honors nation's martyrs,01 Oct 2014
1,MFA reiterates opposition to foreign interference in HK,01 Oct 2014
2,Opposition losing its grip on protests: Analysts,01 Oct 2014
3,Director's wife posts family photo to take focus off rumors,01 Oct 2014
4,Premier welcomes experts,01 Oct 2014
5,Top designer thrilled with Friendship Award,01 Oct 2014
6,History of the heart,01 Oct 2014
7,Positive energy for future,01 Oct 2014
8,Role of Kuomintang veterans recognized,01 Oct 2014
9,Man pleads not guilty in Canada dismemberment trial,01 Oct 2014
10,Protests endanger life and limb,01 Oct 2014
11,Tang: 'Occupy' surely unlawful,01 Oct 2014
12,Young students seen most in major occupied location,01 Oct 2014
13,Agent of change,01 Oct 2014
14,Beer hug,01 Oct 2014
15,Hong Kong's distribution services and logistics disrupted by 'Occupy',01 Oct 2014
16,"Police task weary, thankless job",01 Oct 2014
17,Protesters rapped for obstructing public transport services,01 Oct 2014
18,Golden age for the 'everyday' photographer,01 Oct 2014
19,HK is paying the price,01 Oct 2014
20,"'No matter the size of the animals, they are like children'",01 Oct 2014
21,Beware of foreign meddling,01 Oct 2014
22,HK police used tear-gas to provide safety for all,01 Oct 2014
23,Moving day at the zoo a cagey business,01 Oct 2014
24,Parcel delivery of live animals criticized,01 Oct 2014
25,Protesters are to blame for the 'Occupy Central' chaos,01 Oct 2014
26,Regime change is the real aim of protesters,01 Oct 2014
27,A booming outbound tourism,01 Oct 2014
28,Driving tourism in Canada,01 Oct 2014
29,If you go,01 Oct 2014
30,Entrepreneur bets on horse success,01 Oct 2014
31,Biking brand's road to China's fast lane,01 Oct 2014
32,High on the hog,01 Oct 2014
33,Motorcycle industry asks to switch gears,01 Oct 2014
34,China Art Industry Expo underway in Beijing,01 Oct 2014
35,If you go,01 Oct 2014
36,The rise of Tongzhou,01 Oct 2014
37,Wide-ranging display of creativity,01 Oct 2014
38,Crowds welcome National Day,02 Oct 2014
39,Sharing the Chinese dream,02 Oct 2014
40,"Agency: Facebook, YouTube refuse to delete terror material",02 Oct 2014
41,IN BRIEF (Page 2),02 Oct 2014
42,Tidbits,02 Oct 2014
43,Attackers turned defenders,02 Oct 2014
44,Clouds of suspicion,02 Oct 2014
45,Government websites at risk,02 Oct 2014
46,'Occupy Central' campaign must cease immediately,02 Oct 2014
47,'Occupy' protests have opened Pandora's box,02 Oct 2014
48,'Occupy' takes toll on society,02 Oct 2014
49,Protests will leave deep scars in Hong Kong SAR,02 Oct 2014
50,Ancient tradition of making knives still survives,02 Oct 2014
51,Authentic paste maker fears loss of traditional technique,02 Oct 2014
52,Expat in China designs phone app for easy language pickup,02 Oct 2014
53,Helping to keep the peace,02 Oct 2014
54,Gadgets,02 Oct 2014
55,Wearable devices aim to get a grip,02 Oct 2014
56,Sichuan Opera discovers the world's a stage,02 Oct 2014
57,Stage star helps raise style to new level,02 Oct 2014
58,Where the past is a lesson for the future,02 Oct 2014
59,Nutritional supplements a thriving market,02 Oct 2014
60,Weight-control sector gains as income rises,02 Oct 2014
61,Place of pilgrimage,02 Oct 2014
62,Radiating from the center,02 Oct 2014
63,Chance to tuck into tasty treats,02 Oct 2014
64,Nanning ready for gymnastics championships,02 Oct 2014
65,Volunteers vital to event's success,02 Oct 2014
