,title,byline,dates
401,Port measures strike at 90 ships Operator estimates impact of dockers' walkout on cargo arrivals if action continues to April 21,"Siu, Phila; Wallis, Keith; Chong, Dennis.",10-Apr-13
402,"Prices fall as buyers stay away After weeks of holding out, homeowners are beginning to drop their prices, with about one in 10 shaving 5 to 10 per cent off to get a sale","Leung, Paggie.",10-Apr-13
403,Rolls-Royce looks beyond China for growth engine Carmaker's interest turns to Japan and new markets as luxury sales slow on the mainland,"Lam, Anita.",10-Apr-13
404,Slower food price rises cool inflation Reduced pace of price increases may prove short-lived as pig deaths set to push cost of pork higher and workers' wages continue to rise,Jane Cai in Beijing xuejun.cai@scmp.com.,10-Apr-13
405,"Talks will take time, strike chief says","Siu, Phila; Lee, Ada.",10-Apr-13
406,Thatcher's HK role draws praise from around the nationThatcher's HK role draws praise Beijing expresses deep condolences to Britain as former PM's influence in China remembered,"Cary Huang in Beijing; Cheung, Gary; Cheung, Tony.",10-Apr-13
407,XI VOWS TO MAKE SEASSAFER FOR FISHERMEN President's surprise visit to fishing village and pledge of support for boat crews seen by analysts as strong warning to South China Sea neighbours,"Chan, Minnie.",10-Apr-13
408,"70pc frown on Occupy Central, DAB finds Poll by Beijing-loyal party reveals worries about the effects of civil disobedience","Lee, Colleen.",10-Apr-13
409,China alone cannot solve the crisis [Derived headline],,10-Apr-13
410,Crocs alert [Derived headline],,10-Apr-13
411,He's back: the rapid returnof 'Radio Stephen Shiu' Online broadcaster with a political mission follows shock closure with shock new online station - and an end to party financing,"Cheung, Tony.",10-Apr-13
412,"Mainland movie triumphs fail to lift studio's spirits Despite rising box-office takings, Huayi Brothers says the Chinese market is still not big enough to sustain domestic producers",Kwong Man-ki in Beijing phoenix.kwong@scmp.com.,10-Apr-13
413,"MY TAKEAnimals need care, not bureaucracy","Lo, Alex.",10-Apr-13
414,Obama sets out budget plan [Derived headline],,10-Apr-13
415,Today: Hong Kong Securities and Investment... [Derived headline],,10-Apr-13
416,"Trade group ties expose firms to antitrust suits Charles Rule and Joseph Bial, partners at Cadwalader, Wickersham & Taft, discuss Chinese companies doing business in the US","Rule, Charles; Bial, Joseph.",10-Apr-13
417,Chongqing back to business after Bo Western mega city sending biggest trade delegation yet to HK in wake of scandal,"Chen, George.",10-Apr-13
418,CUHK's movie software adds a depth of realism,"Choi, Christy.",10-Apr-13
419,Global brands pause as retail sales growth slows International store and restaurant chains scale back expansion on mainland as shoppers spend less and prime locations prove hard to find,"Liu, Yvonne.",10-Apr-13
420,Jackie Chan plan to move relics abroad raises roof,"Agence France-Presse; Mok, Danny.",10-Apr-13
421,"Live bird sales down as masks fly off the shelves Poultry sellers lament their loss in earnings, but the pharmacy owners aren't complaining","Tsang, Emily; Lo, Wei.",10-Apr-13
422,Man with a vision,"Choi, Christy.",10-Apr-13
423,New Christie's in Shanghai to pull rich investors Mainland rival seeks to challenge Hong Kong's art market as renowned auction house gets permit to open first wholly owned unit there,"Chen, George.",10-Apr-13
424,"Watchdog slams sale of data as deceitful Health centre's telemarketers used promise of check-ups to gather personal data, and then sold it to insurance broker as marketing tool","Simpson, Cheung.",10-Apr-13
425,"56 Plantation Road, The Peak",,10-Apr-13
426,Appetite fades for corporate purchases Survey shows lower interest among HK firms for growth through acquisition,"Chan, Ray.",10-Apr-13
427,Carmakers gain as bird flu fears hit public transport,"Yu, Jeanny.",10-Apr-13
428,Duty visits of ex-ICAC chief put under spotlight Timothy Tong spent three times the amount that his predecessors did on official trips,"Lee, Colleen.",10-Apr-13
429,"Fitch cuts China'scredit score asdebt increases Global agency says rampant borrowing, local government financing are of growing concern",Toh Han Shih hanshih.toh@scmp.com.,10-Apr-13
430,Growth forecast to rise in emerging Asia Asian Development Bank's annual outlook also sounds note of caution over inflation and asset bubble risks posed by strong capital inflows,Jane Cai in Beijing xuejun.cai@scmp.com.,10-Apr-13
431,New rules to weed out city's shady tour agents Operators will soon have to provide proof of hotel bookings for visitors to Hong Kong,"Nip, Amy.",10-Apr-13
432,Ocean film festival conjures up goddess of sharks,"Lam, Lana.",10-Apr-13
433,"Onshoring trend is overhyped, say shipping chiefs",Keith Wallis in Singapore keith.wallis @scmp.com.,10-Apr-13
434,Property developers question new law Employees say rules banning on-the-spot price cuts to tempt buyers could hurt sales,"Ng, Joyce.",10-Apr-13
435,Q: I'm renting a three-bedroom flat at City... [Derived headline],,10-Apr-13
436,Status: An unincorporated territory of the United States [Derived headline],,10-Apr-13
437,"Tough taskto push for workhours law Committee to look into possible legislation on the issue, but its members are already bracing for strong opposition from business community","Chan, Thomas; Siu, Phila.",10-Apr-13
438,China Gogreen fires up solar investment plan,"Ng, Eric.",10-Apr-13
439,Chinalco Mining bullish despite copper price fall Resources giant's optimism about metal's prospects runs counter to analysts' forecasts of a supply surplus on global market this year,"Ng, Eric.",10-Apr-13
440,CPM sees stable growth in gold prices,"Man-ki, Kwong.",10-Apr-13
441,Tao Heung boosts mainland appetite Cantonese restaurant chain plans to open more outlets to focus on the growing middle class,"Man-ki, Kwong.",10-Apr-13
442,Futures traders left cold by new evening session Transaction volumes may remain thin for some time amid lack of interest and short US overlap,"Yu, Jeanny.",10-Apr-13
443,"Pressure to end live-poultry trade As death toll from H7N9 bird flu rises to nine, with 20 others infected, Shanghai considers permanent ban on selling birds in wet markets",Zhuang Pinghui pinghui.zhuang@scmp.com.,10-Apr-13
444,"Responses to Siew, Lien trips reveal Ma's thinking Hailing of one, shunning of other after their visits to mainland reflect strategy of developing trade relations while eschewing political talks","Chung, Lawrence.",10-Apr-13
445,Rival celebrity diving shows fail to make a splash Media and bloggers criticise the reality specials that force contestants to perform risky stunts,"Kao, Ernest.",10-Apr-13
446,The speed may not have caught up... [Derived headline],,10-Apr-13
447,Study shows faster flu virus mutation,"Chen, Stephen.",10-Apr-13
448,World gets to see brothers' 65-day bike adventure,"Chiu, Joanna.",10-Apr-13
449,Beijing faces dilemma in Korean crisis Leadership will not abandon Pyongyang but giving Kim Jong-un free rein is not an option. China and the US may try to contain him,"Ng, Teddy.",10-Apr-13
450,Jaywalkers face spot fines [Derived headline],,10-Apr-13
451,Iron Lady quickly ditched her principles if politics demanded Margaret Thatcher was not afraid of executing policy U-turns when it came to economic doctrine and avoiding some damaging headlines,,10-Apr-13
452,Rolls-Royce's new ultra-luxury car wraithed in hyperbole [Derived headline],,10-Apr-13
453,"working For all the talk of an economic rebound in the US, the jobless rate remains stubbornly high. It's time policymakers fix the broken American dream Unemployment isn't","Rafferty, Kevin.",10-Apr-13
454,"'Supreme realist' did her best for HK, Wilson says Former governor recalls Thatcher's strong belief in the city's free market and her determination to preserve its way of life","Cheung, Gary.",10-Apr-13
455,Could we use some Thatcher?,,10-Apr-13
456,It is not unreasonable to require patriotism from chief executive,,10-Apr-13
457,On top officials' seven-year plan... [Derived headline],,10-Apr-13
458,Politicised strike muddies waters,,10-Apr-13
459,Street fight,,10-Apr-13
460,"Thatcher not only changed UK, but world [Derived headline]",,10-Apr-13
461,"70pc chance of war, says analyst Leading Chinese expert on North Korea sounds warning as tensions rise and tours are cancelled","Ng, Teddy.",11-Apr-13
462,Bocom chairman to take control at policy bank Finance veteran and reformer expected to lend China Development Bank's backing to a wider range of companies looking to expand overseas,"Jane Cai in Beijing; Chen, George.",11-Apr-13
463,Carson Yeung to ask for permanent stay [Derived headline],,11-Apr-13
464,Ex-railways chief chargedwith bribery in potential prelude to Bo Xilai trial,"Zhai, Keith.",11-Apr-13
465,Fitch takes power firms downa notch Agency downgrades credit rating of mainland SOEs and resources companies,"Ng, Eric.",11-Apr-13
466,Hengli soars after Wanda takeover,"Yu, Jeanny.",11-Apr-13
467,"How HK$500 m manhunt led to a new Gigi Chao After her father's dowry offer became a global sensation, the low-key executive was forced out of the closet - emerging as a powerful activist","Chiu, Joanna.",11-Apr-13
468,Japan-Taiwan fishing deal angers Beijing [Derived headline],,11-Apr-13
469,Mirae Asset Securities to quit HK Local brokerage unit of South Korean giant is latest casualty of industry cull in weak market,"Chen, George.",11-Apr-13
470,Modern living,,11-Apr-13
471,Shipping changes starting to take bite out of strike Sunkist oranges still in short supply but route diversions closer to HK are starting to bear fruit,"Nip, Amy; Lee, Ada.",11-Apr-13
472,3G spectrum battle down to the wire City's leading mobile operators have until the end of today to make their arguments against the government's planned bandwidth carve-up,"Perez, Bien.",11-Apr-13
473,Chinese carmakers still stuck in slow lane on R&D,"Lam, Anita.",11-Apr-13
474,City continues to enjoy tremendous growth,"Chan, Keith.",11-Apr-13
475,Consultation on phone plan ends [Derived headline],,11-Apr-13
476,It would send a clear warning that North Korea... [Derived headline],,11-Apr-13
477,MY TAKEOld master Thatcher's lesson in realism,"Lo, Alex.",11-Apr-13
478,Refiner says cheap US gas threatens local industry,"Ng, Eric.",11-Apr-13
479,Speaking may go down better than shouting [Derived headline],ALL AROUND TOWN.,11-Apr-13
480,That's a wrap [Derived headline],,11-Apr-13
481,"Thumbing a lift home - from Berlin Adam Shek is about to set off on an epic five-month journey from Germany to Hong Kong, and he plans to hitch-hike all the way","So, Peter.",11-Apr-13
482,Today: Canadian Chamber of Commerce lunch... [Derived headline],,11-Apr-13
483,Two deny beating photographer,"Lau, Stuart.",11-Apr-13
484,VAT trial to go national in drive to boost business State Council talks up new tax regime despite experiment's poor initial result in Shanghai,Daniel Ren in Shanghai ren.wei@scmp.com.,11-Apr-13
485,Wheelock pays HK$2.5b for Tseung Kwan O site,"Liu, Yvonne.",11-Apr-13
486,"Agency cuts ratings on power, resources firms","Ng, Eric.",11-Apr-13
487,ANGER ATLEAKS ONTAX HAVENCOMPANIES Government of British Virgin Islands calls journalists' investigation 'illicit' as European countries adopt action plan against tax evasion,Toh Han Shih hanshih.toh@scmp.com.,11-Apr-13
488,City's concert venues 'too small' for Madonna,"Nip, Amy; Chiu, Joanna.",11-Apr-13
489,"Danger lurks in China's shadow banks, says Fitch Agency warns mainstream lenders are at risk from complex web of dependence on dicey loans",Jane Cai in Beijing xuejun.cai@scmp.com.,11-Apr-13
490,Data on exports raises capital inflow concerns 'Puzzling' trade figures prompt questions over whether spike in shipments to HK shows foreign exchange influx into mainland,Victoria Ruan in Beijing victoria.ruan@scmp.com.,11-Apr-13
491,"Democrat's poll planmeets poor reception Founding father Martin Lee puts forward idea of fielding five candidates for chief executive race, but the proposal gains little support","But, Joshua.",11-Apr-13
492,Fears blockade plan may end in bloodshed Ex-policy adviser sees no room for compromise in increasingly tense debate on electoral reform,"Cheung, Tony; But, Joshua.",11-Apr-13
493,Home sales plunge into deep freeze Tough new cooling measures send chill through the mainland market for second-hand flats,"Li, Sandy.",11-Apr-13
494,"Manslaughter trial for boat captainsCaptains to be charged today over boat deaths Skippers of the Lamma IV and the Sea Smooth will appear in court today over their role in Hong Kong's deadliest sea tragedy in decades, which left 39 dead","Simpson, Cheung.",11-Apr-13
495,Smiling in the rain,,11-Apr-13
496,"Talks to end strike complicated by rival unions Contractors meet one camp, then hold separate negotiations after lunch","Siu, Phila; Lee, Ada.",11-Apr-13
497,China Railway project hits snag Work on link halted as Venezuelan government runs out of funds to pay US$7.5 billion contract,Toh Han Shih hanshih.toh@scmp.com.,11-Apr-13
498,Decision to remove boy's oxygen tube 'not wrong',"Chan, Thomas.",11-Apr-13
499,"Fuel cost key to survival, says Swire Hughes-Hallett sees offshore vessels business as 'perfect hedge' to airline industry with high oil prices driving exploration and development",Keith Wallis in Singapore keith.wallis@scmp.com.,11-Apr-13
500,"Institutes must think global to stand out City's universities should recruit students and staff beyond the mainland, says expert as HKU takes third place in Asian institutions ranking","Chong, Dennis.",11-Apr-13
501,Jailhouse rock,"Tam, Johnny.",11-Apr-13
502,Politics rears head in HKDSE exam Liberal studies paper challenges pupils' views on city's democracy battle and filibuster tactics,"Chong, Dennis.",11-Apr-13
503,Softening market in Europe clouds industry prospects Hactl records decline in March air cargo shipments and expects little growth for year,"So, Charlotte.",11-Apr-13
504,Telecom boss denies calling TVB 'shallow' City Telecom chairman says he used the word 'easy' in an interview with local newspaper,"Chiu, Austin.",11-Apr-13
505,Top barrister clears up 'misunderstanding' with mum,"Mok, Danny.",11-Apr-13
506,Wife dies in stabbing at busy restaurant Woman received multiple wounds in attack at eateryduring dinner hour,"Mok, Danny.",11-Apr-13
507,Livestock ban as virus spreads City tells residents to cull their domestic animals by Tuesday to stem spread of H7N9 as five more bird flu cases are confirmed,Zhuang Pinghui pinghui.zhuang@scmp.com.,11-Apr-13
508,"Pollution devastates rural areas, threatens farmland Official says improper sewage treatment, high rate of fertiliser waste risks agricultural land","Zuo, Mandy.",11-Apr-13
509,Probe into carmaker's missing billions,"Li, Jing.",11-Apr-13
510,Zao's works bridged east and west Tributes paid to Chinese-French abstract painter who has died aged 93,"Chow, Vivienne.",11-Apr-13
511,Concrete test result shocks flat owners Jiayu Garden residents voice alarm that the salt level in their sample is just below Hong Kong's maximum limit and exceeds mainland findings,"Ng, Joyce; He Huifeng.",11-Apr-13
512,Visit by Iceland's gay PM hailed Activists' group invites Johanna Sigurdardottir and her wife for a chat over coffee during trip,"Li, Amy.",11-Apr-13
513,Fears growing aboutChinese credit bubble Fitch downgrade of China's local-currency rating amid the rapid rise in local government debt points to increased risk in financial system,,11-Apr-13
514,Suspended death sentence [Derived headline],,11-Apr-13
515,Why are London barristers calling Hong Kong Treasure Island? [Derived headline],,11-Apr-13
516,Japan ramps up defences as H7N9 concerns mount Introduction of emergency legislation brought forward amid raft of public health measures,Julian Ryall in Tokyo.,11-Apr-13
517,Offshore links of Malaysia's rich Journalism group finds evidence of politicians and their families involved in offshore havens that may impact on May 5 elections,Toh Han Shih; Agence France-Presse.,11-Apr-13
518,Mission accomplished for female astronaut,"Chan, Keith.",11-Apr-13
519,HK trails Singapore by any measure of development,,11-Apr-13
520,Incinerator will raise risk of collisions [Derived headline],,11-Apr-13
521,Myanmar must not gag media,,11-Apr-13
522,Poverty trap,,11-Apr-13
523,Time to listen to voices of reason,,11-Apr-13
524,"Another 1,700 international school placesThree new sites boost school places Three new sites allocated, but legislators accuse the government of catering only to the wealthy","Chong, Dennis; Lee, Ada.",12-Apr-13
525,Bird flu seen as curb on inflationBird flu seen as curb on inflation CPI growth expected to ease as mainlanders stop buying chicken and pork products,Daniel Ren in Shanghai ren.wei@scmp.com.,12-Apr-13
526,Legal bill may go upby 68 pc for losers Law Society makes the case for a hefty increase in hourly rates of solicitors when it comes to calculating costs to be paid by the losing party,"Moy, Patsy.",12-Apr-13
527,Mainlandlenders pump up fund flow Boost to country's money supply brightens outlook for economy but poses dilemma for Beijing as inflation threatens to slip its leash,Jane Cai in Beijing xuejun.cai@scmp.com.,12-Apr-13
528,Martin Lee in U-turnover C.E. poll reform Democrat apologises to his supporters as he withdraws controversial proposal to allow five candidates to run for chief executive in 2017,"But, Joshua.",12-Apr-13
529,New flat supply set for 8-year high,"Li, Sandy; Leung, Paggie.",12-Apr-13
530,Quake bribes scandal heading to court [Derived headline],,12-Apr-13
531,"Seven injured in Ap Lei Chau apartment blaze Fire crew takes three hours to extinguish the flames, saying faulty hydrants are to blame","Simpson, Cheung.",12-Apr-13
532,Skippers each face 39 counts of manslaughter,"Chan, Thomas.",12-Apr-13
533,Students hope to talk their way to victory [Derived headline],,12-Apr-13
534,Tarantino's mainland debut chained,"Zhou, Laura.",12-Apr-13
535,Adventurers find insurance not best policy Travellers need to read the small print in documents to make sure they are covered for risky activities and visits to all countries,"Nip, Amy.",12-Apr-13
536,Balloon tragedy in Luxor is a timely reminder,"Nip, Amy.",12-Apr-13
537,"Fujian broker mulls HK float in expansion Faced with dwindling share trading income on the mainland, Industrial Securities is exploring overseas markets for new revenue sources",Daniel Ren in Shanghai ren.wei@scmp.com.,12-Apr-13
538,HK percussionist strikesthe right note in Germany,"Lam, Lana.",12-Apr-13
539,Lest we forget,,12-Apr-13
540,Live-in doll,,12-Apr-13
541,MY TAKEMartin Lee falls foul of the ideologues,"Lo, Alex.",12-Apr-13
542,Rape victim's mother seeks compensation [Derived headline],,12-Apr-13
543,Regular drinkers had first taste of alcohol early,"Man, Joyce.",12-Apr-13
544,Today: British Chamber of Commerce lunch [Derived headline],,12-Apr-13
545,Bell tolls for Amex concierge service End of personal assistance for Platinum credit card customers leaves issuer with less scope to differentiate itself from its bigger rivals,"Chen, George; Man-ki, Kwong.",12-Apr-13
546,City starts tests of mainland poultry Live imports will be stopped if health officials find the H7N9 virus in any of the livestock,"Lo, Wei.",12-Apr-13
547,"Contractors offer 7 pc pay rise Talks break down on second day after two employers fail to come close to strikers' demands, with one firm exiting meeting before it concluded","Siu, Phila.",12-Apr-13
548,"CY offers formula for mainland mums Chief executive, sympathising with parents' dilemma, suggests direct re-exports from HK","Chiu, Joanna; Nip, Amy.",12-Apr-13
549,Dalian Wanda seeking to boost status,"Sito, Peggy.",12-Apr-13
550,"Local character 'key to keeping HK's allure' Sustainable future as shopping destination depends on retail variety, consultant warns","Liu, Yvonne.",12-Apr-13
551,New rating system for lift service companies They will be divided into three categories based on safety and maintenance record,"Lo, Wei.",12-Apr-13
552,"Recall blow for Japan's carmakers on the mainland Checks on more than 32,000 vehicles over defective airbags likely to curb revival in sales","Lam, Anita.",12-Apr-13
553,"School to give backto the community Nord Anglia will offer lower fees and train local teachers,says director","Chong, Dennis; Lee, Ada.",12-Apr-13
554,TV code to be reviewed after bias complaints,"Nip, Amy.",12-Apr-13
555,"1984: Deng Xiaoping says ""a patriot is one who respects... [Derived headline]",,12-Apr-13
556,"Australia's top jobs get 11,000 HK applications","Man, Joyce.",12-Apr-13
557,Baptist U plans 'marathon speech' in battle for land Coalition wants to use delay tactic to block government from taking Renfrew Road site,"Kang-chung, Ng.",12-Apr-13
558,Developer challenges watchdog over dispute Long Winner Development calls for a judicial review of decisions made by Building Authority,"Chiu, Austin.",12-Apr-13
559,Divers take the plunge in new park programme,"Tam, Johnny.",12-Apr-13
560,Gigi wants parents to accept partner Cecil Chao's daughter tells youth forum she hopes family will recognise her 'other half' and calls on minorities to 'make people like them',"Ho, Jolie.",12-Apr-13
561,IMM faces fraud claim over 'bogus' customers Investigators linked to 'hacktivist' collective Anonymous point to two former executives,Toh Han Shih hanshih.toh@scmp.com.,12-Apr-13
562,Lenovo defies slump in computer sales Mainland tech giant maintains global market share in the first quarter while other leaders see theirs shrink amid 14 per cent fall in shipments,"Perez, Bien.",12-Apr-13
563,"Operators call for review of 3G spectrum plan HK's biggest network firm says government has not done its homework, warns of disruptions","Perez, Bien.",12-Apr-13
564,"Patriots, all, but divided on issue of one-party rule",,12-Apr-13
565,"Time to buy, StanChart tells local bargain-hunters","Yu, Jeanny.",12-Apr-13
566,"universal suffrage The meaning of the word patriotism seems straightforward, but not so in the debate on Hong Kong' s future, where it has a long history of flux The shifting foundation of","Cheung, Tony.",12-Apr-13
567,His wife said he seldom went out [Derived headline],,12-Apr-13
568,Leasing firm seeks to double portfolio ICBC Financial Leasing looks to foreign shipowners to raise the value of ship assets this year after signing 51-vessel agreement,Keith Wallis in Singapore keith.wallis@scmp.com.,12-Apr-13
569,Trial looms in Sichuan quake bribes scandal University party boss accused of taking kickbacks worth nearly 11 million yuan for reconstruction work after 2008 disaster,Choi Chi-yuk in Chengdu chiyuk.choi@scmp.com.,12-Apr-13
570,Banker praises Jiang Zemin's eye for e-biz China Development Bank chief's glowing article credits former leader for heralding two decades of progress on e-finance,Cary Huang in Beijing cary.huang@scmp.com.,12-Apr-13
571,Ex-railways chief hopes to avoid death penalty Wife of Liu Zhijun says husband was 'a good man who came home for dinner every night',"Li, Jing.",12-Apr-13
572,TV diet of anti-Japanesewar dramas criticised,"Kao, Ernest.",12-Apr-13
573,XI CALLS ON NAVY TO BE READY FOR STRUGGLE President inspects South Sea fleet and makes rallying call in latest display of military strength amid territorial disputes,"Ng, Teddy.",12-Apr-13
574,"Air quality in Beijing is second worst of 31 cities Lanzhou in Gansu has the worst conditions, says a green report based on government data, but Haikou is cleanest for residents to breathe","Chen, Stephen.",12-Apr-13
575,"Taiwan would 'expel' mainland fishing vessels After signing fishing-rights accord with Tokyo, Taipei warns coastguard will protect its zone","Chan, Minnie.",12-Apr-13
576,Thief claimed to be spy [Derived headline],,12-Apr-13
577,Fukushima is still in an extremely unstable... [Derived headline],,12-Apr-13
578,"The Shanghai rubber bubble of 1910 holds a lesson for today Speculative excess has a long pedigree, given how easily human desire for quick gains can overcome concerns about long-term profitability",,12-Apr-13
579,Tobacco and roadside pollution more dangerous than bird flu [Derived headline],,12-Apr-13
580,"If it can't be free and silent,... [Derived headline]",,12-Apr-13
581,China's limitedN Korea clout,,12-Apr-13
582,Confronting NT land rights will preserve fragile coastline,,12-Apr-13
583,Food security,,12-Apr-13
584,Private cars must follow clean air rules [Derived headline],,12-Apr-13
585,Stock tipsters need watching,,12-Apr-13
586,Children are born to swim Variety of courses cover a range of ages,"Kwok, Gary.",13-Apr-13
587,En+ set to start coal project with Shenhua in RussiaEn+ set to start coal project with Shenhua,Celine Sun in Beijing celine.sun@scmp.com.,13-Apr-13
588,Firemen defend Ap Lei Chau operationFiremen defend Ap Lei Chau operation,"Simpson, Cheung.",13-Apr-13
589,"Haven for 'hot cash' to set up base in HK British Virgin Islands, said to be world's No1 home for hidden assets and a key transit point for mainland money, picks city as its Asia hub",Toh Han Shih hanshih.toh@scmp.com.,13-Apr-13
590,Hospitals can cope with bird flu outbreak,"Kang-chung, Ng.",13-Apr-13
591,Liu Xiaobo relative faces long jail spell [Derived headline],,13-Apr-13
592,"Rooftop residents get special URA cash offer Thirteen families to get between HK$24,000 and HK$56,000 subsidy","Ng, Joyce.",13-Apr-13
593,"Shanghai exit for early investors As part of plans to become a global financial centre, the city mulls setting up secondary market to allow private equity funds to cash out",Daniel Ren in Shanghai ren.wei@scmp.com.,13-Apr-13
594,Tier-2 mainland cities face glut of office space Huge increase in supply likely to put developers under pricing pressure,"Sito, Peggy.",13-Apr-13
