,title,byline,dates
1080,"Shares in two mainland firms battered after reports Glaucus claims set off doubts on Prince Frog, while Huirong pressured over investigations",Toh Han Shih.,22-Nov-13
1081,"Stealth drone completessuccessful maiden flight Unmanned reconnaissance aircraft, which may help monitor disputed territory, latest example of country's fast improving military technology","Chan, Minnie.",22-Nov-13
1082,[ Payout over surgery... ],,22-Nov-13
1083,[ Activists to show why incinerator plan should be thrown out... ],,22-Nov-13
1084,[ Opportunity lost. ],,22-Nov-13
1085,[ Protection essential for rural enclaves... ],,22-Nov-13
1086,No time to toy with child safety,,22-Nov-13
1087,Parties knew rules but process not followed in TV licence vote,,22-Nov-13
1088,Time for the Fed to burst bubbles?,,22-Nov-13
1089,[ 'Slaves' called for help after watching TV show... ],,23-Nov-13
1090,[ Artist of the year: G-Dragon... ],,23-Nov-13
1091,[ Girl the second to die of infection in a week... ],,23-Nov-13
1092,[ Guns blazing How Johnson was inspired to demolish England in Ashes . ],,23-Nov-13
1093,[ Kowloon: 1869 Exhibition offers snapshot of life as it was then . ],,23-Nov-13
1094,[ Sea change The cancer patient navigating her way to sailing success . ],,23-Nov-13
1095,"Catch-22 situation looms over 2017 leadership poll Opponents of Beijing cannot be chief executive, but anyone legally qualified can run, says Li Fei","Cheung, Tony; Tanna Chong.",23-Nov-13
1096,"China gets set to launch crude oilfutures market New company is unveiled to operate a trading platform in the new Shanghai free-trade zone, with foreign investors expected to be welcome","Ren, Daniel.",23-Nov-13
1097,Filipinos flock to back their man Manny Macau title fight pulls in the local supporters and soccer's favourite son David Beckham,"Lee, Danny.",23-Nov-13
1098,HK patent lawyers get boost from mainland Opportunities galore across the border amid talent shortage in a booming IP market,"Lam, Anita.",23-Nov-13
1099,Housing plan on Fung Lok Wai wetland approved,"Wong, Olga; Chi-fai, Cheung.",23-Nov-13
1100,K-pop aims for the stars at music show Korean performers share the stage with global big names in bid to boost their international presence as they look towards the mainland,"Chow, Vivienne; Wee, Darren.",23-Nov-13
1101,Petro-king plans HK$381m upgrade Oil extraction equipment maker eyes fivefold increase in its annual manufacturing capacity,"Ng, Eric.",23-Nov-13
1102,Politicians a new breed of artful lodgers Politicians are forced to be new breed of artful lodgers,"Cheung, Tony.",23-Nov-13
1103,Swing free from commitment Free beginner lessons let you try out the dance,No byline.,23-Nov-13
1104,"Talks onI.T. pact collapse as China refuses to budge By failing to make concessions on products it wants protected, Beijing scuttles deal to remove tariffs for second time this year","Perez, Bien.",23-Nov-13
1105,[ Accenture B4... ],,23-Nov-13
1106,[ Donate online by credit card... ],,23-Nov-13
1107,"[ Monday, November 25: Hong Kong General Chamber of Commerce event: ""Sources of growth in an uncertain world"". ]",,23-Nov-13
1108,"[ NEWS (Section A): Leading the News A3 , Focus A4-5 ,... ]",,23-Nov-13
1109,"[ Sunday, Ming Pao Daily... ]",,23-Nov-13
1110,[ THE INSIDER: EY HEAD MARK WEINBERGER . ],,23-Nov-13
1111,"Disabled sailor is readyto push the boat out Sailability Hong Kong offered training, advice and a goal to reach for cancer patient Peace Chan. Now she has medals in her sights","Lo, Wei.",23-Nov-13
1112,MY TAKEPorn classic finds worthy translator,"Lo, Alex.",23-Nov-13
1113,Power firms agree to pass on 'bonus' profits,"Kao, Ernest.",23-Nov-13
1114,"American diplomat's wife denies he had affair Amid rumours about Gary Locke's exit, she says they will spend Thanksgiving in China","Meng, Angela.",23-Nov-13
1115,Brave Bin-Bin now accepts he is blind Six-year-old victim of horrific attack has new prosthetic eyes after successful surgery and is bearing up well despite traumatic event,"Tsang, Emily.",23-Nov-13
1116,Doctor has vendetta against me: transsexual Rights activist accuses psychiatrist of cutting ties with her after dispute at hospital,"Lam, Lana.",23-Nov-13
1117,Guangdong yet to submit free-trade zone proposal Official pledges to accelerate plan's drafting process after Shanghai FTZ set up in September,"Lau, Mimi.",23-Nov-13
1118,Kai Tak sites get taller towers to meet demand,"Wong, Olga.",23-Nov-13
1119,"Mark Six winner faces claim for years of rent Jagpal Singh hadn't paid rent since 1995, court hears, as he scraps bid for squatters' rights","Chu, Julie.",23-Nov-13
1120,Not to be sniffed at,,23-Nov-13
1121,"Oil pipeline blast kills at least 35 in Qingdao Leak triggers a huge explosion that tears up city's streets, causing cracks up to 1.5 kilometres long and a spill covering 3,000 square metres of sea",,23-Nov-13
1122,Online retailer may set upcargo airline E-commerce operator JD eyes freighter fleet to beat inadequate services on the mainland,"So, Charlotte.",23-Nov-13
1123,"Drilling beyond Local governments, under pressure to tackle chronic air pollution problems, are turning to shale gas to meet future energy demands conventional wisdom","Ng, Eric.",23-Nov-13
1124,Glorious buyout on the cards for Rongsheng founder,"Chiang, Langi.",23-Nov-13
1125,HK$1.7m of illegal cigarettes seized,"Lo, Clifford.",23-Nov-13
1126,Hog the limelight,"Zhao, Shirley.",23-Nov-13
1127,How to help banks conquer the new digital frontiers Consulting firm Accenture is assisting mainland banks in their bid to adapt to a world of apps and develop interactive digital services,"Perez, Bien.",23-Nov-13
1128,Lack of labour may delay rail opening,"Kao, Ernest.",23-Nov-13
1129,Li Fei offers more questions than answers Comments by the chairman of Beijing's Basic Law Committee are pored over by pundits and lawmakers ahead of a consultation exercise,"Tanna Chong; Cheung, Tony.",23-Nov-13
1130,"Writer captured snapshots of life Scottish adventurer John Thomson lugged his bulky wooden camera around Hong Kong and Qing-dynasty China, recording rare images","Chan, Candy.",23-Nov-13
1131,Beijing seeks digital sleuth to catch out photo fakery 'Official' images that are more fiction than fact prompt Beijing to seek a computerised judge,"Chen, Stephen.",23-Nov-13
1132,PLA toldto studyHu militarythinking Order seen as a move by President Xi Jinping to bolster legitimacy with armed forces,"Chan, Minnie.",23-Nov-13
1133,Shanghai parents balk at second child Planners may be disappointed as many couples say they cannot afford another mouth to feed,"Ren, Daniel.",23-Nov-13
1134,[ Cooking oil carcinogen... ],,23-Nov-13
1135,"Pact is not just fortrade, but peace: Ma Taiwan president says services agreement essential to show economic resolve to world and ensure continued peace across Taiwan Strait","Chung, Lawrence.",23-Nov-13
1136,[ Gentrification brings tensions to Kennedy Town... ],,23-Nov-13
1137,City's financial industry has high hopes for real reforms Top money men and women have given development council a blueprint for exploiting the big changes looming on mainland,"Yam, Shirley.",23-Nov-13
1138,Japanese group rejects 'comfort women' fears,"Ryall, Julian.",23-Nov-13
1139,Turbulence over laos dam plan Concern voiced by neighbouring countries over environmental impact of second Mekong project,"Fawthrop, Tom.",23-Nov-13
1140,[ Hard times. ],,23-Nov-13
1141,[ Public opinion being hijacked in HKTV saga... ],,23-Nov-13
1142,Power companiesmust now deliver,,23-Nov-13
1143,Stability at risk in hastily increasing foreign labour pool,,23-Nov-13
1144,Time for Abbott to apologise,,23-Nov-13
1145,"[ Chan Kit-ying , director of services at Mother's Choice... ]",,26-Nov-13
1146,[ Pipe blast blamed on human error... ],,26-Nov-13
1147,[ Trial date set for executive councillor... ],,26-Nov-13
1148,Clansmen get a leg-up at Sheung Shui school,"Zhao, Shirley.",26-Nov-13
1149,"First-round places 'harder to get' Cross-border children may be making it more difficult to get into North District schools, as discretionary admissions at lowest in 16 years","Zhao, Shirley; Tam, Johnny.",26-Nov-13
1150,Global prospects brighten up Investors upbeat on opportunities for next year,,26-Nov-13
1151,"HK faces risks from QE exit, Shanghai zone Business leaders say twin challenges in the new year may lead to fund outflow, higher interest rates and the city losing lead as financial centre","Yiu, Enoch.",26-Nov-13
1152,HK$20m haul from break-in at The Peak Rare diamond among items in safe taken from former home of actor Andy Lau,"Lo, Clifford; Chan, Candy.",26-Nov-13
1153,Huaxi to use IPO funds for acquisition,"Chan, Ray.",26-Nov-13
1154,"Mother 'mayhave made up girl's abduction' As fears for missing tot grow, police sources cast doubt on account of pushchair incident","Lo, Clifford.",26-Nov-13
1155,Plan for housing - not our dying ports Letting Shenzhen have our transshipment business will result in the release of a massive amount of prime waterfront land ideal for homes,"van der Kamp, Jake.",26-Nov-13
1156,Top mainland banker joins private equity Former chairman of SDB teams up with old friend to head PAG's business in the country,"Chen, George.",26-Nov-13
1157,Unsung heroes who embody spirit of the city 11 selfless individuals gain recognition for their efforts in helping to build a better Hong Kong,"Chan, Samuel.",26-Nov-13
1158,[ Alibaba B3... ],,26-Nov-13
1159,"[ NEWS (Section A): Leading the News A3 , Focus A4-5 , China A6-7 , China Digest A7 , Asia A8 , World A10-11 , Opinion A12 , Insight A13... ]",,26-Nov-13
1160,[ Pyongyang's attempts to engage in dialogue while keeping its [nuclear] programme running are completely unacceptable... ],,26-Nov-13
1161,[ Scottish 'blueprint' for independence published... ],,26-Nov-13
1162,"[ Today Interim: Asia Standard Int'l, BEP Int'l, Bright Smart, China Gas, China Water Affairs, Chinlink Int'l, Chow Tai Fook, Dorsett Hospitality, Easyknit Enterprises, Huabao Int'l, KFM Kingdom, Moiselle Int'l, Ngai Shun, Pyxis, Sino Resources, Sparkle Roll, Strong Petrochemical, Tern Properties, Tianda Pharmaceuticals, Vantage Int'l... ]",,26-Nov-13
1163,"[ Today: French Chamber of Commerce breakfast with Karim Azar, general manager of ifc. ]",,26-Nov-13
1164,[ YuanShengTai Dairy Farm B5... ],,26-Nov-13
1165,"Caveat on Shanghai experiment Despite hopes for the free-trade area, experts warn it will not be able to create the same free and fair legal system that Hong Kong enjoys","Chiu, Joanna; Chen, George.",26-Nov-13
1166,Different strokesfor struggling kids Regular visits from specially trained 'Dr Dogs' help children with intellectual disabilities learn how to make friends and get along with others,"Lo, Wei.",26-Nov-13
1167,Hats the way to spread festive fun,"Lo, Wei.",26-Nov-13
1168,MY TAKEAstronauts leave children in a vacuum,"Lo, Alex.",26-Nov-13
1169,Air zone branded 'dangerous act'Air zone escalates diplomatic tensions Beijing defence strategy is criticised by Japanese leader and ignites diplomatic tension across region,"Kwok, Kristine.",26-Nov-13
1170,Children under five to get free jab against fatal bug Centre for Health Protection offers assistance for young who need immunisation as panicked parents drain supplies at private clinics,"Tsang, Emily; Wong, Olga.",26-Nov-13
1171,City is short oflong-term appealon career front Think tank suggests retaining young mainland workers would ease labour shortage - but most say Hong Kong is ideal only for a brief stay,"Fung, Fanny W Y.",26-Nov-13
1172,Deal to easecross-border school chaos More fee-paying primary places to be offered in Shenzhen for mainland children born in HK,"Cheung, Tony.",26-Nov-13
1173,Everbright ready to kick off US$2 b float Beijing bank begins third attempt to list in HK with a public offering of 12 billion shares on the back of buoyant demand for newcomers,"Chan, Ray.",26-Nov-13
1174,Hongkongers 'will elect Beijing-friendly leader',"Lam, Jeffie; Tanna Chong.",26-Nov-13
1175,Huaxi eyes technology deal with IPO funds,"Chan, Ray.",26-Nov-13
1176,Taobao prepares to roll out new shopping fest Alibaba company focuses on small sellers with 'double 12' after success of 'double 11' promotion,"Sun, Celine.",26-Nov-13
1177,Tiananmen dissident turned away,"Kao, Ernest.",26-Nov-13
1178,Yi Hua starts IPO as it selectively expands stores,"Ap, Tiffany.",26-Nov-13
1179,Delicious diplomacy,,26-Nov-13
1180,"Discounts, higher commissions heat up luxury market New strategy sees developers record 63 per cent increase in revenue to HK$8.3 billion this month","Li, Sandy.",26-Nov-13
1181,"Goldman upgrades HK stocks outlook Investment bank takes cue from positive signals from key Communist Party meeting, raising its target for Hang Seng Index by 1,000 points","Yu, Jeanny.",26-Nov-13
1182,HK$11.5m payout for bedridden woman Hospital Authority admits liability but 4 hospitals outside its jurisdiction involved,"Chu, Julie.",26-Nov-13
1183,Law on data use is way behind times: experts Government urged to catch up with information age and consider amending privacy ordinance to protect people without stifling opportunities,"Chiu, Austin.",26-Nov-13
1184,Low-fee MPF schemes get boost from big contributions All is not lost for cheap plans after massive switch by employees fails to materialise,"Yiu, Enoch.",26-Nov-13
1185,"Mini-census may offer3 genders to choose from Male, female or transgender? Proposed new questions aim to get real picture of population","Fung, Fanny W Y.",26-Nov-13
1186,SHKP in 3-year warranties for homes,"Li, Sandy.",26-Nov-13
1187,'No limit' on commercial facilities at sports clubs,"Wong, Olga.",26-Nov-13
1188,"ATV directors 'failing in duties' Company risks losing licence if mismanagement is not kept in check, key shareholder tells court","Chiu, Austin.",26-Nov-13
1189,Call for clarity on workers' wages,"Siu, Phila.",26-Nov-13
1190,"Siblings jailed for tv quiz bribery Brother and sister offered Now TV employee HK$46,000 for information to help them fraudulently win money in live game show","Chan, Thomas.",26-Nov-13
1191,"Human error blamed for blast Poor planning of oil and sewer pipes, and negligence after leak was discovered, led to explosion, work safety investigators say","Zhang, Hong; Li, Jing.",26-Nov-13
1192,JUDGING PANEL,,26-Nov-13
1193,"Once seen in swarms, bird inches towards extinction","Li, Jing.",26-Nov-13
1194,Will new security panel be US or Soviet flavoured? Plenum resolution was typically vague on the role and structure of new intelligence panel,"Huang, Cary.",26-Nov-13
1195,[ Aid for elderly homes... ],,26-Nov-13
1196,[ Coming from a severely impoverished background and suffering a debilitating disability hasn't stopped Willy Law from thinking more about others than about himself. ],,26-Nov-13
1197,[ Elana Ho sets a fine example to any person who feels they are too ordinary to make a difference. ],,26-Nov-13
1198,[ Kan Yiu-kwong is the everyday man who believes he can do much more to help the plight of those with much less than him. ],,26-Nov-13
1199,Answering a call for help,,26-Nov-13
1200,Beijing advises nationals living in Japan to register,"Boehler, Patrick.",26-Nov-13
1201,Doyen ofthe disabled,,26-Nov-13
1202,An extraordinary mother,,26-Nov-13
1203,Saluting Lamma boat hero,,26-Nov-13
1204,"[ Although a seemingly small act of kindness, Jenny's devotion to giving the elderly a sense of personal dignity by providing free haircuts has lasted 27 years. ]",,26-Nov-13
1205,"[ An example of academic excellence and inspirational studentship even without taking into account her disabilities, Mandy Tsang Tsz-kwan's story is truly exceptional. ]",,26-Nov-13
1206,[ Carmen's irrepressible spirit and cheerful work ethic are a joy to see. ],,26-Nov-13
1207,[ Chan kit-ying's devotion stems out of sheer love for abandoned babies and children in need. ],,26-Nov-13
1208,"[ Elsa's story is proof that an individual, dealt the worst possible situation in their youth, can rise to do greater things against all odds. ]",,26-Nov-13
1209,"[ Pastor Lee is the original good Samaritan, helping a particularly needy segment of the community. ]",,26-Nov-13
1210,Beautician's cutting-edge therapy,,26-Nov-13
1211,Blind student is an inspiration,,26-Nov-13
1212,Determinedand dedicated,,26-Nov-13
1213,Director gives lots of tender loving care,,26-Nov-13
1214,Pastor offers refugeto homeless elderly,,26-Nov-13
1215,Robinson bears responsibility Animal rights campaigner 'turns tide' against cruel trade,PEOPLE'S CHOICE AWARD.,26-Nov-13
1216,Street-wise rescuer,,26-Nov-13
1217,[ Kuk should be honest about Legco protest... ],,26-Nov-13
1218,[ Trying too hard. ],,26-Nov-13
1219,Climate signs thatcannot be ignored,,26-Nov-13
1220,Diplomacy wins over belligerence,,26-Nov-13
1221,Law needed to ensure maids are guaranteed the minimum wage,,26-Nov-13
1222,[ More foreclosed homes sold by US banks... ],,27-Nov-13
1223,[ On the market P4... ],,27-Nov-13
1224,"[ Point of sale Price: HK$10.18 million Size: 760 sq ft of saleable area Where: Dragon Terrace, Tin Hau . ]",,27-Nov-13
1225,[ Protesters confront Chen in Taiwan... ],,27-Nov-13
1226,[ Record HIV cases in first three quarters... ],,27-Nov-13
1227,[ There were no winners of the first prize in last night's draw. ],,27-Nov-13
1228,Airport takes off,,27-Nov-13
1229,"Baby not seen for days before 'abduction' Building's CCTV footage showed no sign of missing toddler, police source says","Lo, Clifford.",27-Nov-13
1230,Beijing in push for homes database across mainlandPush for homes database faces local opposition Local governments and vested interests oppose Beijing's drive to create ownership records,"Chiang, Langi.",27-Nov-13
1231,Developers tempt homebuyers with big discounts,"Liu, Yvonne.",27-Nov-13
1232,"Elderly slam 'needless' raids on mahjong parlours Police arrest 129 people, some as old as 90, in crackdown on gambling at apartment complex","Lo, Clifford.",27-Nov-13
1233,"GUANGZHOU COOLING 'WON'T LAST' Southern city's curbs to control soaring market may have to be extended, say experts, as homebuyers who fear being priced out rush to buy flats","Chiang, Langi.",27-Nov-13
1234,"Hong Kong 'to face more competition' Opening of mainland to foreigners will put pressure on city, says legislator","Yiu, Enoch.",27-Nov-13
1235,Investment fund sells in Japan to buy in China British firm bucks the trend by pulling back from Japanese market to focus on Chinese deals,"Sito, Peggy.",27-Nov-13
1236,"Protectedair space to remain 'forever' Controversial defence zone announced at short notice was under consideration 'for some time' and will not be rescinded, say Beijing advisers","Chung-yan, Chow.",27-Nov-13
1237,Rise in mainland banks stopping home mortgages Survey shows the trend that started in top-tier cities has extended to 17 areas as quotas run out and authorities tighten restrictions on prices,"Chiang, Langi.",27-Nov-13
1238,"Topics firming up for reform consultation On the list for discussion are shortlisting rules and number of candidates allowed, but public nomination won't be mentioned, source reveals","Cheung, Gary; Lam, Jeffie; Cheung, Tony.",27-Nov-13
1239,[ Business of Design Week will feature some of the world's most outstanding talent. ],"Chan, Keith.",27-Nov-13
1240,[ Centaline B3... ],,27-Nov-13
1241,[ Donate online by credit card... ],,27-Nov-13
1242,[ Hengshi Mining Investments B6... ],,27-Nov-13
1243,[ I did it for my country and I'm proud of it... ],,27-Nov-13
1244,"[ NEWS (Section A): Leading the News A 3 , Focus A4 , China A6-9 , Asia A10-11 , World A12-15 , Opinion A16, Insight A17... ]",,27-Nov-13
1245,[ Ruling on Li Tianyi appeal to be announced... ],,27-Nov-13
1246,"[ The average prices of luxury homes in Shanghai and Guangzhou rose, while Beijing saw prices in the same segment fall, last week. ]",,27-Nov-13
1247,"[ Today: Joint chamber breakfast: ""Hiring and motivating for keeps"". ]",,27-Nov-13
1248,Asian buyers lead rush for New York's luxury condos Moinian Group aims to tap growing demand with sale of US$44m penthouse at its luxury W New York Downtown Hotel and Residences,"Li, Sandy.",27-Nov-13
1249,Finding the page-turnersto hook kids on reading Non-profit group gives parents access to carefully selected books and encourages children to fall in love with the written word,"Lo, Wei.",27-Nov-13
1250,"First impression is often the basic measure of trust Judging reputations when it comes to business is, in reality, neither quantifiable nor tangible",,27-Nov-13
1251,Giving more than money to HIV-affected youth,"Lo, Wei.",27-Nov-13
1252,MY TAKEMisusing the Cultural Revolution,"Lo, Alex.",27-Nov-13
1253,Savvis gets ready for mainland expansion IT infrastructure services provider is on the lookout for strategic partnerships to tap into growing demand for data centres in the country,"Perez, Bien.",27-Nov-13
1254,Andy Lau's new role: inspiring the kids,"Zhao, Shirley.",27-Nov-13
1255,Beijing to establish new Hong Kong think tank,"Cheung, Gary; Lam, Jeffie.",27-Nov-13
1256,Briton in court after Lantau cow deaths,"Chan, Thomas.",27-Nov-13
1257,Flight of fantasy,"Tam, Johnny.",27-Nov-13
1258,"Hong Kongport set for decline, says study","Kao, Ernest.",27-Nov-13
1259,Liaoningheads for disputedlocal seas China's first aircraft carrier begins battle formation training drills in the politically sensitive waters of the South China Sea,"Chan, Minnie.",27-Nov-13
1260,"Locals set to musclein on mainland buyers Aggressive pricing strategies are expected to lure back Hongkongers looking for new luxury homes in the fourth quarter, analysts predict","Sito, Peggy.",27-Nov-13
1261,"Policewatchdog frugal,poll finds Independent Police Complaints Council's entertainment expenses are in stark contrast with graft-buster's under Timothy Tong",Tanna Chong.,27-Nov-13
1262,StanChart sees profit slump for mainland utilities,"Yu, Jeanny.",27-Nov-13
1263,Supreme Court hears landmark monopoly case Antivirus software company Qihoo is seeking compensation of 150 million yuan from Tencent,"Yu, Sophie.",27-Nov-13
1264,Threat of Christmas strike looms at Cathay Pilot and cabin crew unions may disrupt the busy holiday period if pay demands aren't met,"Siu, Phila.",27-Nov-13
1265,"[ Magnolia, Chung Hom Kok... ]",,27-Nov-13
1266,"[ The headline, ""Marina Bay cuts prices to woo HK buyers"", on page 1 of Property on November 20 should have said Singapore's Marina Bay offers below-secondary market prices to woo Hong Kong buyers. ]",,27-Nov-13
1267,Beijing 'on target' to solve key gas issues China Gas chairman hails progress after announcing a 58.7 per cent year-on-year rise in net profit on increased distribution volumes,"Ng, Eric.",27-Nov-13
1268,"Children to get jabs 'within weeks' Health chief to make vaccine against fatal bug available quickly to kids under five, while those at higher risk will get the injection sooner","Chan, Candy; Tsang, Emily.",27-Nov-13
1269,China South City to boost supply chain unit The company is meeting investors in Hong Kong and Singapore as a precursor to a bond issue,"Lam, Anita; Moiseiwitsch, Jasper.",27-Nov-13
1270,Chow Tai Fook profit surges 92pc The world's largest jewellery chain says results were boosted by the rush to buy gold in April,"Ap, Tiffany.",27-Nov-13
1271,Conferring honours,"Tam, Johnny.",27-Nov-13
1272,Developers of wetland project seek new review Team behind proposed Nam Sang Wai homes stress differences from Fung Lok Wai plan,"Kao, Ernest; Chi-fai, Cheung.",27-Nov-13
1273,Hotung accuses family of fraud,"Chiu, Austin.",27-Nov-13
1274,"Huge disparity in energy use of malls and offices Audit figures show unexplained differences in electricity consumption, but more data needed","Fung, Fanny W Y.",27-Nov-13
1275,Nominating committee is 'best option',Tanna Chong.,27-Nov-13
1276,"Nurse sentenced for assaulting woman, 89","Zhao, Shirley.",27-Nov-13
1277,Skyworth lowers TV sales targets amid slowdown,"Yu, Sophie.",27-Nov-13
1278,Nine detained over deadly Qingdao oil pipe blasts,"Li, Jing; Boehler, Patrick.",27-Nov-13
1279,Raucous welcome for Beijing envoy Protesters barred from approaching Communist Party's top negotiator as he begins first Taiwan tour amid swirl of cross-strait controversies,"Chung, Lawrence.",27-Nov-13
1280,"Shenzhen airport set for move to new home Authorities have an eight-hour window to shift operations - no easy feat, as HKers have learnt",He Huifeng.,27-Nov-13
1281,[ Murder suspect found... ],,27-Nov-13
1282,Li beginsRomaniavisit withtrade deals,"Jiang, Sijia.",27-Nov-13
1283,"State firms face further reckoning Investigation of Chalco executive signals more corruption probes of SOEs, but it's still unclear whether party has will to break up monopolies","Ruan, Victoria.",27-Nov-13
1284,"Reform pledges likely to hurt both stock prices and yuan Beijing's liberalisation policies are likely to mainly hit the mainland's state-owned firms, with private-sector competition eroding margins",,27-Nov-13
1285,China envisions gaining influence Calls for Beijing to lead new inspections of Tehran's nuclear programme offer chance for China to be more active in the Middle East,"Kwok, Kristine.",27-Nov-13
1286,[ Compromise a very slippery slope for HK... ],,27-Nov-13
1287,[ Keeping tabs. ],,27-Nov-13
1288,[ On Shenzhen port authorities trying to persuade foreign carriers to skip HK as a transit hub and deal with them directly:... ],,27-Nov-13
1289,Building trust amid rhetoric,,27-Nov-13
1290,Managing the bottom line,,27-Nov-13
1291,Street revamp project offers more tiny and high-priced flats,,27-Nov-13
1292,3G operators mull response over spectrum HKT chief Alex Arena expects industry players to review hundreds of pages of documents after government moves to reshuffle bandwidth,"Perez, Bien.",28-Nov-13
1293,[ Berlusconi expelled from parliament... ],,28-Nov-13
1294,[ Hats and scarves at the ready for Friday chill... ],,28-Nov-13
