,title,byline,dates
0,Airgun suspect held after flats damaged [Derived headline],,1-Apr-13
1,Expert accused of twisting facts on voting rights Comments on universal suffrage put Basic Law veteran Maria Tam's credibility on the line,"Lau, Stuart; Lee, Colleen.",1-Apr-13
2,Four more cities issue cooling details Shenzhen among local governments to meet State Council deadline on property measures,"Sito, Peggy.",1-Apr-13
3,Hard labour for lawyers who speak only EnglishHard labour for lawyers who speak only English,"Man, Joyce.",1-Apr-13
4,Mobile operators urge release of more spectrum,"Perez, Bien.",1-Apr-13
5,Parallel trading rampant despite ban Mainland operators are using travellers to beat two-tin restriction on infant milk formula,"Tsang, Emily.",1-Apr-13
6,"Strict Checks fail to deter I.P.O. s Mainland campaign to re-examine listings and encourage firms to ditch offerings has limited effect, with cancellations well below expectations",Daniel Ren in Shanghai ren.wei@scmp.com.,1-Apr-13
7,Terminal operator seeks court order to end strike,"Tam, Johnny.",1-Apr-13
8,"Two die in first human cases of bird flu strain Two men succumb in Shanghai within two weeks of contracting lesser-known H7N9 virus, with a woman in Anhui still in critical condition","Lo, Wei; He Huifeng.",1-Apr-13
9,"U.N. case for fixing work hours Employees will be motivated to complete their work quickly if the city sets law to limit working hours, UN labour agency representative says","Siu, Phila.",1-Apr-13
10,Xi gets thumbs-up for relatively easy trip [Derived headline],,1-Apr-13
11,Aids day brings understanding to disease Thousands gather in Central to promote reality of living with Aids and to fight discrimination,"Ho, Jolie.",1-Apr-13
12,Authorities clash over control of PE funds Rival mainland finance watchdogs disagree over which rules are governing private-equity sector,Daniel Ren in Shanghai ren.wei@scmp.com.,1-Apr-13
13,Fleeced with the promise of sex A gang of mainland women are taking 'clients' to a hotel then stealing their valuables,"Lo, Clifford.",1-Apr-13
14,Kyrgyzstan sets sights on Xinjiang coal market But construction of rail link essential to the Central Asian nation's fuel-supply ambitions,"Ng, Eric.",1-Apr-13
15,Learning to lend beyond the industrial blacklist Mainland banks are grappling with income losses from interest rate deregulation and a much narrower field of suitable loan candidates,Jane Cai in Beijing xuejun.cai@scmp.com.,1-Apr-13
16,MY TAKEStereotypes of mainlanders go too far,"Kumar, Hari.",1-Apr-13
17,"Official film venues don't do digital HK festival boss says only three of the government-run screens can show the newer format, forcing it to use smaller commercial cinemas","Chow, Vivienne.",1-Apr-13
18,Real estate agents get help to fight corruption,"Simpson, Cheung.",1-Apr-13
19,Tomorrow: British Chamber of Commerce breakfast... [Derived headline],,1-Apr-13
20,Where to draw line of communication The authorities must be careful not to blur the line between informing and seeking approval,"Tam, Tammy.",1-Apr-13
21,'Pass the message' a tough game for city's politicians Memory lapses and language barrier leave holes in Beijing officials' messages to Hongkongers,"But, Joshua; Lee, Colleen.",1-Apr-13
22,"Born: July 24, 1944 [Derived headline]",,1-Apr-13
23,"Call Beijing on voting rights, says loyalist Head of city's delegation to the NPC says central authorities may need to interpret Basic Law's provisions for universal suffrage","Siu, Phila; Lau, Stuart; Lee, Colleen.",1-Apr-13
24,"Chow prioritises law on gay rights, quashes Christian concern","Tam, Johnny.",1-Apr-13
25,Golden chance from the silver-haired crowd,"Mok, Danny.",1-Apr-13
26,HK still beats mainland as yacht hub Elite boat builder says low taxes and lots of billionaires keep city sailing,"Lam, Anita.",1-Apr-13
27,"trusted judge who fought for legal integrity of city Mr Justice Michael Hartmann began his career as a reporter in Africa, and carried his liberal attitudes into the city's highest courtrooms","Moy, Patsy.",1-Apr-13
28,"Lasting torment In the second of our two-part series marking the 10th anniversary of Sars, the outbreak's first victim recalls its lingering after-effects First patient,",He Huifeng he.huifeng@scmp.com.,1-Apr-13
29,Little hope that latestcooling measures willease property costs Home prices have been hit before with policies like those announced in recent days only to eventually resume their relentless rise,,1-Apr-13
30,"Rising star hit by graft probe Top Jilin official investigated over problems with assets of First Automobile Works Group, the company he once led, report says","Chi-yuk, Choi.",1-Apr-13
31,Shanghai police chief replaced by detective [Derived headline],,1-Apr-13
32,Xi's first overseas foray 'a symbolic victory' Analysts say president visited 'safe' nations to raise his profile but the West may be a challenge,Cary Huang in Beijing cary.huang@scmp.com.,1-Apr-13
33,"Beijing is only treating thesymptoms, not their cause Artificially low interest rates have stored up trouble for the mainland's economy, and no regulatory quick fix will be sufficient to address it",,1-Apr-13
34,Help for grieving parents [Derived headline],,1-Apr-13
35,Shanghai's police chief replaced by top detective Criminal investigation expert picked for post amid talk 58-year-old was ousted over affairs,"Zhai, Keith.",1-Apr-13
36,Source of dead pigs traced to revered historical site Region famed as the birthplace of China's Communist Party forced to revise its methods after tide of rotting hogs is linked to its farmers,"Zuo, Mandy.",1-Apr-13
37,"What analysts won't tell you about selling out of a stock Investing in equities is all about timing, so why do most banks say so little about when to exit - and what does a 'hold' rating really mean?",,1-Apr-13
38,Big hurdles to three-way trade,,1-Apr-13
39,Department dragging its heels over removal of offensive banners,,1-Apr-13
40,Heritage rules need a new look,,1-Apr-13
41,No level playing field,,1-Apr-13
42,Simple ways to make glass recycling safe [Derived headline],,1-Apr-13
43,Apple apologises in warranty row,"Lam, Anita.",2-Apr-13
44,Bird flu fears spark stock stampede Rush into drug plays as speculation mounts over how outbreak of new strain will develop,"Yu, Jeanny.",2-Apr-13
45,China factory data points to recovery,Victoria Ruan in Beijing victoria.ruan@scmp.com.,2-Apr-13
46,"China retains mass appeal Multinationals drawn to consumer markets, talent pool and incentives",,2-Apr-13
47,"Exotic HK stars in Hollywood - again Mexican director del Toro recreates urban streets then flattens them, just like in the movies","Chiu, Joanna.",2-Apr-13
48,"Harilela secret to living with 90 relatives An extended family like no other, the clan manages to keep life harmonious in their 25,000 square foot Kowloon Tong complex","Chong, Dennis.",2-Apr-13
49,Heart attack suspected in burning-store owner [Derived headline],,2-Apr-13
50,Hong Kong foots the bill as Beijing tops up its tax take Why are we paying to enforce a customs regime that benefits only the mainland?,"van der Kamp, Jake.",2-Apr-13
51,"Judge orders striking workers off the dock Injunction took immediate effect last night, but departing unionists vow to stage demonstration at another site in support of pay-rise demand","Siu, Phila; Lau, Stuart; Moy, Patsy; Chong, Dennis.",2-Apr-13
52,"Mainland home sales set to fall Sales may plunge by as much as 50 per cent this month, after mainland cities unveil local cooling measures designed to curb price growth","Sito, Peggy.",2-Apr-13
53,Tankan continues to indicate weakness [Derived headline],,2-Apr-13
54,"We want him to still be alive today, say fans","Ho, Jolie.",2-Apr-13
55,"'There's no free lunch' in pensions for all Research is necessary to find out how much taxpayers are prepared to contribute towards a proposed universal scheme, Exco member says","Lee, Colleen.",2-Apr-13
56,E.N.N. fires up expansion of gas refuelling network Hebei firm aims to blaze a bigger trail into the mainland's transport market as Beijing pushes adoption of the cleaner energy source,"Ng, Eric.",2-Apr-13
57,"Girl, 11, dies after pet hamster bites finger","Lo, Clifford; Mok, Danny.",2-Apr-13
58,Longer hours don't always mean more business The extension of local futures trading may be no panacea for weak demand and thin turnover,"Yiu, Enoch.",2-Apr-13
59,MY TAKE Snappy solution to Adam Cheng 'curse',"Kumar, Hari.",2-Apr-13
60,Today: British Chamber of Commerce breakfast... [Derived headline],,2-Apr-13
61,What is on the plate for researchers to study,,2-Apr-13
62,When a friendly conversation falls flat Talking property is a quick way to dampen the mood among would-be homebuyers,"Leung, Paggie.",2-Apr-13
63,"Wills, wishes and lawyers can we control our assets from the grave? Recent legal wrangles have shown writing a will does not guarantee our wishes will be executed","Gallagher, Steven.",2-Apr-13
64,'Healthy' slump topples China as top art market,"Chow, Vivienne.",2-Apr-13
65,"Dockers face tough battle, veterans say Workers may have a hard time repeating the success of the bar-benders' 36-day strike in 2007 that won them a pay rise, unionists say","Lau, Stuart; Siu, Phila.",2-Apr-13
66,"Expat rental rates to keep on rising in Shanghai With more foreigners moving to the city, expats' rental rates are likely to rise up to 8pc","Sito, Peggy.",2-Apr-13
67,"HK, mainland firms eye Malaysia bullet train plan",Toh Han Shih hanshih.toh@scmp.com.,2-Apr-13
68,Judge's dilemma as tworights make one wrong,"Moy, Pasty.",2-Apr-13
69,"Keep the faith, Harilela urges HongkongersKeep the faith, Harilela tells Hongkongers Hotelier believes that tolerance is the only way to ease tensions between the city and mainland","Chong, Dennis.",2-Apr-13
70,Landslidemay hurt China Goldtrading Tragedy at Tibetan mine could have further repercussions in the market as operation may be closed until it is found to be safe,"Ng, Eric.",2-Apr-13
71,Markets suffer as shipments slow,"Toh Han Shih; Lau, Stuart.",2-Apr-13
72,MMG ventures into Inuit territory Zinc-copper project must make it through three years of environmental impact studies in Canada,"Ng, Eric.",2-Apr-13
73,"Sanofi bets on rapid expansion in China Pharmaceuticals giant plans new factories, acquisitions as it seeks to grow local presence",Celine Sun in Beijing celine.sun@scmp.com.,2-Apr-13
74,Shanghai tightens vigilance on bird flu,"He Huifeng; Lo, Wei; Lawrence Chung in Taipei.",2-Apr-13
75,Wharf's mainland spree set to pay off The developer boasts one of the biggest land banks among its Hong Kong counterparts on the mainland and is ready to reap gains,"Li, Sandy.",2-Apr-13
76,Doctor's prescriptions put patients in hospital,"Lo, Wei.",2-Apr-13
77,"Don't let any more suffer like Leslie, gay icons urge At the Big Love concert on Kowloon waterfront, stars joined by equal rights chief Dr York Chow call for legislation protecting sexual minorities","Chiu, Joanna; Cheung, Tony.",2-Apr-13
78,Equality chief says UN rules for free elections must be met First day in job sees York Chow tackle Basic Law heavyweight over meaning of universal suffrage,"Cheung, Tony.",2-Apr-13
79,"Global links make it harder to fight fraud Cutting through the veil of multinational listings takes more time, says graft buster","Simpson, Cheung.",2-Apr-13
80,"Huawei, ZTE united in patent dispute Competitors join forces to oppose accusations of intellectual property infringement in cases in the United States brought by InterDigital","Perez, Bien.",2-Apr-13
81,Toyota's China sales still head downhill,"Lam, Anita.",2-Apr-13
82,"Dumped furniture divertedfrom landfill into profit Green Dot Home finds new owners for pieces people would otherwise throw away, like an Italian-brand sink worth HK$50,000","Chi-fai, Cheung.",2-Apr-13
83,A generous landlord believed in his dream,"Chi-fai, Cheung.",2-Apr-13
84,"Racing to burning godown, owner had heart attack","Lo, Clifford.",2-Apr-13
85,Taken for a short ride in Virgin's glass-bottom jet,"Parry, Hazel.",2-Apr-13
86,Big challenge for little-known pragmatist New president of Peking University must work to repair its image after series of controversies,"Li, Raymond.",2-Apr-13
87,Cement truck reverses over protesting farmer,"Luo, Chris.",2-Apr-13
88,China to boost maritime presence - fleet leader,"Chi-yuk, Choi.",2-Apr-13
89,Journalist suspended for call to end ties An editor is 'relieved of his position' after he wrote an opinion article urging China to review its links with Pyongyang after third nuclear test,"Li, Raymond; Zhou, Laura.",2-Apr-13
90,"Putting a spring in the step Auction house celebrates 40 years with finest art, wine, jewellery and watches",,2-Apr-13
91,"Signs of a thaw in Sino-Japan ties Envoys' visits are indications that neither Tokyo nor Beijing want all-out conflict, analyst says","Zhai, Keith.",2-Apr-13
92,"Allow factions to advance party reform, writer urges Members should be permitted to form internal groups and engage in political campaigns to create multi-party democracy, says historian","Yu, Verna.",2-Apr-13
93,New way to size up the universe A mainland astrophysicist looks at light from massive black holes from a different perspective,"Chen, Stephen.",2-Apr-13
94,Real estate deals stalled [Derived headline],,2-Apr-13
95,"Shanghai releases plan for pollution Although behind Beijing, the measures to tackle dirty air are considerably tougher","Chen, Stephen.",2-Apr-13
96,Cypriot-style bank crisiscould hit Hong Kong too The troubled Mediterranean island is half a world away but financial conditions there bear some eerie similarities to those over here,,2-Apr-13
97,Coastal development,,2-Apr-13
98,Disputed islands taken by Japan during period of militarism,,2-Apr-13
99,Distorting insurance changes [Derived headline],,2-Apr-13
100,Last orders for lavish banquets,,2-Apr-13
101,No room for doubt in census,,2-Apr-13
102,Coining it in,,2-Apr-13
103,Perfection hides in the detail,,2-Apr-13
104,Bankers call for SME funding reform,"Chan, Ray.",3-Apr-13
105,China pension fund earns 7pc return Safety net for the aged sees best performance in three years with income of 64.5 billion yuan,Daniel Ren in Shanghai ren.wei@scmp.com.,3-Apr-13
106,Courier companies look to deliver a greener city,"So, Charlotte.",3-Apr-13
107,Facebook helps rouse public support,,3-Apr-13
108,Four new cases of bird flu confirmedFour new cases of bird flu confirmed Hong Kong steps up screening at hospitals and sampling at poultry farms as the deadly H7N9 strain infects humans in Jiangsu province,"Zhuang Pinghui; Lo, Wei.",3-Apr-13
109,"Girl, nine, dies after being hit by truck [Derived headline]",,3-Apr-13
110,"The grim life of a dock workhorse Strikers talk of violence, exhaustion, safety fears and the families they seldom get to see","Lee, Ada.",3-Apr-13
111,Japan keen for JFK's daughter as envoy [Derived headline],,3-Apr-13
112,Lunar New Year helps retail sales jump 23pc [Derived headline],,3-Apr-13
113,More talks urged to end reform row Adviser to Beijing says pan-democrats should offer alternative on chief executive nominations,"Cheung, Gary.",3-Apr-13
114,"MPF loses moneyfor second month Retirement scheme's funds fail to build on last year's performance, with recent declines reflecting nervousness over global economy","Yiu, Enoch.",3-Apr-13
115,On hard ground,,3-Apr-13
116,Port rejects dockers' pay claims Union leaders hit back at 'ridiculous' remark and challenge terminal bosses to show them the figures as strikers continue fight for 17pc rise,"Siu, Phila; Lau, Stuart; Moy, Patsy.",3-Apr-13
117,democrats get a mention in people's daily State media article on city's politics eschews one-sided reporting to publish names of the pan-democrats and describe their positions,"But, Joshua.",3-Apr-13
118,MY TAKEThe man who gave birth to confusion,"Kumar, Hari.",3-Apr-13
119,"New data standard signals change ahead Scott Thiel, a partner at DLA Piper Hong Kong, discusses data privacy changes on the mainland","Thiel, Scott.",3-Apr-13
120,Tomorrow 1st Quarter: abc Multiactive [Derived headline],,3-Apr-13
121,"Tuesday, April 9: British Chamber of Commerce... [Derived headline]",,3-Apr-13
122,Vote-rigging big fish that got away Almost 50 were convicted but their silence meant the mastermind remains free,"Simpson, Cheung.",3-Apr-13
123,"Apology shows China market's value Analysts doubt saying sorry, even if it took a while, will hurt Apple's sales on mainland","Yu, Sophie.",3-Apr-13
124,"Australian write-down costs MCC 3 billion yuan Contractor, Citic Pacific await report assigning responsibility for delays to Sino Iron project","So, Charlotte.",3-Apr-13
125,Brokers call for joint ventures in Qianhai zone Legislator urges Shenzhen to let financial firms form partnerships with mainland counterparts,"Yiu, Enoch.",3-Apr-13
126,"Chong Hingsurges onpossibilityof sale Report says family that controls bank may sell, prompting shares to jump almost 10 per cent, pulling other closely held lenders in its wake","Kanis, Li.",3-Apr-13
127,"End is nigh for a bitter banner war The authorities are finally moving to crack down on the unsightly, unauthorised banners put up by the Falun Gong and its opponents","Simpson, Cheung.",3-Apr-13
128,Landlords neglect duty to prevent killer landslides Government urges those ignoring orders to repair slopes to act before the rainy season,"Ngo, Jennifer.",3-Apr-13
129,Next Media shares slump26pc after Taiwan debacle,"Yu, Sophie.",3-Apr-13
130,"Strike a threat to port's status, industry says Vessels are already diverting to rival terminals, shippers say, and city continues to slide down the ranks of world's leading container terminals","Toh Han Shih; Siu, Phila.",3-Apr-13
131,"Auction test for HK's free-wheeling ink artists China Guardian sale is first major gauge of buyer appetite, especially among mainlanders","Nip, Amy.",3-Apr-13
132,Checkpoints' fever screening 'not sensitive enough',"Lo, Wei.",3-Apr-13
133,CY Leung brings home a pass in rating,"Lee, Colleen.",3-Apr-13
134,"Hong Kong-style towers rising over Yangon You can make a real fortune if you can build a hotel overnight, says a leading developer",,3-Apr-13
135,"Huadian cleans up its coal plants Power firm expects higher earnings despite shift to eco-friendlier, though costly, technologies","Ng, Eric.",3-Apr-13
136,Husband dies after wife fails to get help Mentally ill woman sat by body of 88-year-old for two days before tragedy discovered,"Lo, Clifford.",3-Apr-13
137,ICBC whips out wallet as Taiwan rules ease China's biggest bank is quick off the mark in taking advantage of newly relaxed restrictions on mainland holdings in island's lenders,Jane Cai in Beijing xuejun.cai@scmp.com.,3-Apr-13
138,land of opportunity Political reform offers the chance of big profits in the former pariah state. The first of a three-part series looks at the flood of investment into Yangon Prices rocketing in,Charlotte So in Yangon charlotte.so@scmp.com.,3-Apr-13
139,Margaret Leung to join board of HKEx,"Yiu, Enoch.",3-Apr-13
140,"Procedure new to doctors, court told Inquest into 13-year-old boy's death hears that anaesthesiologist asked surgeons to dothroat surgery they were unfamiliar with","Chiu, Joanna.",3-Apr-13
141,Watchdog chief slams shelving of privacy law,"Mok, Danny.",3-Apr-13
142,Workers get itchy feet amid low pay rises: poll,"Chong, Dennis.",3-Apr-13
143,Fishermen told not to sue US oil firm,"Chen, Stephen.",3-Apr-13
144,Masterpieces from mainland The quality of Chinese works of art on offer remains high,,3-Apr-13
145,Poly Auction is the premier art auction house... [Derived headline],,3-Apr-13
146,Protesters for asset disclosure rule detained Three held in Beijing for holding up banners in a public square demanding transparency on the part of leading Communist Party members,"Li, Raymond.",3-Apr-13
147,"Mine officials held after second fatal blast Seven killed and 10 still trapped after explosion, four days after 29 miners died in same pit","Chi-yuk, Choi.",3-Apr-13
148,Promise of a better wheat yield Mapping of genetic codes of the food crop by Chinese and US scientists will lead to varieties that are more resilient to disease and harsh weather,"Zuo, Mandy; Chen, Stephen.",3-Apr-13
149,"Vice-president's low-key tour 'a show of allegiance' Li Yuanchao's three-day trip in Guangdong shows his support of Xi Jinping, say analysts",Mimi Lau in Guangzhou mimi.lau@scmp.com.,3-Apr-13
150,Rewards go unclaimed [Derived headline],,3-Apr-13
151,"China's built enough housing for everyone. Where is it all? As measures to cool the mainland's property market take ever more novel forms, the problem isn't a lack of supply, but a choice of policy",,3-Apr-13
152,Government hangs up on HK's mobile phone users [Derived headline],,3-Apr-13
153,"says Apple Chinese state media attacks on Apple promptan apology from CEO Tim Cook, showing that even the biggest bow when Beijing demands it iKowtow,","Rafferty, Kevin.",3-Apr-13
154,Bicycle ban on promenade is pointless [Derived headline],,3-Apr-13
155,On Beijing's warning to pan-democrats over possible mass protests [Derived headline],,3-Apr-13
156,An outbreak we dare not ignore,,3-Apr-13
157,Pensions for all,,3-Apr-13
158,Wise to rethink disclosure rules,,3-Apr-13
159,Workplaces can gain a lot from employment of mature women,,3-Apr-13
160,peak demand Stretching to meet,,3-Apr-13
161,"Another fatal case as bird flu virus spreads Death in Zhejiang takes total of H7N9 victims to three, with Hong Kong considering reintroduction of health declarations for inbound travellers","Zhuang Pinghui; Lo, Wei.",4-Apr-13
162,Bird flu puts stalls off buying more chickens Sales of live birds are down despite Ching Ming festival and health minister's assurance,"Tam, Johnny.",4-Apr-13
163,Ex-manager of Leslie Cheung sued [Derived headline],,4-Apr-13
164,FTU member part of contractor's management,"Simpson, Cheung; Siu, Phila.",4-Apr-13
165,HKU checking that masks 70pc effective,"Chiu, Joanna.",4-Apr-13
166,Homage to the dearly downloaded,"Chen, Stephen.",4-Apr-13
167,"Home sales sink but worst still to come Effect of government's doubling in stamp duties yet to be reflected in transaction figures, analyst says, but impact could surface this month","Sito, Peggy.",4-Apr-13
168,"HSBC, Bocom set up yuan collaboration [Derived headline]",,4-Apr-13
169,Malaysia heads for a close-run election [Derived headline],,4-Apr-13
170,Samsung's Galaxy S4 set to launch in Hong Kong,"Perez, Bien.",4-Apr-13
171,"Stores seek ways to get around dockers' strike Retailers prepare for containers to be sent to other ports, flown or driven in, amid delivery delays due to dockers' walkout","Nip, Amy; Toh Han Shih.",4-Apr-13
172,"This city's legal system courts disaster for the poor By criminalising lawyers who work on a no-win, no-fee basis, Hong Kong maintains justice as the exclusive preserve of those who can afford it","van der Kamp, Jake.",4-Apr-13
173,Transaction tax confusion vexes local stockbrokers HKEx urged to handle Italian levy on share trades amid patchy collection by brokerages,"Yiu, Enoch.",4-Apr-13
174,All ears on what the headmaster actually said,"Chong, Dennis.",4-Apr-13
175,"Business launches salvo over work limit Employers' coalition gathers forces to fight possible introduction of standard weekly hours, saying it will hurt competitiveness","Siu, Phila.",4-Apr-13
176,"CLP chief to resign, join family office","Ng, Eric.",4-Apr-13
177,Equal and opposite,,4-Apr-13
178,"Intel expands mobile push in China Chipmaker ramps up diversification drive, partnering with Chinese smartphone and tablet makers as demand for portable devices soars","Yu, Sophie.",4-Apr-13
179,MY TAKEOne man's pain is still another's gain,"Kumar, Hari.",4-Apr-13
180,"Tuesday, April 9: British Chamber of Commerce... [Derived headline]",,4-Apr-13
181,Web hosts to censors: we mean no harm [Derived headline],All around town.,4-Apr-13
182,"Young professionals back reform fight, up to a point Core members of 30s Group support Occupy Central movement but have some reservations","Cheung, Gary.",4-Apr-13
183,4 run foul of law over hospital breakout Drug abuser who faced charges of trafficking and wounding tried to flee with others' help,"Man, Joyce.",4-Apr-13
184,"Cuts in expats' expenses hit rents Rise in cost of luxury flats slows in Hong Kong. In contrast, rents for prime housing in Beijing, Shanghai and Guangzhou surged last year","Li, Sandy.",4-Apr-13
185,"Easy to swallow whatever the price Obviously a fan of ours, says elBulli chef of bidder who pays HK$220,000 for dinner","Carney, John.",4-Apr-13
186,"H7N9 harder to track but less likely to cause disease New avian flu strain is more deadly to humans than birds, scientists say, as third death reported","Lo, Wei.",4-Apr-13
187,"Keep coastal access 'people-friendly', designers say","Ng, Joyce.",4-Apr-13
188,"Keep opt-out proof, advises privacy chief Copies of e-mails or faxes asking for data not to be used can help identify recalcitrant companies","Nip, Amy.",4-Apr-13
189,Legal fight lets light in as 'fixer' remains in shadow,"Yu, Sophie.",4-Apr-13
190,Lending by Big Four rises 53 pc in March Jump highlights liquidity available to drive urbanisation push while exacerbating fears of those worried about property market bubble,Jane Cai in Beijing xuejun.cai@scmp.com.,4-Apr-13
191,Mainland to miss growth mark as big reforms bite Top academic sees bad debt and overcapacity as barriers to continued economic rebound,"So, Charlotte.",4-Apr-13
192,"Man-made islands make waves A super prison or landfill site rising out of the sea off the city is back on the agenda, pitching planners against environmentalists","Ng, Joyce.",4-Apr-13
193,More border villages open to public in June,"Wong, Olga.",4-Apr-13
194,PCCW wrongly billed users HK$4.3m,"Mok, Danny.",4-Apr-13
