,title,byline,dates
595,Unionsupset atunchanged pay offer Negotiations with pro-government unions hit the wall as contractors stick to 7 per cent pay rise and unionist calls meeting 'meaningless',"Lee, Ada; Nip, Amy.",13-Apr-13
596,US says Japan can join Pacific trade pact talks [Derived headline],,13-Apr-13
597,"Yuan at record high to US dollar Economists predict further rise, which would fuel inflation on the mainland and in Hong Kong","Jane Cai in Beijing; Man-ki, Kwong.",13-Apr-13
598,"At the moment, there is no need to be overly worried [Derived headline]",,13-Apr-13
599,Big hearts and open arms the key to a happy family,"Ngo, Jennifer.",13-Apr-13
600,MY TAKEDemocracy has no universal standard,"Lo, Alex.",13-Apr-13
601,Pan-democratspush for broaderelection panel Screening candidates may be palatable if nominating body is truly representative,"But, Joshua.",13-Apr-13
602,Pelican brief,,13-Apr-13
603,"Reform comments are not new, says CY","Cheung, Tony.",13-Apr-13
604,Stars compete for film awards [Derived headline],,13-Apr-13
605,"Sunday, Apple Daily [Derived headline]",Paper talk.,13-Apr-13
606,"Tuesday, April 16: German Chamber of Commerce... [Derived headline]",,13-Apr-13
607,"What's down the track for Next? With the group's failure to sell its television and print assets in Taiwan, some analysts say it should refocus on its HK core","Yu, Sophie.",13-Apr-13
608,Air bridge bolts are focus of inquiry Task force will examine the metal pieces that connect the walkways to the airport terminal after two of them collapsed on Sunday,"Ho, Jolie.",13-Apr-13
609,"Business as usual along N. Korea border Hong Kong company executive who has just returned from region says there seems to be no rise in tension, despite threats from Pyongyang","So, Charlotte; Reuters in Seoul charlotte.so@scmp.com.",13-Apr-13
610,Court rejects compensation for labour-camp mother,"Zhou, Laura.",13-Apr-13
611,HKT Trust shares down after Li sale PCCW chairman's stake reduction sends fixed-line network operator down 2.53 per cent,"Perez, Bien.",13-Apr-13
612,"In Sino-US talks, space security a testing issue But there is still no proper platform to tackle matters like debris and weapons",Reuters in Colorado Springsand Minnie Chan.,13-Apr-13
613,"Lights, camera, action, Lenovo Mainland technology firm aims to reach out to youth audience by featuring its range of products in films and television series","Perez, Bien.",13-Apr-13
614,"Mainland M&As expected to stay buoyant 156 mergers worth US$9.6 billion in the cultural market last year, says Deloitte","Yu, Sophie.",13-Apr-13
615,Man denies hitting and biting his wife,"Man, Joyce.",13-Apr-13
616,Martin Lee's idea 'may be a test' Pundits ask whether Democrat's 'rash' plan for electoral reform was a mistake or a clever ploy,"Cheung, Tony.",13-Apr-13
617,"Retailers, milk brands co-operate on vouchers","Nip, Amy.",13-Apr-13
618,Salesman stole iPhones to keep girlfriend happy,"Chan, Thomas.",13-Apr-13
619,Time to call out the bloodhounds Mystery of the police papers found in Happy Valley dog waste bin. An inside job is suspected,"Simpson, Cheung.",13-Apr-13
620,Torture claimant first to win asylum under appeal system launched in 2009,"Moy, Patsy.",13-Apr-13
621,Tribute to yellow emperor,,13-Apr-13
622,"Jail for piousupskirtpervert 'Celibate' Christian who did not believe in sex before marriage took 4,800 voyeuristic videos and photographs of women throughout city","Chan, Thomas.",13-Apr-13
623,Jail term cut in acid attack on ex-husband,"Chiu, Austin.",13-Apr-13
624,"Jewellery queenshines in crisis Annie Yau was thrust into leadership of the TSL empire in difficult times but she and the company thrived, expanding outlets and crafting new tie-ups, writes Celine Sun",Celine Sun in Beijing celine.sun@scmp.com.,13-Apr-13
625,A monument-to-be for pillar of society,"Ng, Joyce.",13-Apr-13
626,"Planning strategy outdated, say experts","Wong, Olga.",13-Apr-13
627,"Scientist shares secret of success Just enjoy what you are doing, says professor involved in unlocking secret of universe","Choi, Christy.",13-Apr-13
628,"Liu's brother-in-law 'faces 14 years' As relative of jailed Nobel laureate prepares to stand trial, lawyer reveals sentence recommended by prosecutors and tells of Liu Xia's 'heartache'","Yu, Verna.",13-Apr-13
629,"The North's stance toward China,... [Derived headline]",,13-Apr-13
630,Border city holds air raid drill amid tensions,"Ng, Teddy.",13-Apr-13
631,"Kerry's mission now focuses on Korean crisis Secretary of state's first China visit, originally set as little more than a diplomatic handshake, is now an urgent meeting of the two powers",Cary Huang in Beijing cary.huang@scmp.com.,13-Apr-13
632,Memorial should be a monument to truth A proposed structure in Guangzhou would remember victims of Sars - but it also needs to praise those who first exposed the epidemic,"Zhai, Ivan.",13-Apr-13
633,Subway office attacked [Derived headline],,13-Apr-13
634,Corrupt politicians have been given... [Derived headline],,13-Apr-13
635,Nancy Kissel's milkshake misdeed costs us millions [Derived headline],,13-Apr-13
636,"Shipping chief locks eyes on the top - not on bottom line Politics, not profit margins, is the overriding concern for China Cosco's chairman as he stays afloat despite the company's sea of losses","Yam, Shirley.",13-Apr-13
637,It's getting harder to find milk... [Derived headline],,13-Apr-13
638,Florence's Five Favourite Designs,,13-Apr-13
639,Conservation staff must do more for distressed animals,,13-Apr-13
640,How serious is Xi's reform talk?,,13-Apr-13
641,Stay vigilant about your data,,13-Apr-13
642,Unacceptable treatment on airport bus [Derived headline],,13-Apr-13
643,Community Business hosts forum on work-life balance [Derived headline],,13-Apr-13
644,"Back to sales basics as privacy rules take effect Direct marketing set to be less of a force with curbs on use of customer data, insurer says","Yiu, Enoch.",15-Apr-13
645,Curtain drawn on disclosure of assets [Derived headline],,15-Apr-13
646,"Dock strikers threaten more action Union says situation will escalate if it does not see sincerity in talks, as HIT plays down impact","Kang-chung, Ng.",15-Apr-13
647,Former dealmaker ready for new fund Andrew Kuo now helps Taiwanese invest in the mainland after leaving Blackstone,"Chen, George.",15-Apr-13
648,Gangs encroaching across the New Territories,,15-Apr-13
649,Green light for state firms may herald rebound in IPO s Initial share sales of Sinopec Engineering and China Galaxy Securities brighten market prospects after run of underperforming offerings,"Chan, Ray.",15-Apr-13
650,Henan confirms first two cases of H7N9 bird flu Deadly strain spreads to central province as two Shanghai deaths push national toll to 13,"He Huifeng; Lo, Wei.",15-Apr-13
651,HK home sales jump as owners reduce prices [Derived headline],,15-Apr-13
652,Land owners barred from their sites Yuen Long landlords lament being held liable for waste dumped on their property by gangster-like intruders who squat and build on the plots,"Chi-fai, Cheung.",15-Apr-13
653,"Robbers steal bags worth HK$800,000 [Derived headline]",,15-Apr-13
654,At her fingertips,,15-Apr-13
655,Clinic makes a point of hiring top acupuncturists,"Tsang, Emily.",15-Apr-13
656,Developers to benefit from capital gains tax Homebuyers to shift attention to primary market with levy on secondary sales,"Li, Sandy.",15-Apr-13
657,"Emperor, UA make mainland move Film company, cinema chain partner to tap market as movie house investment booms","Yu, Sophie.",15-Apr-13
658,How will China treat Iceland's gay first couple? [Derived headline],,15-Apr-13
659,"HSBC eyes sell-off of other mainland assets Bank is raising capital to grow operations in European home market, say analysts, as spotlight falls on lender's 8pc stake in Bank of Shanghai","Kanis, Li.",15-Apr-13
660,"Leave research to medical schools, says vet chief A training institute for vets will give consumers wider choice of providers but it is up to medical schools to tackle viruses, says board chairman","Moy, Patsy; Lau, Stuart.",15-Apr-13
661,MY TAKEFocus fight on who picks the candidates,"Lo, Alex.",15-Apr-13
662,Political questions can give insight into young minds Liberal studies exam questions have opened the way for discussion of sensitive topics in schools,"Chong, Dennis.",15-Apr-13
663,"Rare seahorse species 'breeding in Tai Po waters' Photo shows state of creature after copulation, activists say with support from marine scientist","Lau, Stuart.",15-Apr-13
664,Serious business,,15-Apr-13
665,Tomorrow: German Chamber of Commerce lunch [Derived headline],,15-Apr-13
666,UBS unit follows the money in expansion drive Swiss bank's wealth management business seeks to tap growth in fund flows in Asia,"Kanis, Li.",15-Apr-13
667,"Bird flu, Korea hit prospectsFor fair The spectre of conflict in Korea plus the rapidly changing situation with H7N9 is likely to affect the success of the latest Canton Trade Fair","Lau, Mimi; Li Jing in Guangzhou.",15-Apr-13
668,Carrier lobby groups secure nod for merger Tie-up of TSA and WTSA draws muted response from cargo owners and exporters,"Wallis, Keith.",15-Apr-13
669,"Chinese firms target UK renewal drive As Britain overhauls its airports, railways and energy assets, businesses on the mainland are lining up for a slice of the action",Toh Han Shih hanshih.toh@scmp.com.,15-Apr-13
670,Doctor charged after surgery complications,"Lo, Wei.",15-Apr-13
671,"Jaded professor ready for handcuffs Lady Youde once told Chan Kin-man democracy in HK wasn't far off, but that was 26 years ago and the Occupy Central figure is losing patience","Cheung, Gary.",15-Apr-13
672,Rising costs plunge poor into despairRising costs of living plunge poor into despair,"Chiu, Joanna.",15-Apr-13
673,Activist puts out Occupy Central action plan Movement reveals a timetable to meet and consult supporters and experts on blockade,"Lee, Colleen; Siu, Phila.",15-Apr-13
674,"Chairman's term won't give enough timeto set work hours law, sayslegislator","Siu, Phila.",15-Apr-13
675,"Democracy veteran: we'll never give up Reverend Chu Yiu-ming, who first took on Beijing in the 1980s, says the Occupy Central rally can kick-start civil disobedience in HK","But, Joshua.",15-Apr-13
676,"Malaysian elections hangIN THE BALANCE Resurgent opposition is within striking distance of victory at next month's vote, but it faces some serious questions if it takes the prize, not least of which is who will be the prime minister",Amy Chew in Kuala Lumpur.,15-Apr-13
677,Titan fights liquidation as it seeks return to market Oil and logistics operator looks to raise fresh capital despite court action by major investor,"Ng, Eric.",15-Apr-13
678,UBS unit follows the flow of money Swiss bank's wealth management division seeks to expand by tapping into the funds pouring into Asia as Europe remains in the doldrums,"Kanis, Li.",15-Apr-13
679,"How to prevent getting wiped out by a rights offer Entitlement issues always wallop a company's share price, but you can minimise the pain","Moiseiwitsch, Jasper.",15-Apr-13
680,"Japan As its currency slides amid a government drive to reflate the economy, Japan has never been a more affordable destination for Hongkongers A yen for","Ap, Tiffany; Soh, Paul.",15-Apr-13
681,Forging new frontiers in ETFs,"Moiseiwitsch, Jasper.",15-Apr-13
682,He said that every official that he had talked... [Derived headline],,15-Apr-13
683,N. Korea a test for new leaders Many officials and ordinary people now believe Pyongyang's belligerence is undermining regional stability and China's own interests,"Wang, Xiangwei.",15-Apr-13
684,"Eleven killed, 50injured in Hubeihotel inferno Guests trying to escape the blaze climb out windows using sheets as makeshift ropes","Chen, Stephen.",15-Apr-13
685,Graft-busters shy on disclosure of assets February meeting of national anti-corruption body reveals the lack of support for move to compel party officials to declare their wealth,"Zhai, Keith.",15-Apr-13
686,A little more salt?,,15-Apr-13
687,"New impetus seen in Sino-U.S. dialogue Closer co-operation on Korean nuclear threats and growing mutual economic reliance will produce results, analysts say",Cary Huang in Beijing caryhuang@scmp.com.,15-Apr-13
688,Factories cheat inspectors [Derived headline],,15-Apr-13
689,Peak season,,15-Apr-13
690,Playboy does nothing but lower... [Derived headline],,15-Apr-13
691,"We must learn from past, Thein Sein urges [Derived headline]",,15-Apr-13
692,Earthquake strikes off Papua New Guinea [Derived headline],,15-Apr-13
693,No need to worry about China's competitiveness A shrinking labour pool and rising wages could mean the start of an economic rebalancing act and not a feared loss of manufacturing edge,,15-Apr-13
694,"on the line MTR Corp has fixed its sights on getting into the mainland's burgeoning metro railway sector, but its business model may hit the buffers A lot",Toh Han Shih hanshih.toh@scmp.com.,15-Apr-13
695,"She was a kind of big sister, someone with a big heart [Derived headline]",,15-Apr-13
696,A tale of two cities reveals the art of ambition and confidence The traditional rivalry between Shanghai and Hong Kong has gone beyond finance to now embrace the world of high-priced culture,,15-Apr-13
697,European polls fail to excite Croatian voters [Derived headline],,15-Apr-13
698,Absurd and obscene to compare animal activists to terrorists,,15-Apr-13
699,Escalator not in step with a green campus [Derived headline],,15-Apr-13
700,The lost spirit of entrepreneurism,,15-Apr-13
701,A model for bilateral ties,,15-Apr-13
702,Young drinkers,,15-Apr-13
703,CBRC tightens grip on bank loans Lenders told to curb credit to financing vehicles of local governments and prevent risk contagion after loans to the sector rise to 18pc of GDP,Jane Cai in Beijing xuejun.cai@scmp.com.,16-Apr-13
704,"Central banks differ on policy BoJ acts, while ECB is content to bide its time",,16-Apr-13
705,China slowdown a test for Li KeqiangSlowdown in growth a test for Li Keqiang,Victoria Ruan in Beijing victoria.ruan@scmp.com.,16-Apr-13
706,Iceland deepens trade ties with China [Derived headline],,16-Apr-13
707,Insurance likely to rise in risky property market Head of Mortgage Corporation hints at review of prices to manage firm's exposure to volatility,"Kanis, Li.",16-Apr-13
708,Man jailed for incest with teenage daughter [Derived headline],,16-Apr-13
709,Moneyed passion for art grows as property cools,Daniel Ren in Shanghai ren.wei@scmp.com.,16-Apr-13
710,Pandemic warning over bird flu virus Hong Kong expert says H7N9 could pose a bigger threat than H5N1 and may adapt to become transmittable between humans,"Tsang, Emily; Zhuang Pinghui.",16-Apr-13
711,Striking dockers set to escalate action Unhappy strikers say they have plans ready to go and other workers ready to walk if contractors don't come to the party on wage rises today,"Siu, Phila; Cheung, Gary.",16-Apr-13
712,Supermarket prices surge above rate of inflation,"Chan, Thomas; Chong, Dennis.",16-Apr-13
713,Transsexual in top court bid to marry boyfriend Woman fights for the right to have her new gender recognised under city's marriage laws,"Chiu, Austin.",16-Apr-13
714,Cheap eats help offset Hong Kong's outrageous office rents A global survey of living costs finds that the news isn't all bad when it comes to local prices,"Yiu, Enoch.",16-Apr-13
715,Defence ministry publishes white paper [Derived headline],,16-Apr-13
716,Harry moment,,16-Apr-13
717,It is time to put long-festering territorial pursuits... [Derived headline],,16-Apr-13
718,Mainlanders seek truth at Tiananmen display Young people cross the border to learn more about the 1989 crackdown at City U exhibition,"Cheung, Tony; Siu, Phila.",16-Apr-13
719,MY TAKEWe all need a little light relief,"Lo, Alex.",16-Apr-13
720,"Scrap newtax, says Consumer champion Plan for policyholders to pay for insurers' independent authority is wrong, says city's new protector of customer rights","Moy, Patsy; Lau, Stuart.",16-Apr-13
721,"Screening is not the way to 'love China, love Hong Kong' Inciting Beijing's patrons to bar defenders of autonomy from office is in no one's interests",MICHAELDAVIS.,16-Apr-13
722,Today: German Chamber of Commerce lunch... [Derived headline],,16-Apr-13
723,University to probe sexclaims against professor,"Yeung, Linda.",16-Apr-13
724,Go West lure of low land prices Chongqing reaches out to investors with smaller profits tax and commitments to keep a lid on property and logistics costs,"So, Charlotte.",16-Apr-13
725,Health alert as pollution tops chart People with heart and breathing problems should be careful as indices hit severe level,"Kang-chung, Ng.",16-Apr-13
726,"Hint of Korean tension at anchor in Victoria Harbour Officers with visiting US naval group, who will host members of the PLA garrison today, say stopover is routine and not meant to send a message","Simpson, Cheung; Torode, Greg.",16-Apr-13
727,Investors dump stocks on poor mainland data Hang Seng Index falls 1.4 per cent after Beijing says growth and industrial output slowed,"Yu, Jeanny.",16-Apr-13
728,Next plans to sell Taiwan TV business for NT$1.4b,"Yu, Sophie.",16-Apr-13
729,Plan to house homeless with rubbish slammed,"Lau, Stuart.",16-Apr-13
730,"Radicals left to go it alone inPension protest Mainstream pan-democrats opt out of budget filibuster plan, claiming needy would suffer if delay tactics mean government runs out of cash","But, Joshua.",16-Apr-13
731,Rare praise for reformer Hu Yaobang Ex-Communist Party chief who was purged in 1987 and whose death in 1989 sparked the Tiananmen protests is commemorated by state media,"Yu, Verna.",16-Apr-13
732,Sri Lankan refugee wins temporary right to work,"Moy, Patsy.",16-Apr-13
733,Timing of hydrant failure critical,"Simpson, Cheung.",16-Apr-13
734,"Australia 'ideal destination' for foreign investors Mild inflation, stable political and economic environment nation's selling points, says envoy","Kanis, Li.",16-Apr-13
735,"Echoes of Sars Families of H7N9 patients, having seen the response to the deadly new virus up close, say authorities are falling down on prevention, isolation New bird f lu outbreak creates",He Huifeng in Jiangsu; Zhejiang huifeng.he@scmp.com.,16-Apr-13
736,Frenzy over Greenview Villa vanishes 'Cheap' flats not so hot any more after increase in stamp duty dampens market sentiment,"Sito, Peggy.",16-Apr-13
737,Fung shui master must pay HK$341m taxes,"Man, Joyce.",16-Apr-13
738,"Luxury homes to see slower rent growth Sluggish global economy dampening demand for high-end flats while fuelling strong growth for mass-market units, says consultancy","Leung, Paggie.",16-Apr-13
739,"Speed and service top list of internet users' complaints Consumer Council survey reveals while some are unhappy, most find services satisfactory","Chan, Thomas.",16-Apr-13
740,Spotlight on gm food labels Watchdog calls for compulsory labelling scheme for genetically modified food after traces are found in non-labelled samples,"Chan, Thomas.",16-Apr-13
741,Last year marked important and outstanding... [Derived headline],"Furniss, Tracey.",16-Apr-13
742,"Country offers hi-tech expertise Businessman develops a plan to bring nation's technological knowledge to the mainland, writes Tracey Furniss","Furniss, Tracey.",16-Apr-13
743,"Today, we celebrate the 65th Independence Day of Israel [Derived headline]","Furniss, Tracey.",16-Apr-13
744,Woman sues US central bank over shrinking cash She claims Federal Reserve has allowed her deposit of US$250 to lose a third of its value,"Zuo, Mandy.",16-Apr-13
745,"Death toll in hotel blaze rises to 14 Three suspects wanted for questioning by police turn themselves in, but fourth remains at large","Chen, Stephen.",16-Apr-13
746,"Fair puts on a brave face as exports totter Economic uncertainty, geopolitics, bird flu and soaring costs may be on everyone's minds, but the Canton Fair is still the best - for now",Mimi Lau in Guangzhou Mimi.lau@scmp.com.,16-Apr-13
747,"Cannabis bought from shopping site The 100-yuan order was placed and paid for via Alipay, says Guangzhou-based journalist","Kao, Ernest.",16-Apr-13
748,China is getting a diminishing growth bang for its credit buck First-quarter GDP figures seem at first blush to be in sustainable territory but credit creation numbers show a different story,,16-Apr-13
749,The importance of knowing who does the auditing [Derived headline],,16-Apr-13
750,Lean times come to 'richest village',"Luo, Chris.",16-Apr-13
751,Sympathyfor mum'slabourcamp woe People's Daily commentary sides with woman sentenced to re-education through labour; may reflect resolve to reform controversial system,"Zhou, Laura.",16-Apr-13
752,Disabled apply for jobs [Derived headline],,16-Apr-13
753,"Tokyo, Hanoi in talks over jointmaritime security Japan offers to provide patrol vessels similar to those given to Philippines and Indonesia",Julian Ryall in Tokyo.,16-Apr-13
754,People should have opt-in choice over personal data,,16-Apr-13
755,Property invasion,,16-Apr-13
756,Slow learners ignoring reality,,16-Apr-13
757,Strange silence on right of abode ruling [Derived headline],,16-Apr-13
758,Sustained growththe way ahead,,16-Apr-13
759,Bad behaviour,,16-Apr-13
760,2.7pc rise in MTR fares from June Rail operator will have to give concessions back to passengers for any delay over half an hour,"Lee, Ada.",17-Apr-13
761,Bid to stop'endless debate' on budget Legco boss seeks a way to avoid passage of bill being hijacked by filibustering as unionist calls for 'stamina battle' with radical pan-democrats,"But, Joshua.",17-Apr-13
762,"Dock contractor sweetens pay offer Everbest shows sincerity in proposing extra pay for a specific job function, strike leader says","Siu, Phila.",17-Apr-13
763,"Fast bird-flu test may not go far enough, says expert","Tsang, Emily; Lo, Wei.",17-Apr-13
764,HK runners tell of marathon carnage Student from mainland reported to be in stable condition after surgery; witnesses recall scenes of chaos as rescuers tried to help the injured,"Carney, John; Lee, Ada.",17-Apr-13
765,Homebuyers lured with offer of 95 per cent loans,"Li, Sandy; Kanis, Li.",17-Apr-13
766,Mainland pension fund seeks to grow asset base Call for more investment comes amid forecasts of severe funding shortfall in next two decades,Jane Cai in Beijing xuejun.cai@scmp.com.,17-Apr-13
767,"Mainland sales to fall, say analysts Activity is likely to take a breather after a busy March and further tightening","Sito, Peggy.",17-Apr-13
768,Man held after dog found dead in tiny cage [Derived headline],,17-Apr-13
769,Monthly home sales rise 2.4pc in Canada [Derived headline],,17-Apr-13
770,Moody's lowers China outlook after downgrade,"Kanis, Li.",17-Apr-13
771,Office rents in Pudong top Puxi's The area is overtaking Shanghai's traditional central business district amid increasing demand from financial firms and limited new supply,"Sito, Peggy.",17-Apr-13
772,Pressure on leaders to declare assets [Derived headline],,17-Apr-13
773,Rules to give creditors fairer deal The first overhaul of the city's company insolvency laws in 30 years seeks to prevent cheap sale of assets and to simplify winding-ups,"Yiu, Enoch.",17-Apr-13
774,Sales halt as brochures rewritten for new law Developers tell agents to suspend activity at 30 projects while promotional material is updated,"Li, Sandy.",17-Apr-13
775,Calender,,17-Apr-13
776,City's topjob: beijingfoes need not apply Occupy Central movement organiser tells would-be chief executive candidates to give up fight for democracy in mainland first,"Cheung, Gary.",17-Apr-13
777,MY TAKEPlanning watchdog on a tight leash,"Lo, Alex.",17-Apr-13
778,"Prosecutors to challenge activist's acquittal Pan-democrat Avery Ng, who tossed a T-shirt at a passing Hu convoy, bemoans persecution","Cheung, Tony.",17-Apr-13
779,Shading it. [Derived headline],,17-Apr-13
780,"Shedding light on the murky worldof data protection Scott Thiel, a partner in the intellectual property and technology practice at DLA Piper Hong Kong, talks about privacy on the mainland","Thiel, Scott.",17-Apr-13
781,Somebody came by with a wheelchair... [Derived headline],,17-Apr-13
782,Tributes and protests at Thatcher funeral [Derived headline],,17-Apr-13
783,Veteran seeks a new world of opportunity Tony Espina plans to improve HK links as he takes charge of a Kazakhstan lender,"Yiu, Enoch.",17-Apr-13
784,"Beijing lays out security priorities Defence white paper vows a stronger military, criticises US pivot to Asia-Pacific, and accuses Japan of 'making trouble' over Diaoyu Islands","Chan, Minnie.",17-Apr-13
785,Border-town residents say traders cost them dearly,"Lau, Stuart.",17-Apr-13
786,DTZ predicts continuing uncertainty,"Sito, Peggy.",17-Apr-13
787,Falling price sparks mini gold rush Jewellery and bullion lovers in Hong Kong and mainland fork out as precious metal tumbles,"So, Charlotte; Ren, Daniel; Yu, Jeanny; Sun, Celine.",17-Apr-13
788,"Government seeks public views on building new town Development of Yuen Long South site faces difficulties, but officials say it has merits and land shortage means there are 'no constraints'","Wong, Olga.",17-Apr-13
789,HK generates small dip in greenhouse emissions,"Ng, Joyce.",17-Apr-13
790,Moody's lowers China outlook after downgrade,"Kanis, Li.",17-Apr-13
791,No relief in sight from soaring costs Increase in development and a persistent shortage of skilled labour will push costs higher for the building industry in the next few years,"Liu, Yvonne.",17-Apr-13
792,Rare chance for city's artists at London fair Pavilion will try to drum up interest in Europe in return for a place at HK event in October,"Chow, Vivienne.",17-Apr-13
793,"Secondary marketon the rebound Seven-week high for sales, but they're still below level before latest curbs came in","Leung, Paggie.",17-Apr-13
